Post_ID,Ticker,Title,Body,Post_Date,Upvotes,Num_Comments
5581ccb4-42d5-4d1b-90b6-1bf78630cc90,AAPL,Apple is falling behind its Magnificent 7 rivals. Should it just be the Mag 6?,"The “Magnificent Seven” tech stocks led the market’s post-pandemic boom. But as Big Tech sprints into the AI future, one big name is falling dangerously behind: Apple (AAPL). Once an undisputed tech heavyweight, it risks becoming the least magnificent of them all.
While the others — Google parent…",2025-05-29,,
d0d511ca-20b7-43ef-889b-2ad4f00848e8,AAPL,"UBS Maintains Neutral Rating on Apple (AAPL), Keeps $210 PT","In This Article:
On Tuesday, May 27, UBS analysts reiterated a “Neutral” rating with a steady $210 price target for Apple Inc. (NASDAQ:AAPL). This decision came after President Trump posted on social media and threatened to impose a 25% tariff on iPhones that are not manufactured in the US.
A wide…",2025-05-29,,
12ef7220-fb65-4b36-81ab-7536702101d1,AAPL,Big tech stocks pare gains as uncertainty looms over Trump tariffs despite court ruling,"In This Article:
Big Tech stocks pared gains after a brief spike Thursday morning following a US trade court ruling Wednesday that the vast majority of Trump’s global tariffs are illegal.
Apple (AAPL) traded 0.1% lower midday while Google (GOOG) dipped 0.3%. Amazon (AMZN), Meta (META) and…",2025-05-29,,
81347cf5-1906-4580-86f1-93e9a5a4ad22,AAPL,Wall Street Upgraded This Stock And It Looks Tariff-Resilient,"Just when you thought that tariff headlines couldn’t move the markets lower, Trump sparks another round of chaotic market fluctuations with threats of 50% tariffs on the European Union. With the potential tariff to be delayed as negotiations go on behind the scenes, it now seems like markets are…",2025-05-29,,
fc54603d-37c8-487e-9008-7b166bf18ddb,AAPL,and Alphabet (GOOG) Are The Cheapest Trillion-Dollar Stocks Today,"Trillion-dollar market valuations remain a rare milestone, typically only achieved through extraordinary corporate success and global influence. The first stock to cross this threshold was PetroChina (OTC:PCCYF), which briefly reached $1 trillion on its debut trading day on the Shanghai Stock…",2025-05-29,,
1325b363-7b00-4ffd-b24a-895df8ecca77,AAPL,Apple Supplier Foxconn Eyes Second Japanese EV Deal To Counter China's Auto Surge,"Apple Inc. (NASDAQ:AAPL) supplier Foxconn is set to announce a partnership with a second Japanese auto manufacturer as the Taiwanese manufacturer turns towards EVs.
What Happened: The company's chairman, Young Liu, shared the announcement at the company's annual investor meeting, Reuters reported…",2025-05-29,,
5a6556ed-b9d0-4434-95e5-3b2e0abbca5c,AAPL,"Chip stocks and Big Tech shares jump on Trump tariffs ruling, Nvidia’s earnings, and Elon Musk news",Stock markets are moving higher in premarket trading on Thursday as of the time of this writing. Two groups of stocks are doing particularly well: Big Tech’s Magnificent Seven and major chipmaker stocks. Shares in one stock that crosses over into both groups—Nvidia Corporation (Nasdaq: NVDA)—are…,2025-05-29,,
01414bdb-46d6-468a-bacc-9e5886761ef9,AAPL,Best Buy stock sinks after it cuts guidance due to Trump's tariffs,"In This Article:
Best Buy (BBY) investors are disappointed on Thursday morning as the retailer reports mixed earnings and cuts guidance over Trump administration's tariffs.
Same-store sales fell 0.7% year over year, more than the 0.57% Wall Street expected. Revenue fell 0.9% to $8.77 billion,…",2025-05-29,,
4102db96-c12e-49f5-a232-00e085da4091,AAPL,Should You Buy AAPL Stock as Apple Cooks Up AI Glasses?,"Get all the relevant market information you need — get it fast, on time, and accurately with Barchart Plus.
FREE 30 Day Trial
- Market Pulse
- VolatilityVolume & Open InterestHorizontal StrategiesButterfly Strategies
-
- ResourcesEuropean FuturesEuropean Groupings
- Forex Market Pulse
- Investing…",2025-05-29,,
fc4a55a9-e784-4fe4-bf78-22b72801b9f5,AAPL,Apple Is Reportedly Making iOS Take A Leap From 18 To 26 — Here's Why,"Apple Inc. (NASDAQ:AAPL) is reportedly preparing a rebrand of its software platforms by introducing a year-based naming system.
What Happened: At its Worldwide Developers Conference on June 9, Apple could unveil the new strategy, reported Bloomberg on Wednesday, citing people with knowledge of the…",2025-05-29,,
85d37d81-b170-4a20-87d7-0bce5e85b79e,AAPL,"Nvidia, Apple, Amazon, Tempus AI, Tesla: Why These 5 Stocks Are On Investors' Radars Today","On Wednesday, major U.S. stock indices closed lower, with the Dow Jones Industrial Average falling 0.6% to 42,098.70 and the S&P 500 slipping by a similar margin to 5,888.55. The Nasdaq shed 0.5% to finish at 19,100.94. However, stock futures rebounded after a court overturned the Trump…",2025-05-29,,
117d4847-ae9a-4e2f-bd6e-1b1e483c0fe7,AAPL,Nvidia earnings live: Nvidia stock pops as Wall Street looks through China sales hit,"In This Article:
Nvidia (NVDA) stock popped more than 5% in premarket trading Thursday after the poster child for artificial intelligence reported mixed first quarter results after the close on Wednesday.
Positive signals from Nvidia and CEO Jensen Huang about AI infrastructure demand and the…",2025-05-28,,
0df547a9-6229-4345-8631-65c7be18dd52,AAPL,Jerome Powell Says Supply Shocks Are Coming—Which Stocks Can Still Thrive?,"Fed chair Jerome Powell’s words sure can move markets. And while Fed meetings and new commentary from Chairman Powell will surely have some investors biting their nails, it’s worth noting that the market’s immediate reaction doesn’t always make the most sense.
Of course, it would be nice if the…",2025-05-28,,
bf7def73-fb10-4811-a367-3618a18e3ca9,AAPL,"Is Meta Stock A Buy? Facebook Parent Shares Rebound After Tariff Deal, Q1 Earnings","stock is attempting to rally back after a three month slump. An improving outlook on tariffs and stronger-than-expected first-quarter results should help.
Shares of the Facebook parent company are ahead 17% in May, after slumping 5% in April, 14% in March and 3% in February. Meta stock was hit by…",2025-05-28,,
ea61c1fc-0c66-4208-9380-08c4f68f35d3,AAPL,"Evaluating Apple Against Peers In Technology Hardware, Storage & Peripherals Industry","In today's rapidly changing and fiercely competitive business landscape, it is vital for investors and industry enthusiasts to carefully evaluate companies. In this article, we will perform a comprehensive industry comparison, evaluating Apple AAPL against its key competitors in the Technology…",2025-05-28,,
504bf809-18a4-4a6b-8454-38deb5c7321a,AAPL,"Fox News Host Roasts Trump's Mornings: 'Wake Up, Watch Cable News, Create Chaos, Watch The Futures Tank'","Fox News co-host Jessica Tarlov took a swipe at President Donald Trump on X recently, mocking his “morning schedule” as he continues to publicly threaten individual companies like Apple (NASDAQ:AAPL) with tariffs. 
Trump recently warned that he would impose a 25% tariff on all iPhones not made in…",2025-05-28,,
2fdba1a6-c677-4095-98fc-c4f2f6f8fd44,AAPL,"Should Be Bought on Weakness, Veteran Investor Says","In This Article:
""The time to buy a name like Apple Inc. (NASDAQ:AAPL) is during dips like these,"" veteran investor Dale Smothers said recently during an appearance on Schwab Network.
Smothers, the CEO of RDS Wealth, added that his company will buy more AAPL stock over the long term.
A wide view…",2025-05-28,,
c63f53c6-987e-43ec-9764-0c7bbc02ca8b,AAPL,America’s Largest Investor Dumps Apple Stock,"The California Public Employees’ Retirement System (CalPERS) dumped Apple Inc. (NASDAQ: AAPL) stock in the first quarter, according to SEC filings. It is America’s largest pension fund, managing $540 billion.
 
 
 
24/7 Wall St. Key Points:
 
 
 
 
America’s largest pension fund dumped Apple Inc.…",2025-05-28,,
d70d0a84-236d-4288-b5e8-ea70386dfefb,AAPL,Is Apple Stock A Buy Amid Low Expectations For WWDC?,"stock has had a rough year to date, down 20% through Tuesday's close. Shares of the consumer electronics giant have fallen amid soft iPhone sales, tariff concerns and challenges to its services business. Still, some investors might be wondering: Is Apple stock a buy right now?
The next potential…",2025-05-28,,
71502f1f-89e8-4d2f-9ae6-e3e473193db9,AAPL,Billionaire Bill Ackman Just Bought This Stock,"Bill Ackman, Billionaire investor and founder of Pershing Square Holdings, has had quite the busy 2025, making some notable buys and sells while also considering the next steps to potentially create a “modern-day” version of Berkshire Hathaway (NYSE:BRK-B). As Warren Buffett retires, perhaps it’s…",2025-05-28,,
6087a0c1-b485-4732-9c4e-7d85ccbef6ee,AAPL,Apple's Former Design Chief Jony Ive Called Phones And Laptops 'Legacy Platforms:' Sundar Pichai Says Pulling Out A 'Black Glass Display Rectangle' Won't Make Sense Forever,"As tech's most influential minds rethink the future of computing, their vision faces a market still not sold on the alternatives.
What Happened: Last week, in a video, Jony Ive, Apple Inc.'s (NASDAQ:AAPL) legendary former design chief, described smartphones and laptops as ""legacy products,""…",2025-05-28,,
c2f5d470-773c-4b58-9e56-6ec7d97041ff,AAPL,Alphabet's Veo 3: AI Video Crown Achieved,"Summary
- VEO 3 is receiving significant attention for its capabilities, influencers are trending with self prompted clips that are mind-blowing.
- Access to VEO 3 is available through the Google Ultra Plan, this is now a commercially available product.
- Google still trades at 18 X forward due to…",2025-05-28,,
cf55d3d9-3d11-4bfc-9abb-4ba61497c8cd,AAPL,"Trump’s 25% Tariff Threat Looms, But Apple (AAPL) Isn’t Moving – Yet",,2025-05-28,,
da78155f-3dca-4eb9-b97a-f742ff3e8490,AAPL,"Apple Could Join 200MP Camera Club, Matching Samsung's Flagship Specs: Report","A new leak from a Weibo tipster, Digital Chat Station, suggests that Apple Inc. (NASDAQ:AAPL) is working on a significant camera upgrade for a future iPhone model — a 200-megapixel sensor.
What Happened: While the exact model or launch year remains unclear, the leak, which was first spotted by…",2025-05-28,,
1e148cc2-c7b5-44c8-be60-31020eda40ac,AAPL,Can Apple's AI Tabletop Robot Snap Its Stock Slump?,"Apple, Inc. (NASDAQ:AAPL) is actively developing an AI-powered tabletop robot, internally codenamed J595, as a major new product category focused on blending robotics and artificial intelligence for the home. 
But can it save the struggling tech stock? 
What To Know: The J595 robot is designed…",2025-05-27,,
01b7882f-a23b-4b94-b9e9-86f3bf86a046,AAPL,IBIT Attracts $877M Amid Trump's Latest Tariff Threat,"The iShares Bitcoin Trust ETF (IBIT) pulled in $877.2 million Friday, increasing its total assets to $72.7 billion, according to data provided by FactSet. The inflows came as markets tumbled, with the Dow Jones Industrial Average falling 256 points after President Donald Trump threatened new…",2025-05-27,,
bf1e2413-2f75-4068-bf15-000a2ae4fc52,AAPL,Nvidia’s earnings are the stock market’s next major test after May’s Big Tech comeback,"In This Article:
Megacap technology stocks have gotten a huge boost in May, as investors seek to turn the page on recent tariff tumult and as Nvidia Corp.’s earnings loom.
U.S. banks might kick off earnings season and help set the tone, but it’s the tech companies that lately have had the final…",2025-05-27,,
f1ffb66f-877a-4bdd-9087-157f7c28e831,AAPL,Famous Investor Suggests That Apple (AAPL) Is Not a Buy,"In This Article:
Stephanie Link, a frequent guest on CNBC, recently suggested during an appearance on the network that investors should not buy Apple Inc. (NASDAQ:AAPL) stock.
Link is the Chief Investment Strategist at Hightower Advisors.
Link: Why Would You Pay So Much for Apple Inc.…",2025-05-27,,
823e6d63-83f9-478b-8ae6-d0e9152aa579,AAPL,Europe-Focused ETFs Leap After Tariff Deadline Extended,"Europe ETFs jumped, extending their year-to-date gains over U.S. funds, after President Donald Trump extended a deadline to impose 50% tariffs on imports from the region.
Trump this weekend climbed down from Friday’s threat to hit Europe with 50% taxes starting Sunday, June 1, pushing the deadline…",2025-05-27,,
4dc607c8-478c-4dbf-9d6c-88a6d03165e9,AAPL,"Citi Reiterates Buy Rating on Apple (AAPL), Keeps PT at $240","In This Article:
On May 27, Citi reiterated its Buy rating on Apple Inc. (NASDAQ:AAPL), keeping its price target of $240 for the stock.
Atif Malik from Citi maintains his rating on Apple, as he sees President Trump’s announcement of 25% tariffs on Apple Inc. (NASDAQ:AAPL) to have a limited impact…",2025-05-27,,
ece3a63d-c089-4f88-bb32-618d2bed7984,AAPL,The Stocks to Avoid in Trump’s New Economy,"Editor’s Note: With economic policy poised to make a dramatic turn under the second Trump administration, the old playbook no longer applies. The winners of the past decade may become the laggards of tomorrow, and companies built on fragile foundations already showing signs of stress.
Luckily, my…",2025-05-27,,
dd1b7b79-07dd-41fb-be23-416c17d02d23,AAPL,Using JEPQ for Regular Dividends—Is It Worth the Trade-Off?,Investors seeking sizable capital appreciation will usually search out aggressive growth stocks and exchange traded funds that are tied to tech indexes or the S&P 500. Those that want growth but lack the stomach for the market’s turbulence may opt for the stability of blue chip Dividend King (50…,2025-05-27,,
ffcf6765-3a41-4a7b-9e9c-0643deb214c7,AAPL,Nvidia Stock Climbs Ahead of Earnings,"In This Article:
Nvidia (NVDA) shares climbed Tuesday, ahead of the AI chipmaker’s fiscal first-quarter results due after the closing bell Wednesday.
Shares were up about 3% in recent trading, leaving the stock roughly flat for the year so far, after a rough start to 2025 amid worries about the…",2025-05-27,,
f63a511e-3630-4637-8600-ad9ac02ead73,AAPL,"Dow Jones Today: Stocks Jump After Trump Postpones Tariffs on EU Imports; Tesla, Nvidia Lead Big-Tech Rally","Stocks moved sharply higher Tuesday morning as investors reacted to the latest shift in trade policy from the Trump administration.
The Dow Jones Industrial Average was recently up 1.2%, or more than 500 points, while the S&P 500 and the tech-heavy Nasdaq Composite jumped 1.6% and 2%,…",2025-05-27,,
2d7a83ba-e8c7-4462-a346-762e7ff647bd,AAPL,NVIDIA (NASDAQ: NVDA) Price Prediction and Forecast 2025-2030 for May 27,"Shares of NVIDIA Corp. (NASDAQ:NVDA) jumped 2.99% through a.m. trading on Tuesday as the leader in chipmaking prepares to report Q1 earnings on Wednesday. Earlier this month, as the deescalation of the U.S.-China trade war took hold, NVIDIA joined the $3 trillion market cap club, just ahead of…",2025-05-27,,
369920b2-1b76-4b41-99b8-4b33186b9b52,AAPL,Can OpenAI’s Secret AI Device Disrupt Apple’s iPhone?,"OpenAI dropped a bombshell this week when it announced its purchase of the hardware startup of former Apple (NASDAQ:AAPL) Chief Design Officer Jony Ive. Undoubtedly, Ive is one of the most renowned names in the world of high-tech design. And with Ive to team up with Sam Altman and ChatGPT-maker…",2025-05-27,,
8c8673f8-031a-408a-bf3f-a00a852fcd31,AAPL,"Market Analysis: Apple And Competitors In Technology Hardware, Storage & Peripherals Industry","In the fast-paced and cutthroat world of business, conducting thorough company analysis is essential for investors and industry experts. In this article, we will undertake a comprehensive industry comparison, evaluating Apple AAPL in comparison to its major competitors within the Technology…",2025-05-27,,
c8100c00-1cbf-4dfb-9d17-1ecffa4a7396,AAPL,"Trump’s new tariff threats may shake stocks’ rally as investors brace for a long, hot summer","In This Article:
Just as investors thought they could take a break from the tariff scares, President Donald Trump’s threats of new levies against the European Union and Apple threw trade tensions back into focus ahead of a long holiday weekend.
That’s a reminder to stock market investors that…",2025-05-27,,
7c88630b-915e-4eed-ac2f-c01d72015476,AAPL,Invest $75K in Nvidia or Broadcom? A Strategy for Early Retirement,"Key Points in This Article
 
 
 
 
Nvidia’s leadership in AI infrastructure, driven by its H100 GPUs and upcoming Blackwell chips, fuels massive data center revenue growth, though high valuation and competition pose risks.
 
 
 
Broadcom’s pivot to AI accelerators and networking chips, alongside…",2025-05-27,,
8e006e81-0fd1-44f3-be29-f1a3d45fd1e3,AAPL,Billionaire Ray Dalio Dumped Some SPY and Bought These Stocks,"Ray Dalio, the brilliant billionaire investor over at Bridgewater Associates, made some notable moves in the first quarter that were quite remarkable. Dalio, who’s one of my favorite big money managers to keep tabs on, seems to have positioned his portfolio to do well, regardless of what happens…",2025-05-27,,
