Post_ID,Ticker,Title,Post_Date,Upvotes,Num_Comments
1emp11e_ROKU,ROKU,"Cathie Wood Goes on Dip-Buying on Tech Spree as ARKK Hits 2024 Lows. Flagship fund buys Amazon, AMD, Roku amid market selloff",2024-08-07,109,98
gr04tf_ROKU,ROKU,Thoughts on $ARKK,2020-05-26,28,28
h7mdiz_ROKU,ROKU,"What’s a better long term play, MTUM or ARKK/ARKW?",2020-06-12,15,29
oynurt_ROKU,ROKU,ARKK made $115 million in Robinhood today. https://t.co/BkQTsvznF1,2021-08-05,1417,248
14b98vk_ROKU,ROKU,"So if you had to buy stocks only from ARKK without just buying the ETF, which stocks do you think Cathy Wood will be right about??",2023-06-16,0,23
uxezxw_ROKU,ROKU,ARKK Inflows Stay Strong Despite Underperformance: $1.5B in 2022 So Far,2022-05-25,52,27
x4346h_ROKU,ROKU,Cathie Wood’s ARKK Sees Biggest Monthly Outflow in Nearly a Year,2022-09-02,14,7
kfavo1_ROKU,ROKU,ARKK 18 Jun 21 120 C being miss priced.,2020-12-18,16,53
npjq8q_ABNB,ABNB,"Cleanest Options Flow from Last Week - Setups going into Next Week - QQQ, CRWD, ARKK, PAGS, ZM, ABNB",2021-06-01,30,12
ntz1fd_ABNB,ABNB,"Cleanest + Repeated Options Flow Plays Series # 3 - AMC, CLNE, FUBO, ARKK. FB, FUTU, JMIA",2021-06-06,37,12
kle2zv_MAR,MAR,"[MarketWatch] ARKK is out on UBER. Ark Invest's Cathie Wood: ""stayed private too long and lost the plot. They could have incentivized their drivers to put sensors on their cars and collect data much faster than even $TSLA.""",2020-12-27,1801,267
lv1sjx_SPY,SPY,Investors beware: $ARKK is a liquidity disaster waiting to happen,2021-03-01,3441,990
upjgn0_SPY,SPY,Is ARKK showing us the future of what’s to come for QQQ and SPY,2022-05-14,124,136
1hs1ops_SPY,SPY,ARKK vs. SPY - Performance Comparison past 5 Years,2025-01-02,40,11
lv1sjx_QQQ,QQQ,Investors beware: $ARKK is a liquidity disaster waiting to happen,2021-03-01,3447,990
upjgn0_QQQ,QQQ,Is ARKK showing us the future of what’s to come for QQQ and SPY,2022-05-14,126,136
141nbr3_QQQ,QQQ,QQQ v ARKK. Peak to trough... same pattern,2023-06-05,0,2
13rrb65_ARKK,ARKK,"Cathie Wood’s ARKK Dumped Nvidia Stock Before $560 Billion Surge, you can’t make this up",2023-05-25,2527,274
sa1a5j_ARKK,ARKK,More pain still to come. With Tesla still at a PE ratio of around 300. Its the last thing still propping up the Nasdaq and Arkk. Many stocks down 40-70%. This big fella is the next to blow.,2022-01-22,2084,709
uk2v3n_ARKK,ARKK,ARKK is down 62% in the last 6 months. Cathie still promising 50% return LOL,2022-05-07,2710,352
umzmp7_ARKK,ARKK,$ARKK Therapy Session,2022-05-11,8019,154
sauu82_ARKK,ARKK,Cathie changes ARKK’s page to hide YTD returns,2022-01-23,2927,337
sdg7lm_ARKK,ARKK,Young Cathie Wood pictures are not priced into ARKK. Bullish!,2022-01-26,2669,288
u2c4n1_ARKK,ARKK,Mama Cathie says ARKK will $450 in 5 years,2022-04-12,1553,508
vgb5yq_ARKK,ARKK,"PSA: Cathie Wood might actually be regarded. In case you were thinking about buying the dip in ARKK, don't.",2022-06-20,1424,325
lefi7z_ARKK,ARKK,"Have conviction and hold through with grit wsb! Sharing my 1000% gains in 1 yr. sending motivation tesla,amc,arkk,arkg 💎💎🙌🙌🚀🚀🌕🌕🤜🤜",2021-02-07,2777,200
p5jm6n_ARKK,ARKK,Michael Burry of ‘Big Short’ Bets Against Cathie Wood’s ARKK,2021-08-16,629,321
ueth9e_ARKK,ARKK,The Russian ruble is outperforming ARKK by 61.2% since November 1.,2022-04-29,1312,111
txi0ti_ARKK,ARKK,Cathie Wood's ARKK is worst-performing US equity fund in Q1 2022: Morningstar,2022-04-06,798,161
sdgxez_ARKK,ARKK,ARKK before vs ARKK now,2022-01-26,1633,79
l07cky_ARKK,ARKK,Cathie Wood Plans to Start Gourd ETF After Dominating With ARKK,2021-01-19,1469,98
mmm0kg_ARKK,ARKK,In Mama Cathie we trust - ARKK added 970k shares of PLTR yesterday,2021-04-08,776,156
s4mrkr_ARKK,ARKK,Cathie Wood’s ARKK has its largest one-day capital outflow in 10-months and approaches an 18-month low,2022-01-15,414,229
1emp11e_ARKK,ARKK,"Cathie Wood Goes on Dip-Buying on Tech Spree as ARKK Hits 2024 Lows. Flagship fund buys Amazon, AMD, Roku amid market selloff",2024-08-07,105,98
svyak9_ARKK,ARKK,ARKK is a helluva drug,2022-02-19,903,74
13zz6qk_ARKK,ARKK,ARKK is set to surge at least 86% in the next 1-2 years,2023-06-04,0,116
lojy2s_ARKK,ARKK,"ARKK gamma squeeze, low IV and premium. Cathie has potentially set herself up for a major correction after the last massive years run.",2021-02-20,41,166
s0o5z3_ARKK,ARKK,"Meme stocks (GME, AMC, BB, ARKK, etc.) down HEAVY today. Bonds down as rates continue to rise from money printing. As inflation kills stocks and bonds, assets you can't print are getting stronger.",2022-01-10,109,90
s3t6rm_ARKK,ARKK,This is ARKK looks like on the chart... any thoughts or comments?,2022-01-14,62,113
l8ozve_ARKK,ARKK,"Anyone still in ARK (ARKG, ARKK, ARKQ)?",2021-01-30,73,126
ukbbtw_ARKK,ARKK,Every ARKK Holding Is in the Red This Year Except for Its Cash,2022-05-07,170,65
seysta_ARKK,ARKK,All in on ARKK,2022-01-28,150,76
1end6s6_ARKK,ARKK,Woods ARKK investors pull 2B in funding,2024-08-08,26,24
u3hmvq_ARKK,ARKK,"$ARQQ: DoD officials on the board, downside it sounds like ARKK",2022-04-14,109,67
lyp7tr_ARKK,ARKK,"ARKK adds 460,600 PLTR shares on Firday’s dip",2021-03-05,169,65
10se7sj_ARKK,ARKK,Cathie Wood Says ARKK Is ‘the New Nasdaq’,2023-02-03,16,51
uu11y6_ARKK,ARKK,ARKK portfolio update.,2022-05-20,20,64
s50mea_ARKK,ARKK,"ARKK (Cathie Wood) - the good, the bad and the amazing.",2022-01-16,44,60
s5j665_ARKK,ARKK,Identifying trend channel would have saved you from $ARKK sell-off,2022-01-16,16,67
kce9kw_ARKK,ARKK,EDIT takes a place in ARKK's top 10 holdings,2020-12-13,115,60
uenffo_ARKK,ARKK,"ARKK chart lookin' like a portfolio from someone here who just discovered options and forgot to sell. 2yrs of gains wiped out, well done Cathie 👏",2022-04-29,150,35
sefi6i_ARKK,ARKK,Cramer suggest SARK. That’s the buy signal for ARKK,2022-01-28,98,47
sja4lw_ARKK,ARKK,+$42K Gains in $UPS earning call. I'm up a lot this week! Loaded up $70p 200 contracts on ARKK,2022-02-03,115,38
udwxpd_ARKK,ARKK,$ARKK TA,2022-04-28,84,38
rh70h2_ARKK,ARKK,Cathie Wood’s ARKK ETF Nearing Level At Which Most Investors Will Start Losing Money,2021-12-15,117,34
t717pa_ARKK,ARKK,$ARKK investors still trying to find a bottom,2022-03-05,129,30
qomc4n_ARKK,ARKK,"Will there be some pain in $ARKK into year end? (I know, I know)",2021-11-07,26,48
n77ort_ARKK,ARKK,Cathie Solves ARKK Liquidity Issues,2021-05-07,123,37
w3prtt_ARKK,ARKK,"Coinbase (COIN) is currently up 16% trading at $73. Two months ago, Jim Cramer said when ARKK invest bought 550,000 shares of COIN at $53 per share: ""I think Cathie Wood is the kiss of death. I thought the COIN call was embarrassing,""",2022-07-20,33,36
tz833y_ARKK,ARKK,"$ARKK Puts Gain Porn $48,000+ Position (Thanks, Cathie Wood)",2022-04-08,80,29
12ksbf6_ARKK,ARKK,$BFLY Gaining Momentum as Cathie Wood Scoops Up 2 Million Shares for ARKK,2023-04-13,21,22
vyttyj_ARKK,ARKK,ARKK or or short ARKK ETF?,2022-07-14,10,35
y683sp_ARKK,ARKK,Arkk bottom?,2022-10-17,37,24
10su3kx_ARKK,ARKK,"Cathie Wood says ARKK is ""the new Nasdaq.""",2023-02-03,0,24
l529lu_ARKK,ARKK,ARKK buys NINTENDO CO LTD,2021-01-26,111,31
klslr2_ARKK,ARKK,Can someone explain this? ARKK,2020-12-28,45,42
y0tejz_ARKK,ARKK,ARKK is desperate... prob going to zero,2022-10-10,62,19
1b6mys2_ARKK,ARKK,Purchased ARKK in 2021 (yeah),2024-03-04,76,92
yhggir_ARKK,ARKK,ARKK has lost $9.586billion for its investors,2022-10-30,1392,255
ujq7cb_ARKK,ARKK,Every ARKK Holding Is in the Red This Year Except for Its Cash,2022-05-06,1286,334
kle2zv_ARKK,ARKK,"[MarketWatch] ARKK is out on UBER. Ark Invest's Cathie Wood: ""stayed private too long and lost the plot. They could have incentivized their drivers to put sensors on their cars and collect data much faster than even $TSLA.""",2020-12-27,1794,267
16s5hw4_ARKK,ARKK,"ARKK says that they invest on a 5 year time horizon, but they are down 18.04% over the past 5 years?",2023-09-25,482,166
rh1lsk_ARKK,ARKK,ARKK: An object lesson on how not to invest,2021-12-15,487,283
m037w1_ARKK,ARKK,ARKK (Innovation Fund) Top 5 Stock Picks - Week Ending 3/7/21,2021-03-08,456,210
uuawwx_ARKK,ARKK,"Wayback Playback: ARKK founder Cathie Wood reaffirms five-year time horizon, December 2021",2022-05-20,234,125
1dh10sq_ARKK,ARKK,"Consumer looks healthy, seems no incoming recession. Buy ARKK to take advantage of upcoming interest rate cuts ?",2024-06-16,0,43
kzdj3c_ARKK,ARKK,ARKK and similar investments,2021-01-17,35,127
1d970ix_ARKK,ARKK,Need advice on ARKK for tax exemption person,2024-06-06,0,13
17a5i0j_ARKK,ARKK,Burry called it again re ARKK,2023-10-17,0,25
143koz4_ARKK,ARKK,Questions on ARKK and ARKG,2023-06-07,0,31
knjb48_ARKK,ARKK,Cathie Wood’s Flagship Fund Posts Largest Outflow on Record ARKK,2020-12-31,45,58
p86gx0_ARKK,ARKK,Internal Rate of Return for investments in ARKK compared with the Total US Market based on Fund Flows,2021-08-20,64,41
jdki51_ARKK,ARKK,"What does the community think about ARK ETFs? I am talking about ARKK, ARKW, ARKG, ARKQ and ARKF?",2020-10-18,15,54
nash4a_ARKK,ARKK,I was bored and thinking about Ark funds. So I decided to do a breakdown to see how much of each fund is represented within ARKK. Figured I'd share if anyone else was interested.,2021-05-12,47,40
ze1o4u_ARKK,ARKK,"Can someone explain why ARKK is down 60% in the past year, but SARK is only up 50%",2022-12-06,0,23
kiqvny_ARKK,ARKK,ARKK and ARKG in a taxable account & tax on capital gain distributions,2020-12-23,60,31
u19dmr_ARKK,ARKK,UK Investors - How to get exposure to Cathie Wood's ARKK ETF,2022-04-11,0,26
io39rb_ARKK,ARKK,"Are ARKK, ARKQ and ARKW worth investing for a long term considering their exposure to TSLA?",2020-09-07,17,35
k9v18g_ARKK,ARKK,Think the 60-40 portfolio is for Boomers? And that margin calls from r/WSB are too risky? Check out ARKK.,2020-12-09,6,29
gr04tf_ARKK,ARKK,Thoughts on $ARKK,2020-05-26,28,28
yld3ad_ARKK,ARKK,Arkk etp for Europe 1x and 3x,2022-11-03,0,10
h7mdiz_ARKK,ARKK,"What’s a better long term play, MTUM or ARKK/ARKW?",2020-06-12,15,29
k4r49n_ARKK,ARKK,Realistically what is ARKK 5-year and 10-year realistic return?,2020-12-01,15,22
ifa460_ARKK,ARKK,The market doesn’t account for unexpected innovation which is why ARKK is currently the best ETF today.,2020-08-23,5,23
qg6v2g_ARKK,ARKK,"How to choose between BOTZ, THNQ, ARKK and ARKQ?",2021-10-26,0,7
jcyy42_ARKK,ARKK,Another post about Arkk,2020-10-17,0,13
jjwx6f_ARKK,ARKK,ARKK Companies vs. Sector ARK Etfs,2020-10-28,22,6
kw8tle_ARKK,ARKK,Is ARKK only bullish because of the hype and money pumping in from investors?,2021-01-13,5,6
h7e9hv_ARKK,ARKK,ARKK and ARKW,2020-06-12,4,6
6fnwh7_ARKK,ARKK,Why has $ARKK been traded almost 4 times its daily average today?,2017-06-06,9,0
zkh6w6_ARKK,ARKK,Is ARKK a buy ?,2022-12-13,0,77
lv1sjx_ARKK,ARKK,Investors beware: $ARKK is a liquidity disaster waiting to happen,2021-03-01,3447,990
ujkf0o_ARKK,ARKK,ARKK not updating their YTD return on their website. ARKK is now down 50% YTD.,2022-05-06,2570,315
szjozt_ARKK,ARKK,"$ARKK continues to unload $PLTR - so, go long?!",2022-02-23,757,486
1ex8sbs_ARKK,ARKK,"Cathie Wood’s ARKK Investors Missed the Big Gains and Ate Huge Losses, New Data Show",2024-08-20,354,135
r0glgs_ARKK,ARKK,Cathie Woods Arkk Death Spiral?,2021-11-23,507,383
s7pxvh_ARKK,ARKK,ARKK a buy now?,2022-01-19,354,446
vlar3m_ARKK,ARKK,Advice on ARKK position,2022-06-26,330,360
uddjzd_ARKK,ARKK,Should I Give up on ARKK?,2022-04-27,220,337
mfvd8q_ARKK,ARKK,"At this point, do I take the lesson on ARKK and sell it for VOO?",2021-03-29,181,309
1bqrrx3_ARKK,ARKK,Updated thoughts on $ARKK?,2024-03-29,47,101
s9mp82_ARKK,ARKK,"""All $ARKK buyers since July 2020 are under water.""",2022-01-21,262,147
ueb78c_ARKK,ARKK,"Official as of today: Since the 2014 inception of $ARKK, the ETF has now underperformed Berkshire Hathaway.",2022-04-29,291,101
svvlmo_ARKK,ARKK,$DKNG + $ARKK - Cathie Woods has LOST IT!!,2022-02-18,78,164
ujzede_ARKK,ARKK,TIL: SP500 beats ARKK in 5 year period,2022-05-06,218,98
mf4qmg_ARKK,ARKK,ARKK has put in a bottom?,2021-03-28,82,178
ifa049_ARKK,ARKK,The market doesn’t account for unexpected innovation. Which is why ARKK is currently the best ETF today.,2020-08-23,148,140
m0qizi_ARKK,ARKK,ARKK continue to hold or sell immediately,2021-03-08,30,145
ur9k8d_ARKK,ARKK,ARKK is trading about 30% below its peak in Feb 2020 prior to the Covid crash,2022-05-16,113,75
t3pzhh_ARKK,ARKK,$ARKK is on a run; up 16% since the low of Feb 23,2022-02-28,49,91
kcm7ti_ARKK,ARKK,The only reason I am staying away from ARKK and ARKQ is because of Tesla. is this irrational?,2020-12-14,76,111
rtnyjw_ARKK,ARKK,"Since 1/1/2020, an allocation of 90% S&P 500 and 10% TSLA has outperformed ARKK",2022-01-01,96,81
lrpim1_ARKK,ARKK,Why such a sudden hate for ARKK?,2021-02-24,68,90
1de7po9_ARKK,ARKK,Wash Sale Rule - Selling ARKK/ARKG and buying NVDA?,2024-06-12,10,18
s3gxht_ARKK,ARKK,Arkk vs nasdaq 11 month ago and now,2022-01-14,68,63
sflg1w_ARKK,ARKK,"ARKK - an absolutely crappy stock, may now be ready for a short term opportunity.",2022-01-29,0,79
swus59_ARKK,ARKK,ARKK is absolutely the best ETF you can buy,2022-02-20,0,76
rxq2fz_ARKK,ARKK,"People make fun of ARKK and Woods, but her fund is still up 287%!",2022-01-06,24,70
x2216z_ARKK,ARKK,Investing in ARKK now?,2022-08-31,0,55
krccda_ARKK,ARKK,Should I put my 14k in ARKK ETFs?,2021-01-06,54,68
ozrvsz_ARKK,ARKK,ARKK vs. Goldman Sachs unprofitable company basket,2021-08-07,74,55
tbx1zy_ARKK,ARKK,Cathie Wood’s ARKK Lures Almost $1 Billion Even as ETF Sells Off,2022-03-11,37,47
m038nl_ARKK,ARKK,ARKK (Innovation Fund) Top 5 Stock Picks - Week Ending 3/7/21,2021-03-08,128,37
kizy1n_ARKK,ARKK,Is ARKK a safe long term hold?,2020-12-23,21,57
sier2e_ARKK,ARKK,Cramer likes top stocks in ARKK ?,2022-02-02,31,40
kw8ttd_ARKK,ARKK,Is ARKK only bullish because of the hype and money pumping in from investors?,2021-01-13,40,50
mdor53_ARKK,ARKK,"Man, ARKK has been tearing me a new one.",2021-03-26,15,53
sva63d_ARKK,ARKK,"In the other universe where TESLA would crash like Paypal, Meta, Block, ARKK",2022-02-18,15,40
i7432n_ARKK,ARKK,Investing in ARKK vs investing in all 5 or multiple actively managed ARK ETFs,2020-08-10,31,46
lx95p2_ARKK,ARKK,"I am really confused about ARKK buying PLTR, can someone help me clarify why?",2021-03-04,17,34
mgvio4_ARKK,ARKK,Need some advice on Arkk,2021-03-31,6,33
lygri4_ARKK,ARKK,ARKK sold half of their $PYPL holdings,2021-03-05,18,31
sizewg_ARKK,ARKK,ARKK ETF has become a Dumpster fire,2022-02-02,1,24
iica19_ARKK,ARKK,"1st trade: I’ve narrowed it down to 2 options, AAPL or an ETF (QQQ)(ARKK) or (SPY)",2020-08-28,14,35
m6tosk_ARKK,ARKK,Cathie's copycat MOON ETF overperforming ARKK 10x,2021-03-17,21,29
hqcgim_ARKK,ARKK,Anyone have a position on ARKK?,2020-07-13,22,34
kw8o6i_ARKK,ARKK,Do you think there will be a big arkk & arkg dip in 2021?,2021-01-13,4,31
lz11co_ARKK,ARKK,Question for people invested in ARK funds. Specifically ARKK.,2021-03-06,15,29
hxa2xm_ARKK,ARKK,"Put 1500CAD total into QQQ, APPL, and ARKK yesterday afternoon, not sure how I feel about the market currently. What kind of investments are you guys making rn?",2020-07-24,3,33
jg5v23_ARKK,ARKK,Arkk ETF (Cathy Woods) - Getting Lucky or Real Innovation?,2020-10-22,20,28
hvyafy_ARKK,ARKK,ARKK,2020-07-22,22,28
ki29sc_ARKK,ARKK,ARKG vs ARKK,2020-12-22,5,26
ifn9mr_ARKK,ARKK,Is ARKK a buy ?,2020-08-24,5,26
hasekl_ARKK,ARKK,"ARKK, QQQ, FTEC, and MGK",2020-06-17,9,26
v40lm4_ARKK,ARKK,How has SARK outperformed shorting ARKK this year?,2022-06-03,1,11
k8xtl3_ARKK,ARKK,Thoughts on investing everything into actively managed ETFs? (ARKK),2020-12-08,18,20
oynurt_ARKK,ARKK,ARKK made $115 million in Robinhood today. https://t.co/BkQTsvznF1,2021-08-05,1418,248
vw4cam_ARKK,ARKK,"Cathie Wood continues to buy the dip on Coinbase COIN, here's her ARKK position, visualized.",2022-07-10,865,238
wwij0r_ARKK,ARKK,"Ark Invest's (ARKK) Cathie Wood has sold $50.4 million shares of Nvidia (NVDA) ahead of the company's Q2 earnings report today after the bell. Earlier this month, Wood bought $60M of NVDA shares when it preannounced its weak Q2 sales. What are your thoughts on this move by Wood?",2022-08-24,373,193
13s311z_ARKK,ARKK,$ARKK holders are punching the air rn,2023-05-26,689,61
x5zep5_ARKK,ARKK,"This is crazy... After selling 230k shares of NVDA just two weeks ago, ARKK has re-purchased another 230k shares last week.",2022-09-04,504,102
v5kwwj_ARKK,ARKK,"The way ARKK has bought the dip on TDOC is remarkable! Here's how it looks, visualized.",2022-06-05,415,104
upjgn0_ARKK,ARKK,Is ARKK showing us the future of what’s to come for QQQ and SPY,2022-05-14,123,136
sslj4v_ARKK,ARKK,"Cathie Wood’s ARK Stays the Course, Betting Big on Innovation. ARK Investment Management is snapping up more shares of largely unprofitable companies. Past two weeks, Ms. Wood’s flagship ARK Innovation ARKK exchange-traded fund has bought more than $400 million of high-growth stocks,",2022-02-14,359,72
1hs1ops_ARKK,ARKK,ARKK vs. SPY - Performance Comparison past 5 Years,2025-01-02,37,11
1e1hjtp_ARKK,ARKK,ARKG & ARKK,2024-07-12,10,36
y0wdmy_ARKK,ARKK,The Tortoise And The Hare. Warren Buffett's Berkshire Hathaway vs Cathie Wood's ARKK ETF Since 2020 (right click chart to turn off loop),2022-10-11,216,26
14b98vk_ARKK,ARKK,"So if you had to buy stocks only from ARKK without just buying the ETF, which stocks do you think Cathy Wood will be right about??",2023-06-16,1,23
10sg2ne_ARKK,ARKK,"Cathie Wood Takes Victory Lap, Calling ARKK 'the New Nasdaq'",2023-02-03,7,27
uxezxw_ARKK,ARKK,ARKK Inflows Stay Strong Despite Underperformance: $1.5B in 2022 So Far,2022-05-25,53,27
ng35du_ARKK,ARKK,"ARKK, ARKX and COIN Bagholder",2021-05-19,23,41
108ay82_ARKK,ARKK,"ARKK has nearly exited their position in NVDA and continued to buy the dip in TSLA. Here it is, visualized. Thoughts?",2023-01-10,7,19
ud1eiv_ARKK,ARKK,ARKK Innovation Fund Down 65% from ATH: Tesla Remains Biggest Bet,2022-04-27,70,12
x4j2jv_ARKK,ARKK,Cathie Wood's ARKK continues to face headwinds...SARK investors rejoice.,2022-09-03,22,14
sfbek9_ARKK,ARKK,All 43 ARKK Holding List (2022) With Weight & Market Value,2022-01-29,5,18
15lrn9d_ARKK,ARKK,A Mean-Reversion Strategy for ARKK ETF,2023-08-08,1,0
141nbr3_ARKK,ARKK,QQQ v ARKK. Peak to trough... same pattern,2023-06-05,0,2
x4346h_ARKK,ARKK,Cathie Wood’s ARKK Sees Biggest Monthly Outflow in Nearly a Year,2022-09-02,12,7
y3ok7a_ARKK,ARKK,This year ARKK has massively underperformed compared to an ETF designed to only invest in meme stocks. I literally couldn't come up with a worse ETF idea than that if I tried. Time to pack it up?,2022-10-14,4,3
ptvpki_ARKK,ARKK,Useful leaderboard that tracks what Cathie Wood is buying and selling in ARKK,2021-09-23,47,5
untn16_ARKK,ARKK,The story of ARKK does not look so great anymore.,2022-05-12,10,4
ofnpn8_ARKK,ARKK,ARKK might be entering into a downtrend.,2021-07-07,3,11
jfrsre_ARKK,ARKK,How much sense would it make to invest in both ARKK and TSLA?,2020-10-22,0,9
jcz5rc_ARKK,ARKK,Another post about Arkk,2020-10-17,1,6
ljlnug_ARKK,ARKK,Using a 'Pie' to invest in ARKK with trading212,2021-02-14,0,5
og95ve_ARKK,ARKK,Further development of ARKK downtrend,2021-07-08,0,2
lspr8i_ARKK,ARKK,2021 IPO Picks - ARK Invest Cathie Wood BUYING these SPACs! CAPA BFLY IPOA EXPC SKLZ ARKK,2021-02-26,3,3
ljly8c_ARKK,ARKK,Investing in ARKK through a 'pie' in Trading212,2021-02-14,1,3
hpkfu7_ARKK,ARKK,ARKW and/or ARKK for Long Term Hold ?,2020-07-11,2,5
ls09n2_ARKK,ARKK,"ARKK ETF strike price 51.82 , instead of 52 like even number. why is that",2021-02-25,1,2
meg0ka_ARKK,ARKK,"Cheapness, Profitability, and Sentiment of ARKK Holdings",2021-03-27,4,1
9cnes0_ARKK,ARKK,What are your thoughts on $ARKK,2018-09-03,20,9
py2j8g_ARKK,ARKK,Ultimate Options Selling Guide PT 2 - Detailed Trade Example (ARKK),2021-09-29,509,132
kcajie_ARKK,ARKK,ARKK leaps have been paying out like crazy. Chart included.,2020-12-13,341,223
y0gjg2_ARKK,ARKK,Looking for best LEAP strategy to long ARKK.,2022-10-10,16,37
nk45n8_ARKK,ARKK,Sell or keep ARKK Calls,2021-05-24,15,58
oo7si0_ARKK,ARKK,One of my finest plays... ARKK 126c 7/23,2021-07-20,40,48
kfavo1_ARKK,ARKK,ARKK 18 Jun 21 120 C being miss priced.,2020-12-18,16,53
k8vgap_ARKK,ARKK,DEEP ITM LEAP calls on ARKK,2020-12-08,31,39
o9vxff_ARKK,ARKK,ARKK Call Option,2021-06-28,8,25
kjtnbw_ARKK,ARKK,ARKK: Naked Put or Synthetic Long Stock,2020-12-25,13,25
lslmol_ARKK,ARKK,Keep these ARKK 175c June 18th?,2021-02-26,2,18
m2i14g_ARKK,ARKK,ARKK LEAPS?,2021-03-11,9,18
rndj49_ARKK,ARKK,Opened a credit spread on ARKK one day after I sold the stock at a loss. Did I trigger wash sale rule?,2021-12-24,2,7
kf2a69_ARKK,ARKK,ARKK Call Options: ARKK220121C125,2020-12-17,1,14
mf7iiq_ARKK,ARKK,ARKK IV,2021-03-28,5,11
il9zv9_ARKK,ARKK,calls on ARKK,2020-09-02,0,15
rrpw7r_ARKK,ARKK,ToS Glitch: ARKK Options and Capital Gains Distributions?,2021-12-30,8,5
rs3jvp_ARKK,ARKK,"Odd strike prices, ARKK",2021-12-30,2,5
pbbmni_ARKK,ARKK,Need help with an option play with ARKK and ARKG,2021-08-25,0,6
rs5qeh_ARKK,ARKK,What Happened to the ARKK Options Chain,2021-12-30,1,3
lrrfbo_ARKK,ARKK,Arkk funds loading up on SQ today,2021-02-25,4,6
jrdobu_ARKK,ARKK,ARKK $150 Jan2023 calls,2020-11-10,0,8
iz8ce0_ARKK,ARKK,Strategy to protect ARKK position,2020-09-24,11,7
j6rm1m_ARKK,ARKK,Wheeling ARKK,2020-10-07,2,6
15lqxoc_ARKK,ARKK,A Mean-Reversion Strategy for ARKK ETF,2023-08-08,3,2
ntz1fd_ARKK,ARKK,"Cleanest + Repeated Options Flow Plays Series # 3 - AMC, CLNE, FUBO, ARKK. FB, FUTU, JMIA",2021-06-06,37,12
npjq8q_ARKK,ARKK,"Cleanest Options Flow from Last Week - Setups going into Next Week - QQQ, CRWD, ARKK, PAGS, ZM, ABNB",2021-06-01,32,12
1frslc1_ARKK,ARKK,"Does all these ""growth"" shilling on mainstream investing sub remind people of anything ? Yes, it resembles the shilling of ARKK in 2020. People even took mortgage and go 100% ARKK in IRA",2024-09-29,8,10
nxwqss_ARKK,ARKK,"Take out mortgage on fully paid home and put 2/3rd in QYLD and 1/3 in ARKK - Good idea ? , pls help, new in the game",2021-06-12,0,29
p5wg2e_ARKK,ARKK,"Looks like burry is shorting arkk , I ranted about how ARKk and cathie wood suck on a previous post, and I got hate. I guess great minds think a like",2021-08-17,40,119
kb7jfz_ARKK,ARKK,ARKG and ARKK,2020-12-11,37,32
14yrbey_ARKK,ARKK,ARKK Stocks Sunk - The Intellectual Investor (History Lesson),2023-07-13,1,0
pu4msq_ARKK,ARKK,nice video on why burry shorted arkk & tesla,2021-09-23,15,13
