Post_ID,Ticker,Title,Post_Date,Upvotes,Num_Comments
3m8fdu_XOM,XOM,"How low do these (BP, RSD.A, XOM, COP) large Oil companies have to get before it makes sense to buy for long term?",2015-09-24,19,45
2p0z4n_XOM,XOM,"XOM, CVX, COP - big oil predictions in long term?",2014-12-12,2,5
10l10cn_XOM,XOM,"When to Get Out of Oil Stocks? XOM, COP and CVX",2023-01-25,26,51
2xadpd_XOM,XOM,Dividend cuts coming for Conoco & Chevron? Tickers: $COP $CVX $XOM,2015-02-26,2,17
2mbwln_XOM,XOM,"Opinion on oil companies; CVX, XOM, BP, COP, RDSA - they all pay dividends, and are all under P/E ratio of 15. Which do you think is best, or is there some index fund that tracks these companies?",2014-11-14,2,2
3rdscw_CVX,CVX,Beastmode Oil Majors - CVX/XOM/COP,2015-11-03,3,8
2p0z4n_CVX,CVX,"XOM, CVX, COP - big oil predictions in long term?",2014-12-12,2,5
10l10cn_CVX,CVX,"When to Get Out of Oil Stocks? XOM, COP and CVX",2023-01-25,27,51
2xadpd_CVX,CVX,Dividend cuts coming for Conoco & Chevron? Tickers: $COP $CVX $XOM,2015-02-26,2,17
2mbwln_CVX,CVX,"Opinion on oil companies; CVX, XOM, BP, COP, RDSA - they all pay dividends, and are all under P/E ratio of 15. Which do you think is best, or is there some index fund that tracks these companies?",2014-11-14,2,2
1dk8q38_COP,COP,Texas Cop Stops $40K Bitcoin Scam Mid-Swindle ,2024-06-20,67,9
n6g8xh_COP,COP,"Scott, Cook, and Gensler: They don't want ""any more of this Gamestop"". ""The SEC is a cop on the beat"". We're ""inexperienced investors"" and ""unqualified people on social media"". We need an ""intermediary or financial advisor"". The SEC is ""gonna vigorously lean in against individuals... ...to assess"".",2021-05-06,107,58
nlokib_COP,COP,My friend and I have read the DDs and invested in Gamestop ($GME). We are now pulling a prank from the Beverly Hills Cop on Ken Griffin (Citadel) and Vlad Tenev (Robinhood).,2021-05-26,119,7
ldobnj_COP,COP,The current short volume is up 163% from previous month. Current price is 1.13 most likely will hit 5$ within this year. What do ya’ll think? Get a bunch of apes together and cop up like they’re hotcakes and stick it to the hedge funds who have been betting against it.,2021-02-06,0,13
4wsske_COP,COP,Okay seriously what the fuck is after hours trading. COP lost literally everything it gained today and I got calls.,2016-08-08,13,22
nv8nic_COP,COP,"Update to my last post😅😅😅 Not so bad, can’t wait for next week , whatever price it is, I will cop more shares in RH account📈📈",2021-06-08,3,4
jerx1i_COP,COP,CALL THE COP: The Ultimate Boomer Play,2020-10-20,2,5
6popwr_COP,COP,COP earnings tomorrow: RARE LONG CALL PLAY from ya boi,2017-07-26,1,17
l6ba3u_COP,COP,Bad Cop Good Cop,2021-01-27,3,3
l69gh7_COP,COP,U man wtf keep buying amc bruv mans gonna lose my investment in tryna cop a yard cuz,2021-01-27,2,3
3k65v5_COP,COP,"I'm 24, purchased 1185 shares of COP at $42.19 now I'm up $7000, should I sell it?",2015-09-09,3,21
je5m1w_COP,COP,Transcript of Conoco Acquisition of Concho Resources $COP $CXO,2020-10-19,5,2
4kad01_COP,COP,Critique my portfolio? Thinkin about picking up some COP and UA as well. Thoughts?,2016-05-20,2,12
6ok2hd_COP,COP,All in on HAL or COP?,2017-07-20,2,9
6rvn9b_COP,COP,Suicide mall cop robot company selling shares,2017-08-06,5,5
5r1ub3_COP,COP,"Moves for today: Credit put spreads on INTC, COP, and BAC",2017-01-30,4,5
3rdscw_COP,COP,Beastmode Oil Majors - CVX/XOM/COP,2015-11-03,3,8
3eh3sj_COP,COP,COP Earnings 7/30,2015-07-24,3,4
3m8fdu_COP,COP,"How low do these (BP, RSD.A, XOM, COP) large Oil companies have to get before it makes sense to buy for long term?",2015-09-24,21,45
csiwv9_COP,COP,"Any hope in oil/gas exploration, COP?",2019-08-19,5,14
je5nw0_COP,COP,Transcript of ConocoPhilips Acquisition of Concho Resources $CXO $COP,2020-10-19,30,2
41qhrc_COP,COP,Is this a bottom for COP?,2016-01-19,7,7
t1i1i_COP,COP,What the hell happened to COP this morning?,2012-05-01,3,11
2p0z4n_COP,COP,"XOM, CVX, COP - big oil predictions in long term?",2014-12-12,2,5
18dxgc_COP,COP,COP: any other ConocoPhilips owners out there?,2013-02-12,6,5
1jw89il_COP,COP,Trade shake-up: Bessent leads on trade as Lutnick plays ‘bad cop’ — and Navarro is sidelined,2025-04-10,52,32
10l10cn_COP,COP,"When to Get Out of Oil Stocks? XOM, COP and CVX",2023-01-25,25,51
je207x_COP,COP,$COP,2020-10-19,5,13
hngp8e_COP,COP,GAP (GPS) Cop or drop?,2020-07-08,0,6
2ta1ku_COP,COP,"Beginner question: What leads investors to believe that certain oil/mining stocks (e.g. FCX & COP) can survive the drop in prices, as opposed to eventually going bankrupt?",2015-01-22,21,16
2xadpd_COP,COP,Dividend cuts coming for Conoco & Chevron? Tickers: $COP $CVX $XOM,2015-02-26,2,17
haeg8g_COP,COP,Is COP at a decent price?,2020-06-16,0,2
jg04vq_COP,COP,EOG & COP,2020-10-22,2,0
1uvwfv_COP,COP,Coro Mining: COP on the TSX,2014-01-10,12,12
3jss07_COP,COP,Is COP a good buy?,2015-09-05,0,5
3nvubc_COP,COP,Opinion on COP,2015-10-07,3,4
2p3als_COP,COP,$COP:Bullish Forecast on ConocoPhillips,2014-12-12,5,4
58be53_COP,COP,COP,2016-10-19,1,1
629hxw_COP,COP,$CVE Just bought $COP Canadian Assets for 17.7B. Thoughts?,2017-03-29,1,0
2qqgri_COP,COP,Does anyone know of the company that sells the body cameras that every cop can be using in the USA?,2014-12-29,0,3
2mbwln_COP,COP,"Opinion on oil companies; CVX, XOM, BP, COP, RDSA - they all pay dividends, and are all under P/E ratio of 15. Which do you think is best, or is there some index fund that tracks these companies?",2014-11-14,2,2
2dkdnw_COP,COP,Is $COP a good buy below $80? Seems to be dipping today.,2014-08-14,3,1
1lexml_COP,COP,"Talk to me about this portfolio: INTC, COP, MO, DPS...",2013-08-30,2,1
1hqmu3h_COP,COP,Conoco Phillips (COP) JUST acquired Marathon Oil. (MRO) ,2024-12-31,2,5
n818ld_COP,COP,Biden's Wall Street cop is putting Robinhood on notice,2021-05-08,38,7
3e39pb_COP,COP,"ConocoPhillips (COP), time to buy?",2015-07-21,10,15
2u2wse_COP,COP,"1/29/15 Earnings to Watch: BABA, FB, MCD, F, DOW, TWC, COH, COP, JBLU & more",2015-01-29,3,4
62dx3b_COP,COP,"3.30.17 Thursday Stock Market Movers & News: LULU, COP, BSX, VFC, GE, CMG, BAC, LMT, GT",2017-03-30,5,0
2ks1g0_COP,COP,"10/30/14 Early Movers: TWC, COP, MOS, KRFT, V, AKAM, BIDU & more",2014-10-30,4,2
3tgv5u_COP,COP,Are negative foreign currency impacts the biggest cop-out ever?,2015-11-19,11,19
9dkf3b_COP,COP,Windstream Dispute Highlights Aurelius’ Role as a Hedge-Fund Debt Cop,2018-09-06,15,10
mcwq6_COP,COP,Conoco Philips (NYSE:COP) Announces Spinoff of Philips 66,2011-11-15,1,0
taeomf_COP,COP,MRO and COP options sinking,2022-03-09,2,10
qhqhco_COP,COP,I went all in to $COP was that smart?,2021-10-28,0,3
gtdxta_COP,COP,$DGLY COP/RIOT PLAY,2020-05-30,2,2
h9m930_COP,COP,With the bill passing on Wednesday. Any other stocks apart DGLY making cop body cams to look into ?,2020-06-15,8,12
gtdwxo_COP,COP,DGLY RIOT/COP PLAY,2020-05-30,7,5
1h6sp60_COP,COP,MRO EXCHANGE TO COP,2024-12-04,2,2
10bwu2h_COP,COP,Thoughts on COP,2023-01-14,1,7
9nmhvc_COP,COP,‪Dividend capture strategy- Option Trading Education https://youtu.be/6mHLcyWBSxw via @YouTube $abbv $abt $cop $$fcx $maa $sjr $afg $wso $trn ‬,2018-10-12,4,0
m57tec_COP,COP,"""If a cop follows you for 500 miles, you're going to get a ticket."" That's how Warren Buffett",2021-03-14,0,2
tn05a6_COP,COP,"Pa. lawmaker, ex-cop explains his support for pot legalization: ‘I haven’t lost my mind’",2022-03-24,49,2
bg4006_COP,COP,"This Durham cop intentionally misled bosses about his unlicensed marijuana dispensary, the OPP concluded. He has never faced discipline",2019-04-22,21,7
5wl00x_COP,COP,"Article: Toronto's former top cop visits Sault, talks about legalizing pot Bill Blair and Trudeau government advocating legalized production and sale of marijuana",2017-02-28,10,3
xjzyiw_COP,COP,Ripple General Counsel Says SEC Chair Cannot “Appoint Himself As Cop On the Beat for Crypto”,2022-09-21,111,9
zd7hx4_COP,COP,The ‘Good Cop and Bad Cop’ of US Crypto Regulations,2022-12-05,5,3
cta7yn_COP,COP,SEC's Top Crypto Cop Joins Coinbase's Law Firm,2019-08-21,3,1
7jhgnr_COP,COP,Joining The Craze: Some Investors Are Taking Out Mortgages On Their Homes To Cop Bitcoin!,2017-12-13,1,0
