Post_ID,Ticker,Title,Body,Post_Date,Upvotes,Num_Comments
5a6f462e-8e1f-48c4-8b69-cba1f9fae430,CRWD,CrowdStrike Partners With Australia’s AARNet to Thwart Cyber-attacks in Research and Learning Institutions,"In This Article:
Crowdstrike Holdings, Inc. (NASDAQ:CRWD) has affirmed its commitment to helping research and learning institutions defend themselves against advanced cyber-attacks. On May 28, the company inked a strategic collaboration with Australia’s Academic and Research Network (AARNet). As…",2025-05-29,,
02642fe9-9617-4850-8dec-63c0e981db4d,CRWD,"Nvidia upgraded, Salesforce downgraded: Wall Street's top analyst calls","In This Article:
The most talked about and market moving research calls around Wall Street are now in one place. Here are today's research calls that investors need to know, as compiled by The Fly.
Top 5 Upgrades:
-
Summit Insights upgraded Nvidia (NVDA) to Buy from Hold after its Q1 results and…",2025-05-29,,
f861613a-6c51-47e0-9bd9-3c16d15bff20,CRWD,Do You Believe in the Growth Prospects of CrowdStrike Holdings (CRWD)?,"In This Article:
Maple Tree Capital, an investment management company, released its Q1 2025 investor letter. A copy of the letter can be downloaded here. Q1 2025 saw a strong start but turned sour due to tariff concerns and macroeconomic fears, leading to a sharp market pullback, with the Nasdaq…",2025-05-29,,
477ef7ec-5b1f-4c22-ba85-a2624da9c309,CRWD,Barclays Lifts CrowdStrike (CRWD) PT to $500 Ahead of FQ1 2026 Earnings,"In This Article:
Barclays analyst Trevor Young has increased the price target on CrowdStrike Holdings Inc. (NASDAQ:CRWD) to $500 from $475, while maintaining an Overweight rating on the shares.
This adjustment comes ahead of CrowdStrike's FQ1 2026 earnings report, which is expected to come out on…",2025-05-28,,
d2497b69-4b9c-432e-acb3-97600b61a960,CRWD,Investors Pay Up To Own These Six Promising Stocks,"Curious which S&P 500 stocks investors think are worth a premium? Just look at the ones with the highest valuations.
Six S&P 500 stocks — including Palantir Technologies (PLTR), Tesla (TSLA) and CrowdStrike (CRWD) — carry forward P-E ratios of 100 or more, says an Investor's Business Daily…",2025-05-28,,
9914b4d8-792d-4716-92ff-82caff44d26b,CRWD,Alphabet Just Slashed Its Stake in This Monster Artificial Intelligence (AI) Cybersecurity Stock. Should You Follow?,"In This Article:
Key Points
-
Per its most recent 13F filing, Alphabet sold shares in CrowdStrike for the first time in a year.
-
Over the last year, CrowdStrike stock has outperformed its peers and the broader market.
-
In addition, Alphabet's recent acquisition of Wiz could be seen as a signal…",2025-05-28,,
65c8b1b6-d0a3-4148-be4c-31b6fc50b35b,CRWD,"Jim Cramer Says CrowdStrike Holdings, Inc. (CRWD) Stock is “One of the Greatest Performers of All Time”","In This Article:
We recently published a list of Jim Cramer Had These 21 Stocks on His Radar. In this article, we are going to take a look at where CrowdStrike Holdings, Inc. (NASDAQ:CRWD) stands against other stocks that Jim Cramer discusses.
Answering a caller’s query about CrowdStrike Holdings,…",2025-05-27,,
c403c582-36d3-47b6-afe7-9b37e521d9b9,CRWD,3 Top Cybersecurity Stocks to Buy in May,"In This Article:
Key Points
-
The cybersecurity space is important, and it's only getting bigger, providing growth opportunities for many companies.
-
While all three of these cybersecurity stocks are worthy of consideration today, a still unproven player could be a particularly good idea right…",2025-05-26,,
94b4a41d-e089-4ab9-b701-4dbaec597868,CRWD,The Market Is Setting Up For A Move (Technical Analysis),"Market Analysis - Nasdaq (NASDAQ:QQQ)
Last week, I noted that we'd entered a large congestion zone and were extended and due for some pullback or chop. Right on schedule, the market put in a solid and healthy chop week although
Last week, I noted that we'd entered a large congestion zone and were…",2025-05-25,,
43daf12b-597b-43bb-a079-b70db784a5b7,CRWD,"Why Stifel Just Boosted Its Price Target on CrowdStrike Holdings, Inc. (CRWD) Stock","In This Article:
We recently published a list of 10 AI Stocks on Latest News and Ratings. In this article, we are going to take a look at where CrowdStrike Holdings, Inc. (NASDAQ:CRWD) stands against other best AI stocks on latest news and ratings.
CrowdStrike Holdings, Inc. (NASDAQ:CRWD) is a…",2025-05-23,,
36c668fa-4732-41be-b258-a1fca0ec1724,CRWD,CrowdStrike (NASDAQ: CRWD) Stock Price Prediction and Forecast 2025-2030 (May 2025),"In the past month, CrowdStrike Holdings Inc. (NASDAQ: CRWD) announced it would cut 5% of its staff, reaffirmed its fiscal 2026 outlook, and appointed a new chief communications officer. Like other cybersecurity stocks, it has shrugged off the tariff-driven volatility, and Jim Cramer continues to…",2025-05-23,,
117c1402-4bf7-4528-87e2-c1b0db92335d,CRWD,"Was Jim Cramer Right About CrowdStrike Holdings, Inc. (CRWD)?","In This Article:
We recently published a list of Jim Cramer Nailed These 11 Stock Predictions. In this article, we are going to take a look at where CrowdStrike Holdings, Inc. (NASDAQ:CRWD) stands against other stocks that Jim Cramer discusses.
Back in 2024, on May 16, Mad Money’s Jim Cramer…",2025-05-23,,
07b73eea-e295-434c-8783-2f717ec59537,CRWD,Stock Market Today: Technology stocks get a solid bid,"In This Article:
Updated: 10:49 a.m.
Technology has emerged as primary market fuel in mid-morning trading.
Three sectors — Communications Services, Information Technology and Consumer Discretionary — are leading the Standard & Poor's 500 Index.
Stocks leading those sectors include Google parent…",2025-05-22,,
0024174a-0876-48c1-b9c2-d88427745558,CRWD,"Stock Market Live May 22: Debt Up, S&P 500 (VOO) Down","Live Updates
 
 Live Coverage
 Updates appear automatically as they are published.
 
 
 
 
 
 
JPMorgan Loves Urban Outfitters
 
 
 9:54 am
 
 
 
 
On what was already looking like a pretty nice day for investors in retail stocks, JPMorgan just upgraded Urban Outfitters (Nasdaq: URBN) stock to…",2025-05-22,,
91e88934-fe8b-4e9d-b7a0-fb0e38e9fb77,CRWD,AI Security Pivot Places Cisco Systems Stock (CSCO) in Pole Position,"In This Article:
Cisco Systems (CSCO) shares remained relatively flat despite the company surpassing expectations in its latest quarterly results published last week. The technology leader delivered both revenue and earnings beats, driven by strong performance in its security and observability…",2025-05-21,,
1ff9bd35-bcae-4028-85e1-577976828671,CRWD,CrowdStrike Strengthens AI Security with NVIDIA Enterprise AI Factory Integration,"In This Article:
On May 19, CrowdStrike Holdings, Inc. (NASDAQ:CRWD) announced its integration into the NVIDIA Enterprise AI Factory validated design, enabling enterprises to protect AI infrastructure, systems, and models as they scale AI adoption.
A financial planner carefully scrutinizing…",2025-05-21,,
90020bb7-e13a-472a-9fcd-5ce8a9edccf3,CRWD,Jim Cramer on Palo Alto Networks (PANW): “Wait Until After They Report”,"We recently published a list of 15 Stocks on Jim Cramer’s Radar. In this article, we are going to take a look at where Palo Alto Networks, Inc. (NASDAQ:PANW) stands against other stocks on Jim Cramer’s radar
On Friday’s episode of Mad Money, Jim Cramer reflected on this week’s market performance,…",2025-05-20,,
