Post_ID,Ticker,Title,Body,Post_Date,Upvotes,Num_Comments
07bcbaa1-77a0-42d4-b8f1-aa237e7e6938,CVX,3 Hedge Fund Favorite Stocks Trading At Yearly Low Prices,"With another 13F filing season out of the way, investors may wish to check out the names that the big money has been scooping up in recent months. In the first quarter, there was a ton of action. And while the biggest takeaway is that the smart money is hedging their bets while staying cautious in…",2025-05-29,,
5e9a7553-8f92-4a91-8cf7-cf5ef3d226f9,CVX,"Futures Erases Overnight Loss, Trade Higher Ahead Of Nvidia Earnings","Futures Erases Overnight Loss, Trade Higher Ahead Of Nvidia Earnings
 
S&P futures are marginally higher on the day, reversing an earlier loss driven by modestly higher yields after Japan’s 40-year auction sale Wednesday was met with the weakest demand since July, even if it was far more solid…",2025-05-28,,
cea04fd6-5fb4-4869-9490-63fa340a9f00,CVX,"Oil prices hold steady on supply risks, expected decision from OPEC+ on output increase","Oil prices held steady on Wednesday after the U.S. barred Chevron Corp. CVX-N from exporting crude from Venezuela, but an expected decision from OPEC+ later this week to increase production in July capped gains.
Brent crude futures was up 6 cents, or 0.1%, to $64.15 a barrel by 4:52 a.m. ET, while…",2025-05-28,,
71270542-b78d-4409-9ad3-2ab9d9cc39fb,CVX,Warren Buffett Is Still Very Worried and Still Selling: His 3 Highest-Yielding Stocks Are Summer Steals,"If any investor has stood the test of time, it is Warren Buffett, and with good reason. For years, the “Oracle of Omaha” has had a rock-star-like presence in the investing world, and his annual Berkshire Hathaway Inc. (NYSE: BRK-B) shareholders meeting draws thousands of loyal fans who are…",2025-05-27,,
6d215b23-7661-4bf7-be90-2c7101d5636c,CVX,2 ETFs Under $50 Built for a Bear Market,"With all of the uncertainty swirling around the economy, the stock market has been moving one step forward and two steps back. The S&P 500 dipped into correction territory in March — falling 10% from its peak level — before emerging from that fearful status in April. Worse, the threat of an…",2025-05-27,,
7150d86a-36fc-4a5e-9a6b-9099a58865b1,CVX,3 High-Yield Dividend Stocks to Buy Right Now to Boost Your Passive Income,"In This Article:
Key Points
-
Buy Dominion Energy for the 4.8% yield; keep it for the unfolding turnaround.
-
Western Midstream Partners pays a monster cash distribution.
-
The recent drop in Chevron's stock price is a solid buy opportunity.
Buying dividend stocks is one of many ways to generate…",2025-05-25,,
51b586e6-14df-4b8d-8f01-8d192a9ba236,CVX,Generating Passive Income: 3 Top Dow Dividend Stocks to Buy for 2025 and Beyond,"In This Article:
Key Points
-
Chevron has hiked its dividends for 38 straight years.
-
Johnson & Johnson recently raised its dividend for the 63rd year in a row.
-
Verizon has the longest dividend growth streak in the U.S. telecom sector.
The Dow Jones Industrial Average is an iconic stock market…",2025-05-24,,
35b4be46-e3ac-4c65-8aa6-281a1b929316,CVX,State Department Tells Chevron to Leave Venezuela,"In This Article:
It was reported on May 22, 2025, that the license allowing Chevron Corporation (NYSE:CVX) to operate in Venezuela will expire on May 27. Let's shed some light on the development.
An aerial view of an oil rig at sea, the sun glinting off its structure.
US Secretary of State Marco…",2025-05-23,,
3fd151ef-a453-4fce-ac71-24c8bb1daa4a,CVX,"Marjorie Taylor Greene Goes Shopping For Tesla, Netflix, UnitedHealth And More: 19 Stocks The Congresswoman Bought","Benzinga and Yahoo Finance LLC may earn commission or revenue on some items through the links below.
Rep. Marjorie Taylor Greene (R-Ga.) has been actively buying stocks in 2025 and is back with more than a dozen more trades less than two weeks after her last disclosure.
Here's the latest…",2025-05-22,,
e842d01f-d211-411a-81ad-6ef4f166f9ad,CVX,Stock Market Today: Technology stocks get a solid bid,"In This Article:
Updated: 10:49 a.m.
Technology has emerged as primary market fuel in mid-morning trading.
Three sectors — Communications Services, Information Technology and Consumer Discretionary — are leading the Standard & Poor's 500 Index.
Stocks leading those sectors include Google parent…",2025-05-22,,
11863ca1-a0f4-40da-b200-ae7592045c2d,CVX,3 Best Inverse ETFs to Profit in a Market Crash,"Key Points
 
 
 
 
The SH and PSQ ETFs provide simple inverse exposure to major U.S. market indexes.
 
 
 
For bearish-leaning risk takers, the SPXS ETF offers powerful leverage when the S&P 500 declines.
 
 
 
Are you ahead, or behind on retirement? SmartAsset’s free tool can match you with a…",2025-05-22,,
1f59da47-e744-46d6-9701-c41b21b96ea7,CVX,Chevron Eyes Major Oil and Gas Assets in Indonesia,"In This Article:
Chevron Corporation (NYSE:CVX) has shown interest in tapping into Indonesia's oil and gas assets with substantial reserves, according to Djoko Siswanto, head of the country's upstream regulator SKK Migas, who made the statement on May 20.
Djoko noted that Chevron is evaluating…",2025-05-22,,
6e7fb55d-4aa7-4e10-a9d5-493189d5d701,CVX,Trump to Extend Chevron’s License to Operate in Venezuela,"In This Article:
It was announced recently that the Trump administration is considering a plan to extend Chevron Corporation (NYSE:CVX)'s license to operate in Venezuela. Let's shed some light on the development.
An aerial view of an oil rig at sea, the sun glinting off its structure.
It was…",2025-05-21,,
a5df46be-e81e-4977-b8eb-e8834d8aa6ff,CVX,If Iran’s Nuclear Sites Are Attacked Oil Will Skyrocket – Grab These High-Yield Energy Giants Now,"This post may contain links from our sponsors and affiliates, and Flywheel Publishing may receive
 compensation for actions taken through them.
 
 Major media outlets announced this week that new intelligence suggests that Israel is preparing to strike nuclear facilities in Iran. This new…",2025-05-21,,
