Post_ID,Ticker,Title,Post_Date,Upvotes,Num_Comments
1cjmhu1_NFLX,NFLX,DIS (Disney) will fall 10%+ on earnings because:,2024-05-03,1142,393
957ft4_NFLX,NFLX,Is DIS really going to eat NFLX’s lunch with it’s streaming service?,2018-08-07,8,33
3h7n28_NFLX,NFLX,"THinking of buying NFLX, FB, TSLA, SHAK, TWTR, DIS, AAPL. Now please tell me why I am an investing genius.",2015-08-16,0,14
u7kpao_NFLX,NFLX,Everyone’s going on about NFLX after-hours when $DIS caught a bit of that heat… earnings predictions for $DIS?,2022-04-20,52,76
10juhvh_NFLX,NFLX,"WBD has $50.4bn in debt, DIS has $45bn, PARA has $15.6bn, and NFLX has $14bn. Netflix is the only one making money on streaming.",2023-01-24,53,49
qd0fo5_NFLX,NFLX,Why isn't DIS valued higher than NFLX?,2021-10-21,27,78
wn8tq3_NFLX,NFLX,Streaming wars continue - which stock do you prefer? $NFLX $DIS $WBD $PARA,2022-08-13,19,62
s93o8q_NFLX,NFLX,Disney Stock $DIS $NFLX,2022-01-21,34,64
g5ow7s_NFLX,NFLX,Netflix(NFLX) vs Disney(DIS),2020-04-21,15,30
80wobf_NFLX,NFLX,$NFLX V. $DIS,2018-02-28,14,32
hz5lkx_NFLX,NFLX,For movie industry control in next 5-10 yrs - would you invest in DIS or NFLX?,2020-07-28,4,21
62g7gp_NFLX,NFLX,"New highs: NFLX, AMZN, DIS, FB.",2017-03-30,28,29
lw408b_NFLX,NFLX,"Streaming - NFLX, DIS, CMCSA, AMZN",2021-03-02,0,14
wkz8yy_NFLX,NFLX,"Subscriber growth for $NFLX, $DIS, $AMZN, $AAPL, and $WBD streaming services.",2022-08-10,28,11
13y31lz_NFLX,NFLX,$DIS & $NFLX 🤔,2023-06-02,4,2
560zo6_NFLX,NFLX,for giggles I modeled a NFLX LBO by DIS. it is a possiblity.,2016-10-05,18,8
hz5mmk_NFLX,NFLX,For movie industry/streaming control in next 5-10 yrs: NFLX or DIS?,2020-07-28,1,1
ndok5d_DIS,DIS,DIS YOLO: ONE MILLION DOLLAR LOSS,2021-05-16,17212,1440
1cjmhu1_DIS,DIS,DIS (Disney) will fall 10%+ on earnings because:,2024-05-03,1148,393
bhs0qg_DIS,DIS,$DIS - $250 to $165k - inspired by NVDIA PUTS BRO,2019-04-26,5607,764
10g43s2_DIS,DIS,Dis beech,2023-01-19,941,556
1cm9cfe_DIS,DIS,There goes our calls guys $DIS,2024-05-07,667,253
16blai8_DIS,DIS,$DIS looks like it's about to pull off a META recovery,2023-09-06,333,516
fcbw7p_DIS,DIS,First Coronavirus cases in FL are 45 minutes from Disney World. Puts on DIS,2020-03-02,1378,313
15el2x6_DIS,DIS,Why's DIS dropping?,2023-07-31,242,489
kb7023_DIS,DIS,$DIS up 13%. Thanks For Saving My Portfolio Mickey!,2020-12-11,2303,116
soo676_DIS,DIS,$DIS Reports Smashing Earnings of $1.06 Compared to Consensus Estimate $0.60,2022-02-09,1054,176
kkx1hy_DIS,DIS,Watched the new Soul movie by $DIS. Looks like they are indicating a breakout. Rising wedge could signal a reversal.... market crash soon?,2020-12-27,1710,118
nce32s_DIS,DIS,$DIS YOLO: Cardboard Box time,2021-05-14,503,376
sm53n8_DIS,DIS,DIS to the moon after earning,2022-02-06,629,215
fipkax_DIS,DIS,Hitler finds out about his DIS puts on Friday,2020-03-14,1467,119
dvvp81_DIS,DIS,DIS tendies.,2019-11-13,941,174
14jk8w1_DIS,DIS,$DIS is looking good for a long call,2023-06-26,198,228
1bubxx3_DIS,DIS,The GUH of GUHs - Balls deep in the Mouse $DIS,2024-04-02,161,143
1eloin0_DIS,DIS,The mouse ($DIS) gonna fuck all your puts,2024-08-06,103,118
783dex_DIS,DIS,Dis some bullshit,2017-10-22,2833,65
1aj4i9r_DIS,DIS,DIS Earnings Plan,2024-02-05,115,147
fez62b_DIS,DIS,"Monday strategy: Calls on DGX, TDOC, CLX, GLD Puts on SPY, DIS, FDX, LYV, MSFT, USO, UAL",2020-03-07,444,259
uhwuf9_DIS,DIS,Bob chapek was trying to tell us something in February but we didn't listen $DIS,2022-05-04,752,89
fzc8e6_DIS,DIS,DIS Puts,2020-04-11,347,298
13ovkpa_DIS,DIS,Disney Theme-Parks Chief Says DeSantis Fight Hasn’t Hurt Business $DIS,2023-05-22,258,139
lksjpg_DIS,DIS,"DOW Yolo: $Dis 1.3mm, NASDAQ Yolo: $SQ 970k",2021-02-16,495,171
1iirnmw_DIS,DIS,"DIS beats earnings by 21%, streaming $293M in profit -- over $1B profit/yr. Total subscribers dis/hulu/espn 234M vs netflix 300M",2025-02-06,121,40
13fl4vn_DIS,DIS,Disney Stock: 3 Reasons to Buy the Dip? | Thoughts? / $DIS,2023-05-12,86,201
1duqpbi_DIS,DIS,$DIS Disney is at a once in a decade buying opportunity,2024-07-03,28,113
j09g4p_DIS,DIS,$DIS Reported to be in talks with U.S. military to develop ICBMs,2020-09-26,830,92
fhli79_DIS,DIS,Hopefully not for long for all of us holding $DIS puts. They are exempt due to them being one of the largest employers in OC and having a better and more efficient crisis response than the state government of CA.,2020-03-12,502,161
18uvahj_DIS,DIS,DIS PUTS,2023-12-31,298,62
1gr77gd_DIS,DIS,Made some cheddar with the House of Mouse $DIS,2024-11-14,300,22
fqzak1_DIS,DIS,"My Bear, very 🌈🐻, YOLO: $70,000 JDST Calls (850 contracts strike $3) & $20,000 in shares of JDST; $43,000 GLD puts; $10,000 GDXJ puts; $92,000 SPY puts; $65,000 DIS puts... and $6,000 DIS Call Credit.",2020-03-29,408,156
1eln771_DIS,DIS,Disney yolo $dis,2024-08-06,33,74
1clj6om_DIS,DIS,$DIS $PLTR ERs ,2024-05-06,67,82
13q4nkc_DIS,DIS,Round 3 of Disney job cuts starting $DIS,2023-05-23,222,88
fhnm34_DIS,DIS,"Bob Iger knew, dipped the fuck out before $DIS tanked 28% after he stepped down",2020-03-12,820,73
ffwpl7_DIS,DIS,Update 3: WSBGod is up $3.4m total from all of his posted open positions (TSLA calls + SPY/DIS/CCL/AAL/RCL/HA puts),2020-03-09,583,100
1al4tvg_DIS,DIS,Disney (DIS) Analysis,2024-02-07,44,99
1aghkp9_DIS,DIS,Betting against the Mouse (DIS),2024-02-01,33,98
1k15220_DIS,DIS,DIS ber case.. more downside?,2025-04-17,4,22
1eayopm_DIS,DIS,DIS will bounce back by Monday,2024-07-24,34,62
16ude59_DIS,DIS,Rachel Ziegler fired by Disney. Is this the turning point where the mouse finally abandons woke culture? $DIS,2023-09-28,0,131
1huzdiz_DIS,DIS,Let the 2025 M&A Games Begin - DIS to acquire FUB0 streaming ,2025-01-06,61,28
cmv9qj_DIS,DIS,$DIS Disney Earnings Thread; Keep all discussion here,2019-08-06,83,331
lh4e75_DIS,DIS,DIS yolo. Hodling through the ER tomorrow,2021-02-10,217,143
oj14y8_DIS,DIS,"Daily Option Statistics for SPCE, CLOV, AMC, GME, TSLA, WISH, DIS, BB, SOFI and others.",2021-07-12,287,109
16pcvmh_DIS,DIS,Puts it is (DIS),2023-09-22,251,49
1esbfc5_DIS,DIS,I’m bullish on $DIS,2024-08-14,0,55
uacpdi_DIS,DIS,Do you think $DIS is a buy?,2022-04-23,13,196
18wg5ui_DIS,DIS,Mickey and Minnie Mouse enter public domain as US copyright expires $DIS,2024-01-02,252,37
1cffwf2_DIS,DIS,Mouse Ear Puts FTW ($DIS),2024-04-28,22,62
soo19a_DIS,DIS,DIS - Fuck all your mouse haters,2022-02-09,268,87
1g5rkhd_DIS,DIS,DIS,2024-10-17,3,38
bbnxxt_DIS,DIS,$50k in $dis calls. May the force be with me,2019-04-10,209,164
15lu0ht_DIS,DIS,Walt Disney Co. (DIS)’s ESPN Is Getting Into Sports Betting With Penn Entertainment,2023-08-08,161,55
lwgrpk_DIS,DIS,We in dis together daddy musky,2021-03-03,269,87
1ebwo92_DIS,DIS,Let's Fucking Go! $DIS,2024-07-25,23,39
e7fr1b_DIS,DIS,"$DIS, go long, the Mandalorian says so himself",2019-12-07,320,94
19bbjb3_DIS,DIS,$DIS - The mega AI bull case for Disney,2024-01-20,10,62
1d9xi28_DIS,DIS,Thoughts about $DIS,2024-06-07,4,45
13k6meq_DIS,DIS,Disney CFO Christine McCarthy says Disney will continue to focus on existing intellectual property for new park investments $DIS,2023-05-17,118,59
1cxcx07_DIS,DIS,DIS news: Pixar lays off 14%,2024-05-21,89,31
95olio_DIS,DIS,"First time trading options, picked up some DIS calls and SNAP puts",2018-08-08,275,113
dr1hjm_DIS,DIS,Full Disney due diligence report inside. What effects will Disney+ have on DIS revenues (with pictures yay),2019-11-03,222,106
fkrl89_DIS,DIS,Who else is still fighting the DIS fight?,2020-03-18,151,120
fg0pzb_DIS,DIS,Why thinking $DIS will close their US Parks is BAD DD,2020-03-09,96,133
bir8pu_DIS,DIS,The true reason for DIS dropping this morning,2019-04-29,584,46
eyig7y_DIS,DIS,"I’m +9,750% on TSLA, just raising money for $DIS ER tho",2020-02-04,226,82
1am0j8x_DIS,DIS,Bought 3 105 DIS calls yesterday. Sold this morning because I was afraid it would fall. How do you learn to have diamond hands?,2024-02-08,6,41
dvv1sj_DIS,DIS,WTF is the news on $DIS? stock is mooning,2019-11-13,112,113
duymye_DIS,DIS,$DIS calls anyone?,2019-11-11,66,134
h8uy2o_DIS,DIS,NBA may not be coming back at DIS or otherwise,2020-06-14,56,125
rivw2x_DIS,DIS,Was looking for confirmation bias to YOLO on $DIS - I found it,2021-12-18,146,65
16mh8xf_DIS,DIS,Puts on DIS fellas?,2023-09-19,94,37
9a1uv8_DIS,DIS,At Disney World and noticed $DIS is now selling Micron branded merch. Long $MU.,2018-08-24,759,31
1fozexx_DIS,DIS,DIS 120C June'2025 Expiration - to the moon,2024-09-25,12,15
z1wl09_DIS,DIS,Inverse Cramer wins again: DIS puts printing at open.,2022-11-22,221,35
ge4gxn_DIS,DIS,DIS (Disney) earnings thread - today after the bell,2020-05-05,98,100
1gse7y3_DIS,DIS,$DIS options YOLO,2024-11-16,19,7
1am45yc_DIS,DIS,Haven't seen any DIS gains so here,2024-02-08,65,19
1g53bmz_DIS,DIS,DIS calls - sell or hold?,2024-10-16,3,8
1dtpu41_DIS,DIS,$DIS Are Universal Parks Expansion Plans A Cause For Concern?,2024-07-02,7,13
1d3iy1j_DIS,DIS,Walt Disney (DIS) 2Q24 Earnings: Mixed Results but Promising Future?,2024-05-29,4,11
1elk095_DIS,DIS,DIS small YOLO,2024-08-06,3,5
34e9i7_DIS,DIS,Three Strikes of the New Financial Regulation – Part 6: Banking Dis-Union,2015-04-30,3,0
e20jmz_DIS,DIS,"DIS news. Research firm Apptopia estimates that Disney+ has had 15.5 million downloads in the past 2 weeks, close to a million a day.",2019-11-26,699,93
wl85kx_DIS,DIS,$DIS jumps 5% after hours on revenue and EPS beat. Parks division revenue surge and streaming subscriber number growth in focus. Will raise streaming prices for both ad-free and ad-supported tiers.,2022-08-10,121,35
1c76lun_DIS,DIS,"Question about indexes, acc vs dis",2024-04-18,1,4
3hpx9z_DIS,DIS,DIS!!!! Stop dropping pls,2015-08-20,13,75
hg8ako_DIS,DIS,$DIS - analysts cut estimates again on likely delays to parks reopening and production resumption,2020-06-26,11,38
g8eulf_DIS,DIS,DIS earnings May 6th,2020-04-26,1,35
34xpe7_DIS,DIS,Disney (DIS) Tops Q2 EPS by 13c,2015-05-05,32,49
12cw1o_DIS,DIS,"Disney (DIS) to buy Lucas Films, will release Star Wars Episode 7 in 2015",2012-10-30,92,42
fjsx2s_DIS,DIS,Whats happening with Disney ($DIS)?,2020-03-16,13,25
957ft4_DIS,DIS,Is DIS really going to eat NFLX’s lunch with it’s streaming service?,2018-08-07,10,33
bd72cv_DIS,DIS,DIS call option 4/18 - what to do,2019-04-14,9,27
ulrnk6_DIS,DIS,Any [dis]advantages to mid-year tax-loss harvesting?,2022-05-09,5,6
3xpk74_DIS,DIS,ELI5: What's up with $DIS?,2015-12-21,36,34
f7i3q7_DIS,DIS,"AMD, V, or DIS for long term?",2020-02-21,0,21
e16dzc_DIS,DIS,"Ok, I’m going to try and break away from the Dis, V, WM, MSFT, AMZN thing. What are the most exiting healthcare sector stocks in your mind?",2019-11-24,0,21
8uf8gz_DIS,DIS,"BABA , GE , INST , SBUX , DIS",2018-06-28,7,27
fogajb_DIS,DIS,"Good time to get in TSLA, NVDA, UAL, BA, DIS ?",2020-03-25,0,16
bdjmj6_DIS,DIS,Is $DIS a buy at these prices?,2019-04-15,0,20
9sfy7k_DIS,DIS,$DIS - immune to market sell-off and a good time to invest,2018-10-29,6,18
jvfa2u_DIS,DIS,Thoughts on $DIS,2020-11-16,2,9
f2re9o_DIS,DIS,Is DIS ever going to run again?,2020-02-12,0,13
8qwcof_DIS,DIS,How are you playing the nascent bidding war between Comcast ($CMCSA) and Disney ($DIS) for Fox's ($FOXA) assets?,2018-06-13,5,19
3hre0h_DIS,DIS,DIS | Brief Analysis on its Future Prospects,2015-08-20,43,21
1dsldf_DIS,DIS,How does Disney (DIS) not boom after a movie release like Iron Man,2013-05-06,0,32
7l1w5l_DIS,DIS,"If $DIS is successful with acquiring $FOXA, it's a good buy now",2017-12-20,6,19
8k4zyq_DIS,DIS,Thoughts on DIS?,2018-05-17,6,17
fhhaif_DIS,DIS,Is it worth buying DIS for a short time hold?,2020-03-12,0,10
gpjr5o_DIS,DIS,"Price Buying Recommendation for (DIS, BA, NVDA, SPG, AAPL, LUV, TSLA, Roku, TTD)?",2020-05-24,0,9
fxuo58_DIS,DIS,$DIS - Putting Disney Plus' early success into context:,2020-04-09,1,8
al391x_DIS,DIS,FOX DIS merger terms/choice,2019-01-29,10,12
fbh8p1_DIS,DIS,Will Disney (Dis) have a weak Q1 with the Corona Virus or will they be able to make it up with their media services?,2020-02-29,1,8
fej1bs_DIS,DIS,"Hi All - Jack again... This Friday afternoon I will be purchasing more $MCD, $DIS and $RCL.",2020-03-06,0,8
eyu98d_DIS,DIS,DIS forecast after earning?,2020-02-04,21,6
6x32vt_DIS,DIS,($DIS )Disney cutting 10% of jobs at ABC + other budget cuts...,2017-08-30,77,7
545ygk_DIS,DIS,"stockAday: Disney's no Daffy, eh, Donald? $DIS",2016-09-23,18,15
566pzt_DIS,DIS,Is DIS a good buy?,2016-10-06,3,16
93t3y9_DIS,DIS,How do we feel about $DIS Earnings Next Week,2018-08-01,2,11
3fwbpr_DIS,DIS,Looking for opinions : cash out CMG and buying DIS,2015-08-05,7,18
fdifis_DIS,DIS,Opinion on $DIS,2020-03-04,3,4
7t83pw_DIS,DIS,"Disney (DIS) seems to do great as a company, what is holding the stock back? Are they facing difficulties in any area?",2018-01-26,1,11
iyyug1_DIS,DIS,$DIS - Needham lowers estimates on continuing COVID impact,2020-09-24,1,1
a027ff_DIS,DIS,"A few dividend picks: $DIS, $CAH, $LOW",2018-11-24,0,7
8i1lqa_DIS,DIS,Why dis stock price down in post market?,2018-05-09,0,8
3h7n28_DIS,DIS,"THinking of buying NFLX, FB, TSLA, SHAK, TWTR, DIS, AAPL. Now please tell me why I am an investing genius.",2015-08-16,0,14
5kpbig_DIS,DIS,Why you should invest in Disney (DIS).,2016-12-28,0,11
3k76tx_DIS,DIS,Estimated Merch for Star Wars Episode 7 Already Priced in to DIS?,2015-09-09,0,13
b3qpem_DIS,DIS,"If you had FOXA, how much DIS and/or cash did you get",2019-03-21,4,3
9i9owf_DIS,DIS,Comcast has won the bid for Sky against Fox (DIS). Sky is the premier satellite Subscription based TV/News service in the UK.,2018-09-23,3,4
7jq63u_DIS,DIS,$DIS & $FOX Merger,2017-12-14,2,5
4vwpzk_DIS,DIS,"Bought Disney (DIS) back in November, where do you think it will go from here?",2016-08-03,2,8
7jwedr_DIS,DIS,How did Reuters and other news agencies knew about mergers/acquisitions like DIS/FOX down to the announce date way ahead of time?,2017-12-15,1,5
97amyy_DIS,DIS,Will DIS acquisition on FOX give significant boost on earning?,2018-08-14,1,2
80rv4i_DIS,DIS,Should I sell or hold DIS?,2018-02-28,2,4
6vtbel_DIS,DIS,Question about using FIFO or LIFO on a 30 year old stock (DIS),2017-08-24,0,5
2dcdcn_DIS,DIS,"Looking to invest in stocks that have a strong footing, growth potential and pay a dividend. What does Reddit think of APPL, DIS and NUE?",2014-08-12,3,10
3ek235_DIS,DIS,Invest in DIS now or after 3rd Quarter Earnings Release?,2015-07-25,1,8
9coylr_DIS,DIS,Thoughts on DIS?,2018-09-03,0,1
9hezop_DIS,DIS,"The fight for UK's Sky is going to auction. You could say its up in the air, whether Fox (DIS) or Comcast will want it more.",2018-09-20,3,0
1m9k0q_DIS,DIS,Can you guys help me understand the move that DIS (Disney) decided to make,2013-09-12,2,8
4de984_DIS,DIS,$DIS COO Stepping down.,2016-04-05,2,3
2rfw5w_DIS,DIS,DIS realistic entry price?,2015-01-05,0,5
3ew3g3_DIS,DIS,DIS & VWO - Should I be Scared from China's Drop?,2015-07-28,10,3
3x3jdg_DIS,DIS,Star Wars The Force Awakens effect on DIS,2015-12-16,0,3
2lhwu0_DIS,DIS,DIS earnings leaked early?,2014-11-06,2,4
2wgocq_DIS,DIS,$DTV posted solid earnings and subscriber growth today. The company is also still hoping to be acquired by $T. The FCC is expected to approve/dis-apporve the deal within the next 30 days.,2015-02-19,4,3
27vwxd_DIS,DIS,Will ESPN World Cup Broadcast Affect DIS Price?,2014-06-11,0,4
2uoz0z_DIS,DIS,Earnings beat has made my DIS April 90 Calls gain 100%,2015-02-03,0,2
452rx9_DIS,DIS,More trouble for daily fantasy sports... ESPN $DIS and DraftKings $DRAFT have unwound their exclusive advertising relationship - a deal worth $250M - that will allow ESPN to sell ad time to the site's competitors.,2016-02-10,1,0
1ivs8vg_DIS,DIS,Is DIS stock just permanently dead / broken,2025-02-22,164,170
z0nj1j_DIS,DIS,Bob Iger has returned as CEO of $DIS,2022-11-21,2552,422
1eo3kxc_DIS,DIS,How to get out of this DIS grave that Mickey Mouse dug for me?,2024-08-09,364,395
wl7y4x_DIS,DIS,"Disney ($DIS) subscriber growth blows past estimates, as company beats on top and bottom line",2022-08-10,875,240
165m0gg_DIS,DIS,Trying to catch the falling DIS knife…,2023-08-30,287,408
hpz6tl_DIS,DIS,"DIS - Florida Hits New Coronavirus Record, Disney World Opens",2020-07-12,938,253
15xcjg4_DIS,DIS,What Happened to Disney (DIS) and Is it a Buy Right Now?,2023-08-21,178,248
14gsw3z_DIS,DIS,Is Disney (DIS) worth holding?,2023-06-23,108,258
1b6wuoz_DIS,DIS,Morgan Stanley raises Disney stock target to $135 on streaming outlook and parks growth. DIS closed 1.5% up (113$),2024-03-05,317,60
1bnmvzo_DIS,DIS,Barclay upgrades Disney expecting streamer profitability sooner than guided & to achieve 25-30% margins. DIS is up 3% today; up 30% YTD,2024-03-25,232,61
1883u4w_DIS,DIS,"Proxy war at DIS, if you own any vote.",2023-12-01,93,77
ttrb18_DIS,DIS,Should I sell DIS and put the cash in something else?,2022-04-01,59,186
18maxxr_DIS,DIS,"HSY or DIS, which one is the better value buy?",2023-12-19,14,74
14t6mt0_DIS,DIS,Why does Disney (DIS) carry so much goodwill on their balance sheet?,2023-07-07,117,64
u7b81x_DIS,DIS,"Large Cap Stocks like $DIS are lower than pre-pandemic levels, good buy?",2022-04-19,64,121
dvyy9n_DIS,DIS,"Sold DIS last week. Man, this hurts",2019-11-13,166,126
1228i2x_DIS,DIS,Why Disney (DIS) is a no brainer buy right now,2023-03-26,0,79
wlpwk3_DIS,DIS,DIS looking into sports betting (from Q3 earnings call),2022-08-11,69,73
13kvyir_DIS,DIS,Disney (DIS) DCF UPDATED.,2023-05-18,45,58
r4xrge_DIS,DIS,Is there any end in sight to DIS bleeding?,2021-11-29,49,89
uerugb_DIS,DIS,What’s the bear case for DIS (Disney)?,2022-04-29,16,90
qvk3q2_DIS,DIS,Thoughts on Disney (DIS),2021-11-16,86,78
mffcds_DIS,DIS,Thoughts on Disney (DIS)?,2021-03-29,41,104
te2rq7_DIS,DIS,Really eyeing DIS. Is there any reason to stay away from DIS?,2022-03-14,31,83
u7kpao_DIS,DIS,Everyone’s going on about NFLX after-hours when $DIS caught a bit of that heat… earnings predictions for $DIS?,2022-04-20,51,76
16jg9z5_DIS,DIS,What happens to stocks like Disney (DIS) when they sell major assets?,2023-09-15,38,40
10juhvh_DIS,DIS,"WBD has $50.4bn in debt, DIS has $45bn, PARA has $15.6bn, and NFLX has $14bn. Netflix is the only one making money on streaming.",2023-01-24,56,49
qd0fo5_DIS,DIS,Why isn't DIS valued higher than NFLX?,2021-10-21,29,78
wn8tq3_DIS,DIS,Streaming wars continue - which stock do you prefer? $NFLX $DIS $WBD $PARA,2022-08-13,17,62
14pqvsy_DIS,DIS,Trade DIS for ETFs?,2023-07-03,17,32
s93o8q_DIS,DIS,Disney Stock $DIS $NFLX,2022-01-21,33,64
vtqfqp_DIS,DIS,Stock analysis and valuation of Disney - The wounded giant is recovering $DIS,2022-07-07,64,48
f9he6a_DIS,DIS,The future of Disney’s DIS?,2020-02-25,45,89
10eftih_DIS,DIS,I am not bearish on $DIS,2023-01-17,2,47
gpydir_DIS,DIS,Disney $DIS,2020-05-24,78,69
zvn7if_DIS,DIS,Disney(DIS) DCF analysis need advice and criticisms,2022-12-26,33,38
g5ddhx_DIS,DIS,DIS,2020-04-21,30,81
pz818s_DIS,DIS,Bear case for DIS,2021-10-01,29,56
ujpqey_DIS,DIS,Disney $DIS moving in on home furnishings,2022-05-06,31,49
109n574_DIS,DIS,Disney (DIS) gets activist investor Nelson Peltz,2023-01-12,0,42
1aklrvj_DIS,DIS,"Market closed with DIS at 99.3, up 10% YTD. Q1 FY24 earnings is tomorrow after market. Expected resistance at 105, will it break through?",2024-02-06,14,13
m1perx_DIS,DIS,DIS or AAPL?,2021-03-10,14,68
1c1i7l2_DIS,DIS,Disney (DIS) DCF Analysis,2024-04-11,0,9
mv0swg_DIS,DIS,"DIS (Disney) @ 1-month low, time to get in?",2021-04-20,54,54
lfbjzx_DIS,DIS,I was gifted some DIS stocks when I was born,2021-02-08,150,36
kc3mjb_DIS,DIS,DIS STOCK. Too late to get in?,2020-12-13,26,60
flj7iv_DIS,DIS,"Yes, we all love DIS and SBUX, but what're some smaller, less-popular names you're watching?",2020-03-19,35,65
18tffi2_DIS,DIS,"Seeking suggestions on companies to swap DIS, PFE and BMY with in year end tax loss harvesting",2023-12-29,1,9
ra8lo9_DIS,DIS,Is DIS a good buy right now?,2021-12-06,31,41
15bfddb_DIS,DIS,Disney $DIS Finna Swan Dive,2023-07-27,0,20
smyzat_DIS,DIS,Can someone explain to me why $DIS is a streaming company now?,2022-02-07,73,32
1801xd4_DIS,DIS,"DIS, O & VZ saved my year!",2023-11-20,5,8
8v1wag_DIS,DIS,$DIS,2018-06-30,66,55
vccxh2_DIS,DIS,Closing positions for DIS,2022-06-14,15,28
16em4i5_DIS,DIS,Will Fubotv $FUBO benefit from the dispute between Disney $DIS and Charter Cable $CHTR ?,2023-09-10,8,9
m3ersp_DIS,DIS,Buy $AMD or $DIS?,2021-03-12,14,36
m7kybq_DIS,DIS,"The Walt Disney Company, a multi-sector play $DIS",2021-03-18,56,27
7c1jwo_DIS,DIS,Disney ($DIS),2017-11-10,68,44
vr7hah_DIS,DIS,Anyone done a deep dive into DIS pre/during/post renaissance?,2022-07-04,15,17
enh2ix_DIS,DIS,Disney (DIS) stock? Is now the time to buy,2020-01-12,5,40
ftqjru_DIS,DIS,What’s a good price to buy Disney Stock at? (DIS),2020-04-02,3,36
gw0sbh_DIS,DIS,DIS & DKNG,2020-06-03,25,30
gizh4i_DIS,DIS,If you had to pick one stock to buy today from FB or DIS?,2020-05-13,11,30
g5ow7s_DIS,DIS,Netflix(NFLX) vs Disney(DIS),2020-04-21,14,30
sbs69l_DIS,DIS,Picking between DIS and MO,2022-01-24,2,17
l689em_DIS,DIS,$DIS on sale right now?,2021-01-27,22,22
g0k4ee_DIS,DIS,Buy DIS at $100?,2020-04-13,6,30
gfvkju_DIS,DIS,DIS about to spike up! Buy!,2020-05-08,7,29
jah4eb_DIS,DIS,Disney $DIS becoming attactive. Thoughts?,2020-10-13,18,23
3zf297_DIS,DIS,When will Disney (DIS) go back up to $120 ish? Was trying to buy a house...,2016-01-04,5,46
kb8op6_DIS,DIS,DIS Moon Mission,2020-12-11,25,21
gw4s36_DIS,DIS,DIS,2020-06-03,15,25
gec9xh_DIS,DIS,RTX or DIS,2020-05-06,18,25
mefng0_DIS,DIS,Would like some feedback on my first ever DD. (DIS),2021-03-27,15,18
wjb90i_DIS,DIS,DIS making solid technical move,2022-08-08,13,7
t9paxu_DIS,DIS,Thoughts on DIS?,2022-03-08,10,10
g5o4xk_DIS,DIS,"USO, DIS, and SHAK are looking like solid buys tomorrow!! Easy money in my pin.",2020-04-21,0,24
fh2st0_DIS,DIS,Disney (DIS) what are you all waiting for it to hit to buy?,2020-03-11,3,26
ge6deq_DIS,DIS,Opinions $DIS?,2020-05-05,4,25
gnj5z1_DIS,DIS,Great performance from DIS,2020-05-20,265,119
z11tss_DIS,DIS,Disney (DIS) jumped almost 10% following the news that the company re-appointed Bob Iger as CEO. Jim Cramer tweeted this earlier this morning. How much further do you think DIS will rally?,2022-11-21,147,59
1eqvy64_DIS,DIS,Walt Disney (DIS) Looking for Bottom on $60B Theme Park Expansion,2024-08-13,8,10
1b7ivh8_DIS,DIS,Streaming Services a BUY right now? (WBD & DIS),2024-03-05,1,16
190yk3f_DIS,DIS,$DIS vs $JWN,2024-01-07,0,18
1cymf38_DIS,DIS,"5/22 Daily Update: $NVDA, $WBD Partners with $DIS, $AMZN Alexa",2024-05-23,14,0
rvxtwt_DIS,DIS,"Walt Disney (DIS) Stock Gains After Being Named Top Large-Cap Growth Idea for 2022, Analyst Says Shares Could Rally Over 25%",2022-01-04,24,27
wkz8yy_DIS,DIS,"Subscriber growth for $NFLX, $DIS, $AMZN, $AAPL, and $WBD streaming services.",2022-08-10,29,11
1207xia_DIS,DIS,$DIS,2023-03-24,0,5
13y31lz_DIS,DIS,$DIS & $NFLX 🤔,2023-06-02,5,2
pnss6z_DIS,DIS,Just recently started investing after taking over a custodial account set up years ago for me with a couple shares of DIS. Just looking for thoughts or advice going forward.,2021-09-14,11,14
wlrlei_DIS,DIS,Disney surpassed Netflix on subscribers. Do you think DIS will maintain its market leadership in streaming?,2022-08-11,4,6
z0zqjg_DIS,DIS,Bob Iger returns as Disney CEO. DIS up almost 10% premarket,2022-11-21,14,2
bcdnqu_DIS,DIS,Good day to be a Dis investor!,2019-04-12,29,20
fhej3i_DIS,DIS,DIS - Back to my average cost,2020-03-12,5,17
gowlhe_DIS,DIS,"Price Buying Recommendation for (DIS, BA, NVDA, SPG, AAPL, LUV, TSLA, Roku, TTD)?",2020-05-23,0,8
gvxyth_DIS,DIS,DIS,2020-06-03,6,7
g0nciw_DIS,DIS,DIS - Disney Institutional Investors Dumping Stock - Other sources please?!,2020-04-13,4,7
foff0z_DIS,DIS,Bought DIS 96$ puts 4/9 @ 11$ - they are worth 6$ now. Any mouse traps between now and 4/9?,2020-03-24,3,7
ofsuhw_DIS,DIS,$DIS Streaming Thesis Driven Valuation Analysis!,2021-07-07,7,0
fa6rmq_DIS,DIS,$DIS puts?,2020-02-27,0,7
bjn5lk_DIS,DIS,Thoughts on DIS,2019-05-01,4,9
dx1wvm_DIS,DIS,Disney Stock Breakdown (DIS) | Buy or Sell?,2019-11-16,0,7
lfua94_DIS,DIS,"I’m curious, why is everyone’s thoughts on Walt Disney (Dis)?",2021-02-09,1,0
f9bl7f_DIS,DIS,(DIS) Walt Disney Thriving As Its Disney+ Potential Surges,2020-02-25,1,4
fspehw_DIS,DIS,What causes these types of spikes AHs? - $DIS,2020-04-01,3,3
8mqt0q_DIS,DIS,DIS vs CMCSA,2018-05-28,3,9
dt6w2c_DIS,DIS,$DIS Get ready for a good story from Disney,2019-11-08,0,1
6a6h97_DIS,DIS,"$DIS earnings tonight! Might not go well, but it won't matter",2017-05-09,5,5
7c1l7k_DIS,DIS,$DIS,2017-11-10,3,4
8sjsez_DIS,DIS,What happens to FOXA stock if DIS acquires them ?,2018-06-20,4,1
24a5w7_DIS,DIS,"Early movers: MRK, COH, ADM, HLF, DIS, NFLX & more",2014-04-29,0,8
3zqedf_DIS,DIS,Why Star Wars may not save Disney (DIS) stock,2016-01-06,1,5
3hqmi2_DIS,DIS,DIS -5% today,2015-08-20,5,4
4bc4ic_DIS,DIS,"3.21.16 Monday Pre-Market Movers: HOT, IHS, AAPL, NKE, SYMC, JWN, FDX, VAL, FB, SPLS, DIS, MON & more",2016-03-21,6,1
3gqa93_DIS,DIS,Disney's Licensing Deal With Kabam Is A Template For Success - The Walt Disney Company (NYSE:DIS),2015-08-12,6,0
3cf6ua_DIS,DIS,"7/7/15 Early Tuesday Movers: MRK, LULU, TSLA, CRM, TIF, FIT, SHAK, AMD, GE, DIS, AAP & more",2015-07-07,7,0
1qpb2m_DIS,DIS,"DIS - a 'no-brainer' stock for a long-term investor to own, in a nutshell - in this case 'Keep It Simple, Stupid'.",2013-11-15,3,2
3fvfq7_DIS,DIS,"8/5/15 Early Wednesday Movers: LL, AAPL, DISH, TWX, PCLN, DIS, ATVI, ETSY, FLSR, TV, Z & more",2015-08-05,1,0
154ueb_DIS,DIS,Can someone advise as to where I could find the 52-Week Highs and Lows for NYSE:DIS from November 19th to now?,2012-12-19,1,3
1x6e8m_DIS,DIS,"2/6/14 Stocks to Watch (Earnings, News, Etc): GM, DNKN, TWTR, DIS, YELP, GMCR & more...",2014-02-06,6,1
1s0qxc_DIS,DIS,$DIS around 69.50 looks good long term buy point -- 67.50 area if you want to be patient and expect more short-term downside - Disney (DIS) (no current holding/position),2013-12-03,5,0
