Post_ID,Ticker,Title,Post_Date,Upvotes,Num_Comments
1gqhj5v_AMZN,AMZN,My day trades today ADBE AMZN DNA,2024-11-13,1,0
1gqhj5v_CRM,CRM,My day trades today ADBE AMZN DNA,2024-11-13,1,0
1kqazlj_NET,NET,Regeneron to buy bankrupt DNA testing firm 23andMe for $256 million,2025-05-19,228,46
bo79gm_JPM,JPM,$DNAX DNA Brands Ridesharing Fleet Hits the Roads - Second Round of Purchasing Commences,2019-05-13,2,0
hzkjpr_C,C,"$ONCS announced the promising potential of its novel DNA–encodable vaccine candidate, CORVax12, which is designed to act as a prophylactic vaccine to prevent COVID-19, was featured in the show 'Straight Talk' by KGW NewsC.",2020-07-28,3,19
pq6a5p_MRNA,MRNA,DNA…the new mRNA Stock,2021-09-17,38,31
hu8yrp_MRNA,MRNA,"Better understanding mRNA vs Plasmid DNA Vaccine companies when investing into Moderna, Inovio, and others",2020-07-19,1,4
1kqazlj_REGN,REGN,Regeneron to buy bankrupt DNA testing firm 23andMe for $256 million,2025-05-19,222,46
hudigq_DNA,DNA,"INO, AZN, ALT, VXRT: DD on DNA-based vaccine plays ahead of the AZN clinical trials publication",2020-07-20,200,118
pv8q0j_DNA,DNA,"YOLOs on DNA, GENI, CC, JBI, VIAC - $3.5M on the line",2021-09-25,158,92
n7vlvn_DNA,DNA,"$INO Safety and immunogenicity of INO-4800 DNA vaccine against SARS-CoV-2: a preliminary report of a randomized, blinded, placebo-controlled, Phase 2 clinical trial in adults at high risk of viral exposure",2021-05-08,193,70
1delst8_DNA,DNA,Bird flu will be a banger for $DNA,2024-06-13,12,21
w1x09g_DNA,DNA,Mars Candy Company sued: Products contain dangerous DNA-altering chemical unsafe for human consumption.,2022-07-18,65,52
pplbpz_DNA,DNA,Why DNA is about to fly. ARK and Cathie now own approximately %50 of the tradeable float and will not be selling as they own a large part of the PIPE...Under the radar SPAC redemption play for what is a true Unicorn.,2021-09-16,106,51
wpb191_DNA,DNA,Gingko Bioworks - DNA - Biosecurity Division Killing It,2022-08-15,14,44
ljbrjf_DNA,DNA,INOVIO and their INO-4800 DNA COVID-19 vaccine vs. RNA vaccines,2021-02-13,74,47
15r2fk3_DNA,DNA,Sarepta's DNA Goldmine: SRPT 🧬,2023-08-14,15,18
q21p6w_DNA,DNA,$120k DNA YOLO. Cathie Wood Has Me Diamond Hard,2021-10-05,60,35
qxihvj_DNA,DNA,DNA Options Loss - $100k unrealized,2021-11-19,57,30
pq6a5p_DNA,DNA,DNA…the new mRNA Stock,2021-09-17,40,31
ivc7aw_DNA,DNA,The Holy Grail of DNA Sequencing,2020-09-18,20,42
vtl9ed_DNA,DNA,What The Heck Is Going On With Gingko Bioworks DNA?,2022-07-07,1,19
x7cc03_DNA,DNA,Does Cathies favourite stock $DNA hit support and is a buy?,2022-09-06,1,12
t3ho08_DNA,DNA,What does the Hivemind think of Gingko Bioworks Ticker: DNA,2022-02-28,14,16
y7ogej_DNA,DNA,DNA develops synthetic biology to deter bio-terrorists,2022-10-19,3,6
pq08hd_DNA,DNA,"$500K DNA YOLO, Being a degen is in my DNA",2021-09-17,33,11
x4aqlz_DNA,DNA,$DNA a buy or not? support now,2022-09-02,0,6
q70d9r_DNA,DNA,$DNA: Ginkgo Bioworks and the short attack,2021-10-13,17,10
ftobn0_DNA,DNA,DNA Sequencing and You (Or Your Parents),2020-04-02,15,16
qsj070_DNA,DNA,AAPL NVDA DNA AMZN ETSY it’s like being at a candy store,2021-11-12,5,7
pkwr9w_DNA,DNA,INO: FDA Philippines authorizes start of Inovio Phase 3 DNA Vax.,2021-09-09,35,4
74x1ib_DNA,DNA,Late show colbert says dna testing to be 240 million industry in 2020 or some shut. Currently only 70 millions.,2017-10-07,8,13
cc3g0j_DNA,DNA,"23andMe is moving into Apple’s territory with a pilot to pull in medical data, not just DNA",2019-07-12,3,3
9gu57k_DNA,DNA,How nucleic acid memory could be used to store data in DNA | (This is Good For Mu) VentureBeat,2018-09-18,12,2
udtyqm_DNA,DNA,"Why I’m long on long read DNA sequencing ($PACB, LON:$ONT)",2022-04-28,147,81
ld7ni6_DNA,DNA,Why you should be watching the VGAC/23andme (DNA testing) merger,2021-02-05,76,47
yoy6o_DNA,DNA,DNA storage will be the future of data storage. Any public companies working on this?,2012-08-23,4,31
8pkh3p_DNA,DNA,How would one invest in the retail market of DNA / ancestry testing?,2018-06-08,1,6
21kah6_DNA,DNA,FDA panel unanimously recommends Exact Sciences' (EXAS) DNA-based colon cancer screening test.,2014-03-28,25,2
77mn6_DNA,DNA,DNA Genentech: Color on quarter,2008-10-17,3,0
1kqazlj_DNA,DNA,Regeneron to buy bankrupt DNA testing firm 23andMe for $256 million,2025-05-19,224,46
mmc6wg_DNA,DNA,CRSP Crispr DNA editor,2021-04-07,56,61
1905fgs_DNA,DNA,$dna Gingko Bioworks,2024-01-06,0,18
lbmpz9_DNA,DNA,imminent growth of NASDAQ:INO. DNA vaccines for immunotherapy,2021-02-03,46,30
q6zj41_DNA,DNA,$DNA: Ginkgo Bioworks and the short attack,2021-10-13,32,13
m8nmgz_DNA,DNA,Inovio Pharmaceuticals making future DNA medicines...,2021-03-19,7,17
kuk9ao_DNA,DNA,Bloomberg: SoftBank Takes Stake in DNA Firm Pacific Biosciences,2021-01-10,5,4
limscd_DNA,DNA,$DNA: Ride the revolution in Genetic Technology,2021-02-12,7,1
felvih_DNA,DNA,"Inovio Pharmaceuticals, Inc. - Inovio Accelerates Timeline for COVID-19 DNA Vaccine INO-4800",2020-03-06,0,3
b6pxwn_DNA,DNA,"Share Your DNA, Get Shares: Startup Files an Unusual Offering",2019-03-28,6,0
7s7ok3_DNA,DNA,DNA Kits/Test,2018-01-22,2,1
2i2xxs_DNA,DNA,VICL - Needleless DNA EBOLA Vaccine? Watch for a rise.,2014-10-02,0,0
yy0cvd_DNA,DNA,DNA Stock Dips To 52-Week Low. Should I Buy This Dip?,2022-11-17,1,2
xqk160_DNA,DNA,Sold 10 CSP’s on $DNA @2.50 for January’23!! I’ve done ZERO RESEARCH!! Let’s gooooo!!,2022-09-28,0,1
px372u_DNA,DNA,PharmaCyte Biotech Announces Encapsulation Material Does Not Alter Cellular DNA,2021-09-28,5,0
oq67l0_DNA,DNA,"Ai Di Weixin (advaccine biopharmaceuticals co. ltd ) ( INOVIO Expands Partnership with Advaccine to Conduct Global Phase 3 Efficacy Trial of COVID-19 DNA Vaccine Candidate, INO-4800 ) sprints to the Hong Kong Stock Exchange. https://min.news/en/economy/795adf980b883da78a602aca8b732c87.html",2021-07-23,0,0
hky1fu_DNA,DNA,Are there any stocks for DNA-based data storage/IT solutions?,2020-07-04,5,4
hu8yrp_DNA,DNA,"Better understanding mRNA vs Plasmid DNA Vaccine companies when investing into Moderna, Inovio, and others",2020-07-19,1,4
1d9n06x_DNA,DNA,Twist Bioscience - Synthetic DNA Manufacturer Competing with Danaher,2024-06-06,11,0
9ojx03_DNA,DNA,Your DNA is worth $21,2018-10-16,46,18
8yrich_DNA,DNA,Writeup on Doric Nimrod Air One – DNA:LN,2018-07-14,9,1
1yrs54_DNA,DNA,The ABCs of Investors’ DNA,2014-02-24,9,1
1nwnrg_DNA,DNA,DNA of Equity Investors: Vltava Fund,2013-10-07,3,0
qf4hat_DNA,DNA,"I scanned 150 charts this weekend to buy the dip (or sell CSPs), here are some names I'm looking at: DLO, HOOD, DUOL, RSKD, DNA",2021-10-25,111,34
yexr5j_DNA,DNA,DNA put @2.50 Nov 18 adj,2022-10-27,1,3
q87i8p_DNA,DNA,DNA calls?,2021-10-14,1,1
1is82eb_DNA,DNA,"DNA (Daily News & Analysis)🫡

Feb 18th 2025; Tuesday

Trump says reciprocal tariffs will begin in April after study

- The president argues current trade deals—especially ones with South_Korea, India, and the EU—are unfair to the US.",2025-02-18,0,0
1gqhj5v_DNA,DNA,My day trades today ADBE AMZN DNA,2024-11-13,1,0
1jkviph_DNA,DNA,$APDN: Applied DNA Submits Validation Package to New York State Department of Health for H5 Bird Flu/Pan-Influenza A Laboratory-Developed Test,2025-03-27,3,10
1i16z88_DNA,DNA,This company is interesting for the DNA based synthetic lethality treatment,2025-01-14,1,2
18mtowe_DNA,DNA,$DNA Is In Play - The Merger/Partnership - Buying In Pre-Market,2023-12-20,3,2
1659t9k_DNA,DNA,DNA stock alert: Is Ginkgo Bioworks the next big AI stock?,2023-08-30,5,4
wux4aw_DNA,DNA,$DNA Long Term Outlook & Why I Am Bullish,2022-08-22,1,10
hzkjpr_DNA,DNA,"$ONCS announced the promising potential of its novel DNA–encodable vaccine candidate, CORVax12, which is designed to act as a prophylactic vaccine to prevent COVID-19, was featured in the show 'Straight Talk' by KGW NewsC.",2020-07-28,1,19
ktazvx_DNA,DNA,$APDN - FDA Lists Applied DNA’s Linea™ COVID-19 Assay Kit,2021-01-08,3,13
ho1sl0_DNA,DNA,HTGM has been granted a key Covid-19 patent. The patent relates to a new way of detecting DNA and RNA in the same sample. Exemplary positive-strand RNA viruses include Coronaviruses (examples of which include SARS coronaviruses).,2020-07-09,26,13
quhfmf_DNA,DNA,$DNAX DNA Brands Signs Joint Venture Agreement,2021-11-15,0,1
gjjzdu_DNA,DNA,5/14 Applied DNA Receives FDA Emergency Use Authorization for COVID-19 Diagnostic Assay Kit,2020-05-14,2,1
i9ktpa_DNA,DNA,$ITMC Huge news as ITOCO signs Intellectual Property Acquisition and Technology Commercialization Agreement for Rapid DNA Testing and Immutable Virus Test Result Verification,2020-08-14,0,1
bo79gm_DNA,DNA,$DNAX DNA Brands Ridesharing Fleet Hits the Roads - Second Round of Purchasing Commences,2019-05-13,2,0
27unp5_DNA,DNA,$DNAX is about to Crash tomorrow: DNA Brands Retracts Previously Released Announcement of Agreement With Trenton Coca-Cola,2014-06-11,3,9
a59dcl_DNA,DNA,$DNAX DNA Brands Acquires NEO High Alkalized Superwater (NEO),2018-12-11,0,0
ok8tav_DNA,DNA,Invitation to the r/spawners community to discuss the concept of Spawning and the companies that have it in their DNA,2021-07-14,20,7
b2wogd_DNA,DNA,Canopy Growth and DNA Genetics Extend and Expand Relationship,2019-03-19,88,39
e9nan4_DNA,DNA,DNA Genetics Announces Entry into CBD Market Through Licensing Deal with 1933 Industries Inc.,2019-12-12,36,19
78744a_DNA,DNA,Tweed and DNA Genetics renew and expand their partnership,2017-10-23,31,18
ejm9y5_DNA,DNA,Bophelo Partners with DNA Genetics in Lesotho,2020-01-03,26,10
poc41k_DNA,DNA,Halo Collective Announces Official Launch of Two Premium Cannabis Strains in Oregon with DNA Genetics,2021-09-14,2,0
j7zeoc_DNA,DNA,"Interview with Aaron, DNA Genetics Co-Founder, about the cannabis industry",2020-10-09,1,5
e84vl6_DNA,DNA,Halo Partners with DNA Genetics to Launch Leading World-Renowned Genetics in Oregon,2019-12-09,23,4
b5ua71_DNA,DNA,OG DNA Genetics Inc. and Generic Gold Corp. Announce Proposed Reverse Takeover,2019-03-26,2,3
b73dwn_DNA,DNA,"Applied DNA Sciences, Inc. (NASDAQ: APDN) enters into exclusive cannabis licensing and cooperation agreement with TheraCann International",2019-03-29,4,0
8d8gtt_DNA,DNA,DNA Genetics Signs LOI with Segra for Landmark Plant Micropropagation Program in California,2018-04-18,4,0
84uolp_DNA,DNA,How technology companies are using the power of blockchain to transform DNA sequencing,2018-03-16,21,5
9gja9h_DNA,DNA,ArtWallet: Where The DNA of Art Meets Blockchain. Looking for Artist Criticism and stance on Blockchain developing the Art Market.,2018-09-17,7,3
8iqny1_DNA,DNA,Our DNA Will Soon Connect to the Blockchain: the AI Hive Mind Theory,2018-05-11,0,4
9fkap0_DNA,DNA,Secured DNA Tests Become Possible Due to Blockchain,2018-09-13,1,0
88yfxx_DNA,DNA,Bitcoin Keys Could Be Written Into Your DNA Sooner Than You Think,2018-04-02,0,1
