Post_ID,Ticker,Title,Post_Date,Upvotes,Num_Comments
395ncw_PG,PG,"6/9/15 Early Tuesday Movers: LULU, GE, PBY, FDX, HPQ, ETSY, PG, PLAY & more",2015-06-09,8,2
12fx1gl_PEP,PEP,"Technical Trade Radar: April 10 - 14 (FDX, GIS, ICE, ORCL, CAH, LLY, PEP)",2023-04-08,7,3
3np94k_PEP,PEP,"10/6/15 Tuesday Movers: PEP, DD, TCS, CSCO, ILMN, LGF, SNE, BABA, SUNE, FDX, AMZN & more",2015-10-06,3,1
1tvmwj_SBUX,SBUX,"CNBC Fast Money desk long ideas - SBUX, XOM, QCOM, BAC, HA, FDX, EWW",2013-12-28,0,1
1bkpoz5_NKE,NKE,"As the next Warren buffet, who predicted FDX and NKE earnings correctly this is my next play.",2024-03-22,269,116
1bk6ltf_NKE,NKE,Why NKE will go down and FDX will go up today,2024-03-21,76,153
1dpmzk5_NKE,NKE,FDX ✅ MU SURPRISINGLY down ❌ NKE IS going to beat ✅,2024-06-27,36,66
1bhf4ug_NKE,NKE,"Big week ahead. NVDA GTC, BoJ RBA BoE FOMC announcements, Fed economic projections, Jpow 2x, MU FDX NKE LULU PDD earnings, Reddit IPO",2024-03-18,173,47
1dozfae_NKE,NKE,50k FDX YOLO Update,2024-06-26,32,13
zruigs_NKE,NKE,Indexes being carried by NKE (+13.4%) and FDX (+5%) today - Increased consumer confidence data,2022-12-21,6,0
4bc4ic_NKE,NKE,"3.21.16 Monday Pre-Market Movers: HOT, IHS, AAPL, NKE, SYMC, JWN, FDX, VAL, FB, SPLS, DIS, MON & more",2016-03-21,7,1
m51lsn_NKE,NKE,"Expected moves for this week. Tesla, SPY, CRWD, NKE, FDX and more.",2021-03-14,349,136
o4ecyw_NKE,NKE,"Expected moves this week. SPY, QQQ, NKE, FDX, BB",2021-06-20,70,39
1bhf4ug_LULU,LULU,"Big week ahead. NVDA GTC, BoJ RBA BoE FOMC announcements, Fed economic projections, Jpow 2x, MU FDX NKE LULU PDD earnings, Reddit IPO",2024-03-18,171,47
395ncw_LULU,LULU,"6/9/15 Early Tuesday Movers: LULU, GE, PBY, FDX, HPQ, ETSY, PG, PLAY & more",2015-06-09,9,2
o4ecyw_WMT,WMT,"Expected moves this week. SPY, QQQ, NKE, FDX, BB",2021-06-20,71,39
m51lsn_DG,DG,"Expected moves for this week. Tesla, SPY, CRWD, NKE, FDX and more.",2021-03-14,344,136
td8v8a_DG,DG,"Expected Moves this week: USO, XOM, CVX, WEAT, FDX, and more.",2022-03-13,116,33
xfralz_F,F,"Jim Cramer predicted that FedEx will have a great year amid strong e-commerce sales back on the 29th of June. Now, FDX is cutting costs & has withdrawn 2023 guidance after Q1 shipments disappointed. At this point, do you think Cramer should even bother sharing his opinions?",2022-09-16,516,138
28gg5b_GM,GM,"Early movers: FDX, AMZN, GM, GPS, TMUS, JPM & more",2014-06-18,3,1
xft2ft_FDX,FDX,$FDX THIS MORNING,2022-09-16,5822,595
ecbt7k_FDX,FDX,First Kill on $AMZN hit list - $FDX,2019-12-18,6983,694
18mwpxf_FDX,FDX,"I called the FDX miss, who got rich this morning?",2023-12-20,1297,351
18j2tvn_FDX,FDX,FDX is going to miss,2023-12-15,801,166
1bkpoz5_FDX,FDX,"As the next Warren buffet, who predicted FDX and NKE earnings correctly this is my next play.",2024-03-22,273,116
14kq3c5_FDX,FDX,"$FDX - FedEx being sued for ""the biggest odometer fraud scheme in history""",2023-06-27,430,119
fez62b_FDX,FDX,"Monday strategy: Calls on DGX, TDOC, CLX, GLD Puts on SPY, DIS, FDX, LYV, MSFT, USO, UAL",2020-03-07,438,259
1bk6ltf_FDX,FDX,Why NKE will go down and FDX will go up today,2024-03-21,73,153
ri08y9_FDX,FDX,I tried to tell you all $FDX FedEx calls was the play to make! I even bought 50 more calls total 250! How do I even sleep tonight????,2021-12-16,190,336
1flc9jt_FDX,FDX,Could have waited for 10-10.5K but didn’t want to risk volatility (FDX 10 bagger) ,2024-09-20,158,46
xg13p5_FDX,FDX,"Sure, blame everyone but yourself FDX",2022-09-16,674,48
1dpmzk5_FDX,FDX,FDX ✅ MU SURPRISINGLY down ❌ NKE IS going to beat ✅,2024-06-27,37,66
1dozjwt_FDX,FDX,68k Gain On FDX Earnings Play,2024-06-26,177,39
1bhf4ug_FDX,FDX,"Big week ahead. NVDA GTC, BoJ RBA BoE FOMC announcements, Fed economic projections, Jpow 2x, MU FDX NKE LULU PDD earnings, Reddit IPO",2024-03-18,172,47
riisf6_FDX,FDX,Thanks to all the tards! $FDX FedEx calls keep going up! Theta my ass! Lol,2021-12-17,110,156
1fmzru1_FDX,FDX,Gains FDX earnings,2024-09-22,83,25
1fh1cfl_FDX,FDX,"Prognosis ER , freight me FDX down below , see chart",2024-09-15,23,24
1dnoxk1_FDX,FDX,50k $FDX YOLO update,2024-06-24,24,32
18mxl7e_FDX,FDX,$FDX Play $469 -> $10.2k Gain,2023-12-20,88,39
1fllkro_FDX,FDX,FDX puts saved my portfolio,2024-09-20,39,18
1dnx1qv_FDX,FDX,FDX Earnings on 06/25,2024-06-25,21,30
1fts0m0_FDX,FDX,My thoughts on FDX during the port strikes,2024-10-01,26,15
1fo4gyc_FDX,FDX,What could possibly go wrong? Fdx call ⬆️ ,2024-09-24,7,17
xfr9y7_FDX,FDX,"Jim Cramer predicted that FedEx will have a great year amid strong e-commerce sales back on the 29th of June. Now, FDX is cutting costs & has withdrawn 2023 guidance after Q1 shipments disappointed. At this point, do you think Cramer should even bother sharing his opinions?",2022-09-16,196,41
1flep1g_FDX,FDX,FDX - 900% gain ,2024-09-20,51,9
1bkcaei_FDX,FDX,Lets go FDX,2024-03-21,10,26
1dl7v1r_FDX,FDX,50k $FDX YOLO update,2024-06-21,7,18
1dozfae_FDX,FDX,50k FDX YOLO Update,2024-06-26,31,13
18mxefb_FDX,FDX,$455 to ~$6k $FDX,2023-12-20,114,15
11ttmc0_FDX,FDX,1.2k—>8.3k fdx calls,2023-03-17,110,29
1bkzxp6_FDX,FDX,9k-->24k overnight from FDX,2024-03-22,70,12
hk6ckd_FDX,FDX,FDX 7/02 $155 C YOLO payday,2020-07-02,224,47
rh9vjm_FDX,FDX,FedEx $FDX calls…earnings are to be announced tomorrow AH….let’s hope they DELIVER me some gains :),2021-12-15,23,67
1fq0w2s_FDX,FDX,Thanks DOJ! SMCI Puts made up for bad bets on FDX and NVDA,2024-09-26,20,2
18mya4s_FDX,FDX,Thanks FDX for the Christmas gift,2023-12-20,55,18
1dohsv6_FDX,FDX,"$FDX earnings play , followed by $NIKE earnings play ❤️",2024-06-25,13,10
m2d4sh_FDX,FDX,"$$$ FDX DELIVERING YOU TENDIES...massive upside going into ER, FULL DD inside",2021-03-11,77,64
1dkfyt0_FDX,FDX,Building positions in Mu and FDX coming soon earning and nvdea giving me today's snack,2024-06-20,8,9
itgurs_FDX,FDX,FDX GANG RISE UP!!!!,2020-09-15,43,69
ir3gyh_FDX,FDX,47K FDX YOLO,2020-09-12,61,57
1doyuko_FDX,FDX,Banked on FDX EARNINGS,2024-06-26,15,1
d5bbz1_FDX,FDX,$FDX Puts for tomorrow ? FedEx recently loss amazon as a partner,2019-09-17,61,56
xg8bjq_FDX,FDX,Anyone made 1.2M% gain in FDX 165 put today?,2022-09-17,65,23
tjuvdu_FDX,FDX,Fed up with losing? Buy FedEx ($FDX)!!!,2022-03-22,1,39
istkbb_FDX,FDX,Possible explanation for obvious manipulation of FDX. ER and Walmart Plus.,2020-09-14,29,42
xiv983_FDX,FDX,Fedex ($FDX) FUD,2022-09-20,10,23
xtc146_FDX,FDX,1000 into this idea day before the close $FDX best I’ve ever seen #options,2022-10-02,26,15
psks07_FDX,FDX,"FDX YOLO for earnings. Near its 52W low, gimme tendies or my wifes bf is gunna ship me via fedex to the gulag",2021-09-21,18,23
10f61vz_FDX,FDX,$UPS VS $FDX,2023-01-18,8,8
itauin_FDX,FDX,FDX Earnings...whats happenning,2020-09-15,3,30
ineuim_FDX,FDX,FDX FOREVER FEGS,2020-09-06,22,25
it3fwj_FDX,FDX,FDX hold to January or sell before earnings?,2020-09-15,3,29
ips22e_FDX,FDX,Why I like FDX to the Upside.,2020-09-09,14,27
jfaj1u_FDX,FDX,I’m listening to WSB on my first options trade. FDX 297.50C Nov 13 2020,2020-10-21,7,27
pspmui_FDX,FDX,"FDX Earnings, let’s get feisty.",2021-09-21,11,18
jeuvzl_FDX,FDX,fdx puts ???,2020-10-20,3,25
hatikd_FDX,FDX,FedEx FDX,2020-06-17,9,25
inmwwz_FDX,FDX,FDX calls 9/25 vs UPS calls 10/16,2020-09-06,13,24
b2x2ik_FDX,FDX,What’s your move with FDX?,2019-03-19,22,29
xvtz6m_FDX,FDX,$FDX looking like it’s going to run pretty hard. Buybacks already started.,2022-10-04,1,6
xvts2h_FDX,FDX,FDX - Caution,2022-10-04,4,5
ectkoi_FDX,FDX,"Iron condor on FDX, what could I have done better?",2019-12-19,16,24
5374lp_FDX,FDX,"Next week's earnings, $ADBE $FDX $LEN $AZO $RAD $BBBY",2016-09-17,96,26
ilni54_FDX,FDX,PTON & FDX: The last remaining tickers this earnings season with positive momentum.,2020-09-03,12,19
9gqyww_FDX,FDX,FedEx (FDX) buy on weakness?,2018-09-18,33,24
jk184e_FDX,FDX,UPS and FDX gang represent 😌,2020-10-29,21,16
d8x1uy_FDX,FDX,FDX: Held today well a key support level ($142.5) since 2016,2019-09-25,3,20
faool5_FDX,FDX,$FDX Earnings play,2020-02-28,17,19
ermnes_FDX,FDX,FDX DD,2020-01-21,48,15
iul0t7_FDX,FDX,YOLOing on $FDX 10/30,2020-09-17,17,14
je6j9t_FDX,FDX,FDX 300c 11/13?,2020-10-19,4,15
itj3ke_FDX,FDX,Mailman Delivering the tendies! FDX & UPS Play,2020-09-15,17,14
9gojuy_FDX,FDX,"FedEx (FDX) EARNINGS THREAD: Q1 Revenue, $17.1B vs. $16.88B expected, Q1 Earnings Per Share (EPS), $3.46 vs. $3.82 expected, raises guidance",2018-09-17,12,23
ptdz0a_FDX,FDX,FDX - Snaked out a win,2021-09-22,10,7
ng6vps_FDX,FDX,FDX 5/28 300P $75k YOLO,2021-05-19,10,9
ipqh6q_FDX,FDX,More FDX DD,2020-09-09,20,11
6k1hv4_FDX,FDX,CNBC: $FDX halted for Pending News,2017-06-28,11,24
isme5t_FDX,FDX,Sell volume on FDX,2020-09-14,4,11
hcs7no_FDX,FDX,FDX earnings,2020-06-20,8,11
5qq4kc_FDX,FDX,"FedEx did not punish or fire Matt Uhrin, man who put out American flag on fire set by protestors. Stock has been going up. Buy $FDX",2017-01-28,44,18
imo2bv_FDX,FDX,PTON/FDX YOLO’s killed it this week. All positions closed🤙🏽,2020-09-04,1,10
kciwqt_FDX,FDX,PFE FDX,2020-12-13,22,6
d648tp_FDX,FDX,My first option gain with FDX,2019-09-18,60,8
g7bvec_FDX,FDX,"UPS, FDX, Going into earnings",2020-04-24,3,11
l9pp7j_FDX,FDX,FedEx $FDX - Reason behind weakness?,2021-02-01,70,81
aicy54_FDX,FDX,Is FedEx a buy here? FDX stock took a 40% hit. Value and dividend growth play?,2019-01-21,40,39
bs5907_FDX,FDX,Why are UPS and FDX down so much?,2019-05-23,3,25
in74v8_FDX,FDX,FDX and UPS Green in a Sea of Red?,2020-09-05,2,8
6kg2xq_FDX,FDX,stockAday: can FedEx deliver? $FDX,2017-06-30,36,14
bz64dq_FDX,FDX,Thoughts on FedeX (FDX) after dropping Amazon express shipments?,2019-06-11,6,9
d5p3nu_FDX,FDX,FDX suck,2019-09-17,0,2
ddrapc_FDX,FDX,FDX Post Earnings - Is it a Great Company at a Discount Now?,2019-10-05,0,0
b2zaq3_FDX,FDX,$FDX Sentiment trending down,2019-03-19,2,0
1h3b0k_FDX,FDX,UPS vs FDX P/E ratio?,2013-06-26,11,5
3fwh4f_FDX,FDX,Anyone know why FDX is seeing a climb today despite the EC's concerns of the TNT Express deal?,2015-08-05,6,2
107bzx_FDX,FDX,What the hell do I do with my FDX?,2012-09-20,0,4
1ajq3j9_FDX,FDX,"UPS vs. FDX, which one is better company?",2024-02-05,5,22
pvav4p_FDX,FDX,What do you think of FedEx (FDX)?,2021-09-25,34,64
pw5z3x_FDX,FDX,Thoughts on FDX,2021-09-27,22,64
r2u0pn_FDX,FDX,"Bloody day but added BA,OKE, CVX,UPS,FDX, VZ",2021-11-26,54,45
xflcfs_FDX,FDX,"FDX large after market drop, justified or over reaction?",2022-09-16,19,19
m2d6jm_FDX,FDX,"$$$ FDX DELIVERING YOU RETURNS...massive upside going into ER, DD inside",2021-03-11,24,13
9dnaco_FDX,FDX,FedEx (FDX) - sell it all?,2018-09-06,10,23
kck2to_FDX,FDX,"PFE, UPS, FDX, BNTX",2020-12-13,4,11
itxwiq_FDX,FDX,FDX was a solid gainer for the past 3 months,2020-09-16,17,10
llml6w_FDX,FDX,FDX is showing an interesting pattern,2021-02-17,0,7
khj3mt_FDX,FDX,$fdx continues to drop,2020-12-21,10,4
fllaq6_FDX,FDX,FedEx (FDX) - Solid LT growth story hampered by ST pessimism,2020-03-20,4,7
j6l8gm_FDX,FDX,May 15 2020 UPS and FDX huge increases,2020-10-07,0,3
gw4hhb_FDX,FDX,I need Insights on FedEx Corporation NYSE: FDX,2020-06-03,0,5
igz5wb_FDX,FDX,Effect of USPS shenanigans on UPS and FDX?,2020-08-26,2,3
adg9kl_FDX,FDX,Why is UPS much higher valued than FDX?,2019-01-07,2,7
hizwwy_FDX,FDX,FedEx (FDX) Surpasses Q4 Earnings and Revenue Estimates,2020-07-01,0,0
d61t83_FDX,FDX,FedEx FDX,2019-09-18,1,2
30dx3a_FDX,FDX,you have $50K to put in one stock. $FDX or $UPS?,2015-03-26,0,11
3s4kx5_FDX,FDX,FDX and UPS for the holiday season?,2015-11-09,5,6
3kyo6s_FDX,FDX,[Discussion] $FDX (Fedex) and the transportation/service sector,2015-09-14,9,5
71myuv_FDX,FDX,Why is FDX up?,2017-09-21,1,1
xfralz_FDX,FDX,"Jim Cramer predicted that FedEx will have a great year amid strong e-commerce sales back on the 29th of June. Now, FDX is cutting costs & has withdrawn 2023 guidance after Q1 shipments disappointed. At this point, do you think Cramer should even bother sharing his opinions?",2022-09-16,527,138
12fx1gl_FDX,FDX,"Technical Trade Radar: April 10 - 14 (FDX, GIS, ICE, ORCL, CAH, LLY, PEP)",2023-04-08,7,3
10f67uj_FDX,FDX,$UPS VS $FDX,2023-01-18,2,1
zruigs_FDX,FDX,Indexes being carried by NKE (+13.4%) and FDX (+5%) today - Increased consumer confidence data,2022-12-21,5,0
pwjel5_FDX,FDX,"With shopping/shipping season starting, and FDX greatly discounted, it’s a great buy rn!",2021-09-27,3,1
kfdeko_FDX,FDX,$fdx earnings,2020-12-18,5,3
lg2zvm_FDX,FDX,FDX on the road to recovery?,2021-02-09,3,0
5xt8qc_FDX,FDX,"3.6.17 Monday Market Movers & News: SNAP, DB, NFLX, XRX, AMZN, HPQ, GRMN, FDX",2017-03-06,20,1
5bnygk_FDX,FDX,"$FDX is close to breakout, rally will continue...",2016-11-07,2,1
395ncw_FDX,FDX,"6/9/15 Early Tuesday Movers: LULU, GE, PBY, FDX, HPQ, ETSY, PG, PLAY & more",2015-06-09,9,2
4bc4ic_FDX,FDX,"3.21.16 Monday Pre-Market Movers: HOT, IHS, AAPL, NKE, SYMC, JWN, FDX, VAL, FB, SPLS, DIS, MON & more",2016-03-21,6,1
3np94k_FDX,FDX,"10/6/15 Tuesday Movers: PEP, DD, TCS, CSCO, ILMN, LGF, SNE, BABA, SUNE, FDX, AMZN & more",2015-10-06,4,1
2gnjqm_FDX,FDX,"9/17/14 Stocks to Watch: FDX, LEN, GIS, ADBE, MSFT, SNE & more...",2014-09-17,8,2
2xckh7_FDX,FDX,"2/27/15 Early Friday Movers: FDX, BAC, CSX, MNST, JCP, GPS, HLF, SPLK, WTW & more",2015-02-27,6,1
2cvvnc_FDX,FDX,"Early movers: FDX, LB, BAC, YELP, FOXA, WEN & more",2014-08-07,8,1
28gg5b_FDX,FDX,"Early movers: FDX, AMZN, GM, GPS, TMUS, JPM & more",2014-06-18,3,1
20t7wn_FDX,FDX,"FDX Q4 misses on revenue an earnings, blames weather",2014-03-19,3,1
1tvmwj_FDX,FDX,"CNBC Fast Money desk long ideas - SBUX, XOM, QCOM, BAC, HA, FDX, EWW",2013-12-28,0,1
1qgbxa_FDX,FDX,"Early movers 11/12/13: DHI, TWTR, NRT, RIG, FDX, WMT & more - CNBC",2013-11-12,1,0
m51lsn_FDX,FDX,"Expected moves for this week. Tesla, SPY, CRWD, NKE, FDX and more.",2021-03-14,343,136
resczw_FDX,FDX,"Expected moves this week. SPY, QQQ, IWM, BTC, ETH, TSLA, FDX .",2021-12-12,200,49
1fkv2vf_FDX,FDX,3 Months Ago FDX Was First Earning's Play,2024-09-19,5,9
td8v8a_FDX,FDX,"Expected Moves this week: USO, XOM, CVX, WEAT, FDX, and more.",2022-03-13,115,33
16jca8l_FDX,FDX,Earnings play: writing naked 9/22 puts on FDX at $230 strike (2x expected move) for.75/contract.,2023-09-15,7,19
o4ecyw_FDX,FDX,"Expected moves this week. SPY, QQQ, NKE, FDX, BB",2021-06-20,71,39
11s3znd_FDX,FDX,FDX put volume spike - 16k contracts in 5 minutes,2023-03-15,0,6
is3v6f_FDX,FDX,FDX ER PLAY,2020-09-13,11,26
vidhqc_FDX,FDX,FDX earrings,2022-06-22,4,9
m2d40d_FDX,FDX,"$$$ FDX DELIVERING YOU RETURNS...massive upside in call options going into ER, DD inside",2021-03-11,14,16
xl6b4p_FDX,FDX,FDX Pre-Release Trade,2022-09-22,6,0
m7x0r3_FDX,FDX,Should I sell my FDX call before earnings announcement tonight?,2021-03-18,1,4
ecr4p3_FDX,FDX,"Iron condor on FDX earnings, what could have I done better?",2019-12-19,12,8
iv1lqz_FDX,FDX,FDX 9/18 260 Call,2020-09-18,1,3
dlquk7_FDX,FDX,FDX calendar spread breached upper break-even point,2019-10-22,2,0
147r031_FDX,FDX,Thougts on FDX (FedEx)?,2023-06-12,0,7
xfc5l3_FDX,FDX,$BEN vs $KMB vs $MDT vs $FDX,2022-09-16,2,11
ne98pu_FDX,FDX,"FedEx and United Parcel Services - A Speculative Analysis (NYSE: FDX, NYSE: UPS)",2021-05-17,13,9
pu1twj_FDX,FDX,Anyone been buying FedEx (FDX) on the pullback?,2021-09-23,5,5
1bphcwi_FDX,FDX,Fedex (FDX) Shares At Fair Value,2024-03-28,1,0
irrs2l_FDX,FDX,Anyone else playing FDX calls for earnings and UPS calls for sympathy gain?,2020-09-13,2,5
7tkz47_FDX,FDX,"Post here your low market cap coins to get into at the rebound (my picks: FDX, PRL, WISH, OPT, SNOV, XBL, WAND, MTX - see in the description why)",2018-01-28,8,6
7y480n_FDX,FDX,"Post here your undervalued coins under 15M Cap of real projects with 10x/100x potential (these are my picks: WAND, FDX, OPT, ARY, WISH, AIX, EVE - see the description why)",2018-02-17,2,4
7rlec7_FDX,FDX,"Post here your coins to buy if you missed buying on the dip (My picks: OPT, WABI, FDX, , WAND, PRL, APPC, ELTCOIN, ATL - see why)",2018-01-19,0,0
