Post_ID,Ticker,Title,Post_Date,Upvotes,Num_Comments
15b8ml8_ENPH,ENPH,Sunset on the solar bubble - ENPH FSLR puts,2023-07-27,15,64
1cy944u_ENPH,ENPH,Solar stocks up - Biden raising tariffs on Chinese solar cells. First Solar (FSLR) biggest gainer. Which of you got in?,2024-05-22,34,39
1en8wpa_ENPH,ENPH,Help with understanding ENPH and FSLR,2024-08-08,12,10
f769dz_ENPH,ENPH,Buy VSLR/RUN/SEDG/ENPH and how they are different from FSLR - Complete DD,2020-02-21,20,26
1hgd9ul_ENPH,ENPH,FSLR looks cheap to me and positioned to grow even under new administration ,2024-12-17,14,29
1d1an1m_FSLR,FSLR,What are we buying in June? $nvda? $mstr? $fslr? $dell?,2024-05-26,345,510
1cy944u_FSLR,FSLR,Solar stocks up - Biden raising tariffs on Chinese solar cells. First Solar (FSLR) biggest gainer. Which of you got in?,2024-05-22,30,39
f6yxd8_FSLR,FSLR,$FSLR (First Solar) Earnings Thread,2020-02-20,28,186
15b8ml8_FSLR,FSLR,Sunset on the solar bubble - ENPH FSLR puts,2023-07-27,15,64
1b25opv_FSLR,FSLR,FSLR Surprises w/Forward Guidance,2024-02-28,9,26
m42rpj_FSLR,FSLR,Just found a fucking gem. First attempt at DD. FSLR,2021-03-13,83,76
rralho_FSLR,FSLR,"DIP ALERT: TLRY, MRNA, FSLR",2021-12-29,50,64
13k5egi_FSLR,FSLR,"FSLR puts, debt ceiling spending cuts will fuck them",2023-05-17,29,37
1cycrr9_FSLR,FSLR,FSLR 📈📈📈,2024-05-22,14,6
1cy6uku_FSLR,FSLR,FSLR 250 call ripped,2024-05-22,13,4
1czzoir_FSLR,FSLR,Should have diamond hand my FSLR call,2024-05-25,2,4
yyv023_FSLR,FSLR,Tesla/ FSLR call credit spreads go brrrr,2022-11-18,12,14
zl8e26_FSLR,FSLR,Short FSLR,2022-12-13,7,14
kjge88_FSLR,FSLR,FSLR will Outshine its Peers into 2021,2020-12-24,18,22
xq4vxn_FSLR,FSLR,$FSLR megaphone pattern!,2022-09-28,6,9
f734yu_FSLR,FSLR,"after a red week, an $FSLR yolo tops it off...",2020-02-21,29,27
jjgihi_FSLR,FSLR,When you #YOLO on $SNAP and roll it into $FSLR (PineappleStocks),2020-10-28,34,21
926147_FSLR,FSLR,WHERES THE GUY WHO TOLD US TO YOLO FSLR,2018-07-26,25,33
u9nafz_FSLR,FSLR,Stocks With high Cash Ratios and low debt Plus high growth $STEM $DKNG $AFRM $BLND $FSLR $REGI $MP $LAW $IOT $TELL $AI $ONON $TWLO $U,2022-04-22,0,8
4y7p1q_FSLR,FSLR,Seriously is anyone fucking holding FSLR from earnings? I am getting massacred. What the fuck is this shit stock,2016-08-17,9,34
pn47cr_FSLR,FSLR,Opinions on the future of PNL and FSLR,2021-09-13,0,8
i50shv_FSLR,FSLR,RUN with the FSLR wind,2020-08-06,12,11
2wx2q3_FSLR,FSLR,"Wow, made a lucky grab on some $FSLR calls today!",2015-02-23,8,30
4v34n7_FSLR,FSLR,First Solar Earnings DD (FSLR),2016-07-28,17,24
690x7b_FSLR,FSLR,FSLR SUN BOUND PARTY THREAD,2017-05-03,21,18
m1a908_FSLR,FSLR,"$FSLR DD - 5/21 CALL, $70 strike",2021-03-09,16,4
60hsf5_FSLR,FSLR,Anybody know what's up with FSLR today?,2017-03-20,3,19
6pynu6_FSLR,FSLR,"$FSLR EARNINGS THREAD:Net sales of $623 million, GAAP EPS of $0.50 and non-GAAP EPS of $0.64",2017-07-27,17,13
4x261j_FSLR,FSLR,FSLR,2016-08-10,11,17
6pw73t_FSLR,FSLR,Last earnings plays for a while: INTC and FSLR credit put spreads,2017-07-27,1,14
7i7oc5_FSLR,FSLR,$FSLR about to explode,2017-12-07,8,11
58awda_FSLR,FSLR,FSLR +5%. Why?,2016-10-19,6,15
4x2tat_FSLR,FSLR,Down 5k on $FSLR. Bag holding since a day before earnings.,2016-08-10,1,15
6x6i1y_FSLR,FSLR,Is now a good time to get into First Solar (FSLR)?,2017-08-31,18,10
4w4lru_FSLR,FSLR,FSLR fell off a cliff at market open,2016-08-04,14,13
7ppcgw_FSLR,FSLR,FSLR 🌔,2018-01-11,11,9
8ot91q_FSLR,FSLR,Time to buy FSLR? RSI 28.88 down 5.84%,2018-06-05,7,8
71klmd_FSLR,FSLR,FSLR Credit put spread for tariff decision tomorrow,2017-09-21,7,10
71rp8r_FSLR,FSLR,i fucking called it! $fslr sec 201 ruled in there favor bitch to the moon!!!! Up 8%,2017-09-22,7,8
6pymtn_FSLR,FSLR,Uh oh FSLR halted right now,2017-07-27,11,9
4wx3c8_FSLR,FSLR,Anyone know why $FSLR is tanking a bit today?,2016-08-09,3,12
t5g8i_FSLR,FSLR,FSLR,2012-05-03,9,18
7w923w_FSLR,FSLR,I bought $FSLR at $75.5 AMA,2018-02-08,3,8
7iixd9_FSLR,FSLR,Is anybody on the FSLR train?,2017-12-08,14,7
78y83y_FSLR,FSLR,FSLR 🚀,2017-10-26,8,8
71oz3u_FSLR,FSLR,$fslr first solar sec 201 trump or usa will increase tarrifs on solor panels. Uf it goes through our own usa brand will hit $100,2017-09-22,8,6
3fvmry_FSLR,FSLR,When FSLR recoups my NBG loss in one day,2015-08-05,24,9
6qop6l_FSLR,FSLR,After a year or so of bagholding FSLR. I see green.,2017-07-31,13,6
71tj9q_FSLR,FSLR,"$fslr at 51.45 deutsch bank pt 110 is sec 201 gets passed by trump. Which it will, it's trump.",2017-09-22,5,6
4rpeyt_FSLR,FSLR,$FSLR is oversold short term,2016-07-07,1,9
7xljym_FSLR,FSLR,SEDG is up 15% on earnings so why isn't FSLR up too?,2018-02-14,5,3
5vr63g_FSLR,FSLR,So is anyone looking at FSLR right now?,2017-02-23,4,6
5vcyyy_FSLR,FSLR,FSLR YOLO into earnings?,2017-02-21,5,6
7nv1po_FSLR,FSLR,Fslr on takeoff again!,2018-01-03,0,4
6lux9o_FSLR,FSLR,FSLR 36/39 credit put spread for next week,2017-07-07,7,3
4ychk6_FSLR,FSLR,I feel sorry for those who bought into fslr earnings then proceeded to try and short solar.,2016-08-18,4,6
63eqfu_FSLR,FSLR,FSLR - reached bottom?,2017-04-04,5,4
8ab909_FSLR,FSLR,First Solar (FSLR) Short Strangle,2018-04-06,1,2
7ppw84_FSLR,FSLR,$FSLR ------> moon,2018-01-11,4,2
2m3b0j_FSLR,FSLR,FSLR calls,2014-11-12,3,8
5p4ufd_FSLR,FSLR,Moves for today: short XOM $85 puts and FSLR $34 puts for next Friday. Short KR $34 puts for next month,2017-01-20,4,4
50utn5_FSLR,FSLR,Time to buy FSLR?,2016-09-02,1,5
4w4s8l_FSLR,FSLR,Anybody else waiting for this $FSLR turnaround?,2016-08-04,1,5
2vgi5h_FSLR,FSLR,In $FSLR right as that $AAPL news hit!,2015-02-10,5,7
4tus52_FSLR,FSLR,Thoughts on First Solar and 8point3 (FSLR and CAFD),2016-07-21,1,5
793mu6_FSLR,FSLR,Fslr 22% since earnings today. Not that I have it snore sold before earnings. Fuck me right,2017-10-27,3,2
6n2flf_FSLR,FSLR,FSLR 40.5/38 credit put spread for next week,2017-07-13,6,2
2104rb_FSLR,FSLR,"FSLR had a hell of a bull run, anyone going bearish the next week?",2014-03-21,10,7
4fnqso_FSLR,FSLR,FSLR ER on 4/27,2016-04-20,7,3
4tv7ti_FSLR,FSLR,FSLR DD,2016-07-21,2,4
4v2g7b_FSLR,FSLR,FSLR - still a good buy?,2016-07-28,1,4
4ee4ua_FSLR,FSLR,FSLR DD and speculation,2016-04-12,4,2
4ept5h_FSLR,FSLR,"[discussion] solar stocks RUN, FSLR, SCTY..",2016-04-14,1,0
32qspx_FSLR,FSLR,$FSLR breaking out of recent consolidation and notes on $ES_F,2015-04-15,2,2
1c0irj_FSLR,FSLR,First Solar (FSLR) and friends soar...,2013-04-09,2,1
5ax6h6_FSLR,FSLR,First Solar (FSLR) -18% After Earnings,2016-11-03,70,43
4rq6qy_FSLR,FSLR,"Goldman Cuts First Solar, FSLR drops 10%",2016-07-07,8,18
2vgm9t_FSLR,FSLR,FSLR and APPL strike energy deal. How will this affect FSLR? Currently up 7.37% today.,2015-02-10,9,21
3p9uy3_FSLR,FSLR,Your thoughts on gold miners (GDX and GDXJ) as well as solar (FSLR and SPWR) long term?,2015-10-18,1,19
1f9mnz_FSLR,FSLR,"hey investing, just posting my trade, just sold my 12840 mjna shares and (brought in another $1500 from savings) bought 68 fslr shares, thanks to your advice went into less risky stock as far as Im concerned",2013-05-29,0,19
690uir_FSLR,FSLR,FSLR crushes estimates,2017-05-03,4,11
1z1568_FSLR,FSLR,SCTY vs FSLR,2014-02-26,1,17
nf8h0_FSLR,FSLR,What are your thoughts on First Solar (FSLR)?,2011-12-16,2,19
1f89rr_FSLR,FSLR,"ok so I don't want to throw away my money anymore, should I buy scty tsla fnma fslr, or maybe some biofuel company? I want as high risk I can get without this forum calling me an idiot....GO...absolutely no penny stocks, unless its a solar company",2013-05-28,0,17
yj4e1_FSLR,FSLR,Thoughts on First Solar (FSLR)?,2012-08-20,8,15
568ho0_FSLR,FSLR,First Solar FSLR,2016-10-06,3,9
5dc676_FSLR,FSLR,First Solar (FSLR) -12% AH After Announcing Guidance,2016-11-16,0,9
100ykw_FSLR,FSLR,"FSLR, LULU and MCP are the top 3 picks in the Sept contest so far",2012-09-17,14,13
1epb0c_FSLR,FSLR,Thoughts on FSLR? Overvalued?,2013-05-20,10,12
85z3q4_FSLR,FSLR,"Solar Companies Discussion. FSLR, JKS, CSIQ, TSLA, SPWR, RUN, TAN, etc",2018-03-21,0,3
1owy2d_FSLR,FSLR,FSLR up 24% since Friday,2013-10-21,8,10
1g1nb5_FSLR,FSLR,"How come this forum is dead silent about FSLR, SPWR, SCTY?",2013-06-10,0,9
13ykvx_FSLR,FSLR,First Solar (FSLR) begins to see daylight,2012-11-28,21,8
1fscyq_FSLR,FSLR,Here is some quick data to give you an idea how dominant FSLR is,2013-06-06,0,7
2j52ya_FSLR,FSLR,Any theories as to why FSLR is down besides oil prices?,2014-10-13,0,5
4lasen_FSLR,FSLR,"Conclusion statement from the NRDC paper ""Distributed Energy Resources in Nevada"" -- re: solar sector SCTY, VSLR, FSLR,",2016-05-27,0,2
4qc28g_FSLR,FSLR,stockAday: Chasing away the clouds over First Solar? $FSLR,2016-06-28,1,1
4i22ik_FSLR,FSLR,Any professional opinions on FSLR?,2016-05-05,1,1
2qr47k_FSLR,FSLR,Thoughts on FSLR?,2014-12-29,1,3
4fvtuj_FSLR,FSLR,"Mildly Interesting. If you bought FSLR exactly 1 year ago, today you could break even.",2016-04-21,0,1
3cmt2t_FSLR,FSLR,Anyone else looking at FSLR?,2015-07-09,2,2
uyg7i_FSLR,FSLR,Solar back in the headlines: FSLR +19% today,2012-06-12,16,3
q2jvl_FSLR,FSLR,FSLR?,2012-02-23,5,4
1f9xs6_FSLR,FSLR,"if fnma goes positive again today i will literally shit myself, don't really care, I'm up on fslr already",2013-05-29,0,3
1c0dds_FSLR,FSLR,Global warming: Is it time to invest in solar? (FSLR),2013-04-09,1,3
qc48y_FSLR,FSLR,Is it really game over for FSLR?,2012-03-01,4,2
11749i_FSLR,FSLR,"FSLR - Good time for a multi-month/year investment, or is it still just a trading stock?",2012-10-09,5,1
1fuwon_FSLR,FSLR,FSLR is about 6% of entire world Solar PV market !!!!,2013-06-07,0,0
1fnei0_FSLR,FSLR,Anyone else holding fslr? expect the bulls to stay in control?,2013-06-04,0,0
800b4_FSLR,FSLR,FSLR First Solar Conference Call Summary: Shares slide 25 points in after hours,2009-02-24,1,0
1hnhy67_FSLR,FSLR,Bull or bear for FSLR?,2024-12-27,16,29
ns6tx7_FSLR,FSLR,"Anti-Solar bill AB 1139 was defeated today, rooftop solar stocks to rebound (RUN, CSIQ, FSLR)",2021-06-04,1848,175
1d0dmww_FSLR,FSLR,Buy FSLR or too late/wait for a dip?,2024-05-25,24,25
1en8wpa_FSLR,FSLR,Help with understanding ENPH and FSLR,2024-08-08,14,10
wa9lr3_FSLR,FSLR,"Solar Stocks are going to have a good day today--RUN, NOVA, SING, FSLR, CSIQ, SPWR, SIRC",2022-07-28,9,18
5mfqud_FSLR,FSLR,FSLR -- Should I 'hold' or 'sell' my share of First Solar,2017-01-06,5,47
f769dz_FSLR,FSLR,Buy VSLR/RUN/SEDG/ENPH and how they are different from FSLR - Complete DD,2020-02-21,16,26
8d8jjw_FSLR,FSLR,Thoughts on FSLR?,2018-04-18,38,30
jmun3z_FSLR,FSLR,"RUN, JKS, SPWR, FSLR or BEPC as Energy/Renewable Stock?",2020-11-02,3,7
8p0zd4_FSLR,FSLR,$FSLR - Hold or Buy the Dip?,2018-06-06,21,15
pn4654_FSLR,FSLR,Opinions on the future of PNL & FSLR,2021-09-13,2,1
f6lydk_FSLR,FSLR,FSLR ?,2020-02-20,8,6
8pcxzy_FSLR,FSLR,I just bought shares of FSLR 6 days ago,2018-06-07,0,12
591vzy_FSLR,FSLR,What do you guys think about FSLR?,2016-10-24,10,13
7prsa5_FSLR,FSLR,What do we think of FSLR?,2018-01-11,9,10
cdzqon_FSLR,FSLR,Anyone averaging down on FSLR?,2019-07-16,1,5
3mefjd_FSLR,FSLR,FSLR or SCTY,2015-09-25,1,15
9gw5mr_FSLR,FSLR,Trends holders seeing in FSLR,2018-09-18,0,7
201vo7_FSLR,FSLR,"Help me make a pick among these Solar comps>>SCTY, JKS,GTAT, FSLR,SPWR,SUNE",2014-03-10,15,14
5w9uo5_FSLR,FSLR,Need help on First Solar Inc (FSLR),2017-02-26,5,9
7i8bwo_FSLR,FSLR,FSLR and friends...,2017-12-07,15,6
2j9j2o_FSLR,FSLR,$FSLR or $SCTY?,2014-10-14,4,13
dajcih_FSLR,FSLR,Do we know what happened with FSLR Friday?,2019-09-28,0,1
71rpro_FSLR,FSLR,$fslr to the moon sec 201 passed!,2017-09-22,1,5
1x1ql0_FSLR,FSLR,FSLR,2014-02-05,10,10
5awzwf_FSLR,FSLR,FSLR down ~15% following Q3 earnings,2016-11-03,5,5
5b0fq3_FSLR,FSLR,What happened with FSLR?,2016-11-04,1,5
1y9agx_FSLR,FSLR,What stocks are you watching this week and why? I am looking at FSLR and GS,2014-02-18,3,9
6q4rzo_FSLR,FSLR,FSLR - There was no way it wouldn't beat earnings.,2017-07-28,1,3
404uv1_FSLR,FSLR,What does /r/stocks think about FSLR?,2016-01-09,10,5
4gjcgu_FSLR,FSLR,Any thoughts on $FSLR before tomorrow's earnings report?,2016-04-26,5,4
4qalcl_FSLR,FSLR,$fslr. Time to buy or wait it out?,2016-06-28,1,4
4hvf4d_FSLR,FSLR,Thoughts on SCTY vs FSLR vs CSIQ?,2016-05-04,3,4
1pooxq_FSLR,FSLR,FSLR. Niceeeee,2013-11-01,2,6
5b29bd_FSLR,FSLR,FSLR - Time to buy yet?,2016-11-04,4,1
4w42rs_FSLR,FSLR,$FSLR question about ER and estimates.,2016-08-04,3,1
4i2kdf_FSLR,FSLR,"$SCTY, $SPWR, and $FSLR",2016-05-05,7,1
20xbj1_FSLR,FSLR,Time to cash out on FSLR?,2014-03-20,10,3
on2rf_FSLR,FSLR,David Einhorn closes out short positions and also purchased another long term short position in to Dell. First Solar (FSLR) was trading at $170 in Feb 2011 and fell to $30 Dec 2011 and closes his short position. LOL what a guy ,2012-01-19,2,5
22j4k5_FSLR,FSLR,Has Anyone Been Keeping an Eye Out for $FSLR?,2014-04-08,0,1
2nsa5w_FSLR,FSLR,$FSLR First Solar perspective,2014-11-29,1,0
7et8y_FSLR,FSLR,Kaufman lowers tgts and estimates on SPWRA and FSLR,2008-11-21,0,0
1gh05kv_FSLR,FSLR,"Updated Valuations: LRCX, FSLR, MEDP, V, GOOGL, and MSFT",2024-11-01,40,6
zslwud_FSLR,FSLR,Goldman Sachs raises First Solar ($FSLR) Price Target to $231,2022-12-22,15,3
zd8wv9_FSLR,FSLR,"FSLR Stock Relentlessly Printing Higher Highs. First Solar, Inc. (NASDAQ...",2022-12-05,0,1
il7zub_FSLR,FSLR,Opinions on FSLR,2020-09-02,3,1
47d2cz_FSLR,FSLR,Trending stocks Weds 24th FSLR NUGT MBLY CAR ETSY,2016-02-24,2,5
1idol0_FSLR,FSLR,"$FSLR (first solar) hot or not? , $BA (boeing) will recover to 108?",2013-07-16,5,6
sok65_FSLR,FSLR,"$FSLR - This POS stock, is now a falling knife, my guess is it should find support around $15...",2012-04-23,2,7
10kte8_FSLR,FSLR,Some serious buyers come in for FSLR today.,2012-09-27,1,6
1yzto9_FSLR,FSLR,"Early movers: TGT, LOW, DAL, BAC, BA, FSLR & more",2014-02-26,4,3
xkm5c_FSLR,FSLR,FSLR +26% break out on profit jump,2012-08-02,9,4
2dc0ic_FSLR,FSLR,"Early movers: ANF, TW, SKUL, JPM, RAX, FSLR & more",2014-08-12,2,2
2x3xy1_FSLR,FSLR,"2/25/15 Early Wednesday Movers: LOW, HTZ, CHK, DLTR, FSLR, HPQ, WMT, AAPL, LUV & more",2015-02-25,2,1
zvlc2_FSLR,FSLR,FSLR busting a move this morning,2012-09-14,1,3
69ezom_FSLR,FSLR,SOLAR ENERGY STOCKS: are we getting it wrong? $FSLR$,2017-05-05,1,3
41pwfb_FSLR,FSLR,Really reaching here but can anyone post the buy-side short FSLR report from Sumzero from 01.08.16?,2016-01-19,9,0
lqj70_FSLR,FSLR,Shorting - Early Can Be Wrong: Post-Mortem of an First Solar (NSDQ:FSLR) Short,2011-10-27,3,1
pfzdyu_FSLR,FSLR,FSLR looking great for a run,2021-09-01,8,14
m1av4u_FSLR,FSLR,"$FSLR DD - 5/21 CALL, $70 strike",2021-03-09,2,1
251lvc_FSLR,FSLR,"USO, SCO, TSLA and FSLR plays for consideration",2014-05-08,1,1
7ih58l_FSLR,FSLR,"Live Trades on /CL, $PXS, $FSLR 12-8",2017-12-08,4,0
7i0zoc_FSLR,FSLR,"Live Trades on $PLAY, $SQ, $FSLR, $AVAV 12-6",2017-12-06,5,0
1owwkh_FSLR,FSLR,"Four Stocks To Watch This Week (GOOG,FSLR,PPC,QIHU)",2013-10-21,0,0
19046su_FSLR,FSLR,"Two Stocks Poised to Rebound: $SING (solar energy) and $DUOT (AI); $FSLR, $RUN, $CSIQ included",2024-01-06,9,9
1jag0e4_FSLR,FSLR,Convince me not to buy a large chunk of FSLR?,2025-03-13,0,26
1kt8tcf_FSLR,FSLR,FSLR coming stock trend & valuation,2025-05-23,5,8
1hgd9ul_FSLR,FSLR,FSLR looks cheap to me and positioned to grow even under new administration ,2024-12-17,15,29
1gh0041_FSLR,FSLR,"Updated Valuations: LRCX, FSLR, MEDP, V, GOOGL, and MSFT",2024-11-01,105,47
1cxbh3n_FSLR,FSLR,First Solar ($FSLR),2024-05-21,21,56
1i1zfzx_FSLR,FSLR,Thoughts on FSLR?,2025-01-15,4,14
6wz9dt_FSLR,FSLR,Long $FSLR or Sell?,2017-08-30,4,8
