Post_ID,Ticker,Title,Body,Post_Date,Upvotes,Num_Comments
17f45b1d-1bc0-4d63-b65f-f5a1ed8339e4,GM,"Nvidia Aims To Bypass Big Tech Dependency By Going Straight To International Governments, As It Did Recently With Saudi Arabia","In This Article:
Nvidia (NASDAQ:NVDA) is looking beyond Big Tech as it strategizes global expansion by doing deals with foreign governments, the Financial Times reports.
As the innovative chip company behind artificial intelligence, demand for Nvidia’s technology crosses all boundaries — from…",2025-05-29,,
24e3f32f-e329-4e89-a74c-023762934913,GM,Microsoft (NASDAQ: MSFT) Stock Price Prediction for 2025: Where Will It Be in 1 Year,"Shares of Microsoft (NASDAQ:MSFT) gained 0.50% over the past five trading sessions, doing little to deter the stock’s strong performance over the past month that has resulted in a gain of 16.09%. Year-to-date, the tech behemoth is now up 9.28% as it continues to reward investors with a dividend…",2025-05-29,,
3b3666eb-5820-4872-b2f1-2c89bf5ee4d4,GM,"Here are Thursday's biggest analyst calls: Nvidia, Tesla, Salesforce, AppLovin, Broadcom, Netflix, Southwest & more","Here are Thursday's biggest calls on Wall Street: Bank of America reiterates Salesforce as buy Bank of America said Wednesday's earnings report was ""not a game changer"" but that's sticking with the stock. ""We believe Salesforce is well positioned to continue capturing share of the cumulative $200…",2025-05-29,,
1c908663-04f5-4846-8c40-306d6a2cefbd,GM,Ford CEO Faces Another Catastrophe,"Ford Motor Co. (NYSE: F) CEO Jim Farley spends part of his week talking to people on his DRIVE podcast. He spends some of the rest of the time dealing with how to fix Ford’s abysmal quality problems, which have driven warranty expenses that have cost America’s number two car company hundreds of…",2025-05-29,,
a041709b-adc9-47fa-88f8-dcfb54b08789,GM,With Many Upcoming Trade Agreements….INVEST TO WIN!,"Key Points
 
 
 
 
Qatar and the UK placed orders of over $100 billion with Boeing
 
 
 
The US could export nearly 600,000 more cars to the EU, to match European Imports
 
 
 
The US should be delivering huge quantities of natural gas to Europe and Asia
 
 
 Are you ahead, or behind on…",2025-05-29,,
47019152-bd4e-473f-bb76-a8db7664dfe9,GM,Tesla (NASDAQ: TSLA) Stock Price Prediction and Forecast 2025-2030 (May 29),"Shares of Tesla Inc. (NASDAQ: TSLA) have popped 6.7% in the past week, despite concerns about Tesla sales in China and Europe, after some proposed tariffs were delayed. The share price is still 11.6% lower year to date, as well as down 22.9% since its 52-week high on Dec. 17, 2024.
 
 
 
 
24/7…",2025-05-29,,
546c5f8f-fee1-441a-85bf-d913f6360ba3,GM,General Motors CEO Backs Trump's Auto Tariffs As A Tool To 'Level The Playing Field'—'They've Taken The Time To Understand Our Industry',"In a recent interview, General Motors Co. (NYSE:GM) CEO Mary Barra expressed her support for the auto tariffs imposed by President Donald Trump, citing the unfair competition faced by U.S. automakers in the global market.
What Happened: Barra, in an interview at The Wall Street Journal’s Future of…",2025-05-29,,
181efbde-210a-4406-a1c2-ea9a4dbafa93,GM,How a ‘golden share’ may push through a steel deal,"Less than a week after President Trump suggested he was endorsing a deal to resolve the saga of Nippon Steel’s $14.1 billion takeover of US Steel (previously blocked as a security risk by President Biden’s administration), Nikkei reported that the US government could receive a “golden share” as a…",2025-05-29,,
8633bf0c-f5b9-4bb6-aa6b-3c63c49cade7,GM,"GM CEO Defends Trump's Auto Tariffs, Discusses China EV Advancement and More | WSJ","At WSJ's Future of Everything event, Mary Barra speaks with WSJ editor in chief Emma Tucker about how her company is ...",2025-05-28,,
5d3592b8-39f7-44c3-b12d-812990d59b65,GM,"Ibex appoints Ricky Fields as global head of business development, Wave iX","In This Article:
ibex (IBEX) announced the appointment of Ricky Fields as Global Head of Business Development for ibex Wave iX, the company’s next-gen AI solutions platform that is redefining the customer experience industry. In this role, Fields will report directly to Carl O’Neil, EVP and GM of…",2025-05-28,,
3a613cb2-c187-4f66-a918-63c6035dc04f,GM,Canada Goose joins a rising number of companies lowering or ditching guidance amid tariff chaos. Here's the list,"Companies are finding it increasingly challenging to forecast earnings amid economic uncertainty.
Michael M. Santiago/Getty Images
Companies are describing economic conditions as ""volatile"" and ""impossible to predict.""
Firms like GM and UPS are overhauling earnings forecasts amid uncertainty…",2025-05-28,,
578ad5bd-f51a-4115-a085-f07f97d33b0d,GM,General Motors To Invest $888 Million In NY V-8 Engine Plant Despite Surge In EV Market Share,"General Motors Co. (NYSE:GM) will invest $888 million in its Tonawanda Propulsion facility, where the company manufactures V-8 engines that power its SUVs and Full-Size Trucks.
What Happened: The investment follows the company's plans to provide support for the production of its sixth-generation…",2025-05-28,,
0f3aeee1-c75a-47a1-8659-9089f66983f3,GM,GM to pour $888M into building new V-8 engine in New York,"General Motors is investing $888 million in its Tonawanda Propulsion plant in Buffalo, New York, ""to support the production of the sixth generation of GM’s V-8 engines,"" the automaker announced Tuesday. 
The investment is a shift from a previously announced $300 million commitment to make…",2025-05-28,,
721a046f-9db0-41e5-8459-7987cd3dcf06,GM,"As new CEO takes over, Wall Street is expecting more from Stellantis than GM, Ford or Tesla","As Stellantis names insider Antonio Filosa to take over as chief executive, it turns out Wall Street is expecting more from the Jeep maker’s stock price than any of its major rivals.",2025-05-28,,
c84f4aa4-8cb5-4b0a-86a3-f596ecc95745,GM,GM to invest $888 million in US powertrain plant,"In This Article:
General Motors has announced plans to invest $888 million in its Tonawanda Propulsion plant to support the production of the sixth generation of GM’s V-8 engines, used in full-size trucks and SUVs. GM says the new generation of engines is expected to deliver stronger performance…",2025-05-28,,
04afb39a-5676-4aff-b032-ba536c15aaa2,GM,GM’s Mary Barra on the Auto Giant’s EV Strategy,,2025-05-28,,
cea0e588-dde8-4592-a9aa-25c1183fc6ea,GM,GM Is Betting $900M To Prove The V8 Still Has A Future,"General Motors is investing nearly $900 million to build its next-gen V8 in New York.
- Production is expected to begin in 2027 and it will power full-size trucks and SUVs.
- The new V8 promises to be more powerful, efficient, and cleaner than today’s unit.
General Motors is in the midst of a…",2025-05-28,,
639e7e5e-3785-4a8f-b0a7-eed90c586e18,GM,"'Full hit from China': Analysts are staying bullish on Nvidia ahead of earnings, but tariffs loom large","Nvidia will deliver its first-quarter earnings report after the closing bell on Wednesday.
-
Wall Street is upbeat on the premier AI chip maker, but is cautious on guidance.
-
Analysts see a potential hit from tariffs, with activity in China in focus for analysts.
Investors are gearing up for…",2025-05-28,,
60140a42-5837-4143-afe2-8ea887680555,GM,General Motors Company (GM) to Invest $888 Million in Tonawanda Propulsion Plant,"In This Article:
General Motors Company (NYSE:GM) on Tuesday announced plans to invest $888 million in its Tonawanda Propulsion plant to support the production of the sixth generation of V-8 engines used in SUVs and full-size trucks.
A group of technicians in a garage, inspecting car parts and…",2025-05-27,,
8f59cd50-00bf-4fef-8ca7-2612a7962426,GM,GM Invests in V-8 Engines as It Backpedals on EVs,,2025-05-27,,
bd1eb3cf-2e41-416d-88ab-8bd15335b8c3,GM,"GM to invest at least $800 million for engine production at New York facility, sources say",,2025-05-27,,
af2f5e97-0986-4b22-9b5c-7d359d67d142,GM,GM to invest $888 million for engine production at New York facility,"By Kalea Hall
DETROIT (Reuters) -General Motors is investing $888 million at a New York propulsion plant to increase engine production and build a next-generation V8, the company said on Tuesday.
The investment at the Tonawanda propulsion plant in Buffalo, New York, first reported by Reuters, is a…",2025-05-27,,
3aa6246b-b60f-4d1b-bfd4-c858392e6305,GM,Elon Musk latest message sends Tesla stock surging,"Tesla's CEO, Elon Musk, has a lot on his plate. The mercurial leader runs Tesla, SpaceX, Starlink, and the social media website, X. He's also been spending more than his share of time in Washington, D.C., where he heads the Department of Government Efficiency, or DOGE, an organization within…",2025-05-27,,
4e90908b-b945-4bbd-8e16-a5a0d36e8653,GM,Was Jim Cramer Right About General Motors Company (GM)?,"In This Article:
We recently published a list of Was Jim Cramer Right About These 11 Stocks? In this article, we are going to take a look at where General Motors Company (NYSE:GM) stands against other stocks that Jim Cramer discusses.
In that older episode, a longtime shareholder asked Cramer…",2025-05-27,,
489ed74e-ff58-4a6e-acf9-9f339c46035d,GM,1 No-Brainer S&P 500 Index Fund to Buy Right Now for Less Than $200,"In This Article:
Key Points
-
The S&P 500 is considered the best benchmark of how the U.S. stock market is performing.
-
One major problem is the S&P 500’s concentration in large-cap tech stocks.
-
The Invesco S&P 500 Equal Weight ETF can be a smart way to get broad stock market exposure.
The S&P…",2025-05-27,,
6c6a44b1-629d-43f2-8bcc-ef730be0506f,GM,15 cities where it's more affordable to buy a home,"The Roberto Clemente Bridge (Sixth Street Bridge) on the Allegheny River in Pittsburgh.
JNix/Shutterstock
Buying a house is stressful, even without factoring in high prices and competition.
However, there are a few places with more affordable homes, according to a WalletHub report.
It found Flint,…",2025-05-26,,
0ba14a1d-c8e5-4355-89b0-9c0c5f700ec6,GM,Another Ford Recall: Is CEO Farley on His Last Legs?,"Key Points
 
 
 
 
Ford Motor Co. (NYSE: F) is facing another major recall, this time involving 270,000 Lincoln Navigators and Ford Expeditions, highlighting persistent quality control failures.
 
 
 
CEO Jim Farley continues to face criticism over ongoing product issues and large recall-related…",2025-05-25,,
a24d4c31-d7e2-48c8-a358-79a6f67ff851,GM,Zoox issues second robotaxi software recall in a month following collision,"Amazon-owned autonomous vehicle company Zoox has issued its second voluntary software recall in a month, following a collision between one of its robotaxis and an e-scooter rider in San Francisco on May 8.
The latest incident involved an unoccupied Zoox vehicle operating at low speed, which the…",2025-05-23,,
c3edea70-62b5-49b5-8300-415156fc9b16,GM,People are buying up used Teslas as the average sale price dips,"Tesla gained more share in the used-EV market in April.
Justin Sullivan/Getty Images
Tesla's used-EV sales grew by 27% in April, per Cox Automotive data, and the average sale price fell 1.8%.
While some Tesla owners have said they plan to sell over vandalism concerns or Elon Musk's politics,…",2025-05-23,,
fe3065c7-ab4e-416c-9cc7-aa752f4665e1,GM,More Tesla Owners Are Switching To Cadillac EVs As Elon Musk's EV Giant Faces Turbulent Times,"General Motors Co.'s (NYSE:GM) luxury subsidiary, Cadillac, is experiencing increased adoption of its EVs among Tesla Inc. (NASDAQ:TSLA) owners.
What Happened: Cadillac says that 75% of the customers buying Cadillacs are switching over from other manufacturers, with 10% of those being Tesla…",2025-05-23,,
2c75c6d7-15ef-4f8e-80a3-b7c1c6a71f39,GM,GM EV Sales Surge In The US Despite Donald Trump's Auto Tariffs,"General Motors Co. (NYSE:GM) is steadily gaining on Tesla Inc.'s (NASDAQ:TSLA) lead in the U.S. domestic EV market, despite the Trump administration's automotive tariffs.
What Happened: GM accounted for over 14.4% of all new EVs sold in the U.S. in April 2025, data released by Cox Automotive on…",2025-05-23,,
0318304c-b26f-47e2-9782-5f8429bd5d34,GM,Pirates GM Ben Cherington says trading ace Paul Skenes is 'not at all part of the conversation',,2025-05-22,,
66e4852c-54f1-495d-a746-717180566746,GM,"Hinge Health IPOs at $32 per share, a sign that interest in digital health may be back","In This Article:
Hinge Health (HNGE), a digital health platform for physical therapy, debuted on the New York Stock Exchange at $32 per share Thursday and rising shortly after trading to $39.
The company announced it would go public in March, marking the second time it would attempt to do so. It…",2025-05-22,,
555b7d47-a4d9-428e-817f-e93ea263694f,GM,"General Motors revamps credit card, changes GM Rewards program to add discounts","Taking cues from the travel industry, General Motors plans to relaunch its credit card under a new lender and change how points can be accrued and used on automotive purchases.
The new card provides customers more ways to earn and redeem GM Rewards points on new vehicles, services, parts and…",2025-05-22,,
77e41d95-0494-49e5-a40d-49f30b71d853,GM,BYD Outsells Tesla in Europe,"Chinese electric vehicle (EV) giant BYD outsold Tesla Inc. (NASDAQ: TSLA) in Europe for the first time in April. Research firm Jato Dynamics provided figures to the Financial Times.
 
 
 
24/7 Wall St. Key Points:
 
 
 
 
BYD outsold Tesla Inc. (NASDAQ: TSLA) in Europe for the first time in…",2025-05-22,,
83ed8e8f-5bb4-45c7-86e9-f40bcfbaba36,GM,Tesla (NASDAQ: TSLA) Stock Price Prediction and Forecast 2025-2030 (May 22),"Shares of Tesla Inc. (NASDAQ: TSLA) slipped 2.7% on Wednesday, extending its retreat in the past week as concerns grow about Tesla sales particularly in China and Europe. The share price is 17.1% lower year to date, as well as down 27.7% since its 52-week high on Dec. 17, 2024.
 
 
 
 
24/7 Wall…",2025-05-22,,
a16e9100-b731-4db5-88c9-129e86024b1d,GM,"Q&A with Uber CEO Dara Khosrowshahi on the trade-offs with Route Share, Uber's business structure, autonomous vehicles, working with fleet operators, and more","Today, I’m talking with Uber CEO Dara Khosrowshahi. We recorded this conversation the day Uber announced a big set of product updates, including new options for shared rides and some features to make commuting easier and more predictable. Dara was in New York for all that, so he came to our…",2025-05-22,,
683d03c0-99ff-4b91-8d52-f52f72e76c53,GM,PWHL hires Boston Fleet assistant GM Meghan Turner as GM of its Seattle expansion franchise,,2025-05-21,,
ed3d1a13-d9f8-47e4-a029-c3e8d49a0c16,GM,"If You Invested $15,000 In Ford (F) 15 Years Ago, This Is How Much Cash From Dividends You Would Have Today","Key Points
 
 
 
 
Due to the depreciation of its stock price in April, along with most of the rest of the market, Ford Motor Company finds itself slowly climbing back up as the market recovers. 
 
 
 
Ford’s dividend is an unusually high 6.98% at the time of this writing, although its price in…",2025-05-21,,
