Post_ID,Ticker,Title,Post_Date,Upvotes,Num_Comments
tr55d1_GME,GME,"GME reached $448,950 seconds before halt. I was watching this as it was happening. LFG",2022-03-29,29367,2077
msblc3_GME,GME,GME YOLO update — Apr 16 2021 — final update,2021-04-16,176254,17824
11xxru4_GME,GME,(GME) Gamestop earnings. Let's take a closer look...,2023-03-21,9382,1295
l78uct_GME,GME,GME YOLO update — Jan 28 2021,2021-01-28,301617,22949
tt8wrc_GME,GME,GME Stock Split SEC Filing,2022-03-31,22561,2581
l846a1_GME,GME,GME YOLO month-end update — Jan 2021,2021-01-29,265395,19845
lnqgz8_GME,GME,GME YOLO update — Feb 19 2021,2021-02-19,224989,12852
lae6j0_GME,GME,GME YOLO update — Feb 1 2021,2021-02-01,217806,18010
lb6jld_GME,GME,GME YOLO update — Feb 2 2021,2021-02-02,161953,17349
l6ekdz_GME,GME,GME YOLO update — Jan 27 2021 --------------------------------------- guess i need 102 characters in title now,2021-01-27,219066,14605
mbpclz_GME,GME,GME YOLO update — Mar 23 2021,2021-03-23,130589,8052
tldlqk_GME,GME,GME after the earnings dip,2022-03-23,74752,1342
m0q5bm_GME,GME,GME YOLO update — Mar 8 2021,2021-03-08,172226,8052
l7iorh_GME,GME,GME Overnight Pajama Party Megathread,2021-01-29,85518,76584
lt7v4w_GME,GME,GME YOLO month-end update — Feb 2021,2021-02-26,151000,7625
m1xhlc_GME,GME,"GME Megathread for March 10, 2021",2021-03-10,48307,87513
lbykxg_GME,GME,GME YOLO update — Feb 3 2021 – heads up gonna back off the daily updates for now,2021-02-03,148219,9936
m237es_GME,GME,"GME Megathread Part 2 for March 10, 2021",2021-03-10,47751,65726
lmagzp_GME,GME,"Today, Interactive Brokers CEO admits that without the buying restrictions, $GME would have gone up in to the thousands",2021-02-18,145319,7824
tql3zs_GME,GME,GME Yolo: 300k->1.35mil,2022-03-28,32424,1599
l5nphz_GME,GME,GME YOLO update — Jan 26 2021,2021-01-26,140339,9287
y2z9vb_GME,GME,I think my parents hate me after buying GME at 115$,2022-10-13,29247,879
l8c0u4_GME,GME,"Used some of my GME tendies to buy Nintendo Switches from Gamestop, then donated them to a Children's Hospital. Got featured on the local news and brought glory to WSB.",2021-01-30,215400,6980
mch84i_GME,GME,GME YOLO update — Mar 24 2021,2021-03-24,102382,5691
lsgv43_GME,GME,Tried to quickly buy 50k worth of GME before close but fat fingered and ended up buying “GMED”,2021-02-25,98748,6698
mdnjql_GME,GME,"GME Megathread for March 26, 2021",2021-03-26,35890,50183
m8g6c2_GME,GME,"GME Megathread for March 19, 2021",2021-03-19,35344,60760
l8539h_GME,GME,CNBC now running Ads promoting that Melvin Capital closed their short positions on $GME,2021-01-29,106393,7096
mcx43r_GME,GME,"GME Megathread for March 25, 2021",2021-03-25,32746,66423
lrmrsc_GME,GME,"GME up 37% ""I'm not sure I can take it again""",2021-02-24,84195,6037
mhektw_GME,GME,GME YOLO month-end update — Mar 2021,2021-03-31,104752,3985
la09rn_GME,GME,"Don’t listen to them, this is them trying to take focus away from GME",2021-02-01,112736,5585
mbdncf_GME,GME,"GME Megathread for March 23, 2021",2021-03-23,31374,36945
m0fpgd_GME,GME,"GME Megathread for March 08, 2021",2021-03-08,31030,73758
l2x7he_GME,GME,GME YOLO update — Jan 22 2021,2021-01-22,96738,6085
la6w8q_GME,GME,Just bought $1MM worth of $GME. My profits from years of trading. Let’s stick it to the HFs! 🦍 strong together. 💎 🙌,2021-02-01,117151,5035
mc4hjd_GME,GME,"GME Megathread for March 24, 2021",2021-03-24,28705,56987
ls63oa_GME,GME,"GME Megathread for Thursday February 25th, 2021",2021-02-25,32076,72026
lw4qgi_GME,GME,"Fuck it, Heres your daily GME Thread-Megathread 3/2/21",2021-03-02,33089,30311
m5jn1y_GME,GME,"GME Megathread for March 15, 2021",2021-03-15,29413,57784
m16emz_GME,GME,"GME Megathread for March 09, 2021",2021-03-09,29961,67811
mqolln_GME,GME,"GME Megathread for April 14, 2021",2021-04-14,26497,35203
mgewny_GME,GME,"GME Megathread for March 30, 2021",2021-03-30,28196,33447
l6cb1x_GME,GME,"The GME Thread, Part 3.14, for January 27, 2021",2021-01-27,36704,46892
mame8e_GME,GME,"GME Megathread for March 22, 2021",2021-03-22,29227,31340
m3hkjf_GME,GME,"GME Megathread for March 12, 2021",2021-03-12,29007,54773
m67ywm_GME,GME,"GME Megathread for March 16, 2021",2021-03-16,28436,50590
l97ykd_GME,GME,The real reason Wall Street is terrified of the GME situation,2021-01-31,58212,7661
lre2k6_GME,GME,"GME Megathread for Wednesday, February 24th, 2021",2021-02-24,30216,83767
mfoivk_GME,GME,"GME Megathread for March 29, 2021",2021-03-29,28015,25370
l4xje1_GME,GME,GME YOLO update — Jan 25 2021,2021-01-25,87559,5319
lb8lwf_GME,GME,Why the fuck are we acting like we lost? We made GME go from 4 to 400 and it took combined trading platforms to silence and cheat to bring it to 90.,2021-02-02,77293,5345
m2q39b_GME,GME,"GME Megathread for March 11, 2021",2021-03-11,28397,39176
lwtejk_GME,GME,"GME Megathread for March 3rd, 2021",2021-03-03,29337,38681
m6zbhp_GME,GME,"GME Megathread for March 17, 2021",2021-03-17,26969,47157
l7v9o8_GME,GME,GME What About Second Breakfast Club Megathread,2021-01-29,31360,71479
l7s631_GME,GME,GME Breakfast Club Megathread,2021-01-29,30644,75994
mpbvt1_GME,GME,"GME Megathread for April 12, 2021",2021-04-12,23833,32494
m7pr7b_GME,GME,"GME Megathread for March 18, 2021",2021-03-18,26009,35135
mh524f_GME,GME,"GME Megathread for March 31, 2021",2021-03-31,25593,23624
mz69gk_GME,GME,$GME squeeze incoming,2021-04-26,44767,4090
l78fuh_GME,GME,"I just bought $5,000 in $GME. I would not have done this if the brokerages didn't try to manipulate the market.",2021-01-28,75317,4808
lsc5ji_GME,GME,"GME Megathread Part 2 for Thursday, February 25th, 2021",2021-02-25,26798,69796
lddphx_GME,GME,"$GME & $AMC Line comparation, from the last 5 Days...",2021-02-05,71394,4672
l8izo3_GME,GME,"Beware those who are shilling other stocks claiming they're the next GME! They're just trying to get your attention, and they're succeeding! 🚨",2021-01-30,58637,5662
l6sttu_GME,GME,Don’t be scared by the drop in $BB $GME etc. Hedge Funds trade after hours to scare y’all off... KEEP BUYING AND HOLDING 🚀🚀,2021-01-28,86554,4334
l9runf_GME,GME,The Silver Squeeze is a hedge-fund coordinated attack so they can keep fighting the $GME fight,2021-02-01,73299,4656
ms17e4_GME,GME,"GME Megathread for April 16, 2021",2021-04-16,23232,25820
mrcp5k_GME,GME,"GME Megathread for April 15, 2021",2021-04-15,22977,25195
lathys_GME,GME,To all GME holders: Shut up and listen,2021-02-02,55585,5438
m1s4gv_GME,GME,I made a promise to some friends that I would eat a green crayon if GME hit $250. Might as well show you apes as well.,2021-03-10,64454,3701
le235t_GME,GME,GME Institutions Hold 177% of Float Why the Squeeze is not Squoze,2021-02-06,57785,4827
mq0c0d_GME,GME,"GME Megathread for April 13, 2021",2021-04-13,22422,23995
lxkint_GME,GME,"GME Megathread for March 04, 2021",2021-03-04,24562,42306
ml9ho9_GME,GME,"GME Megathread for April 06, 2021",2021-04-06,23008,18751
l8hsjd_GME,GME,"Billboard in Oklahoma City, OK! If someone can rent out a billboard for GME you can hold your shares!!! 💎 🖐!!!! (Left watermark for credit)",2021-01-30,132856,3217
laujs5_GME,GME,GME thread for 2/2/21,2021-02-02,26059,69966
l82y7u_GME,GME,How to Buy GME Above Broker Limits,2021-01-29,75153,3874
mi9hdf_GME,GME,GME YOLO update — Apr 1 2021,2021-04-02,87627,2686
lavgj3_GME,GME,My 102 year old grandmother bought GME in August 1995 and held through all this time.,2021-02-02,110105,3240
lc5690_GME,GME,RH eases restrictions again in AMC and GME,2021-02-04,66968,3940
lybuq0_GME,GME,"GME Megathread for March 05, 2021",2021-03-05,23051,43403
l747eg_GME,GME,Citadel reloaded their shorts before they told Robinhood to stop trading $GME,2021-01-28,84026,3561
lv7ahq_GME,GME,"GME daily thread March 1, 2021",2021-03-01,22819,49992
mhu8tg_GME,GME,"GME Megathread for April 01, 2021",2021-04-01,21548,21557
l65p3u_GME,GME,"The GME Thread, Part 2, for January 27, 2021",2021-01-27,24594,87031
l7zgdk_GME,GME,"RH now limiting to 2 shares max of GME. This is the same shit as yesterday, just disguised.",2021-01-29,68622,3713
lbm3vr_GME,GME,GME super awesome megathread weds 2/3,2021-02-03,24257,58491
mlzzpw_GME,GME,"GME Megathread for April 07, 2021",2021-04-07,21162,18985
mnf6e4_GME,GME,"GME Megathread for April 09, 2021",2021-04-09,20121,27539
lqj165_GME,GME,"GME Safe Space Megathread for February 23rd, 2021",2021-02-23,25210,15303
lb7rg4_GME,GME,GME overnight Pajama party megathread 9000,2021-02-02,25716,22742
l4sg3u_GME,GME,Can I get a flair for buying GME at the literal top ($155.29)?,2021-01-25,58098,4022
mmpqrw_GME,GME,"GME Megathread for April 08, 2021",2021-04-08,19390,25403
nvs3c6_GME,GME,🚀 GME Q1 Earnings Megathread 💎🙌 🚀,2021-06-09,16867,11858
lsvmfs_GME,GME,"GME Megathread for Friday, February 26th, 2021",2021-02-26,20059,56676
ll68pc_GME,GME,"The SEC Just posted the new numbers for Failure to Deliver. Guess What, GME is failing to deliver every day.",2021-02-16,49450,3421
mkih9q_GME,GME,"GME Megathread for April 05, 2021",2021-04-05,18596,22436
lbyf09_GME,GME,GME overnight thread / SEC intern meet-and-greet,2021-02-03,22369,22043
l6wvia_GME,GME,"Robinhood and other brokers literally blocking purchase of $GME, $NOK, $BB, $AMC; allow sells",2021-01-28,26946,5376
l2t0k1_GME,GME,GameStop (GME) halted at $72.80,2021-01-22,4650,1785
l3otq5_GME,GME,All right WTF is going on with GME,2021-01-24,1678,1129
l47jf5_GME,GME,"Spreadsheet to calculate GME Exit Strategy, ROI Calculations & Breakeven Analysis",2021-01-24,1990,305
m2ok1a_GME,GME,"GME Thread - March 11, 2021",2021-03-11,902,1136
lcroz5_GME,GME,GME and meme stock an expensive lesson to learn.,2021-02-04,923,818
1di6g1j_GME,GME,"CMV: GME is no longer a video game store, it's now the Ryan Cohen SPAC",2024-06-17,577,124
l6au21_GME,GME,"William Galvin, the Secretary of the Commonwealth of Massachusetts -- suggests there is something “systemically wrong” with the GME squeeze",2021-01-27,1041,259
ldzb68_GME,GME,"GME, Mob Mentality, and the irresponsibility of Reddit hype.",2021-02-06,539,606
ls7qf3_GME,GME,"Overflow sticky thread for GME, etc.",2021-02-25,265,445
l5jewj_GME,GME,"I wanted to share Matt Levine's discussion on Market Manipulation and GME, it's a good laymen's explanation of the legal ambiguities in securities law",2021-01-26,336,150
10n9nu0_GME,GME,Why are so many investors still hanging on to GME?,2023-01-28,38,188
qu188u_GME,GME,"If people were angry when brokers halted GME buy's, what would happen if a stock market crash occurs and ordinary investors are not able to sell?",2021-11-14,159,155
1dah3sx_GME,GME,ELI5 the new GME situation  ,2024-06-07,0,70
m1ymyl_GME,GME,"GME Thread - Wednesday March 10th, 2021",2021-03-10,34,226
k6ntxj_GME,GME,GME Short Squeeze: An In-depth Analysis,2020-12-04,256,101
l4yez3_GME,GME,Why are all GME buyers say wait til Friday?,2021-01-25,91,149
w44lll_GME,GME,Thinking of Calls on GME post split - no meme talk pls,2022-07-21,0,99
1i5ka89_GME,GME,"Why does my HSA and IRA type account care about wash sales? Regarded GME had 500 shares at $40 over 2 years ago, traded enough to where I’m ahead and have 850 shares now",2025-01-20,0,6
y4kyug_GME,GME,Is it time to sell my GME?,2022-10-15,0,86
l42pwh_GME,GME,Buying GME long dated puts,2021-01-24,6,105
l43wrh_GME,GME,GME: The Long Thesis and Hopeful Return to Sanity,2021-01-24,53,89
l4n6az_GME,GME,GME's latest Short Interest after Jan 22 EOD is 70.97M. Cost of borrowing also increased,2021-01-25,1397,782
l0ml8z_GME,GME,What is wallstreetbets on about with GME?,2021-01-19,27,79
ttjskc_GME,GME,[Genuinely Curious] is there any way GME stock splitting could go wrong?,2022-04-01,0,57
l3vddv_GME,GME,Why is GME a good short term stock buy?,2021-01-24,2,57
lb0lol_GME,GME,GME short interest down to 51% from S3 Partners,2021-02-02,0,57
op00jd_GME,GME,Your Thoughts on $GME Thesis,2021-07-21,2,37
b3w6uj_GME,GME,Any bullish Gamestop (GME) shareholders here?,2019-03-21,10,55
lc6mei_GME,GME,Why I think Hedge Funds are digging themselves deeper and deeper holes with GME,2021-02-04,0,40
l364kf_GME,GME,Are there any beaten down companies you suspect are in the process of massively reinventing themselves like BB and GME?,2021-01-23,9,34
l5aorm_GME,GME,Is a short squeeze still possible for GME?,2021-01-26,0,31
l4ccf6_GME,GME,"Is the current GME situation market manipulation or something? I want to invest, but I don’t want to do anything illegal or unethical.",2021-01-25,6,29
krjwud_GME,GME,What is up with GME and naked short selling.,2021-01-06,56,22
l3uhgt_GME,GME,Market Commentary (How about that GME and BB craze? Where are we in the market cycle? ) - 1/23/2021,2021-01-24,45,22
iw7t7k_GME,GME,Does buying GME make any sense with the new console generation coming out?,2020-09-20,12,26
l49ydu_GME,GME,Last questions about GME before tomorrow's carnival,2021-01-24,19,20
l6uva1_GME,GME,Companies try to prevent people from trading GME and AMC,2021-01-28,88992,6698
l64xvw_GME,GME,GME Dedicated Thread - Breaking: CNBC engages in market manipulation - lies about Melvin Capital having already covered positions,2021-01-27,42056,4814
l8rhr3_GME,GME,Weekend GME Thread + Homework for all: Let's stop using brokerages that halted trading,2021-01-30,36216,4281
lazcak_GME,GME,What $GME has taught me in 36 hours of day trading,2021-02-02,26742,5518
lbuhp0_GME,GME,GME short squeeze what comes next part 2,2021-02-03,21907,3795
l98jee_GME,GME,GME end financial culture: how this meme is becoming a serious thing,2021-01-31,21140,2228
l701sa_GME,GME,"Robinhood, which previously sold user information to Citadel, is now blocking buy orders of GME,AMC and more, engaging in blatant market manipulation.",2021-01-28,27855,1583
le7syu_GME,GME,GME Institutions Hold 177% of Float,2021-02-06,15523,1346
lrrcdk_GME,GME,GME Gamma Squeeze Part Two?,2021-02-25,10010,2240
l3067c_GME,GME,The Importance of whats happening with GME,2021-01-22,7444,1662
lbzkbi_GME,GME,Reminder - Whether you own GME or not - CHANGE YOUR GODDAMN BROKER,2021-02-03,9104,1153
lww0h7_GME,GME,"If someone finishes their DD with ‘this could be the next GME’, I am instantly put off.",2021-03-03,12546,809
luo6u5_GME,GME,GME Short Squeeze What Comes Next Part 6,2021-02-28,7466,1188
lfbw0s_GME,GME,"Tired of hearing about GME, AMC, & NOK? I handpicked the most popular posts, tickers, and DD from the last week. Here are the results!",2021-02-08,6822,752
l47j9y_GME,GME,"Spreadsheet to calculate GME Exit Strategy, ROI Calculations & Breakeven Analysis",2021-01-24,5194,554
lrxbvv_GME,GME,GME short squeeze what comes next part 4,2021-02-25,3803,750
lsq77k_GME,GME,GME Short Squeeze What Comes Next Part 5,2021-02-26,3115,932
laln2m_GME,GME,GME Short Squeeze What Comes Next,2021-02-02,2864,808
l2suf7_GME,GME,"GME $71 as of right now. Are you guys selling it putting a limit order? And if you are, at what price?",2021-01-22,2259,834
lhujhn_GME,GME,Weed stocks are NOT like GME.,2021-02-11,2036,660
loffqz_GME,GME,A bug in Schwab caused my retirement account to go naked short GME.,2021-02-20,2445,430
labfji_GME,GME,"Over 5 million shares of GME Failed to deliver, what can this mean?",2021-02-01,1848,541
lgkm5t_GME,GME,GME Short Squeeze What Comes Next Part 3,2021-02-10,1566,399
layb68_GME,GME,r/Stocks - GME megathread!,2021-02-02,680,5174
k688qv_GME,GME,For Those Who Don't Understand the Inevitable Short Squeeze with GME,2020-12-03,1204,527
lpz4xo_GME,GME,The whole GME/AMC trend completely derailed my plans and strategy.,2021-02-22,1078,584
laahda_GME,GME,"Serious question, did the GME squeeze already happen?",2021-02-01,849,945
ls2ow1_GME,GME,"GME Megathread for Thursday, February 25th, 2021",2021-02-25,672,2258
l7uja3_GME,GME,"Are there any stocks other than GME, AMC, NOK, and BB that people want to talk about?",2021-01-29,775,1051
zfeo8j_GME,GME,GME 2022 Q3 Earnings,2022-12-07,550,472
l7zr2y_GME,GME,Jan29 GME Discussion Thread,2021-01-29,455,2351
l4ov6a_GME,GME,BB vs. GME,2021-01-25,389,949
l7t1b0_GME,GME,"Can't ""the rich"" just buy GME or AMC?",2021-01-29,594,395
likb1g_GME,GME,Naked shorting in GME and how the pieces suddenly fit together,2021-02-12,1160,147
ki9rsu_GME,GME,Is GME currently in the short-squeeze (up 20% today so far)?,2020-12-22,611,296
l8fcbm_GME,GME,An Oversimplified Look at the GME Situation,2021-01-30,794,207
l8yamo_GME,GME,Buying GME is NOT screwing Wall Street - It is giving them your money,2021-01-30,288,676
kwj7jz_GME,GME,GME short squeeze +40%,2021-01-13,412,365
lancov_GME,GME,I’m completely sick of seeing GME and AMC posts,2021-02-02,608,203
kaa2qh_GME,GME,GME Either Squeezes or Gets Delisted - Who Will Win Short or Squeeze? Predictions here,2020-12-10,469,267
l8aq54_GME,GME,Realistic ceilings? GME/BB/AMC/NAKD,2021-01-30,342,361
l9p5ve_GME,GME,S3 Alleges Significant GME Shorts Were Covered,2021-01-31,338,361
lnvero_GME,GME,I strongly suspect that Schwab/Ameritrade does not actually have our GME shares.,2021-02-20,543,202
la52q9_GME,GME,"Am I just dumb, or could hedge-funds just buy the dip after they slosh funds in and out of $GME for months?",2021-02-01,359,258
l8r0oo_GME,GME,The rise of GME was predicted step by step 143 days ago in this DD,2021-01-30,674,141
lbv3f6_GME,GME,GME POV: someone who already exited position,2021-02-03,380,218
1e1y1oa_GME,GME,GME is going to go down,2024-07-13,0,138
l6p8pq_GME,GME,"I've seen discussion of the GME short ratio (~6), or ""days to cover"", as evidence that shortsellers could not have possibly covered their positions yet...",2021-01-28,242,238
l3auqj_GME,GME,"Can someone explain why is $GME , $BB and $PLTR with big gains today?",2021-01-23,228,242
kv93m6_GME,GME,Why is GameStop (GME) doing so well this year?,2021-01-11,231,217
1jkbnag_GME,GME,Interesting Stocks Watchlist (03/26) - GME follows MicroStrategy's Strategy,2025-03-26,19,34
vsrhct_GME,GME,I was stupid enough to have a faith on GME,2022-07-06,0,331
lam8fb_GME,GME,Anyone else just feeling this really bad depression after the GME fiasco?,2021-02-02,194,212
la6yh2_GME,GME,"GME Shorts Covering? Reports from S3 Partners, Ortex, and IHS Markit Ltd. all reporting dramatic reduction in SI%. Can this be right?",2021-02-01,144,244
m219ec_GME,GME,Bearish takes on GME?,2021-03-10,80,295
l9fixg_GME,GME,Are GME shares not 70% owned by financial insitutions ?,2021-01-31,190,188
l3e0o6_GME,GME,"GME Price target, Monday 130$ or 12$",2021-01-23,121,191
lai51i_GME,GME,Are you still holding GME as of today?,2021-02-01,87,216
laepvq_GME,GME,What happened to GME Today and Is It Over?,2021-02-01,103,196
l79i8n_GME,GME,Where to buy GME UK?,2021-01-28,70,207
l6k8x8_GME,GME,Help me understand the GME situation,2021-01-28,195,125
l3t2jh_GME,GME,GME Monday,2021-01-24,84,178
l40vvz_GME,GME,Downside risk for GME plays?,2021-01-24,110,161
le87x5_GME,GME,GME Guide and Common Misconceptions,2021-02-06,165,124
l9chts_GME,GME,Prisoner's Dilemma - Hold $GME,2021-01-31,162,124
laiaay_GME,GME,What do you make of this? Millions in GME calls bought today at ~ $800,2021-02-02,192,106
l7aidx_GME,GME,Were the $GME shorts covered with today's madness?,2021-01-28,169,112
1e9sc3j_GME,GME,Wheeling stocks $NDVA $GME $DJT $AVGO and option play on $PFE and thoughts on future plays. ,2024-07-22,2,10
wx7tpv_GME,GME,"This isn't BBBY, GME, or AMC. This isn't even Crypto. This is ELECTRICITY prices in Europe!",2022-08-25,3924,642
lu3vno_GME,GME,"When GME madness was going on, I was trying to sell my FB calls. Robinhood didn’t allow me to log in. A pop up screen kept saying: “sorry, we’re unable to process your request, please try again later” when I was finally able to log in, instead of $600 win I had $1100 loss PER CONTRACT",2021-02-28,4387,717
lt5ell_GME,GME,Don't want to spam r/StockMarket with GME I'd like to contain that in the relevant subreddits but I do think that this info should be widely known. Thank you,2021-02-26,5345,315
wab8tp_GME,GME,GME short sellers have lost $443.4 million so far this month. GME among the top 10 most unprofitable stocks for short sellers during July 2022,2022-07-28,2357,369
wpsywn_GME,GME,GME chair Ryan Cohen has disclosed he is still in his call options for BBBY ranging $60 to $80,2022-08-16,1361,244
nual1x_GME,GME,Most Anticipated Earnings For This Week! Keep an eye out for $GME 👀,2021-06-07,1206,244
lagng0_GME,GME,Buy and Sell Order numbers for GME on Fidelity,2021-02-01,755,182
l7uf9n_GME,GME,DAILY SQUEEZE THREAD - 2021-01-29: Please put all GME/AMC/other squeeze stock discussion in here to help clean up our wonderful sub!,2021-01-29,298,401
plo2yy_GME,GME,What do GME apes see as the endgame?,2021-09-10,191,325
laaf5f_GME,GME,This needs to be said about GME and the information you are finding here and WSB 💎🤲🚀,2021-02-01,331,189
l62tlz_GME,GME,"PSA/""THE NEXT GME"" - PLEASE READ: This time period is a great chance to vastly improve the content on this sub",2021-01-27,327,129
pmzz5j_GME,GME,GameStop (GME) Recent Stock Float History,2021-09-12,279,109
l3o8ve_GME,GME,Why BB will go much higher than GME,2021-01-24,133,165
1bpcl1h_GME,GME,"Besides the GME issue, are there other reasons to not use Robinhood?",2024-03-27,0,74
m5vjxn_GME,GME,"$GME Wave Count; Possible Wave 4 of (1) of iii. If this primary count plays out, wave (1) of iii may complete between 336 and 406 before wave (2) of iii pullback (target depends on completion of (1)): Not trading advise; I like the stock. I bought a position at 225 today.",2021-03-15,262,110
lbu3cs_GME,GME,They all follow $ GME.,2021-02-03,389,80
l9h4oq_GME,GME,$GME $AMC TO THE MOONNN!! 🚀🚀🚀🚀🚀🚀🚀🚀,2021-01-31,523,55
l4kfpv_GME,GME,"GME is sitting at 90 dollart pre-market Google says. +38%, how risky would this stock be to buy today?",2021-01-25,55,170
l8oz70_GME,GME,"Don’t put money you can’t risk in $GME or $AMC but even a few shares makes a difference. Join the revolution. Long the shorts, this is the way!",2021-01-30,177,107
l7hnpf_GME,GME,"Actual Reason You can't buy GME, AMC and etc.",2021-01-29,132,125
1boda41_GME,GME,GME Technical Analysis-Giant falling wedge ready for a breakout,2024-03-26,0,53
l4u5yc_GME,GME,$GME is going back up... Right?,2021-01-25,30,164
nx3d8a_GME,GME,"Question for all the apps out there! Is it at all possible in any way whatsoever that the hedgies are pushing all these new “meme stocks” and turning us onto them, as a way to distract us from GME and AMC and spread our power out between too many other stocks.??",2021-06-11,136,101
l9vp58_GME,GME,DO NOT BUY SLV CITADEL IS THE 5TH LARGEST OWNER ITS A TRAP GME AND AMC ONLY,2021-02-01,463,46
ln3z3a_GME,GME,GME Shares are Pumped Up Pre-Market Nearly Every Morning By Hedge Funds Then Sold Off to Cause Negative Looking Sentiment Going into Market,2021-02-19,138,97
l5o679_GME,GME,$GME: Will this craziness go past this Friday?,2021-01-26,80,113
lsjo9f_GME,GME,"GME, AMC. S0S, KOSS, PLTR, WKHS all were targeted by shorts today. Some were sold short way beyond the actual amount of shares that even exist for trading.",2021-02-25,215,70
l8qbhk_GME,GME,Doing my part. Screw these market manipulating crooks. Support the cause! $GME $AMC $BB $NOK,2021-01-30,385,47
l667ms_GME,GME,Why does CNBC seem to be annoyed with GME situation?,2021-01-27,144,89
l4ydhb_GME,GME,"I invested in GME when it was at 9, now I'm diverting my money here",2021-01-25,33,113
1d9wd40_GME,GME,"If GME can rocket , 🚀 could AMC be next ?",2024-06-06,0,23
l8yemc_GME,GME,Reddit vs GME Shorts,2021-01-30,331,33
l46blh_GME,GME,The Infinity Squeeze of 08 briefly made $VW the most valuable company in the world. How much would $GME have to go up in order for it to achieve the same?,2021-01-24,175,53
m18oee_GME,GME,Breaking new GME UP 25% today,2021-03-09,89,67
la1psx_GME,GME,"Don’t listen to them, this is them trying to take focus away from GME",2021-02-01,283,30
mnwx0g_GME,GME,"An untrained perspective of GME (There was no ""Tin Foil Hat"" flair or i would have used it)",2021-04-10,14,72
l8t0gx_GME,GME,Shout out to the new guys that bought 1 GME share Friday... hold that golden banana 🦍🍌,2021-01-30,162,37
m2wqbu_GME,GME,'We should see the GME short squeeze continuing': S3 Partners,2021-03-11,108,43
u8wfho_GME,GME,NFLX will buy GME,2022-04-21,0,49
mh6dld_GME,GME,What are your thoughts regarding all the “due diligence” happening in r/GME and r/wallstreetbets about GameStop and Citadel?,2021-03-31,19,56
lgkmtp_GME,GME,WSB Mods deleting FINRA data thread. GME Short Interest @ 78.46%,2021-02-10,127,33
o3oskb_GME,GME,$CLOV- Serious Discussion: Is this stock the actual dark horse.. AMC & GME prepared us for???,2021-06-19,25,47
l9hxnd_GME,GME,PLEASE READ IF YOU OWN GME!!!!,2021-01-31,8,54
l9qqr9_GME,GME,Info sheet from one of the watchers on another platform. Good stuff and funny. $BCRX #BioWar This about sticking it to the shorts in a massive way. 🚀🚀🚀🚀🚀🚀🚀🚀🚀🚀🚀🚀🚀🚀🚀 $GME $AMC,2021-02-01,83,34
du6tgm_GME,GME,Long GME (Gamestop) - Feedback Appreciated :),2019-11-10,84,69
80s7d2_GME,GME,GME has a few puffs left,2018-02-28,17,67
gr1ic0_GME,GME,Analysis of GameStop ($GME),2020-05-26,26,24
i3m1pd_GME,GME,"I just published my analysis on GameStop (GME, $4.01, $260M). Let me know what you think!",2020-08-04,32,6
idzhbm_GME,GME,"On a slow Friday could I post this video so I could get some feedback on my new style of presenting DD on GameStop ($GME, $4.61, $299M market cap)",2020-08-21,37,1
6rllin_GME,GME,FL and GME (Foot locker + gamestop) -- Dying or undervalued?,2017-08-04,3,6
ygnm2_GME,GME,GameStop (NYSE:GME) Without the Games,2012-08-19,5,0
1d6ry4l_GME,GME,DeepFuckingValue aka RoaringKitty just disclosed a $200 million GME position,2024-06-03,7341,690
l7mym2_GME,GME,The criminals that took GME down 371 points (77%) with only 8 million shares should rot in jail,2021-01-29,33923,2671
1d9j8t9_GME,GME,Obliterated 20$ puts on GME ,2024-06-06,1428,418
nwvxr4_GME,GME,"GME recieved a $90,000,000+ premium purchase on the DEEP ITM puts",2021-06-10,1945,656
