Post_ID,Ticker,Title,Post_Date,Upvotes,Num_Comments
1gptry0_KO,KO,"Is It Time to Buy KO, OXY, and Heavyweights Like TM or HMC?",2024-11-12,19,46
2ndhk9_WMT,WMT,"Early Movers: TIF, HRL, WMT, HMC, SNE, PBR",2014-11-25,2,6
qilfi2_F,F,"TSLA Market Cap increased more than HMC, F, & GM total market caps combined in 4 days",2021-10-29,1181,632
q98ta_GM,GM,Auto: HMC or GM?,2012-02-28,4,7
qilfi2_GM,GM,"TSLA Market Cap increased more than HMC, F, & GM total market caps combined in 4 days",2021-10-29,1177,632
nruxh0_HMC,HMC,HMC (Honda) is INSANELY undervalued,2021-06-04,25,73
js9mm1_HMC,HMC,Honda (HMC) will mass produce level 3 autonomous cars by March 2021.,2020-11-11,27,33
vhytmj_HMC,HMC,Can someone explain why nasdaq.com and fidelity.com have different HMC dividend histories,2022-06-22,0,5
juw56c_HMC,HMC,INSIDER INFO AT 27:55 ON NEW HONDA LINE OF TRUCKS BUY HMC BUY,2020-11-15,11,11
n9vmtz_HMC,HMC,Summer runners! $HMC $HOG $PII $DKS,2021-05-11,9,6
7a3fzo_HMC,HMC,"Before open earnings numbers: AGN, GRPN, TAP, HMC, GRMN, EL, CLX",2017-11-01,58,7
6z5tsb_HMC,HMC,$HMC $GNRC Power Generators. Generac is literally all sold out on $HD online page.,2017-09-10,6,11
628syz_HMC,HMC,Buy $HMC,2017-03-29,1,4
6xb6db_HMC,HMC,We did good with $NTNX. But on to the next one. Another gift for you needy gambling addicted degenerates. $HMC every drug lord will buy one.,2017-09-01,2,0
1givw34_HMC,HMC,$HMC Honda in Hawaii starting a Hydrogen Pilot Program with a tiny unknown company that have been silently working on tech for 13+ years ,2024-11-03,4,2
20btbl_HMC,HMC,Why is Honda (NYSE:HMC) Doing so Awful ?,2014-03-13,2,36
awojhr_HMC,HMC,HMC the best buy for value investors of all time?,2019-03-03,8,5
4kt7c1_HMC,HMC,$HMC,2016-05-24,1,4
q98ta_HMC,HMC,Auto: HMC or GM?,2012-02-28,3,7
44x0u8_HMC,HMC,"Presentation on Automotive Lending (3Q-2015) by Experian - Relevant Tickers: WFC, ALLY, F, COF, T, JPM, SAN, HMC, GM",2016-02-09,5,0
qilfi2_HMC,HMC,"TSLA Market Cap increased more than HMC, F, & GM total market caps combined in 4 days",2021-10-29,1173,632
lm6krs_HMC,HMC,"HMC (Honda) is massively overlooked, with huge upside potential",2021-02-17,167,114
1gfrh9q_HMC,HMC,$HMC Honda to start Hydrogen Project in Hawaii,2024-10-30,26,12
1gb8ug5_HMC,HMC,$HMC Honda to start Hydrogen Pilot Program with tiny USA Tech company,2024-10-24,15,3
vt5yeq_HMC,HMC,HMC Honda Motor Co sets 1 year lows - looking like a buy or avoid?,2022-07-07,18,38
10yi2lu_HMC,HMC,"Pre-Market Earnings Report for February 10, 2023 : ENB, IQV, MTD, GPN, MGA, FTS, WPC, NWL, ESNT, COOP, HMC, SPB",2023-02-10,8,0
lnexu8_HMC,HMC,Honda (HMC) a good buy?,2021-02-19,9,9
i8b203_HMC,HMC,Opinions on Honda. ticker HMC,2020-08-12,3,11
dsv0dl_HMC,HMC,Honda (HMC) Stock Value,2019-11-07,8,13
kqb7zy_HMC,HMC,Confused on HMC?,2021-01-04,4,2
a0fkun_HMC,HMC,Thoughts on $HMC as a value investing pick?,2018-11-26,1,2
2u6vuz_HMC,HMC,$HMC - Any thoughts on the future of Honda?,2015-01-30,8,7
5aju2n_HMC,HMC,"$HMC raised its full-year net profit guidance, citing strong Chinese demand. Good time to get in.",2016-11-01,1,1
1nxc1u_HMC,HMC,Can someone explain the price difference between HMC and TM?,2013-10-07,1,1
rahqzd_HMC,HMC,"$ROCK, $HMC, and other companies that hired the most employees in November",2021-12-06,31,5
2ndhk9_HMC,HMC,"Early Movers: TIF, HRL, WMT, HMC, SNE, PBR",2014-11-25,2,6
11wy4ro_HMC,HMC,Thoughts on Honda Motor Company (HMC),2023-03-20,7,15
s5zlre_HMC,HMC,What’s anyone’s thoughts on SNA ( Snap-on tool brand ) HMC ( Honda Motors car brand ),2022-01-17,2,6
1gptry0_HMC,HMC,"Is It Time to Buy KO, OXY, and Heavyweights Like TM or HMC?",2024-11-12,21,46
1gb88wz_HMC,HMC,$HMC Honda to start Hydrogen Project with SunH in Hawaii. Is Hydrogen stock of value for the future? ,2024-10-24,1,0
revker_HMC,HMC,Honda motors - $HMC,2021-12-12,22,41
awoim5_HMC,HMC,HMC is an incredible buy for value investors or I’m missing something?,2019-03-03,4,8
