Post_ID,Ticker,Title,Body,Post_Date,Upvotes,Num_Comments
e067eeea-cf5c-4a94-a716-7ce00beea746,IBM,"IBM's TP Software Stays 'Extremely Relevant' To Growth, Even In The Public Cloud Age: Analyst","On Wednesday, B Of A securities analyst Wamsi Mohan maintained a Buy rating on International Business Machines (NYSE:IBM) with a price forecast of $270.
The rating reflects the analyst’s view that the company is a defensive investment and anticipates improving revenue growth that should, in turn,…",2025-05-29,,
adfe53ce-2a22-4128-ae43-09e1552739ca,IBM,'Original White Collar Displacements': Mark Cuban Compares AI Taking Jobs to When There Was '2 [Million] Secretaries',"'Original White Collar Displacements': Mark Cuban Compares AI Taking Jobs to When There Was '2 [Million] Secretaries' Billionaire entrepreneur Mark Cuban says AI might take your job, but it will lead to more ""total"" employment.
Key Takeaways
Anthropic CEO Dario Amodei told Axios this week that AI…",2025-05-29,,
638ad83b-e991-45cb-825d-945c28ebfeec,IBM,Locking the back door: building resilience in motor finance cybersecurity,"Cybercrime in the automotive finance sector is no longer confined to major players. As AI enhances attack capabilities, Zuto, a UK-based provider of motor finance software and technology, calls for better workforce awareness, greater collaboration with partners and a focus on human-led prevention…",2025-05-29,,
db74fc98-2a68-4479-9c80-5ca7d5320ea0,IBM,The 3 Schwab ETFs Investors Should Be Buying Aggressively Before June,"I find myself on a continuous search for the best exchange traded funds (ETFs), given just how broad and expansive this space has become. Indeed, the range of ETF options out there is truly incredible, with thousands of options for investors to choose from. 
 
 
 
Key Points
 
 
 
 
The incredible…",2025-05-28,,
74e7409b-9292-4db1-b487-2d964f2ebd81,IBM,Deutsche Bank to optimise operations with IBM’s software suite,"In This Article:
Deutsche Bank has announced an extension of its alliance with IBM, focusing on the integration of IBM's software solutions into its operations.
The agreement allows the German bank to utilise IBM's extensive range of software offerings, which includes business and IT automation…",2025-05-28,,
2cc00523-bb12-4aff-b9fa-109b111d6a12,IBM,VanEck Launches Europe’s First Only Quantum Computing ETF,"VanEck has launched Europe’s first quantum computing ETF targeting companies involved in the development or application of the technology. The VanEck Quantum Computing UCITS ETF (QNTM) is listed on Deutsche Borse and the London Stock Exchange with a total expense ratio (TER) of 0.55%.
QNTM Tilts…",2025-05-28,,
afc59dcf-ff9c-41a8-b0c9-0e2853efa39b,IBM,"CEOs who aren't yet preparing for the quantum revolution are 'already too late,' IBM exec says","Quantum computing will change the tech landscape as much as artificial intelligence has. Execs from IBM, Microsoft, IonQ, PsiQuantum, and D-Wave told BI that corporate leaders should be preparing now.
D-Wave
Ready or not, the quantum computing revolution is nearly here.
Companies that don't evolve…",2025-05-28,,
4b768fbf-9baf-49e4-ad53-74899e555347,IBM,Box Earnings Are Imminent; These Most Accurate Analysts Revise Forecasts Ahead Of Earnings Call,"Box, Inc. (NYSE:BOX) will release its first-quarter earnings results after the closing bell on Tuesday, May 27.
Analysts expect the Redwood City, California-based company to report quarterly earnings at 26 cents per share, down from 39 cents per share in the year-ago period. Box projects to report…",2025-05-27,,
8271638a-2c63-440e-9f00-51dc81957324,IBM,US Corporate Giants Tap Euro Debt Market,"US Corporate Giants Tap Euro Debt Market
A surge in US companies issuing euro-denominated debt has seen some €40 billion borrowed at a record pace this year.
Sign up for smart news, insights, and analysis on the biggest financial stories of the day.
Why work hard for the Yankee dollar when better…",2025-05-27,,
8c08376c-e1c5-4337-8873-c8d1e6f436ff,IBM,"It Might Actually Be 20 Times Easier for Quantum Computers to Break Bitcoin, Google Says","Google just dropped a new research paper, and Bitcoin maxis may want to do some quick math. The tech giant's quantum team found that breaking the RSA encryption protecting everything from your bank account to your Bitcoin wallet might need 20 times fewer quantum resources than previously…",2025-05-27,,
4240d7d9-ab38-4876-b90f-e1708049cab0,IBM,"Quantum Computing Could Break Bitcoin-Like Encryption Far Easier Than Intially Thought, Google Researcher Says","A new research paper by Google Quantum AI researcher Craig Gidney shows that breaking widely used RSA encryption may require 20 times fewer quantum resources than previously believed.
The finding did not specifically mention bitcoin BTC or other cryptocurrencies, but took aim at the encryption…",2025-05-27,,
66354545-4bb2-47d0-8e7c-dec97ebc340e,IBM,"China spawns an x86 supercomputing monster, with an AMD connection","China spawns an x86 supercomputing monster, with an AMD connection
Chipmaker Hygon, which recently teased a 128-core, 512-thread CPU, merges with server-maker Sugon
China has spawned a supercomputing contender.
This story starts in 2016 when AMD licensed its first-generation Zen CPU design and the…",2025-05-27,,
dce2644e-b71c-4f27-96ed-3a4969d2d637,IBM,These Are The 50 Best Places To Work In America,"These Are The 50 Best Places To Work In America
 
What makes a company a great place to work? In a competitive labor market, top employers stand out by offering strong compensation, a culture of purpose, and the opportunity for growth.
This graphic, via Visual Capitalist's Marcus Lu, highlights…",2025-05-26,,
55593367-73c2-470d-b8c6-4c9f0025e085,IBM,Meta chief AI scientist Yann LeCun says current AI models lack 4 key human traits,"Meta's chief AI scientist, Yann LeCun, says AI lacks key human traits, requiring a shift in how they are trained.
Meta Platforms
Yann LeCun says there are four traits of human intelligence.
Meta's chief AI scientist says AI lacks these traits, requiring a shift in training methods.
Meta's V-JEPA…",2025-05-25,,
8e8111c6-5c0d-42e9-b028-9a3a817faa9e,IBM,"AI is ‘breaking’ entry-level jobs that Gen Z workers need to launch careers, LinkedIn exec warns","LinkedIn’s chief economic opportunity officer, Aneesh Raman, said artificial intelligence is increasingly threatening the types of jobs that historically have served as stepping stones for young workers who are just beginning their careers. He likened the disruption to the decline of manufacturing…",2025-05-25,,
1d6a0248-aea6-4e3b-b1de-385352f0f015,IBM,Turns out using 100% of your AI brain all the time isn’t most efficient way to run a model,"Turns out using 100% of your AI brain all the time isn’t most efficient way to run a model
Neural net devs are finally getting serious about efficiency
Feature If you've been following AI development over the past few years, one trend has remained constant: bigger models are usually smarter, but…",2025-05-25,,
7efcd92c-f25b-41e6-8db7-656d92a31917,IBM,The Real Reason the OpenAI-Jony Ive Partnership Is So Strange,"Over three decades working in Silicon Valley, Jony Ive has shaped the shell of the iMac, designed the look of the iPod and come up with the form factor for the iPhone. Pretty much every major piece of Apple technology we touch, from the heyday of Alta Vista to today, went through Ive’s hands…",2025-05-25,,
53baddaf-1a0c-484c-a153-a823ab23058f,IBM,AI ain't B2B if OpenAI is to be believed,"AI ain't B2B if OpenAI is to be believed
But it's still going to come in through the back door
Comment As AI pilots within enterprises increasingly flame out, OpenAI is making a pivot to consumers, suggesting AI is more likely to sneak into the enterprise through users than walk in through the…",2025-05-25,,
cacf229b-d561-445e-a862-749a5e964cbe,IBM,Microsoft’s Layoffs Signal AI’s Growing Role in Big Tech Jobs,"Key Points
 
 
 
 
Microsoft (NASDAQ: MSFT) is leveraging AI to drive internal efficiency, with recent layoffs likely reflecting automation-driven workforce reductions rather than economic weakness.
 
 
 
Azure continues to outperform AWS in cloud growth, bolstered by Microsoft’s bundling of AI…",2025-05-25,,
2505c898-0ac9-4a4d-889b-89c1923b311c,IBM,Footloose in Bengaluru: India's Silicon Valley,"BENGALURU, India -- This is a city that needs little introduction, given its growing fame as India's Silicon Valley and its increasingly important role as a hub for Asian technology and innovation.
Young people from across India move to Bengaluru, capital of the southern state of Karnataka, to…",2025-05-25,,
605c0e36-1ddc-4948-a8cc-2588ee2c7e53,IBM,"Trump's Commerce Secretary Says Future of American Manufacturing is 'Tradecraft' Jobs That Only Require High School Education - 'Great jobs that Start in $80,000'","President Donald Trump's push to bring back manufacturing to the U.S. from abroad has forced major companies to rethink their entire business models and invest in the country.
Earlier this year, Apple (NASDAQ:AAPL) announced plans to invest $500 billion in the U.S. to expand its manufacturing in…",2025-05-24,,
6cb5540f-32d1-4ad1-a82d-ccb524301046,IBM,They've been retired for 2 decades— and have learned to make the most of their golden years,"Bernita Clark, 82, makes costumes for her daughter's 12-foot-tall skeleton.
Michael Starghill, Jr. for BI
Sitting at her sewing machine, Bernita Clark, 82, guides a piece of blue fabric as the needle bobs up and down. To her side sit scissors, measuring tape, thread, and a skull.
It's for a…",2025-05-24,,
1458b7ec-7e82-4a34-bce5-f0041111725c,IBM,Duolingo CEO walks back AI-first comments: ‘I do not see AI as replacing what our employees do’,"A week after declaring that AI would eventually replace contract workers at the language-learning app, Duolingo’s CEO said the company was “continuing to hire” and would support its existing workers in getting up to speed on the technology. It follows buzzy startup Klarna in backing off an…",2025-05-24,,
024aad7e-865c-4d30-8689-063237692888,IBM,Amazon Tests Audio Summaries of Products for Shopping,"Shoppers tired of doing online research on products they’re interested in buying could soon just listen to a robust CliffsNotes-type summary.
Amazon started testing short-form audio product summaries, featuring artificial intelligence-powered shopping experts talking about a product’s key…",2025-05-23,,
5d787263-b84d-4918-a559-09334ad2fdac,IBM,What is Mistral AI? Everything to know about the OpenAI competitor,"Mistral AI, the French company behind AI assistant Le Chat and several foundational models, is officially regarded as one of France’s most promising tech startups and is arguably the only European company that could compete with OpenAI. But compared to its $6 billion valuation, its global market…",2025-05-23,,
64e183d9-4625-4940-96f2-3332faef70cb,IBM,"Wells Fargo warns Trump’s tariffs won’t bring back American manufacturing jobs, which will need a minimum $2.9 trillion investment to regain peak","Despite President Donald Trump continuing to tout tariffs as a way to increase U.S. manufacturing, a Wells Fargo report from this week argues meaningfully increasing manufacturing employment will be an “uphill battle.” Tariffs have pushed companies to absorb costs or pass them down to consumers,…",2025-05-23,,
c9c89760-fe92-49f8-b19a-6af20b6334b6,IBM,"Analyst Highlights Potential ‘Big Driver’ for IBM (IBM), Calls Pullback ‘Transitory’","In This Article:
As major AI players waver due to valuation and demand concerns, investors are looking for relatively under-the-radar tech stocks for growth potential. IBM has been gaining ground as the company plans new strategies for a turnaround. The stock is up 16% so far this year.
Wamsi…",2025-05-23,,
78aebea0-5abc-4f8f-b3f9-11eb95940c33,IBM,"Diversified-Land Portfolio: Alico President & CEO John Kiernan, Live at Nasdaq","In This Article:
IPO Edge hosted a fireside chat on May 20 at Nasdaq MarketSite with John Kiernan, President and Chief Executive Officer of Alico, Inc. (Nasdaq: ALCO). The in-person interview was joined by Editor-at-Large Jarrett Banks and they discussed the company’s strategic transformation to…",2025-05-22,,
59450e25-2503-4b96-adf8-4d6429e5f170,IBM,$1000 Invested In IBM 5 Years Ago Would Be Worth This Much Today,"IBM (NYSE:IBM) has outperformed the market over the past 5 years by 3.02% on an annualized basis producing an average annual return of 17.31%. Currently, IBM has a market capitalization of $240.71 billion. 
Buying $1000 In IBM: If an ...
Full story available on Benzinga.com",2025-05-22,,
2b8b9aa4-5b5b-4ade-87e8-23ce6f2bc583,IBM,Was Jim Cramer Right About Accenture plc (ACN)?,"In This Article:
We recently published a list of Was Jim Cramer Right About These 12 Stocks? In this article, we are going to take a look at where Accenture plc (NYSE:ACN) stands against other stocks that Jim Cramer discusses.
Back in 2024, on May 16, a caller on the Mad Money show asked about…",2025-05-22,,
82db0fb9-07a4-4b54-8f70-ccbbb6f1981b,IBM,Trump's $6 Trillion Investment Deals Face Reality Check: Only A Fraction May Reach The Real Economy,"In This Article:
Benzinga and Yahoo Finance LLC may earn commission or revenue on some items through the links below.
President Donald Trump has touted multi-trillion-dollar investment commitments as proof that his economic strategy is delivering a historic revival of American manufacturing and…",2025-05-22,,
2b8127da-83a4-4c4e-837e-8d22ae310b45,IBM,IONQ Stock Surges on Strategic Quantum Acquisitions,"In This Article:
Quantum computing pioneer IonQ (IONQ) is actively pursuing an ambitious acquisition strategy in the quantum networking space, and early indications suggest it may be paying off. While the company reported relatively flat revenue growth in Q1, posting $7.6 million earlier this…",2025-05-22,,
64dd501b-73e6-4fda-870d-bb6057169f63,IBM,Telegram’s CEO launched multiple dominant social networks before hitting 40 and has fathered more than 100 biological children. He’s facing up to 10 years in prison,"Telegram just announced its first annual profit, raking in $540 million in 2024. Revenues also hit $1.4 billion, up from $343 million a year ago. The company is fully owned by Pavel Durov, the 40-year-old billionaire wunderkind who’s often been called the Mark Zuckerberg of Russia, and who also…",2025-05-22,,
829dc6b8-1445-403a-b3ac-923ebc46c605,IBM,IBM Rides the AI Wave to New Highs. Wall Street Is Having Second Thoughts,,2025-05-22,,
e4c405c9-cef4-4f3a-b31d-63bb4544ef70,IBM,Mercantilism In America: The Trouble With Self-Sufficiency,"By Kevin Duffy, Mises Wire | May 20, 2025
“China has been ripping us off for years, taking advantage of our open markets while they close theirs. They’re not playing fair, and it’s costing us billions.”—Donald Trump, Pennsylvania campaign rally, June 28, 2016
Donald Trump’s economic…",2025-05-22,,
bf01d6be-fe4b-4312-b0e8-11759b0803fd,IBM,Brian Brushwood: Why We Fall for Scams,"""You don't get conned because you're stupid—you get conned because you're human."" 
That's the message of this week's guest, Brian Brushwood. He's an Austin-based magician, podcaster, and professional skeptic. With shows like Scam Nation and The Modern Rogue, he's taught millions of us how to…",2025-05-21,,
