Post_ID,Ticker,Title,Post_Date,Upvotes,Num_Comments
1kkvh80_META,META,"Made $191K Trading Options on SPY, QQQ, AAPL, and META – Finally Found My Rhythm",2025-05-12,433,194
1hicdom_META,META,Why not just buy Goldman Sachs at 16x earnings? JP Morgan at 12x? GOOGL at 25x META at 28x? LVMH at 22x? AMEX at 21x?,2024-12-20,201,166
1cfbrae_META,META,Congressman McCaul's buys META before pushing for his TikTok Ban bill.,2024-04-28,1309,130
1ccczui_META,META,Now META earnings Surprised above expectations … and the selloff begins with 15% down post market!,2024-04-24,166,108
yl42yj_META,META,"Apple is now valued at Amazon, Alphabet, and Meta — combined",2022-11-03,403,137
