Post_ID,Ticker,Title,Body,Post_Date,Upvotes,Num_Comments
fb0cab61-2790-4f17-9ae2-1f29073508b4,MMM,Major Exercise Alert: John P. Banovetz Exercises Options Worth $139K At 3M,"A significant insider transaction involving the exercise of company stock options was reported on May 27, by John P. Banovetz, Executive Vice President at 3M MMM, as per the latest SEC filing.
What Happened: The latest Form 4 filing on Tuesday with the U.S. Securities and Exchange Commission…",2025-05-27,,
c5d7432b-cfc8-422a-9353-247dac884819,MMM,Brian Brushwood: Why We Fall for Scams,"""You don't get conned because you're stupid—you get conned because you're human."" 
That's the message of this week's guest, Brian Brushwood. He's an Austin-based magician, podcaster, and professional skeptic. With shows like Scam Nation and The Modern Rogue, he's taught millions of us how to…",2025-05-21,,
3f68cbfe-5fef-4d5b-8a57-a7286e3b6a27,MMM,"Disney, Stifel Financial, Truist Financial And An Industrial Stock: CNBC's 'Final Trades'","On CNBC's “Halftime Report Final Trades,” Joshua Brown, CEO of Ritholtz Wealth Management, said 3M Company (NYSE:MMM) looks “incredible.”
Supporting his view, JP Morgan analyst Stephen Tusa maintained 3M with an Overweight rating on May 16 and raised the price target from $140 to $167.
Brian…",2025-05-21,,
