Post_ID,Ticker,Title,Post_Date,Upvotes,Num_Comments
5ny5uh_IBM,IBM,Next week's earnings: $NFLX $GS $UNH $C $MS $GE $IBM $CMA $OZRK $USB,2017-01-14,227,62
8c7hp6_IBM,IBM,Some implied moves for the degenerate gamblers playing any earnings next week : $NFLX 9.9% $GS 3.4% $IBM 4.0% $MLNX 9.2% (mthly) $ISRG 5% $MS 3.9% $AXP 4% $AA 5.9% $GE 6.2% $JNJ 2.7% $ABT 3.7% $PIR 16.3% (mthly) $BX 3.1% $BAC 3.8%,2018-04-14,54,36
239npr_IBM,IBM,"Early movers: MS, GE, PEP, GOOG, IBM, WB & more",2014-04-17,3,2
2x8c1l_CRM,CRM,"2/26/15 Early Thursday Movers: SHLD, KSS, CRM, LB, MS, AXP, DNKN, GMCR, WDAY & more",2015-02-26,4,1
2x8c1l_WDAY,WDAY,"2/26/15 Early Thursday Movers: SHLD, KSS, CRM, LB, MS, AXP, DNKN, GMCR, WDAY & more",2015-02-26,3,1
1hmbhvp_PATH,PATH,$CNTM - First-in-class MS Drug That Could Reverse Disease Progress (DD Inside),2024-12-25,5,12
oia1x1_JPM,JPM,"Historical Post Earnings Moves MEGA Compilation (Q2 Week 1) - $JPM, $GS, $WFC, $BAC, $MS, $TSM, and More",2021-07-11,129,38
tz9g1_JPM,JPM,"MS, JPM and Goldman all secretly cut Facebook's revenue forecast in the middle of the IPO roadshow",2012-05-22,46,32
cfkwe1_JPM,JPM,"GS, MS, JPM Traders Hit By Worst First Half in Decade",2019-07-20,13,2
4xddmu_JPM,JPM,"Big Wall Street banks, including Goldman Sachs (NYSE:GS), Morgan Stanley (NYSE:MS) and JPMorgan Chase (NYSE:JPM), have asked the Federal Reserve to grant them an additional five-year grace period to comply with the Volcker rule, sources told Reuters.",2016-08-12,534,56
f1c3o8_JPM,JPM,"Does anyone here have access to institutional research (GS, JPM, MS, DB, etc)?",2020-02-09,0,6
78w23r_JPM,JPM,JPM vs MS,2017-10-26,3,4
qucrs_JPM,JPM,"After Bank Stress Tests: Dividend & Buyback Predictions… A Double? (JPM, WFC, BK, STT, BAC, C, GS, MS)


",2012-03-13,3,1
1ijiizb_JPM,JPM,"How do you feel about big banks like JPM, MS, GS?",2025-02-07,20,23
1jwwdgw_JPM,JPM,JPM - MS - WFC - BLK all post solid earnings.  Some double-digits.  CPI/PPI both good.,2025-04-11,0,11
ypdlle_JPM,JPM,"Best banking stock? JPM, BAC, MS, etc?",2022-11-08,12,35
8u0clj_JPM,JPM,"Favorite Banking stock to buy and hold right now? (GS, JPM, BAC, MS etc.)",2018-06-26,2,15
1ijchtf_JPM,JPM,What's Driving Bank Stocks to Skyrocket? Even WFC Is Up Over 45% Since I Sold! (MS WFC C Société Générale),2025-02-06,10,25
i2d7yz_JPM,JPM,"Unusual Options Activity in HSBC, WORK, RCII, VXX with uptick in activity in JPM/MS",2020-08-02,322,87
oia3ig_JPM,JPM,"Historical Post Earnings Moves MEGA Compilation (Q2 Week 1) - $JPM, $GS, $WFC, $BAC, $MS, $TSM, and More",2021-07-11,56,21
q678pa_JPM,JPM,"Historical Post Earnings Moves MEGA Compilation and Analysis (Q3 Week 1) - $JPM, $WFC, $BAC, $C, $GS, $MS, $TSM, and More",2021-10-11,11,0
107s3zt_JPM,JPM,Getting access to systematic strategy research (JPM/MS/SocGen/..),2023-01-09,10,5
1gvg4u5_JPM,JPM,"Where and How to Access Reports from MS, JPM,GS, BofA and Others?",2024-11-20,7,6
oia1x1_BAC,BAC,"Historical Post Earnings Moves MEGA Compilation (Q2 Week 1) - $JPM, $GS, $WFC, $BAC, $MS, $TSM, and More",2021-07-11,131,38
8c7hp6_BAC,BAC,Some implied moves for the degenerate gamblers playing any earnings next week : $NFLX 9.9% $GS 3.4% $IBM 4.0% $MLNX 9.2% (mthly) $ISRG 5% $MS 3.9% $AXP 4% $AA 5.9% $GE 6.2% $JNJ 2.7% $ABT 3.7% $PIR 16.3% (mthly) $BX 3.1% $BAC 3.8%,2018-04-14,54,36
qucrs_BAC,BAC,"After Bank Stress Tests: Dividend & Buyback Predictions… A Double? (JPM, WFC, BK, STT, BAC, C, GS, MS)


",2012-03-13,2,1
ypdlle_BAC,BAC,"Best banking stock? JPM, BAC, MS, etc?",2022-11-08,10,35
8u0clj_BAC,BAC,"Favorite Banking stock to buy and hold right now? (GS, JPM, BAC, MS etc.)",2018-06-26,2,15
v9yq5_BAC,BAC,"BAC +5%, MS+3%, GS +3% banks on the move this morning",2012-06-19,9,11
qm8ps_BAC,BAC,"Financial sector leading today. C, BAC, MS all +3%",2012-03-07,1,1
oia3ig_BAC,BAC,"Historical Post Earnings Moves MEGA Compilation (Q2 Week 1) - $JPM, $GS, $WFC, $BAC, $MS, $TSM, and More",2021-07-11,51,21
q678pa_BAC,BAC,"Historical Post Earnings Moves MEGA Compilation and Analysis (Q3 Week 1) - $JPM, $WFC, $BAC, $C, $GS, $MS, $TSM, and More",2021-10-11,13,0
107s3zt_BAC,BAC,Getting access to systematic strategy research (JPM/MS/SocGen/..),2023-01-09,12,5
1ijchtf_C,C,What's Driving Bank Stocks to Skyrocket? Even WFC Is Up Over 45% Since I Sold! (MS WFC C Société Générale),2025-02-06,8,25
q678pa_C,C,"Historical Post Earnings Moves MEGA Compilation and Analysis (Q3 Week 1) - $JPM, $WFC, $BAC, $C, $GS, $MS, $TSM, and More",2021-10-11,11,0
vu8y7g_GS,GS,"Market impact of Abe assassination, thoughts from GS, MS, and ME. My view: Liberal Democratic Party gains support in 10 Jul elections and moves ahead with Abenomics/hawkish foreign policy. Upside potential for nuclear power industry and Japanese defense contractors.",2022-07-08,204,30
5ny5uh_GS,GS,Next week's earnings: $NFLX $GS $UNH $C $MS $GE $IBM $CMA $OZRK $USB,2017-01-14,230,62
oia1x1_GS,GS,"Historical Post Earnings Moves MEGA Compilation (Q2 Week 1) - $JPM, $GS, $WFC, $BAC, $MS, $TSM, and More",2021-07-11,132,38
cfkwe1_GS,GS,"GS, MS, JPM Traders Hit By Worst First Half in Decade",2019-07-20,12,2
4xddmu_GS,GS,"Big Wall Street banks, including Goldman Sachs (NYSE:GS), Morgan Stanley (NYSE:MS) and JPMorgan Chase (NYSE:JPM), have asked the Federal Reserve to grant them an additional five-year grace period to comply with the Volcker rule, sources told Reuters.",2016-08-12,527,56
c8i6fn_GS,GS,"What Do You Think Analysts and Bankers at GS, MS, JPMC Read to Gain Insight into the Economy and Markets?",2019-07-03,8,10
f1c3o8_GS,GS,"Does anyone here have access to institutional research (GS, JPM, MS, DB, etc)?",2020-02-09,0,6
ii462_GS,GS,"Best IPO of the summer? SZYM Solazyme initiated with Buy/Outperm by Lazard, MS, GS, PC, Jeffries",2011-07-06,0,3
qucrs_GS,GS,"After Bank Stress Tests: Dividend & Buyback Predictions… A Double? (JPM, WFC, BK, STT, BAC, C, GS, MS)


",2012-03-13,2,1
95qr3_GS,GS,"As Goldman Sachs Downgrades Morgan Stanley, Downgrades Itself (GS, MS) ",2009-07-29,1,0
1ijiizb_GS,GS,"How do you feel about big banks like JPM, MS, GS?",2025-02-07,21,23
f0bwfu_GS,GS,"Can anyone explain why stock prices for major banks like GS, MS, C, etc. suffered a HUGE drop back in 07-08 from its ATH?",2020-02-07,1,25
8u0clj_GS,GS,"Favorite Banking stock to buy and hold right now? (GS, JPM, BAC, MS etc.)",2018-06-26,2,15
epy4bd_GS,GS,How is JPM different from GS and MS?,2020-01-17,1,1
v9yq5_GS,GS,"BAC +5%, MS+3%, GS +3% banks on the move this morning",2012-06-19,10,11
5skort_GS,GS,"Anyone have access to power and utilities sell side research (GS, MS, DB, etc.)?",2017-02-07,4,2
oia3ig_GS,GS,"Historical Post Earnings Moves MEGA Compilation (Q2 Week 1) - $JPM, $GS, $WFC, $BAC, $MS, $TSM, and More",2021-07-11,54,21
q678pa_GS,GS,"Historical Post Earnings Moves MEGA Compilation and Analysis (Q3 Week 1) - $JPM, $WFC, $BAC, $C, $GS, $MS, $TSM, and More",2021-10-11,12,0
1gvg4u5_GS,GS,"Where and How to Access Reports from MS, JPM,GS, BofA and Others?",2024-11-20,6,6
1anrygu_MS,MS,Apple is relaunching iWork to compete with MS Office,2024-02-10,1224,294
l67bf8_MS,MS,"Thank you all, my wife was diagnosed with MS recently and my bank account had -$1,400 in it.",2021-01-27,6929,256
fheqjy_MS,MS,"50k in puts on 2/24 = Bear Gains - I tried to bring you with me. PUTS - CAR, HLT, MAR, LYFT, MS",2020-03-12,2157,251
123kegl_MS,MS,Stocks falling 'imminent' as investors realize earnings guidance looks unrealistic - MS By Investing.com,2023-03-27,354,55
mf5m2b_MS,MS,Goldman & MS Block Trades: What Really Happened Friday?,2021-03-28,461,80
11db73e_MS,MS,S&P 500 rally is a bull trap; bear market will resume in March - MS By Investing.com,2023-02-27,186,75
9yv5vr_MS,MS,Tech Stocks presented by Ms. Heather Locklear,2018-11-20,563,33
vu8y7g_MS,MS,"Market impact of Abe assassination, thoughts from GS, MS, and ME. My view: Liberal Democratic Party gains support in 10 Jul elections and moves ahead with Abenomics/hawkish foreign policy. Upside potential for nuclear power industry and Japanese defense contractors.",2022-07-08,203,30
s7jskn_MS,MS,MS,2022-01-19,245,31
tuax2i_MS,MS,Ms. Acras!,2022-04-02,367,13
5ny5uh_MS,MS,Next week's earnings: $NFLX $GS $UNH $C $MS $GE $IBM $CMA $OZRK $USB,2017-01-14,230,62
qof941_MS,MS,The three Ms you’ll want by Monday,2021-11-07,54,47
w3m5ol_MS,MS,"The bear market is far from over as recession risks rise, says Morgan Stanley (MS). Given the recent bounce in stocks, do you think the bear market is over?",2022-07-20,99,32
oia1x1_MS,MS,"Historical Post Earnings Moves MEGA Compilation (Q2 Week 1) - $JPM, $GS, $WFC, $BAC, $MS, $TSM, and More",2021-07-11,131,38
11jz7j7_MS,MS,"S&P 500 could rally to 4,150 if dollar and rates continue to fall - MS By Investing.com",2023-03-06,17,21
ejfknr_MS,MS,TESLA to unveil new prototype model MS,2020-01-03,184,29
sni2we_MS,MS,"Cramer said buy GM, MS downgrades em, load up on puts?",2022-02-08,39,26
16lv9a5_MS,MS,FSD Pharma announces Interim Results from First-in-Human Clinical Trial of Lucid-MS (Lucid-21-302) for Multiple Sclerosis,2023-09-18,5,7
g5vfsv_MS,MS,Technical MS paint analysis,2020-04-22,54,33
vn02bk_MS,MS,RIP MS-DIS-JNJ-SBUX - Jim Cramer picks 4 ‘buyable’ stocks to snap up after ugly market days,2022-06-28,17,16
y5heex_MS,MS,So much for MS big govt AR contract...,2022-10-16,6,14
11g3045_MS,MS,Update to my technical analysis I posted here on 2/10 (Created in MS Paint this time),2023-03-02,6,9
wk4zh6_MS,MS,$TWTR's Complaint Against Musk Contains Hints that $MS May Not Be Willing to Provide the Debt Necessary to Close the Deal. Under Musk's deal if Morgan Stanley walks he's not required to fund X Holdings I. Will the court risk this eventuality? PUTS ON TWITTER?,2022-08-09,14,12
8c7hp6_MS,MS,Some implied moves for the degenerate gamblers playing any earnings next week : $NFLX 9.9% $GS 3.4% $IBM 4.0% $MLNX 9.2% (mthly) $ISRG 5% $MS 3.9% $AXP 4% $AA 5.9% $GE 6.2% $JNJ 2.7% $ABT 3.7% $PIR 16.3% (mthly) $BX 3.1% $BAC 3.8%,2018-04-14,51,36
xjn41y_MS,MS,"Network 1 Financial Securities Inc. has underwritten six US microcap IPOs this year that surged by an average 2,190% on their first day of trading (ATGX was one of them). That’s more than 250x the performance of offerings underwritten by GS, JPM and MS.",2022-09-20,27,8
ym671k_MS,MS,Regard-level MS Paint skills on full display. Looking at SPXU or SPY Puts for a June expiration because JPow will do it again. Thoughts?,2022-11-04,5,5
s0yifg_MS,MS,TSLA: PT 1300 from MS sir Adam !,2022-01-10,22,8
ybvxbk_MS,MS,$MS Daily looks very clean...,2022-10-23,0,2
gas3xb_MS,MS,Thursday Unemployment Previous Pumps in One detailed MS Paint Analysis!,2020-04-30,43,15
8un57y_MS,MS,RIP $GS AND $MS,2018-06-28,17,22
epcya8_MS,MS,Who's shooting the moon with $MS calls with earnings tomorrow?,2020-01-16,7,15
8nltdp_MS,MS,I mean technically MS wasn't wrong,2018-05-31,97,11
ep3hsc_MS,MS,Opinion on $MS?,2020-01-15,4,12
669p1g_MS,MS,$MS Beats,2017-04-19,17,17
5jjynv_MS,MS,"MS Energy AM: Arctic Drilling Ban, Saudi Fuel Price Increase, ENLK Sales, Energy Trading Flow, Cyclical Trade, API Data",2016-12-21,7,19
a301th_MS,MS,Microsoft is building a Chromium-powered web browser that will replace Edge on Windows 10 (short MS!!!),2018-12-04,6,13
7ue2yi_MS,MS,MS following FB's lead after earning's call,2018-01-31,6,13
52xe6t_MS,MS,Give me one reason why i shouldnt sell ms t x now and buy back in next week at between .48-52,2016-09-15,1,17
l6afk0_MS,MS,Just made back every dollar I ever spent on overpriced tickets and M&Ms....,2021-01-27,7,1
3n5f5r_MS,MS,guy on CNBC just suggested MS might buy AMD,2015-10-01,6,18
95axtd_MS,MS,MS Tesla Update,2018-08-07,26,8
8zuhht_MS,MS,"MS Q2 EPS $1.30, consensus $1.11, revenue $10.6B, consensus $10.1B",2018-07-18,11,9
929tfy_MS,MS,$BAC $CS $GS $MS trend exhaustion -> Sell,2018-07-27,0,10
agjvot_MS,MS,"MS-13 at it again: ""No rebound for MU at any point in 2019""",2019-01-16,20,5
7sxjud_MS,MS,Can somebody MS Paint this photo and post it to r/roastme,2018-01-25,20,8
5jmtvn_MS,MS,"After making the biggest investment mistake of my life, my goal was to get back to pre-ms.tx levels by the end of the year. Today, that happened",2016-12-21,10,11
tz9g1_MS,MS,"MS, JPM and Goldman all secretly cut Facebook's revenue forecast in the middle of the IPO roadshow",2012-05-22,43,32
cfkwe1_MS,MS,"GS, MS, JPM Traders Hit By Worst First Half in Decade",2019-07-20,15,2
25q5st_MS,MS,Questions about getting an MS in Finance after an unrelated degree,2014-05-16,1,11
16mxjs_MS,MS,"Corporate Canada still a ‘struggle’ for women: Sherry Cooper - The Globe and Mail - “If the world had been full of female traders instead of male traders” the meltdown would have been avoided, said Ms. Cooper, one of only two women to be named chief economist of one of Canada’s big banks.",2013-01-15,0,9
1planu_MS,MS,Should I enroll in a MS Finance program?,2013-10-31,0,7
31xh2c_MS,MS,Anyone have any experience with MS in Data Science or Analytics degrees?,2015-04-08,1,1
16iu3g_MS,MS,A former analyst for MS M&A / KKR takes the time to answer questions about PE,2013-01-14,2,0
wbx1gp_MS,MS,SoFi Head of Investment Strategy Ms. Liz Young commented for the rest of the year.,2022-07-30,71,79
4xddmu_MS,MS,"Big Wall Street banks, including Goldman Sachs (NYSE:GS), Morgan Stanley (NYSE:MS) and JPMorgan Chase (NYSE:JPM), have asked the Federal Reserve to grant them an additional five-year grace period to comply with the Volcker rule, sources told Reuters.",2016-08-12,527,56
1dpr50j_MS,MS,FSD Pharma Receives Ethics Committee Approval for a Phase-1 Multiple Ascending Doses Clinical Trial for Lucid-21-302 (Lucid-MS) in Australia $HUGE ,2024-06-27,2,1
1cpr1ho_MS,MS,Question on MS funds comparison chart,2024-05-11,3,0
77srus_MS,MS,A Stock Market Panic Like 1987 Could Happen Again https://nyti.ms/2kZ5e2N,2017-10-21,6,22
c8i6fn_MS,MS,"What Do You Think Analysts and Bankers at GS, MS, JPMC Read to Gain Insight into the Economy and Markets?",2019-07-03,8,10
43aall_MS,MS,"Shiller PE is much higher than average, but why are these long-term holds (AAPL, F, MU, MS) trading < 10 PE?",2016-01-29,9,18
f1c3o8_MS,MS,"Does anyone here have access to institutional research (GS, JPM, MS, DB, etc)?",2020-02-09,1,6
f1gdl4_MS,MS,Biogen Soars on Patent Win for MS Drug Tecfidera Over Mylan,2020-02-09,21,3
1wrq4j_MS,MS,BS from Berkeley? or BS+MS from Cal Poly Slo?,2014-02-02,0,21
uefu7_MS,MS,"Gorman from Morgan Stanley mentions Facebook is ""10% off of the lows"" on CNBC multiple times. Anyone think MS was behind all the buying this afternoon?",2012-05-31,12,21
agxu96_MS,MS,Morgan Stanley (MS) Earnings Breakdown,2019-01-17,16,1
2zkpa2_MS,MS,How exactly is MS supposed to be making money?,2015-03-19,0,11
78w23r_MS,MS,JPM vs MS,2017-10-26,3,4
70er73_MS,MS,Need Equity Research Career Advice: MS vs BAML,2017-09-16,2,2
5fo14m_MS,MS,"Investor(s); Thoughts to Ponder when working with the next FB, MS, APPLE, SpaceX (BIG IDEA).",2016-11-30,1,3
3drx0m_MS,MS,Anyone playing Morgan Stanley (MS) earnings?,2015-07-18,9,2
3pmwz1_MS,MS,Morgan Stanley (MS) just slammed Twitter (TWTR),2015-10-21,2,0
ii462_MS,MS,"Best IPO of the summer? SZYM Solazyme initiated with Buy/Outperm by Lazard, MS, GS, PC, Jeffries",2011-07-06,0,3
qucrs_MS,MS,"After Bank Stress Tests: Dividend & Buyback Predictions… A Double? (JPM, WFC, BK, STT, BAC, C, GS, MS)


",2012-03-13,3,1
95qr3_MS,MS,"As Goldman Sachs Downgrades Morgan Stanley, Downgrades Itself (GS, MS) ",2009-07-29,1,0
1ijiizb_MS,MS,"How do you feel about big banks like JPM, MS, GS?",2025-02-07,19,23
1inszh6_MS,MS,MS and Nvidia stocks,2025-02-12,0,20
1jwwdgw_MS,MS,JPM - MS - WFC - BLK all post solid earnings.  Some double-digits.  CPI/PPI both good.,2025-04-11,0,11
ypdlle_MS,MS,"Best banking stock? JPM, BAC, MS, etc?",2022-11-08,13,35
188f2l8_MS,MS,Alibaba dips on MS downgrade as PDD grabs spot of most valuable Chinese e-commerce firm,2023-12-01,8,5
f9ky5e_MS,MS,"Not sure if this has hit MS news yet, apologies if so but tomorrow might be nasty too...",2020-02-26,9,26
tba4e3_MS,MS,Morgan Stanley (MS) or BlackRock (BLK)?,2022-03-10,4,10
f0bwfu_MS,MS,"Can anyone explain why stock prices for major banks like GS, MS, C, etc. suffered a HUGE drop back in 07-08 from its ATH?",2020-02-07,3,25
liqflq_MS,MS,I'm thinking about a covered short or pit options in morgan Stanley (MS) for about a month.,2021-02-13,4,11
8u0clj_MS,MS,"Favorite Banking stock to buy and hold right now? (GS, JPM, BAC, MS etc.)",2018-06-26,2,15
f1gijy_MS,MS,Biogen Soars on Patent Win for MS Drug Tecfidera Over Mylan,2020-02-09,1,2
b456da_MS,MS,"Will Brexit have effect on big IT companies, noted on US stock markets like SAP, MS etc?",2019-03-22,3,3
epy4bd_MS,MS,How is JPM different from GS and MS?,2020-01-17,1,1
7sh057_MS,MS,Apple/Amazon/Google/MS going into earnings announcements - anticipating an increase in SP?,2018-01-23,5,6
7gguir_MS,MS,MS raises target for $MU from $39 to $55,2017-11-29,17,5
584gqd_MS,MS,Earnings Play $MS OR $EBAY?,2016-10-18,4,4
50njll_MS,MS,MS,2016-09-01,1,4
5q6uwi_MS,MS,Morgan Stanley ($MS),2017-01-25,0,1
ihq4u_MS,MS,MS (Morgan Stanley) reports possible breach of data. Analysts say this $23 stock should be average of $29.50,2011-07-06,2,0
w3m50p_MS,MS,"The bear market is far from over as recession risks rise, says Morgan Stanley (MS). Given the recent bounce in stocks and crypto, do you think the bear market is over?",2022-07-20,781,235
sslj4v_MS,MS,"Cathie Wood’s ARK Stays the Course, Betting Big on Innovation. ARK Investment Management is snapping up more shares of largely unprofitable companies. Past two weeks, Ms. Wood’s flagship ARK Innovation ARKK exchange-traded fund has bought more than $400 million of high-growth stocks,",2022-02-14,357,72
1ijchtf_MS,MS,What's Driving Bank Stocks to Skyrocket? Even WFC Is Up Over 45% Since I Sold! (MS WFC C Société Générale),2025-02-06,9,25
zw3zhd_MS,MS,DD: $TGTX TG Therapeutics FDA Decision 12/28/2022 on Relapsing MS Drug Briumvi: Stock will move either way hugely,2022-12-27,21,33
1181t17_MS,MS,FSD Pharma Presenting Two Scientific Posters on Preclinical Toxicology and Efficacy Data of Lucid-21-302 (Lucid-MS) at Americas Committee for Treatment and Research in Multiple Sclerosis (ACTRIMS) 2023 Forum,2023-02-21,1,1
zj72z1_MS,MS,MS Key Data Watch Calendar for the Week Ahead,2022-12-11,6,1
tuayn4_MS,MS,Ms. Acras!,2022-04-02,0,1
mroy3d_MS,MS,"Have you sir-Ms heard of ebang You might be thinking why is this stock tanking the real reason is make this going down Asian hate, and we’re getting shorted These fake bears wants to fill orders below 4$ so they can try to hop on the ipo ride to get a massive amount of shares.",2021-04-15,0,7
hfn6zf_MS,MS,"Are any of CSCO, BMY, MS a buy?",2020-06-25,0,5
m2qz3d_MS,MS,"Mullen Technologies Announces Purchase of Advanced Engineering and Manufacturing Center in Tunica, MS. NASDAQ: $NETE",2021-03-11,1,0
v9yq5_MS,MS,"BAC +5%, MS+3%, GS +3% banks on the move this morning",2012-06-19,7,11
8cpmn8_MS,MS,"Options Action Trade for April 16th, 2018 - Morgan Stanley (MS)",2018-04-16,5,1
36rtu2_MS,MS,Morgan is long AAPL: MS explains why AAPL could rise 50%,2015-05-21,0,7
1vg2nh_MS,MS,"1/17/14 Stocks to Watch: GE, MS, AXP, INTC, COF, UPS & more...",2014-01-17,12,3
2t1ryu_MS,MS,"1/20/15 Early Tuesday Movers: MS, JNJ, DAL, FB, JCP, HAL, T & more",2015-01-20,4,2
3ntzas_MS,MS,"10/7/15 Wednesday Movers: STZ, YUM, TWTR, ADBE, BIIB, MS, LULU, SBUX, NKE, ESRX, BUD, NOK, P & more",2015-10-07,1,1
2x8c1l_MS,MS,"2/26/15 Early Thursday Movers: SHLD, KSS, CRM, LB, MS, AXP, DNKN, GMCR, WDAY & more",2015-02-26,3,1
239npr_MS,MS,"Early movers: MS, GE, PEP, GOOG, IBM, WB & more",2014-04-17,4,2
2ay6pz_MS,MS,"7/17/14 - Stock to Watch Before The Bell: UNH, LVS, MAT, MS, AN, YUM & more...",2014-07-17,3,1
x394m_MS,MS,Any thoughts on Morgan Stanley (MS) stock with its recent crash towards a new low?,2012-07-24,4,2
qm8ps_MS,MS,"Financial sector leading today. C, BAC, MS all +3%",2012-03-07,1,1
q13yw_MS,MS,"MS, C, INTC, WMT putting the pressure on at the moment",2012-02-22,2,0
rjjvu_MS,MS,"MS -3.3% weakest of the banks today.
",2012-03-29,1,0
onagl_MS,MS,"MS comes in at -14c/share beating -58c/share EST, stock +5%",2012-01-19,1,0
eklj33_MS,MS,"MS 2020 Outlook - Thoughts, Themes, Ideas (Long and Short)",2020-01-06,59,12
h82b4n_MS,MS,Quadriga Insights - MS European Annual Hedge Fund Forum Barcelona 2020 - Diego Parrilla,2020-06-13,9,3
h0dcnh_MS,MS,MS - Gaming and Lodging Primer,2020-06-10,9,0
5ekzzz_MS,MS,"Warren Buffett’s Meeting with University of Maryland MBA/MS Students – November 18, 2016",2016-11-24,23,1
5skort_MS,MS,"Anyone have access to power and utilities sell side research (GS, MS, DB, etc.)?",2017-02-07,3,2
4go23u_MS,MS,MS - Fintech / Blockchain,2016-04-27,3,0
i2d7yz_MS,MS,"Unusual Options Activity in HSBC, WORK, RCII, VXX with uptick in activity in JPM/MS",2020-08-02,325,87
198grt0_MS,MS,MS going 📉,2024-01-16,0,0
oia3ig_MS,MS,"Historical Post Earnings Moves MEGA Compilation (Q2 Week 1) - $JPM, $GS, $WFC, $BAC, $MS, $TSM, and More",2021-07-11,55,21
os2l6a_MS,MS,MS- Call Spread Idea,2021-07-26,1,3
qsfcb3_MS,MS,Financing cash via MS Reversal,2021-11-12,1,1
q678pa_MS,MS,"Historical Post Earnings Moves MEGA Compilation and Analysis (Q3 Week 1) - $JPM, $WFC, $BAC, $C, $GS, $MS, $TSM, and More",2021-10-11,13,0
73ajfy_MS,MS,MS Earnings Time Spread?,2017-09-29,9,15
nonw6w_MS,MS,MS Options - Banks = $ Profit,2021-05-31,0,1
of7i6l_MS,MS,"A friendly reminder that chart patterns are sometimes just random noise. The following charts were made using a random number generator on MS Excel and I was able to find ""technical analysis"" in them. Doesn't mean TA doesn't work, it means understand that the outcomes of it are probability based.",2021-07-07,280,150
1hmbhvp_MS,MS,$CNTM - First-in-class MS Drug That Could Reverse Disease Progress (DD Inside),2024-12-25,3,12
giajmh_MS,MS,HSDT gets FDA for a device to help with MS disease,2020-05-12,4,4
hiz6qe_MS,MS,What is the redemption price of MS Structured Asset?,2020-06-30,2,0
1ff47mv_MS,MS,"I have a BS degree in Computer Science and 3+ years of experience as a ML engineer, do I really need a MS degree in quant finance or similar to start algorithmic trading and become profitable?",2024-09-12,0,23
107s3zt_MS,MS,Getting access to systematic strategy research (JPM/MS/SocGen/..),2023-01-09,11,5
ia1fud_MS,MS,University of Chicago's MS Financial Math or Georgia Tech's MS QCF?,2020-08-15,15,10
62q645_MS,MS,Thoughts on a MS in Computational Engineering and Science?,2017-04-01,6,4
1eaco8o_MS,MS,"MS preferred F series stock, why isnt it paying 9.44% ?",2024-07-23,0,5
14yq3ot_MS,MS,General Feeling on Morgan Stanley (MS) Stock,2023-07-13,5,4
ydr1x5_MS,MS,Opinions on VanEck MS DMDL VS SPDR Global Aristocrats,2022-10-26,3,2
1gvg4u5_MS,MS,"Where and How to Access Reports from MS, JPM,GS, BofA and Others?",2024-11-20,7,6
qxql12_MS,MS,"MS Equity Market Relative Valuation (as of Nov. 12, 2021)",2021-11-19,2,1
1jqtpwa_MS,MS,"Vaporized Cannabis Provides ""Significant Improvements"" for MS Patients",2025-04-03,72,7
9jpa15_MS,MS,"Spasticity Scales May Not Be Sufficiently Informative of Sativex Benefits in MS Patients, Small Study Suggests",2018-09-28,0,0
