Post_ID,Ticker,Title,Post_Date,Upvotes,Num_Comments
1kvy304_NET,NET,$MSW has $92M BTC at a $60M market cap with positive Net Income and earnings coming,2025-05-26,25,33
1kgep5w_NET,NET,Warren Buffett: Putting 75% Of Your Net Worth Into A ‘Lead-Pipe Cinch’,2025-05-06,472,160
1k95m98_NET,NET,Dead Cat Bounce or Shift in Sentiment? SPY Net Options Sentiment Looking Bullish,2025-04-27,185,146
1k4miyt_NET,NET,"29 y/o, $170k net worth, investing $5K/month, need some motivation",2025-04-21,1115,330
1hca86o_NET,NET,Elon Musk becomes the first person to reach a net worth of $400 billion,2024-12-12,6264,279
1h8z1w6_NET,NET,How much (%) of your net worth do you keep invested? ,2024-12-07,255,538
1gbg6ip_NET,NET,28M just hit $100k net worth but feeling way behind,2024-10-24,767,432
1f0bslt_NET,NET,"I made it to $100,000 net worth. What should I do now?",2024-08-24,678,473
1ef9dp3_NET,NET,"Tilray Brands Reports Record Financial Results, Achieves 26% Net Revenue Growth | Tilray",2024-07-29,214,122
1ecqcbb_NET,NET,Net worth explosion after 100k,2024-07-26,829,360
1di63zy_NET,NET,"AAPL has grown their market cap by $800 billion in the past 60 days. Is the market expecting ""AI"" to grow their net income by an additional $40B a year moving forward?",2024-06-17,337,183
ryd15u_NET,NET,The tax guy at H&R Block when I show up with 40 binders of paperwork because I ran a set of servers with 40 simultaneous scalping algos to execute 45.4 million trades in a year for a net profit of $100.27,2022-01-07,2769,163
n3azop_NET,NET,The hard truth: If you don't have at least 10% of your net worth in crypto you aren't really bullish and crypto won't change your life.,2021-05-02,357,221
leq2kt_NET,NET,A new milestone! 100k net worth,2021-02-07,1561,262
bkn65j_NET,NET,"Warren Buffett: If a bank needs a government bailout, the CEO and spouse should lose 'net worth'",2019-05-04,3782,341
