Post_ID,Ticker,Title,Body,Post_Date,Upvotes,Num_Comments
1km3kmw_OXY,OXY,Buffett's $OXY: What's the simple value logic?,"Hello fellow r/valueinvesting members,


I'm seeking your expertise for feedback on the following analysis. I don't necessarily intend to purchase the stock, but I'm trying to understand the rationale behind Berkshire Hathaway's decision to invest in it. It's become a bit of an obsession for me.


I am aware of their preferred stock holdings, but this analysis focuses on their investment in common stock.


While a common explanation is, ""We like OXY position in the Permian Basin"", as a value investor, I find this explanation too simplistic. Buffett and Munger are not known for speculation; they favor solid investments supported by clear financial metrics.


Therefore, there must be a deeper reason for this investment, and I suspect the answer is simpler than we might imagine.


The first red flag is that oil is a commodity, and oil companies' earnings are heavily dependent on oil prices, which are inherently speculative. This doesn't seem like a typical Buffett investment.


Now, for the analysis, I've attempted to keep the approach as straightforward as possible. The simplest logic I've arrived at is as follows:


Firstly, it's prudent not to assume that oil companies will possess more oil than their proven net reserves; assuming otherwise would be speculative.


Occidental Petroleum (OXY) acquired CrownRock for $12 billion. CrownRock's net proven reserves are 623 million barrels of oil equivalent. At the time of the acquisition, the oil price was approximately $70 per barrel. This would value CrownRock's reserves at roughly $43.61 billion (623 million barrels * $70/barrel), representing the gross expected future revenue. This implies a multiple of approximately 3.634 on the acquisition value ($43.61 billion / $12 billion).


As of today, OXY holds approximately 4.6 billion barrels of oil equivalent. During the period of Buffett's common stock acquisitions, the oil price was also around $70 per barrel. This would value OXY's total reserves at $322 billion (4.6 billion barrels * $70/barrel) in terms of gross expected future revenue. If we apply the same multiple used for the CrownRock acquisition (3.634), we arrive at a valuation for OXY of approximately $88.60 billion ($322 billion / 3.634).


During Buffett's acquisition period, OXY's market capitalization was around $60 billion. If this valuation method is sound, it could suggest that Buffett was acquiring the company with a margin of safety of roughly 32.3% (($88.60 billion - $60 billion) / $88.60 billion). And if this kind of valuation is right, based on OXY's current market capitalization of $43.6 billion, it would mean that today it has a margin of safety of approximately 50.8% (($88.60 billion - $43.6 billion) / $88.60 billion).


This is the simplest approach I've identified that aligns this investment with value investing principles, but I remain uncertain about its validity.


Other valuation methods are very challenging and unreliable. Predicting the Discounted Cash Flow (DCF) for oil companies is nearly impossible, as it's tantamount to predicting oil prices. Even when attempting a valuation based on historical figures, I haven't found clear evidence of undervaluation.


Two other possibilities come to mind:

 * They possess information that is not available to the general public.

 * They were primarily impressed by the company's management and placed less emphasis on strict valuation metrics. (I find this hypothesis difficult to accept).

 *  This video suggests Buffett's focus is on OXY's strong cash flow for buybacks and dividends, viewing it as a ""coupon clipping bet"" on existing assets rather than speculative drilling, similar to his Chevron investment and comparing it to US Treasuries for yield with limited risk.   However, I am not really convinced that what is being said is true and would like an opinion on the video: https://youtu.be/9tXj16MoQbQ?si=B1ScGMkSpnew6_gJ


What are your thoughts? Could you share your perspective or any knowledge on this subject? I would appreciate an objective reply or some supporting numbers.

",2025-05-14,55,71
1km3kmw_NET,NET,Buffett's $OXY: What's the simple value logic?,"Hello fellow r/valueinvesting members,


I'm seeking your expertise for feedback on the following analysis. I don't necessarily intend to purchase the stock, but I'm trying to understand the rationale behind Berkshire Hathaway's decision to invest in it. It's become a bit of an obsession for me.


I am aware of their preferred stock holdings, but this analysis focuses on their investment in common stock.


While a common explanation is, ""We like OXY position in the Permian Basin"", as a value investor, I find this explanation too simplistic. Buffett and Munger are not known for speculation; they favor solid investments supported by clear financial metrics.


Therefore, there must be a deeper reason for this investment, and I suspect the answer is simpler than we might imagine.


The first red flag is that oil is a commodity, and oil companies' earnings are heavily dependent on oil prices, which are inherently speculative. This doesn't seem like a typical Buffett investment.


Now, for the analysis, I've attempted to keep the approach as straightforward as possible. The simplest logic I've arrived at is as follows:


Firstly, it's prudent not to assume that oil companies will possess more oil than their proven net reserves; assuming otherwise would be speculative.


Occidental Petroleum (OXY) acquired CrownRock for $12 billion. CrownRock's net proven reserves are 623 million barrels of oil equivalent. At the time of the acquisition, the oil price was approximately $70 per barrel. This would value CrownRock's reserves at roughly $43.61 billion (623 million barrels * $70/barrel), representing the gross expected future revenue. This implies a multiple of approximately 3.634 on the acquisition value ($43.61 billion / $12 billion).


As of today, OXY holds approximately 4.6 billion barrels of oil equivalent. During the period of Buffett's common stock acquisitions, the oil price was also around $70 per barrel. This would value OXY's total reserves at $322 billion (4.6 billion barrels * $70/barrel) in terms of gross expected future revenue. If we apply the same multiple used for the CrownRock acquisition (3.634), we arrive at a valuation for OXY of approximately $88.60 billion ($322 billion / 3.634).


During Buffett's acquisition period, OXY's market capitalization was around $60 billion. If this valuation method is sound, it could suggest that Buffett was acquiring the company with a margin of safety of roughly 32.3% (($88.60 billion - $60 billion) / $88.60 billion). And if this kind of valuation is right, based on OXY's current market capitalization of $43.6 billion, it would mean that today it has a margin of safety of approximately 50.8% (($88.60 billion - $43.6 billion) / $88.60 billion).


This is the simplest approach I've identified that aligns this investment with value investing principles, but I remain uncertain about its validity.


Other valuation methods are very challenging and unreliable. Predicting the Discounted Cash Flow (DCF) for oil companies is nearly impossible, as it's tantamount to predicting oil prices. Even when attempting a valuation based on historical figures, I haven't found clear evidence of undervaluation.


Two other possibilities come to mind:

 * They possess information that is not available to the general public.

 * They were primarily impressed by the company's management and placed less emphasis on strict valuation metrics. (I find this hypothesis difficult to accept).

 *  This video suggests Buffett's focus is on OXY's strong cash flow for buybacks and dividends, viewing it as a ""coupon clipping bet"" on existing assets rather than speculative drilling, similar to his Chevron investment and comparing it to US Treasuries for yield with limited risk.   However, I am not really convinced that what is being said is true and would like an opinion on the video: https://youtu.be/9tXj16MoQbQ?si=B1ScGMkSpnew6_gJ


What are your thoughts? Could you share your perspective or any knowledge on this subject? I would appreciate an objective reply or some supporting numbers.

",2025-05-14,57,71
1kbj30c_OXY,OXY,"Sold 100 Shares OXY 39.55.  Sold June 6, $40 Put for $2.3.",,2025-04-30,14,18
1k6mxhg_OXY,OXY,Occidental Petroleum,"I’m looking into OXY as a potential value play. It’s trading below historical highs and Buffett’s still holding it, but with oil prices soft and geopolitical risks in play, I’m wondering, Do you think OXY’s current valuation reflects long-term upside, or are the risks too high?",2025-04-24,21,28
1k2x2pt_OXY,OXY,Why does Buffet love OXY so much?,"I've been trying to figure out why Buffet has such a hardon for OXY. Don't get the wrong impression. I'm not one of those dumbasses who believes clean energy is going to replace oil in the next ten years, and I know OXY has one of the best oil rich geographic areas in north America. But considering the OXY's carbon capture methods are nowhere near the price they want it to be yet per ton, why does Buffet seems to have such a conviction for it? I think he has almost 30% of the company now? And oil prices are cyclical as always with god knows what disaster might influence them tomorrow. What am I missing? Why does he love them so much?  ",2025-04-19,107,65
1jv8uv5_BAC,BAC,Why isn't everyone buying OXY?,"I have no position in OXY but im curious, everyone is always talking about how smart Warren Buffet is and Oxy has been one of his largest positions, in fact there's been rumors of him basically buying it.

Oxy is down 27% YTD.  -47% YOY.  -50% since May 2022 and today we are getting the same price from January 2022.

As Buffet often says, if he liked it at $55 he must LOVE it at $35 today?  

A couple of his other large positions:

BAC down 23% YTD & -11% YOY

AXP down 21% YTD

Curious why I don't see people jumping on these prices as we all love Buffet.  ",2025-04-09,0,34
1jv8uv5_OXY,OXY,Why isn't everyone buying OXY?,"I have no position in OXY but im curious, everyone is always talking about how smart Warren Buffet is and Oxy has been one of his largest positions, in fact there's been rumors of him basically buying it.

Oxy is down 27% YTD.  -47% YOY.  -50% since May 2022 and today we are getting the same price from January 2022.

As Buffet often says, if he liked it at $55 he must LOVE it at $35 today?  

A couple of his other large positions:

BAC down 23% YTD & -11% YOY

AXP down 21% YTD

Curious why I don't see people jumping on these prices as we all love Buffet.  ",2025-04-09,0,34
1jv8uv5_AXP,AXP,Why isn't everyone buying OXY?,"I have no position in OXY but im curious, everyone is always talking about how smart Warren Buffet is and Oxy has been one of his largest positions, in fact there's been rumors of him basically buying it.

Oxy is down 27% YTD.  -47% YOY.  -50% since May 2022 and today we are getting the same price from January 2022.

As Buffet often says, if he liked it at $55 he must LOVE it at $35 today?  

A couple of his other large positions:

BAC down 23% YTD & -11% YOY

AXP down 21% YTD

Curious why I don't see people jumping on these prices as we all love Buffet.  ",2025-04-09,0,34
1juoczb_OXY,OXY,Oxy stock future,"Guys the unexpected has happened, many of you here I have seen have held bag on oxy at 50 levels. The assumption was that crude oil prices would hover around 70 and then go higher up but today the wti crude oil futures crashed below 60 as u well know coz of the tariff fiasco of trump and expected recession. Now if u have read the investor report of oxy, the effect on free cash flow for 1 dollar decrease in oil barrel price is around 260 million so that would mean , given today's 59 futures price a 11 dollar decrease from the avg crude oil price of 70 for FY 2024-25 which gives us 11*26 = 2.86 million dollar less free cashflow and yes if they go to 50 dollar a barrel it's done. 2024-25 FCF was
4 billion, so that gives us 1 billion FCF for this year if oil futures hang around 58 and now that opec has started to increase their production along with a recession sentiment we can see worse times.

Now coming to the share price, people have touted that oxy is undervalued but I always thought it was fairly valued at 60 dollars a share which was the case when the company had 70 dollar a barrel cost. Now I actually didn't do much calculation and just bought shares of oxy at 38.9 dollars a share today which I saw go down 7 percent the same day and I sat and did the calculation. If oil goes back to 70 dollars we can see the stock back at 55 range. Now how much time will it take is the question , coz will trump trigger a recession which obviously we can't predict but surely for the near term the increased opec production has signalled worse prices for oil coz the Saudis can afford to have more barrels at lesser price as long as it is just a tad lower than their current income. The stock is now at 36 dollars a share, and assuming it takes 2 years time( a non conservative estimate) for oil to get back to 70's range or more as demand comes back high after a recession, oxy would be back to 60 giving us a return of 54 percent (over my buying price of 38.95). 

But there's a catch, oxy has a lot of debt which it said it intends on decreasing with assumptions of that constant 70 s oil barrel range thesis. Now those will be halted and complete dividend slashes will happen and that can be pretty bad as the outlook wouldn't be so good for oxy given that position. But again there's a catch ,it might very well be that this whole decrease in barrel price (which are just futures) doesnt hold up and oil increases to 65 dollars a barrel (that would mean we would do fantastic on the investment) if things change due to  trump holding back and assuming that we don't enter into a recession but we will have oversupply over the short term though with opec increasing production giving us depressed prices. 


So my overall judgement is that oxy right now is an okay bet at these prices, the risks are there But the reward seems to be juicy as well. What are ur thoughts on this folks ? I am just an Indian software guy working in Bangalore and I am pretty new to investing so my thesis can have a lot of holes in it and therefore would like you guys to comment on this.

Wbd on the other hand at 7.7 dollars looks good to buy on a side note as well.",2025-04-08,23,42
1ingr0r_OXY,OXY,Warren Buffett and Berkshire Hathaway bought $35.7 million dollars of OXY shares the last Friday - 1st SEC filing this year.,"[https://www.sec.gov/Archives/edgar/data/315090/000095017025018266/xslF345X05/ownership.xml](https://www.sec.gov/Archives/edgar/data/315090/000095017025018266/xslF345X05/ownership.xml)

Total of **763,017** shares of Occidental Petroleum (OXY) for **$35,724,074** in this filing.  In five SEC Form 4 filings for OXY in 2024, Warren Buffett purchased 20,462,610 shares of OXY for $1,089,852,797.  In ten SEC Form 4 filings for OXY in 2023, he bought 49,364,154 shares of OXY for $2,906,881,567.  (Source: Berkshire Hathaway SEC Form 4 filings for Occidental Petroleum.)",2025-02-12,96,39
1igr9vn_OXY,OXY,OXY a good opportunity,,2025-02-03,42,86
