Post_ID,Ticker,Title,Body,Post_Date,Upvotes,Num_Comments
1i9nm6c_OXY,OXY,The Very Last: Occidental Petroleum Investment Thesis,"Dear Redditors,

In this letter, I will explain why Warren Buffett invested in Occidental Petroleum and why I am too.

Let me start with how Warren Buffett has basically bought himself a risk-free bond yielding 10% with future growth potential that have very very long runways. And yes, oil prices matter... sort of…

**What happens when oil prices are high?**

Well, back in Q1 2023, OXY redeemed 6.47% of Berkshire Hathaway’s preferred shares after a record 2022 where worldwide oil prices averaged at $91.91 in Q1, $100.10 in Q2, $98.30 in Q3, and $94.36 in Q4 of 2022 (based on OXY's Q1 2023 10-Q).

The redemption was mandatory, due to a provision in the preferred stock where if (in the trailing 12 months) OXY spends more than $4.00 per share in either:(i) dividends paid to common shareholders and (ii) repurchases of the common stock, then the amount above $4.00 per share must be redeemed at a 10% premium.

At the time, the long-term federal funds rate (FFR) was reaching 5%. Given OXY’s credit ratings Baa3 by Moody’s and BB+ by S&P and Fitch, the interest on OXY’s debt would’ve been \~6% to 7%. Interest payments have tax benefits. Preferred shares do not. This is why Warren Buffett said ""this makes sense"" during his annual shareholder meeting.

So in the high oil prices scenario, depending on the FFR rate, preferred decreases, debt decreases, buybacks increase, earnings increase, and the stock price increases (perhaps some multiple expansion too, depending on how Mr. Market feels).

**What happens when oil prices are low?**

This is where things get interesting as Warren Buffett has found downside protection.

(1) OXY is one of the most efficient oil producers claiming production costs that break even at $40 worldwide oil price which puts a nice margin of safety on earnings. 

(2) The preferred shares are immortal. With lower capital amounts returned to shareholders, preferreds are unlikely to get redeemed. Even if we get Paul Volckered at some point, the tax benefit strategy redeeming preferreds over debt no longer works. 

(3) Low oil prices bring down the oil production of the United States and OXY contributes to about \~1 million barrels of oil equivalent per day (boepd). That's a noticible amount if it were to going missing, compared to smaller players. Overall, the US is in a very strong position to affect oil prices (geopolitics in part) and I highly doubt they US wants to cede energy price control back to OPEC. Moreover, the United State's lead in oil production is mutually beneficial as OPEC countries seek to diversify from oil driven economies. Oh, and the Saudi's tried to kill US shale, but failed. Turns out, at the end of the day, economies need their fiscal budgets to balance... except for the US who controls the dollar.

(4) US oil majors (perhaps all oil majors) are no longer interested in the boom and bust cycle that wreaks havoc on supply chains and drives inflation. Price stability is in the world’s best interest. Crashing oil prices, I would say, is unlikely -- despite Donald Trump's economic illiteracy. That said, a tighter mid-cycle range of oil prices is in everyone's best interest.

(5) Not to offend some Warren Buffet cultists, but it appears he is also decreasing the float of the company to add some stock price stability which could indirectly protect credit ratings from volatile price action and bipolar bull/bear sentiment on oil. Remember, he described OXY’s volume as a gambling parlor and being able to buy his entire stake in 2 weeks and decreasing the amount of lendable shares (up to 50%) could help price stability. Warren Buffett also owns some warrants too, so it’s a win-win for both.

**What does that leave for the rest of us?**

Assuming oil prices stay in the current $70 to $90 range, OXY’s earnings are relatively predictable.

Now, excuse me for using EPS. I know it's a sin, but for simplicity, just listen to me.

Some quarters will come in low range (maybe $0.50) while other quarters come in the high range ($1.50). Depending how Mr. Market feels about oil (bullish or bearish due to geopolitics, renewables, etc), OXY’s price may swing +/- 30%. But in the long-term, the earnings will average out, debt will decrease, preferred shares will  be redeemed, dividends increased, buybacks increased, and OXY will be an opportunistic consolidator (this is where Warren Buffett’s trust in Vicki’s capital allocation is crucial).

So it's clear Warren Buffet is making out like a bandit, so why are other super investors such as Li Lu buying a stake in the company?

Believe it or not, I believe these super investors are ***speculating*** on OXY’s competitive advantage in carbon management, chemical substrates, and subsurface tech -- after all “safe investments make for safe speculation.”

Crazy, I know, but before you stop reading, hear me out.

OXY is basically a high yielding bond with two growth driver’s that have very *very* long runways: 

1. Direct Lithium Extraction (DLE)
2. Carbon Management via Direct Air Capture (DAC) and Carbon Sequestration

I’ll start with the less controversial one…

**TerraLithium: Direct Lithium Extraction**

If you didn’t know TerraLithium is a 50-50 joint venture between a start-up, All American Lithium, and a subsidiary of Occidental Petroleum. All American Lithium was the latest iteration of a company that originally formed to [acquire the assets](https://www.desertsun.com/story/tech/science/energy/2017/02/10/salton-sea-geothermal-plant-would-use-lithium-tech-caught-teslas-eye/97743092/) of Simbol Materials, which developed a much-hyped and highly secretive lithium extraction process. Simbol Materials’ technology impressed **ELON MUSK** (yes, you read that correctly) so much that Tesla offered to buy the start-up for $325 million. But the deal fell apart as Simbol Materials’ commanded a billion dollar valuation (**Jefferies valued them at $2.5 Billion**). Tesla investors familiar with the matter, know that they did not have a billion dollars to throw around at the time. And months later Simbol Materials went bust.

Fast forward to today:

**Berkshire Hathaway Energy owns 10 out of the 11 geothermal power plants in the Salton Sea and TerraLithium has over 40 patents relating to direct lithium extraction from geothermal brine. Together, they are working to tap the estimated 18 million metric tons of lithium suspended in geothermal brine. That's the equivalent to half of the current global production of lithium. It's enough to make over 375 million electric vehicle batteries. The depth of the Salton Sea's reserves dwarf other potential reserves such as the  Smackover Formation or hectorite clay, recovered oil field brines, recycled electronics, etc.**

The 11th geothermal power plant is owned by a competitor EnergySource Minerals who is also trying to extract lithium from geothermal brine. Despite being closer to a commercially viable solution, EnergySource Minerals attempted to challenge TerraLithium's patent for being ""too general"" which may suggest that TerraLithium's patent claims are competitively advantaged (on top of the scale advantage provided by Berkshire Hathaway Energy). The other competitor called Controlled Thermal Resources must start from scratch (the project being dubbed  “Hell’s Kitchen”). That is, build a geothermal power plant and then add the direct lithium extraction tech which, compared to Berkshire Hathaway Energy and TerraLithium, has high execution risk. Berkshire Hathaway Energy has been running their geothermal plants for decades and Occidental Petroleum has decades of experience with carbon, chemical substrates, and subsurface tech. Let's just say, in a weird twist, the potential Tesla backed Simbol Materials is now backed by Occidental Petroleum and Berkshire Hathaway Energy via a subsidiary called TerraLithium.

Any regulatory hurdles will be minimal: (1) At the national level, there's a strong bipartisan push for lithium independence. (2) At the state level, the government plans on taxing all extracted lithium. (3) At the local community level, there's a powerful incentive to revitalize communities that were destroyed by the drying of the Salton Sea which exposed toxic lakebed dust containing pesticides and heavy metals. New direct lithium extraction facilities offer a chance for regional revival creating an estimated 80,000 new jobs. (4) Direct lithium extraction from geothermal brine is significantly greener than hard rock mining and solar evaporation of brine.

**If you ever wondered why Warren Buffet chose his successor to be Greg Abel (*****the current CEO of Berkshire Hathaway Energy*****) this is probably a major contributing factor (not the only though).**

I have no idea what TerraLithium will be worth, but in Q2 2024 Occidental Petroleum did a “small” fair value adjustment of $27 million on assets that were once valued at **$2.5 billion in 2014 by Jefferies** \-- with a stronger team now, than 10 years ago. Eventually, they plan on licensing this tech, and let's just say, owning the patents to the tech that can extract half the current global production is probably worth something. And of course lithium prices matter, but the tech is a fixed cost that would be shielded from the *cyclicality* of lithium prices.

Now, onto the more controversial one…

**1PointFive: Carbon Management**

Anti-oil company climate activists can stop reading now.

On May 18^(th), 2024, at CERAWeek by S&P Global -- an annual global energy conference focusing on the industry’s biggest goals and challenges -- Yahoo Finance's Julie Hyman interviewed CEO Vicki Hollub to discuss Occidental Petroleum’s CrownRock Acquisition in December 2023. 

In the latter half of the interview, Vicki Hollub details a clear path for how Occidental Petroleum will transition to a Carbon Management Company, via their subsidiary 1PointFive:

>“We've been using CO2 for enhanced oil recovery for over 50 years. It's a core competence of ours; we understand how CO2 works, how to manage it, and how to handle it effectively. We have the necessary infrastructure in the Permian Basin for this.  
For a long time, we attempted to capture anthropogenic CO2 from industrial sources. This proved to be challenging because negotiating with industrial sites to retrofit equipment for carbon capture was difficult. We started this effort back in 2008 but were unsuccessful in making it happen with any partners.”

Vicki is talking about Occidental Petroleum’s previously failed Carbon Capture Storage (CCS) venture called Century. Built in 2010, Century was intended to be the largest carbon capture facility in the world, aiming to handle over 20% of global CCS capacity. Integrated into a natural gas processing plant, Century was designed to capture carbon dioxide before it could be released into the atmosphere by using two engines: one capable of capturing 5 million metric tons of carbon dioxide and the other able to capture more than 3 million metric tons of carbon dioxide.

However, a **Bloomberg Green** investigation found satellite data showing that cooling towers on one of the engines didn’t function, suggesting that Century never operated at more than a third of its capacity in the 13 years it’s been running. The technology worked but the economics didn’t hold up because of limited gas supplied from a nearby field, leading to disuse and eventual divestment by Occidental Petroleum who sold off the project in 2022 for $200 million to Mitchell Group - significantly less than the original $1.1 Billion invested into Century.

The painful lesson: while CCS technology worked, the economics are heavily tied to the carbon dioxide emission source. Mainly, the profitability relied on how much carbon dioxide was emitted and negotiating/working with the owners of the emission source. 

Luckily, a new carbon capture technology emerged, direct air capture (DAC), that proved much more economically viable:

>“Then we discovered a carbon capture technology designed to extract CO2 directly from the atmosphere. This was a game-changer for us, akin to finding the holy grail. With this technology, we no longer needed to negotiate with emitters; instead, we could control our own development pace and schedule. This direct air capture approach allows us to operate when and where it makes the most sense.”

Learning from the failed venture of Century, Vicki believes that DAC is more economically viable because the source of carbon dioxide is pulled out of the atmosphere (not carbon dioxide emission sources) which shifts the bottleneck to cost reduction of DAC technology. Freed from the complication of carbon dioxide emitters, Occidental Petroleum engineers can focus on building the most cost efficient DAC facility without rushing or technical limitations from carbon dioxide emitters that could result in suboptimal decisions.

>“An added advantage is that the technology uses potassium hydroxide to capture CO2 from the air. We are the largest marketer of potassium hydroxide in the U.S. and the second largest globally. Additionally, for efficient mixing in the contact tower—necessary for optimal CO2 extraction—PVC diffusers are used. We also manufacture PVC, creating synergies with our existing oil and gas and chemical businesses.  
These synergies were fortuitous, and it felt like it was meant for us. However, the economic viability of direct air capture depends on various factors, including the performance of rivals and market conditions.”

Along with Occident Petroleum’s infrastructure to use captured carbon for enhanced oil and natural gas recovery in the Permian Basin, when it comes to developing DAC, Occidental Petroleum already has part of the supply chain for DAC vertically integrated.

The main challenge that remains is the fact that DAC is a rather expensive process. According to a news post by Julie Chao from Berkeley Labs on April 20^(th), 2022, DAC costs about $600 per metric ton of carbon dioxide removal (CDR) with the following 2 factors driving up the cost: (1) Separating the carbon dioxide from the reactive absorbent -- usually potassium hydroxide -- requires a costly heating process. (2) Carbon dioxide’s poor solubility in water requires a costly pressurizing process to sequester the carbon dioxide in a saline reservoir to use later for enhanced oil and natural gas recovery.

Despite the US tax credit of $180 per metric ton of carbon dioxide removal that is directly captured from the atmosphere, the overall economics make DAC a money losing venture with a theoretical net loss of $420 per metric ton of DAC CDR.

However, Vicki talks about a developing carbon credit market, where DAC CDR credits can be sold for a premium with increasing demand:

>“We plan to launch the first phase of Stratos, our direct air capture facility in the Permian Basin, by mid-next year. We have already sold about 70% of the carbon reduction credits for the facility, which will ultimately handle 500,000 tons of CO2 per year. The demand is strong, coming from airlines, tech companies, consulting firms, and others interested in reducing their carbon footprint.  
These buyers are part of the voluntary compliance market, focusing on offsetting their carbon emissions. This should provide us with a steady cash flow from the facility.  
As for when the facility will break even and become profitable, it depends on the value of credits beyond those we’ve already sold. While credit prices are currently rising due to limited availability, I hope to have a clearer picture in two years. We’ll check back with you as things continue to evolve.”

At full capacity, Stratos will collect 500,000 metric tons of carbon dioxide per year costing at least $300 million in annual operational expenses. In combination with the $180 DAC CDR credits, Stratos is projected to lose $420 per metric ton of CDR which is an annualized loss of $210 million. 

However, as Vicki points out, companies are willing to pay a premium for DAC CDR credits, which may help subsidize and offset the loss. Here’s a list deals that were already made:

1. [https://www.1pointfive.com/news/1pointfive-and-microsoft-announce-agreement-for-direct-air-capture-cdr-credits](https://www.1pointfive.com/news/1pointfive-and-microsoft-announce-agreement-for-direct-air-capture-cdr-credits)
2. [https://www.1pointfive.com/news/1pointfive-and-att-announce-direct-air-capture-carbon-removal-agreement](https://www.1pointfive.com/news/1pointfive-and-att-announce-direct-air-capture-carbon-removal-agreement)
3. [https://www.rockwellautomation.com/en-us/company/news/press-releases/Rockwell-Automation-Announces-Direct-Air-Capture-Carbon-Removal-Credit-Agreement-With-1PointFive.html](https://www.rockwellautomation.com/en-us/company/news/press-releases/Rockwell-Automation-Announces-Direct-Air-Capture-Carbon-Removal-Credit-Agreement-With-1PointFive.html) 
4. [https://www.1pointfive.com/news/1pointfive-and-trafigura-announce-agreement-for-direct-air-capture-cdr-credits](https://www.1pointfive.com/news/1pointfive-and-trafigura-announce-agreement-for-direct-air-capture-cdr-credits)
5. [https://www.1pointfive.com/news/1pointfive-and-boston-consulting-group-announce-agreement-for-direct-air-capture-cdr-credits](https://www.1pointfive.com/news/1pointfive-and-boston-consulting-group-announce-agreement-for-direct-air-capture-cdr-credits)
6. [https://www.1pointfive.com/news/1pointfive-cdr-purchase-agreement-td-bank-group](https://www.1pointfive.com/news/1pointfive-cdr-purchase-agreement-td-bank-group)
7. [https://www.1pointfive.com/news/amazon-cdr-removal-credit-purchase-agreement](https://www.1pointfive.com/news/amazon-cdr-removal-credit-purchase-agreement)
8. [https://www.1pointfive.com/news/ana-carbon-dioxide-removal-purchase-from-1pointfive](https://www.1pointfive.com/news/ana-carbon-dioxide-removal-purchase-from-1pointfive)
9. [https://www.1pointfive.com/news/1pointfive-and-the-houston-astros-announce-direct-air-capture-carbon-removal-credit-agreement](https://www.1pointfive.com/news/1pointfive-and-the-houston-astros-announce-direct-air-capture-carbon-removal-credit-agreement)
10. [https://www.1pointfive.com/news/1pointfive-announces-agreement-with-houston-texans](https://www.1pointfive.com/news/1pointfive-announces-agreement-with-houston-texans) 
11. [https://www.1pointfive.com/news/1pointfive-announces-agreement-with-airbus](https://www.1pointfive.com/news/1pointfive-announces-agreement-with-airbus)

Climate activists' be damned, but reducing in carbon emissions doesn't quickly eliminate all the carbon in the atomosphere. To reverse climate change, carbon needs to be removed from the air.

*That is a fact.*

There are a handful of startups that remove carbon from the air, but their solutions can only remove **tens** of thousands of metric tons. To be blunt, all of their solutions are subscale and fall short of even putting a dent into reversing climate change.

However, Stratos' scale is to the tune of **hundreds** of thousands. At full capacity, Stratos can remove \~500,000 metric tons of carbon per year while running on green energy.

*Stratos' scale blows out the competition by over 10 times the capacity.*

And unlike trees, OXY *can* optimize DAC plants to be built, smaller, cheaper, and faster. If this tech improves, it would only take a few thousand of these DAC plants to reverse climate change.

*OXY, via their subsidiary 1Point5, is both well capitlized and vertically integrated to scale DAC and fight climate change.*

**History doesn't repeat itself, but it often rhymes.**

Crazy or not, I believe buying OXY now is like buying Nvidia.

Nvidia’s GPUs have proven various use cases from gaming, crypto, to AI, where the core gaming business was rather unattractive.

*Before Nvidia's enormous run, analysts valued Nvidia's GPUs potential in crypto and AI at basically 0.*

Similarly, OXY’s expertise in carbon, chemical substrates, and subsurface tech has proven various use cases from carbon based enhanced oil recovery, lithium extraction, carbon sequestration, and carbon removal tech.

*Currently analysts value Direct Lithium Extraction tech and a transtion to Carbon Management at 0.* 

What baffles me is that Nvidia’s growth is fueled by **speculative demand** for crypto and artificial intelligence. The world has yet to see returns, but plans on spending $1 trillion over the next few years on AI hoping the economics will work out.

*If that isn’t speculation, I don’t know what is.*

And believe me, I understand this tech more than you ever would think. A colleague of mine who has a PhD in CS told me exactly the many use cases of GPUs, but I didn't buy it because: (1) I viewed AI as speculative. (2) Because of reason 1, I expected companies to invest slowly and cautiously. I mean, just look at how the market reacted to Mark Zuckerberg's push into the Metaverse. (3) Because of reason 1 and 2, I expected a slow growth rate where Nvidia's moat would erode in a 3 to 5 year time frame to competitors (something that is happening as we speak -- i.e. CUDA on AMD) before Nvidia could make a killing.

In fact, my stance on tech in general can be summarized as so:

>The reality of tech companies is that they age rapidly — like dog years squared. Moats flash in and out of existence within 2 to 3 years time (along with their valuations). The odds of finding the next Oracle are slim to none, because it's almost certain that the world will never rely on a single relational database architecture again. The main worries in tech are competition, growth, value-cre-ation, and value-ation. When competition enters the space, investors should pack their bags since the rapid democratization of information allows competition to grow at lightning speeds. Ironically, the forever holdings are businesses that are entrenched usually for non-technological reasons (i.e Apple, Google, Meta, Amazon, Spotify, Palantir). And lack of technical and algorithmic literacy, makes the chances of accurately determining an enduring business at early stages next to none.

With the release of ChatGPT, you can imagine where I went wrong... At that point, I should've just bought the damn company since the growth was obviously higher than I anticipated completely invalidating my original thoughts. But I digress, the focus of this letter isn't about me confessing my sins for missing out on Nvidia...

Nvidia aside, Occidental Petroleum’s growth is fueled by **non-speculative demand**:

(1) Lithium independence is a bipartisan goal, and lithium demand is very healthy with our tech boom.

(2) Climate change keeps getting worse. Reducing emission slows it, but to reversing it requires the atmosphere to be decarbonized which is a very healthy tailwind for a growing carbon credit market that OXY can dominate.

(3) Due to oil being sytemically ingrained into the world, the clean energy transition is very slow. So I can sleep knowing that tomorrow oil will still be here.

Overall, I buy whenever OXY nears ***single*** digit earnings multiples or reaches an acceptable free cash flow yield (adjusted for things I deem reasonable like Warren's preferred shares, because there’s cash flow and then there’s cash flow I get).

For me OXY is a safe vehicle to park my money while I wait for other opportunities. And until then, I will just be clipping coupons.

So yeah, oil prices matter... sort of... but, Occidental Petroleum has some other things too...

From,

YetAnotherSpeculator

\#NotFinancialAdvice

**\[Amendment; January 27, 2025\]** Please re-read my stance on tech. In a mere 2 years AI investment, we are at a crossroads with Nvidia v.s. DeepSeek. I believe this letter speaks for itself. As for what's going to happen?  I have no fucking clue, but I do not believe natural market forces are in play.

**\[Amendment; April 9, 2025\]** In an ironic turn of events, an orange man is shilling EVs and about to tank US shale. So much for ""Drill, baby drill."" Now, I have no doubt that lower oil prices equals less oil production. **But, if US shale falters, there will be massive ramifications**. There is a reason why the stock market is declining rapidly. There is an old man fondling economic nukes, putting the world on the brink of economic instability we have not seen since the pandemic. The fear is real, and opportunity is already appearing. Perhaps there's a reason why Berkshire was making small bets on beer, pizza, and pools... in any event, depending on how long these tarriffs persist, US shale is one of the last places you want to be...

**\[Amendment; May 14, 2025\]** As Warren Buffett said himself, this market volatility is nothing. Had you seen my revisions, I swung massive handsomely into a small oil company in the state of California and let’s just say have done quite well since during this recovery. As for where i put those gains, OXY is neither on nor off the table, but other opportunities can and will exist. oil is a commodity and volatile, but it works in both directions. but one thing won’t change and that’s how important OXY is to reducing the deficit…",2025-01-25,211,83
1i7hhvp_OXY,OXY,Selling a strangle on OXY,,2025-01-22,2,2
