Post_ID,Ticker,Title,Body,Post_Date,Upvotes,Num_Comments
9db69d99-738b-4447-901a-2734d8d33e44,PYPL,"Ron DeSantis Signs Law Allowing Gold, Silver For Transactions In Florida, Citing 'Declining Dollar' Concerns","Florida Governor Ron DeSantis has enacted a new law, opening the doors for transactions using gold and silver in the state. This move is seen as a nod to the original “gold standard.”
What Happened: DeSantis signed the bill, HB 999, into law, allowing Floridians to use gold and silver for…",2025-05-28,,
41454b27-6e53-4339-911e-43f40ba465e9,PYPL,Palantir Technologies (NASDAQ: PLTR) Price Prediction and Forecast 2025-2030 for May 26,"Shares of Palantir Technologies Inc. (NASDAQ:PLTR) were mostly flat over the past five trading sessions, falling by 0.10%. That did little to deter its recent rally, which has seen the stock gain nearly 24% over the past month, bringing its year-to-date gain to nearly 66%. Since going public in…",2025-05-26,,
b69e6bae-d6b1-48af-8d1d-0bf52af3822d,PYPL,Slid after a Strong 2024,"In This Article:
Sound Shore Management, an investment management firm, has released its investor letter for the first quarter of 2025. A copy of the letter can be downloaded here. The fund’s Investor Class (SSHFX) and Institutional Class (SSHVX) declined 1.93% and 1.89% respectively, in the first…",2025-05-26,,
7c588da1-2368-46d2-90e9-cf3ea0bc8825,PYPL,Palantir Evades DOGE Fallout As Federal Contractor Booz Allen Hammered,"Shares in Palantir Technologies (PLTR) on Friday traded sideways as investors hammered Booz Allen Hamilton (BAH), a rival government and defense contractor. Palantir stock has gained 62% in 2025 but its relative strength line has flattened out.
On the stock market today, Booz Allen stock tumbled…",2025-05-23,,
ab55df0d-bb0f-459a-8885-6e58c5e21c7e,PYPL,SoFi Technologies (NASDAQ: SOFI) Price Prediction and Forecast 2025-2030 (May 23),"SoFi Technologies Inc.’s (NASDAQ: SOFI) chief executive officer recently said at a conference that the fintech company has targeted 30% member growth and 20% revenue growth. The share price is 5.5% lower than a week ago. Though the stock had a strong start to 2025, on last look the share price was…",2025-05-23,,
8b3a3143-3874-4c68-bea4-cb7bfae3f069,PYPL,PayPal (NASDAQ: PYPL) Price Prediction and Forecast 2025-2030 (May 2025),"Shares of PayPal Holdings, Inc. (NASDAQ: PYPL) gained 16.64% over the past month, joining in the broad market’s rally that has been propelled by the announcement of a 90-day tariff pause between the U.S. and China. However, the stock is still struggling longer-term, with a year-to-date loss of…",2025-05-22,,
