Post_ID,Ticker,Title,Post_Date,Upvotes,Num_Comments
ur00pp_AAPL,AAPL,"I sold all my positions in GOOG, PYPL, AMZN, AAPL, and MSFT today. ($50,000 left, what was once $120,000)",2022-05-16,0,281
loixzf_AAPL,AAPL,"LEAPS: AAPL, AMD, PINS, SQ, PYPL, ETSY",2021-02-20,26,46
ur00pp_MSFT,MSFT,"I sold all my positions in GOOG, PYPL, AMZN, AAPL, and MSFT today. ($50,000 left, what was once $120,000)",2022-05-16,0,281
zk3qqj_MSFT,MSFT,$APCX Some highlights from this Research report. This E-commerce solutions processing company similar to $GPN and $JTPY and even $PYPL is consistently growing and developing. https://technewstrends.com/digital-banking/,2022-12-12,2,3
ur00pp_AMZN,AMZN,"I sold all my positions in GOOG, PYPL, AMZN, AAPL, and MSFT today. ($50,000 left, what was once $120,000)",2022-05-16,0,281
ujxfhb_AMZN,AMZN,What is the common factor of all the S&P 500 stocks that are crashing? AMZN PYPL NFLX etc,2022-05-06,101,129
14xyxw6_META,META,"META $235C $39k --> $2.6M. Next up, PYPL!!",2023-07-12,3257,877
sxppg3_META,META,Am I the only one who thinks the recent PYPL & META correction is a serious overreaction?,2022-02-21,99,158
yu2bk9_TSLA,TSLA,"QQQ has broken the 50 SMA, back in bullish territory? Looking at beaten names: TSLA, SQ, CRWD, PYPL",2022-11-13,244,55
18oec3y_TSLA,TSLA,PAYPAL (PYPL) is a buy,2023-12-22,69,126
1hkk4wp_AMD,AMD,Recent Honey controversy a bearish warning for $PYPL,2024-12-23,322,144
loixzf_AMD,AMD,"LEAPS: AAPL, AMD, PINS, SQ, PYPL, ETSY",2021-02-20,24,46
1efs44q_TXN,TXN,"PYPL Q2: EPS beat by 34%, payment volume up 11% YoY, stock up 9% in premarket",2024-07-30,74,49
81fl43_ANET,ANET,Need opinion on JD or PYPL,2018-03-02,4,11
1c4z1sf_SNOW,SNOW,"SHOP, PYPL, SNOW, ZS",2024-04-15,5,6
p9n1ed_SNOW,SNOW,"I scanned over 150 charts this weekend. Here are some good setups I found to BTFD (or sell CSPs): DKNG, SNOW, DPZ, PYPL, TSM",2021-08-22,28,8
p9n21y_SNOW,SNOW,"I scanned over 150 charts this weekend. Here are some good setups I found to BTFD (or sell CSPs): DKNG, SNOW, DPZ, PYPL, TSM",2021-08-22,64,21
jx3l45_SNOW,SNOW,Stock Watch List - Nov 19 2020 ($TSLA $PYPL $TWLO $NFLX $CVNA $PTON $SNOW $PINS $DKNG),2020-11-19,4,0
1fp1b75_PLTR,PLTR,"Cathie Wood's Ark Invest Buys $4.5M Of PayPal (PYPL) And $3.5M Of Pinterest (PINS) Shares, Continues Offloading Palantir (PLTR)",2024-09-25,513,144
1efqr8y_PATH,PATH,$PYPL beat expected earnings by 34%,2024-07-30,534,118
1c4z1sf_ZS,ZS,"SHOP, PYPL, SNOW, ZS",2024-04-15,5,6
uw1vhj_NET,NET,"What’s wrong with PayPal ($PYPL)? They have a good PE ratio, are profitable (making money each quarter), and are selling at a 75% discount from their all time high? What am I missing?",2022-05-23,930,389
yu2bk9_CRWD,CRWD,"QQQ has broken the 50 SMA, back in bullish territory? Looking at beaten names: TSLA, SQ, CRWD, PYPL",2022-11-13,242,55
cb2gj7_OKTA,OKTA,Thoughts on PayPal (PYPL)? $117.93 (Up 36% this year),2019-07-09,142,94
zk3qqj_JPM,JPM,$APCX Some highlights from this Research report. This E-commerce solutions processing company similar to $GPN and $JTPY and even $PYPL is consistently growing and developing. https://technewstrends.com/digital-banking/,2022-12-12,2,3
yp264a_BAC,BAC,Today's trades: BAC + PYPL,2022-11-07,2,6
18oec3y_C,C,PAYPAL (PYPL) is a buy,2023-12-22,72,126
189637e_C,C,PYPL Valuation,2023-12-02,50,72
3egosi_AXP,AXP,"Anyone have a favorite in the payment space? V,MA,SYF,PYPL,DFS,AXP,WU..",2015-07-24,7,14
qs4tiv_AXP,AXP,"At current prices, which would you choose between V, MA, and PYPL?",2021-11-12,79,122
1k79prd_PYPL,PYPL,$PYPL Guh or Print,2025-04-25,11,8
14xyxw6_PYPL,PYPL,"META $235C $39k --> $2.6M. Next up, PYPL!!",2023-07-12,3253,877
15gjuns_PYPL,PYPL,uhhh PYPL bros?,2023-08-02,1067,455
15rzumh_PYPL,PYPL,I’m hurting guys $PYPL,2023-08-15,680,552
178kwns_PYPL,PYPL,$350K $PYPL Yolo,2023-10-15,660,325
1fp1b75_PYPL,PYPL,"Cathie Wood's Ark Invest Buys $4.5M Of PayPal (PYPL) And $3.5M Of Pinterest (PINS) Shares, Continues Offloading Palantir (PLTR)",2024-09-25,512,144
15hiuvs_PYPL,PYPL,-$100k today $PYPL,2023-08-03,650,265
1efqr8y_PYPL,PYPL,$PYPL beat expected earnings by 34%,2024-07-30,537,118
1ef5lq5_PYPL,PYPL,I am ready to get hurt again. $20k $PYPL YOLO,2024-07-29,289,188
176gbt6_PYPL,PYPL,I’m down so bad the only logical thing to do was buy more $PYPL,2023-10-12,335,283
14z0ofh_PYPL,PYPL,500k+ PYPL YOLO. Can we repeat last year's rally?,2023-07-13,400,278
14ohiij_PYPL,PYPL,Death Knell for $PYPL,2023-07-02,439,252
17ckbg3_PYPL,PYPL,I’m gonna say it…. $PYPL,2023-10-20,202,373
1fz075u_PYPL,PYPL,"$2,400,000 BABA and PYPL position current status",2024-10-08,364,94
1ab5ix0_PYPL,PYPL,NASDAQ:PYPL PayPal A Second Look.,2024-01-26,1217,54
zpyoon_PYPL,PYPL,From 3k to 33k in 5 months from playing the PYPL channel,2022-12-19,784,154
15xkq75_PYPL,PYPL,PYPL 30k all in,2023-08-21,447,188
16ok3vt_PYPL,PYPL,I didn’t hear no bell😤 $PYPL,2023-09-21,365,197
17emihk_PYPL,PYPL,Why is $PYPL so hot amongst this sub atm?,2023-10-23,247,207
1akoudf_PYPL,PYPL,Why does PayPal (PYPL) have so many fans and yolos?,2024-02-06,221,183
1ge36fw_PYPL,PYPL,PYPL & CROX earnings play (feat. 2 bonus lotto gambles),2024-10-28,171,98
1akti6m_PYPL,PYPL,Down $730k between PYPL & BABA. Still in for $1.73 million! Let's Go!,2024-02-07,345,109
158lxcv_PYPL,PYPL,PYPL 500K YOLO UPDATE #1,2023-07-24,462,118
15ifiy2_PYPL,PYPL,Losing $100k yesterday on ITM Leaps wasn’t regarded enough so I had to up the stakes $PYPL,2023-08-04,356,125
17m4a9u_PYPL,PYPL,PYPL Calls 61k Gain,2023-11-02,544,75
15zd3ew_PYPL,PYPL,PYPL YOLO increased to $106k. Deep Value Edition,2023-08-23,222,145
rb1jzw_PYPL,PYPL,"From down over 95% to this. 1.5k -> 35k in two weeks. I had about 20k invested in TSLA, AMD , PYPL, and SQ calls expiring friday.",2021-12-07,598,125
18xpyh7_PYPL,PYPL,PYPL LEAPs,2024-01-03,102,158
15lnj4t_PYPL,PYPL,"The Fed figured out how to use the internet, PYPL is fucked right?",2023-08-08,220,121
18c4qlt_PYPL,PYPL,PayPal (PYPL) Has a Compelling Case,2023-12-06,114,131
15kohbn_PYPL,PYPL,PayPal ($PYPL) Launches a Stablecoin in Latest Crypto Payments Push,2023-08-07,213,97
zp2usp_PYPL,PYPL,This is what a reversal looks like for PYPL. Next earnings is going to be huge. also wait until pypl breaks 103$ resistance for confirmation,2022-12-18,164,137
13x1gkw_PYPL,PYPL,Someone bought half a billion dollars worth of pypl after hours. Also 65 calls are being purchased. Huge 5% day tomorrow incoming??,2023-05-31,131,117
xzl5yp_PYPL,PYPL,Someone Angered King PYPL,2022-10-09,715,42
sy07pt_PYPL,PYPL,Everytime I look at my PYPL position,2022-02-21,629,59
15xrpqu_PYPL,PYPL,$100k $PYPL YOLO,2023-08-22,115,98
1539by9_PYPL,PYPL,185k pypl yolo,2023-07-18,190,71
gez0xx_PYPL,PYPL,"$PYPL Calls, May 6 After Hours, Visualized",2020-05-07,713,64
1ald2q8_PYPL,PYPL,PayPal (PYPL) Earnings Analysis,2024-02-07,63,72
13fvhjf_PYPL,PYPL,Paypal $PYPL Share Price vs P/E. P/E Is At An All Time Low. Trap or Opportunity?,2023-05-12,88,100
1ajq6ql_PYPL,PYPL,PLTR & PYPL Calls,2024-02-05,49,72
17dn4bq_PYPL,PYPL,It's time to buy $PYPL,2023-10-22,43,93
15ffk87_PYPL,PYPL,PYPL to the moon,2023-08-01,89,84
o8fvqo_PYPL,PYPL,"PayPal (PYPL) gonna drop, Square (SQ) gonna pop (DD)",2021-06-26,140,135
13bzvbn_PYPL,PYPL,Why I'm getting PYPL calls for earnings,2023-05-08,63,89
14zveqh_PYPL,PYPL,All in $PYPL Update #1,2023-07-14,104,66
14b6n21_PYPL,PYPL,Wish me luck🫡 All in $PYPL,2023-06-16,119,66
skk0b5_PYPL,PYPL,PYPL,2022-02-04,45,137
17n1fpl_PYPL,PYPL,Sold puts on Tesla as it tanked below $200. Bought PYPL and PLTR calls before earnings. Bought SPY calls before Thursday’s rally,2023-11-03,123,47
ysqym9_PYPL,PYPL,I think I f**ked up. I sold calls at 90 for PYPL (23DTE) yesterday and the stock keeps going up! I don't wanna get assigned cuz my average is at 140. do you think pypl will fall back down so I can close them?,2022-11-11,19,111
qkqv6q_PYPL,PYPL,$PYPL Due Diligence,2021-11-01,142,98
u3ut61_PYPL,PYPL,PYPL long-term Bull Thesis,2022-04-14,205,71
17ccbo2_PYPL,PYPL,Where is the technical bottom for PYPL?,2023-10-20,37,62
9pcmjq_PYPL,PYPL,"$PYPL Paypal Earnings Thread; Keep all discussion here, all posts after this will be removed",2018-10-18,72,205
sj2miz_PYPL,PYPL,$PYPL YOLO - 330k bought the dip. Will ride this one to gains,2022-02-02,55,120
1bhhcj2_PYPL,PYPL,"PYPL astrology, to $83 in about 6-9 months.",2024-03-18,19,47
19ap8mf_PYPL,PYPL,Huge volume increase in PYPL $85 Call 1/26,2024-01-19,31,47
1drl9ns_PYPL,PYPL,"PFE, PYPL, NKE - Bull thesis",2024-06-29,23,31
siun78_PYPL,PYPL,SOFI acquisition of GPB now complete. Fuck you pypl for dragging the entire fintech sector down.,2022-02-02,209,68
9187g8_PYPL,PYPL,Why $PYPL can bring you tendies TODAY,2018-07-23,195,116
1676i3a_PYPL,PYPL,Paypal $PYPL Q3 and Q4 Despair?,2023-09-01,63,50
1asjs2h_PYPL,PYPL,What are the chances PYPL will come back?,2024-02-16,19,42
13i2jgg_PYPL,PYPL,"Paypal $PYPL drawdowns. Investors at all time highs: ""Biz has strong MOAT"". After a massive drawdown: ""No MOAT"".",2023-05-15,134,43
13duw2u_PYPL,PYPL,easy money! pypl just has to go up 3% on tomorrow ppi and you 3x ur money! bought 66 strike calls!,2023-05-10,46,62
1bht8ae_PYPL,PYPL,Breakout for Venm…err PYPL!?,2024-03-18,33,36
yldr5p_PYPL,PYPL,$pypl after market..rock bottom...,2022-11-03,58,75
1bv64n2_PYPL,PYPL,Where my PYPL bros at,2024-04-03,65,25
y03d5i_PYPL,PYPL,PYPL 🩸🩸🩸,2022-10-10,168,45
qwyk1h_PYPL,PYPL,Found out PYPL really stands for Pay Up Pal 💀,2021-11-18,190,56
4u85j0_PYPL,PYPL,"Next week's earnings, time to wipe $PYPL's Nut Butter from your Poopdeck.",2016-07-23,152,127
regfnp_PYPL,PYPL,PYPL 200c 12/17,2021-12-12,81,77
qrrv0e_PYPL,PYPL,$PYPL 🚀🚀. Perfect time to get in. Bayesian statistic show that the bottom is right now,2021-11-11,97,74
91hhpi_PYPL,PYPL,Who’s enjoying their tendies because of my $PYPL post?,2018-07-24,173,101
177eows_PYPL,PYPL,PYPL Hopes,2023-10-14,29,36
qp19a6_PYPL,PYPL,"Historical Post Earnings Moves MEGA Compilation AND Analysis (Q3 Week 5) - $CLOV, $PLTR, $SPCE, $PYPL, $DIS, $NIO, $UPST and More",2021-11-07,203,50
18yiy25_PYPL,PYPL,What do you think about PYPL?,2024-01-04,11,35
19eim7v_PYPL,PYPL,Warren Buffett's New Secret Stock PYPL?,2024-01-24,0,34
spjp6h_PYPL,PYPL,Is $PYPL a buy? What’d the boys think?,2022-02-10,23,82
1aldc33_PYPL,PYPL,I may become the proud father of $PYPL & $DIS shares…,2024-02-07,43,22
13cru7q_PYPL,PYPL,$PYPL possibility of a ‘bank run’ on Venmo & PayPal?,2023-05-09,30,35
1j1yyv7_PYPL,PYPL,Current thoughts on PYPL? (PayPal),2025-03-02,2,13
1di00f2_PYPL,PYPL,What's going on with SQ and PYPL? ,2024-06-17,42,81
16qzbv2_PYPL,PYPL,What is going on with SQ and PYPL?,2023-09-24,68,61
1824r15_PYPL,PYPL,Thoughts on PayPal (PYPL) - A few of my thoughts,2023-11-23,5,25
19dwzdt_PYPL,PYPL,The future of fin-tech. Thoughts on PYPL?,2024-01-23,2,12
si7h3t_PYPL,PYPL,Big Business vs. Small Business -- GOOGL and PYPL Earnings,2022-02-01,50,35
i05j10_PYPL,PYPL,AVLR UPWK SHOP PYPL ADBE - If you believe in ecommerce these are your plays,2020-07-29,16,25
b5elgs_PYPL,PYPL,$SQ or $PYPL?,2019-03-25,11,14
fku150_PYPL,PYPL,"Thoughts on buying TSLA, V, PYPL, SHOP?",2020-03-18,4,8
8wo0d8_PYPL,PYPL,V vs MC and SQ vs PYPL,2018-07-06,9,13
4u43m5_PYPL,PYPL,Thoughts on $PYPL?,2016-07-22,6,18
9kk2kx_PYPL,PYPL,Pypl vs Sq,2018-10-01,7,10
ezvz78_PYPL,PYPL,"Today's Investment - AMD, FB, PYPL, MSFT, MGPI - NOOB FRIENDLY!",2020-02-06,0,4
dsbjun_PYPL,PYPL,"How do low interest rate affect financial stocks like V, PYPL,MA and banks",2019-11-06,6,4
82aqju_PYPL,PYPL,$PYPL Files Crypto Patent.,2018-03-06,16,7
4479g8_PYPL,PYPL,PYPL Rebound?,2016-02-04,7,12
3cad8e_PYPL,PYPL,($PYPL) Paypal spinoff 17th July. You tempted to buy?,2015-07-06,10,12
bbryk9_PYPL,PYPL,Keeping an eye on PYPL- making a huge change in fees collected,2019-04-10,1,2
51j5s3_PYPL,PYPL,PYPL a good long term bet?,2016-09-07,4,6
3dzmsz_PYPL,PYPL,Anybody else just see their PYPL share count double AH on TD Ameritrade?,2015-07-20,3,0
1hnwc4r_PYPL,PYPL,Is PYPL a buy for 2025?,2024-12-28,161,131
18wdbqr_PYPL,PYPL,Bought PYPL at $287. Hold or Sell?,2024-01-02,129,201
1hkk4wp_PYPL,PYPL,Recent Honey controversy a bearish warning for $PYPL,2024-12-23,315,144
164pb7i_PYPL,PYPL,Need help $PYPL down bad.,2023-08-29,156,301
j16dxx_PYPL,PYPL,PYPL is developing an e-commerce platform,2020-09-28,765,132
13f8roz_PYPL,PYPL,What's your thoughts on what's happening to $PYPL?,2023-05-12,148,174
qq6ef5_PYPL,PYPL,$PYPL taking a Nose Dive day after Earnings,2021-11-09,241,203
sx8mfv_PYPL,PYPL,Will PYPL recover?,2022-02-20,137,197
18s4fbc_PYPL,PYPL,Consensus on PYPL in 2024,2023-12-27,49,106
10x4ak3_PYPL,PYPL,Is PYPL dead?,2023-02-08,81,153
13i7h0j_PYPL,PYPL,PYPL what happened?,2023-05-15,73,135
ur00pp_PYPL,PYPL,"I sold all my positions in GOOG, PYPL, AMZN, AAPL, and MSFT today. ($50,000 left, what was once $120,000)",2022-05-16,0,281
rfoza5_PYPL,PYPL,"SQ vs. PYPL, which one do you like more and why?",2021-12-13,155,164
14fvcj5_PYPL,PYPL,Sell META and buy PYPL?,2023-06-22,73,120
1415940_PYPL,PYPL,Why PayPal Stock ($PYPL) lost 18% in May,2023-06-05,64,120
13sn7f2_PYPL,PYPL,Why do $PYPL & $SQ perform so poorly?,2023-05-26,101,101
13fmsz4_PYPL,PYPL,$PYPL (PayPal) - Q1 2018 VS Q1 2023,2023-05-12,117,94
ujxfhb_PYPL,PYPL,What is the common factor of all the S&P 500 stocks that are crashing? AMZN PYPL NFLX etc,2022-05-06,100,129
ql5dmc_PYPL,PYPL,"Best Fintech stock to own at these levels? V, MA, PYPL, SQ, etc.",2021-11-02,82,149
1efqsl6_PYPL,PYPL,"PYPL beats and raises 2024 guidance, margins improve ",2024-07-30,102,25
rvd0k9_PYPL,PYPL,Visa (V) vs PayPal (PYPL),2022-01-03,56,134
yhxzhx_PYPL,PYPL,"If you had a choice between $PYPL, $SHOP, and $UPST, which one would you pick?",2022-10-31,49,101
qs4tiv_PYPL,PYPL,"At current prices, which would you choose between V, MA, and PYPL?",2021-11-12,74,122
tghkfy_PYPL,PYPL,"Fintech is making a run lately such as PYPL, SQ, and etc. is the bottom finally over?",2022-03-17,87,103
si719h_PYPL,PYPL,$PYPL down -53% from ATH. Any fundamental reason?,2022-02-01,43,114
svnqu8_PYPL,PYPL,PYPL - what’s everyone’s plans?,2022-02-18,33,97
1basree_PYPL,PYPL,PYPL SBC and EPS ,2024-03-09,49,33
s7cnwd_PYPL,PYPL,"PayPal (PYPL) -- Did I catch a ""falling knife?""",2022-01-19,14,102
qdozal_PYPL,PYPL,Hello People! 48 yr. old elderly man need advice on PYPL and UNH.,2021-10-22,29,103
sjhd3c_PYPL,PYPL,PYPL and FB earnings misses,2022-02-03,82,77
za3bl7_PYPL,PYPL,What's happening to PYPL?,2022-12-01,0,77
t1grhz_PYPL,PYPL,Is it worth to buy extra PYPL,2022-02-25,46,84
vf5u8g_PYPL,PYPL,Should PYPL acquire SOFI?,2022-06-18,3,79
cb2gj7_PYPL,PYPL,Thoughts on PayPal (PYPL)? $117.93 (Up 36% this year),2019-07-09,141,94
qp8sj9_PYPL,PYPL,"Thoughts on buying the dip: $T, $MU, $PYPL, $BA",2021-11-08,32,65
11u3rer_PYPL,PYPL,Anyone still holding PYPL? If so what's your strategy to keep it around?,2023-03-17,40,34
ql5gav_PYPL,PYPL,What’s going on with PayPal (PYPL)?,2021-11-02,66,51
rzw1zk_PYPL,PYPL,PYPL this year? should I bother?,2022-01-09,29,52
r730d0_PYPL,PYPL,Is PYPL a good buy right now?,2021-12-02,52,43
pid32e_PYPL,PYPL,"Question concerning SQ, PYPL, MA and V",2021-09-05,51,47
qlh6e4_PYPL,PYPL,How are V(Visa) and PYPL(PayPal) looking,2021-11-02,36,43
qw06b3_PYPL,PYPL,V vs. PYPL vs. GPN,2021-11-17,27,42
7m1q9h_PYPL,PYPL,$AAPL v $MSFT v $V v $PYPL,2017-12-25,74,67
ubu01s_PYPL,PYPL,What are your 6 predictions for tech earnings this week? (Tues: GOOG MSFT Wed: FB Thurs: AMZN AAPL PYPL),2022-04-25,6,33
wetj9s_PYPL,PYPL,Paypal (PYPL) earning Q2 2022,2022-08-03,70,15
rdfop6_PYPL,PYPL,GPN vs. V vs. PYPL / what’s your pick?,2021-12-10,13,28
o7wqeh_PYPL,PYPL,$V and $PYPL,2021-06-25,16,32
u8akn9_PYPL,PYPL,How risky is it holding $PYPL into earnings?,2022-04-21,6,22
8ez1ho_PYPL,PYPL,PayPal (PYPL) earnings and future outlook (discussion),2018-04-26,73,41
lygri4_PYPL,PYPL,ARKK sold half of their $PYPL holdings,2021-03-05,18,31
7uedta_PYPL,PYPL,PYPL?,2018-01-31,30,50
k0vlvp_PYPL,PYPL,"PYPL bagholders, I implore you to sell",2020-11-25,0,35
loiynf_PYPL,PYPL,"LEAPS: AAPL, AMD, PINS, SQ, PYPL, ETSY",2021-02-20,12,30
t0k5ff_PYPL,PYPL,PYPL? Srsly?,2022-02-24,0,19
102gzlu_PYPL,PYPL,"Stocks making the biggest moves midday: TSLA, SQ, PYPL, COOK, MOH...",2023-01-03,14,9
ow5bbc_PYPL,PYPL,ASML vs PYPL.,2021-08-02,15,24
igjnwt_PYPL,PYPL,V or PYPL?,2020-08-25,12,31
n51nax_PYPL,PYPL,I just did the wildest thing I’ve ever done in trading. PYPL call options investment.,2021-05-04,0,26
y78h67_PYPL,PYPL,"Issues with the BNPL futures? - $AFRM, $SQ, $PYPL, and others",2022-10-18,7,10
ld7nma_PYPL,PYPL,PYPL and why I love the stock,2021-02-05,34,22
jz9gj7_PYPL,PYPL,PYPL Monday morning,2020-11-23,13,18
snvmvi_PYPL,PYPL,"$PYPL Paypal establishes a cross-disciplinary advisory council on Blockchain, Crypto and Digital Currencies (BCDC)",2022-02-08,27,7
obqofs_PYPL,PYPL,$PYPL stock holder -- Tons of Bearish puts today and bearish unusual options activity. Cause for concern?,2021-07-01,8,12
uw1vhj_PYPL,PYPL,"What’s wrong with PayPal ($PYPL)? They have a good PE ratio, are profitable (making money each quarter), and are selling at a 75% discount from their all time high? What am I missing?",2022-05-23,929,389
1amo7c0_PYPL,PYPL,"Dear PYPL bagholders, it's over",2024-02-09,183,207
1czoleo_PYPL,PYPL,PYPL (PayPal YOLO),2024-05-24,29,58
1difaum_PYPL,PYPL,PYPL Competitor Affirm Coming to Apple Pay | Bearish Signals Emerging | Still Hold or Buy More?,2024-06-18,20,13
16q08im_PYPL,PYPL,Exploring the Depths: PYPL and SQ Stocks nearing 52-week Lows – Is it time to dive in?,2023-09-23,12,18
1c4z1sf_PYPL,PYPL,"SHOP, PYPL, SNOW, ZS",2024-04-15,5,6
s3sqbk_PYPL,PYPL,PayPal (Ticker: PYPL) Investment Thesis,2022-01-14,36,40
10bdcuz_PYPL,PYPL,California Rep. Nancy Pelosi Sold Up to $1.00M Worth of PayPal Holdings Stock - PayPal Holdings (NASDAQ:PYPL),2023-01-14,93,17
7vz7k6_PYPL,PYPL,Fundamental Analysis Article: Paypal Corp $PYPL,2018-02-07,111,44
yd5l1z_PYPL,PYPL,"Amazon will now let users pay with Venmo at checkout, big win for PYPL!",2022-10-25,36,14
qsljob_PYPL,PYPL,"PYPL starting to recover, Airline industry takes a hit on a fairly positive day in the market",2021-11-12,56,22
ritz3z_PYPL,PYPL,PYPL vs. V,2021-12-17,5,24
13oa8z7_PYPL,PYPL,Elon might just be buying PYPL,2023-05-21,0,6
n51oz1_PYPL,PYPL,I just did the wildest thing I’ve ever done in trading. All my money PYPL call options .,2021-05-04,7,26
s268jo_PYPL,PYPL,Can someone explain to me how this change without sell volume works? (PYPL) 2% drop with no volume.,2022-01-12,5,13
qcc5df_PYPL,PYPL,Rough day for PYPL,2021-10-20,9,14
p9n1ed_PYPL,PYPL,"I scanned over 150 charts this weekend. Here are some good setups I found to BTFD (or sell CSPs): DKNG, SNOW, DPZ, PYPL, TSM",2021-08-22,27,8
pbzp7w_PYPL,PYPL,WHY people buy SQ when PYPL Is so much better ..,2021-08-26,1,4
mpere1_PYPL,PYPL,Watch $PYPL,2021-04-12,7,5
li81ie_PYPL,PYPL,"Is PayPal a good stock to buy? Wall Street certainly seems to think so: 35 analysts currently have a buy rating on PYPL, 5 say the stock will outperform the market, 6 recommend holding the stock, and just 1 has a sell rating",2021-02-12,7,6
o9jmy7_PYPL,PYPL,Check out this breakdown of PayPal Holdings Inc. (Ticker: PYPL) - Brief Breakdown,2021-06-28,2,0
78q08t_PYPL,PYPL,PayPal (PYPL)-Stock Has Impressive Q3 Results,2017-10-25,29,11
cmepv7_PYPL,PYPL,Why is PYPL tanking,2019-08-05,2,6
ajtce0_PYPL,PYPL,PYPL earnings next week,2019-01-25,5,5
7uj51m_PYPL,PYPL,PYPL down -8% after Ebay drops them as payment provider,2018-02-01,4,6
6pvzkd_PYPL,PYPL,"7.27.17 Thursday Stock Movers & News: TWTR, VZ, PG, LUV, DNKN, FB, GILD, PYPL, BWLD, WHR, AMZN & more",2017-07-27,18,2
3mbsas_PYPL,PYPL,"9/25/15 Friday Movers: BBRY, FINL, PYPL, BOX, MMM, SPLS, KO, BIG, AAPL, GOOGL, INTC, NKE, PIR, BBBY, AMZN",2015-09-25,12,0
1f8jl2n_PYPL,PYPL,Paypal Inc (PYPL) by Miller Funds,2024-09-04,3,0
pdg93k_PYPL,PYPL,Cathie Wood thinks SQ/PYPL will be difficult for the banks to overcome. She makes some grand claims halfway in this vid. Thoughts?,2021-08-28,73,9
yu2bk9_PYPL,PYPL,"QQQ has broken the 50 SMA, back in bullish territory? Looking at beaten names: TSLA, SQ, CRWD, PYPL",2022-11-13,244,55
1innoj3_PYPL,PYPL,Need Advice on PYPL Assignment & GOOG Roll Strategy After Recent Hits (SP),2025-02-12,5,6
15eucdp_PYPL,PYPL,Anyone playing PYPL earnings?,2023-07-31,16,51
qzdb4n_PYPL,PYPL,Has $PYPL bottomed?,2021-11-22,24,65
1d7xzej_PYPL,PYPL,PYPL option play,2024-06-04,8,11
1eltgdl_PYPL,PYPL,Anyone playing with PYPL covered call?,2024-08-06,5,1
152cuiv_PYPL,PYPL,Advice needed for PYPL selling call option strategy,2023-07-17,12,24
12619ki_PYPL,PYPL,Has anyone following PYPL option closely?,2023-03-29,10,22
loixzf_PYPL,PYPL,"LEAPS: AAPL, AMD, PINS, SQ, PYPL, ETSY",2021-02-20,23,46
13hx79o_PYPL,PYPL,"Sold PYPL 62 Put expiring 19 May, might get assigned in IBKR Margin Account",2023-05-15,0,15
13w24hj_PYPL,PYPL,Anyone looking at Pypl $70 call on august 18 or sept 15?,2023-05-30,4,9
p9n21y_PYPL,PYPL,"I scanned over 150 charts this weekend. Here are some good setups I found to BTFD (or sell CSPs): DKNG, SNOW, DPZ, PYPL, TSM",2021-08-22,67,21
rp6iw9_PYPL,PYPL,"PYPL or SQ Calls, a tasty play for 2022?",2021-12-26,10,25
xcmvj8_PYPL,PYPL,Thinking about opening PYPL Jan2023 $120 call option?,2022-09-12,3,17
siwvpe_PYPL,PYPL,PYPL 170 Jan 20 2023 call option,2022-02-02,4,20
skeyc1_PYPL,PYPL,CCs on $PYPL,2022-02-04,0,20
tkhntc_PYPL,PYPL,Short term outlook for AMD vs. PYPL?,2022-03-23,8,15
rneglk_PYPL,PYPL,Pypl covered calls,2021-12-24,7,16
rvd5bg_PYPL,PYPL,PYPL 2023 220 CALL,2022-01-03,1,11
qxnu4t_PYPL,PYPL,PYPL put debit spread 12/3 190-185,2021-11-19,1,7
rbw08x_PYPL,PYPL,$PYPL Coming Off the Deck,2021-12-08,12,5
i8s8e6_PYPL,PYPL,Naked Put PYPL went bad,2020-08-13,4,13
qp0tc8_PYPL,PYPL,"Historical Post Earnings Moves MEGA Compilation AND Analysis (Q3 Week 5) - $CLOV, $PLTR, $SPCE, $PYPL, $DIS, $NIO, $UPST and More",2021-11-07,16,3
qclxfi_PYPL,PYPL,"PYPL long/PINS short, DTE 1",2021-10-21,2,2
rv4t11_PYPL,PYPL,"Capture $PYPL CC premium with BMO upgrade, or hold on?",2022-01-03,1,0
kib6z0_PYPL,PYPL,Advice on PYPL (Unsure if I should close position),2020-12-22,1,6
7uf5f7_PYPL,PYPL,I've read that volume is an important indicator. PYPL sold off heavily after earnings on strong volume but closed after paring losses(but on weaker volume). Implications?,2018-02-01,25,12
o72fpj_PYPL,PYPL,PYPL 295c 6/25 @ 1.14,2021-06-24,2,0
dvsql0_PYPL,PYPL,PYPL November 29 Calls,2019-11-13,28,4
7uk5hl_PYPL,PYPL,"BABA, JNJ, and PYPL 2/9 calls",2018-02-01,2,10
8qnxnx_PYPL,PYPL,$SQ and $PYPL Inverted Strangles....Any Advice Appreciated,2018-06-13,1,8
7boqwo_PYPL,PYPL,PYPL - To Roll or Spread,2017-11-08,1,8
ch9dqt_PYPL,PYPL,My Earnings Analysis: $LVS $FB $NOW $PYPL $XLNX,2019-07-24,1,1
8x76t6_PYPL,PYPL,$SQ $PYPL Inverted Positons - Updated,2018-07-09,4,1
ytd999_PYPL,PYPL,Took this PYPL call off a broadening formation which returned over 500%. Details in images,2022-11-12,105,38
1d9y976_PYPL,PYPL,PYPL Thoughts,2024-06-07,1,1
vj2ruz_PYPL,PYPL,Who has a better chance to recover? Nvda or Pypl?,2022-06-23,0,13
yp264a_PYPL,PYPL,Today's trades: BAC + PYPL,2022-11-07,1,6
rw7jh9_PYPL,PYPL,"PYPL Daily Chart: Gap Detection, Anchored VWAP, Anchored VBP & More",2022-01-04,21,6
sk286e_PYPL,PYPL,"M1904Trading's (insert whatever here) post - 02/03/22 - Literally perfect - ES, NQ, FAANG, PYPL,",2022-02-04,3,2
jf61jd_PYPL,PYPL,Let's See How SQ And PYPL Stock React To This News,2020-10-21,6,0
jx3l45_PYPL,PYPL,Stock Watch List - Nov 19 2020 ($TSLA $PYPL $TWLO $NFLX $CVNA $PTON $SNOW $PINS $DKNG),2020-11-19,5,0
jxpzm5_PYPL,PYPL,Stock Watch List - Nov 20 2020 ($YY $FSLY $GDRX $PYPL $SPCE $ROKU $MRNA $PDD $XPEV $PENN $TWLO $SNAP $ETSY $SQ),2020-11-20,2,0
17vtt69_PYPL,PYPL,$GBUX potential $PYPL competitor,2023-11-15,4,3
z356nq_PYPL,PYPL,Dovish FED means it's time to buy beat up fintech stocks - PSFE PYPL,2022-11-24,0,5
zk3qqj_PYPL,PYPL,$APCX Some highlights from this Research report. This E-commerce solutions processing company similar to $GPN and $JTPY and even $PYPL is consistently growing and developing. https://technewstrends.com/digital-banking/,2022-12-12,2,3
1b1i697_PYPL,PYPL,Would PYPL consider paying a dividend?,2024-02-27,2,9
1jejgs5_PYPL,PYPL,$PYPL : Severely Undervalued Cash King,2025-03-18,103,139
1j9uetv_PYPL,PYPL,$PYPL business model questions,2025-03-12,3,1
1dbwfd7_PYPL,PYPL,Thoughts on PYPL and BABA?,2024-06-09,95,184
1f480sd_PYPL,PYPL,Some time ago I posted about $PYPL…it’s still undervalued,2024-08-29,75,108
1fkn79l_PYPL,PYPL,$PYPL is still undervalued,2024-09-19,47,103
18oec3y_PYPL,PYPL,PAYPAL (PYPL) is a buy,2023-12-22,71,126
1al6isc_PYPL,PYPL,PYPL earnings today,2024-02-07,44,111
1efs44q_PYPL,PYPL,"PYPL Q2: EPS beat by 34%, payment volume up 11% YoY, stock up 9% in premarket",2024-07-30,73,49
sxppg3_PYPL,PYPL,Am I the only one who thinks the recent PYPL & META correction is a serious overreaction?,2022-02-21,101,158
1cza2si_PYPL,PYPL,cathie wood bought pypl,2024-05-24,31,62
1dgxjiy_PYPL,PYPL,PYPL vs SQ - which is the better investment?,2024-06-16,28,52
189637e_PYPL,PYPL,PYPL Valuation,2023-12-02,44,72
1fc1qja_PYPL,PYPL,$PYPL discussion,2024-09-08,11,37
19finnj_PYPL,PYPL,Is there a case for PYPL?,2024-01-25,35,62
1h6q6fp_PYPL,PYPL,PayPal (pypl) ,2024-12-04,1,22
1ded7vf_PYPL,PYPL,Thoughts on PYPL after Apple’s Tap-to-Pay announcement?,2024-06-12,24,27
1dwboue_PYPL,PYPL,Complications in Valuing PYPL,2024-07-05,8,19
15aex0a_PYPL,PYPL,PYPL - Any thoughts?,2023-07-26,30,43
19dwymq_PYPL,PYPL,The future of fin-tech. Thoughts on PYPL?,2024-01-23,16,28
st530r_PYPL,PYPL,Is PYPL undervalued?,2022-02-15,26,65
1aoprc5_PYPL,PYPL,Numerical Valuation for Why PYPL Could Be Undervalued,2024-02-12,27,16
1f8jlif_PYPL,PYPL,Paypal Inc (PYPL) by Miller Funds,2024-09-04,0,0
18c7az6_PYPL,PYPL,How does PYPL make money selling BNPL?,2023-12-06,21,12
13he0yl_PYPL,PYPL,PYPL Quick DCF,2023-05-14,8,24
17htkq3_PYPL,PYPL,Survey results about r/ValueInvesting sentiment on PYPL...,2023-10-27,4,5
