Post_ID,Ticker,Title,Post_Date,Upvotes,Num_Comments
be0glg_AAPL,AAPL,"QCOM Vs. AAPL settlement. How I lost the opportunity to make $50,000 on a very stupid decision",2019-04-16,373,169
15d5z6w_AAPL,AAPL,"Intel $INTC earnings beat expectations which is good news for Apple $AAPL, Qualcomm $QCOM, and AMD $AMD",2023-07-29,117,73
10rwg84_AAPL,AAPL,"Option Probability Updates on SBUX, QCOM, HIG, GILD, F, CLX, AAPL, AMZN, GOOGL",2023-02-02,62,37
jvof7m_AAPL,AAPL,Stock Watch List - Nov 17 2020 ($NFLX $QDEL $SNAP $PLUG $ETSY $ZM $QCOM $AMD $RKT $AAPL $PINS $GM $TSLA),2020-11-17,4,2
1gp088h_MSFT,MSFT,Why is QCOM still stuck at ~$165? It's a high-growth chip stock at a fwd P/E of 15!,2024-11-11,19,36
10rwg84_GOOGL,GOOGL,"Option Probability Updates on SBUX, QCOM, HIG, GILD, F, CLX, AAPL, AMZN, GOOGL",2023-02-02,58,37
10rwg84_AMZN,AMZN,"Option Probability Updates on SBUX, QCOM, HIG, GILD, F, CLX, AAPL, AMZN, GOOGL",2023-02-02,61,37
10s0dgo_AMZN,AMZN,"[UPDATE] Option Probabilities on SBUX, QCOM, HIG, GILD, F, CLX, AAPL, AMZN, GOOG",2023-02-02,4,5
pcf16a_NVDA,NVDA,"Is the semiconductor/processor industry (NVDA, AMD, TSM, QCOM) a no-brainer investment for a 10+ yr time frame?",2021-08-27,477,277
qz9vvh_NVDA,NVDA,QCOM or NVDA,2021-11-22,2,8
1ewbblz_IBM,IBM,Why is QCOM so cheap?,2024-08-19,47,82
1fmx1eo_INTC,INTC,Shoutout that $QCOM/$INTC news on Friday. Always take your gains.,2024-09-22,155,33
5pp3xb_INTC,INTC,Lets talk about QCOM and INTC?,2017-01-23,17,34
15d5z6w_INTC,INTC,"Intel $INTC earnings beat expectations which is good news for Apple $AAPL, Qualcomm $QCOM, and AMD $AMD",2023-07-29,114,73
w5rla7_INTC,INTC,"I see a bunch of $NVDA, $INTC, $QCOM trades by politicians",2022-07-23,2,9
mrnxcg_INTC,INTC,"Your take on Chips (AMD, NVDA, QCOM, INTC)",2021-04-15,8,22
13d6zvc_INTC,INTC,AVGO vs QCOM vs INTC Which is a Better Investment?,2023-05-09,3,17
1kf0p1b_AMD,AMD,Is Qcom still Considered a Good Hold??,2025-05-05,9,28
1kf0omv_AMD,AMD,Is Qcom still Considered a Good Hold??,2025-05-05,6,4
pcf16a_AMD,AMD,"Is the semiconductor/processor industry (NVDA, AMD, TSM, QCOM) a no-brainer investment for a 10+ yr time frame?",2021-08-27,478,277
15d5z6w_AMD,AMD,"Intel $INTC earnings beat expectations which is good news for Apple $AAPL, Qualcomm $QCOM, and AMD $AMD",2023-07-29,112,73
1kf0ovj_AMD,AMD,Is Qcom still Considered a Good Hold??,2025-05-05,0,19
mrnxcg_AMD,AMD,"Your take on Chips (AMD, NVDA, QCOM, INTC)",2021-04-15,9,22
jvof7m_AMD,AMD,Stock Watch List - Nov 17 2020 ($NFLX $QDEL $SNAP $PLUG $ETSY $ZM $QCOM $AMD $RKT $AAPL $PINS $GM $TSLA),2020-11-17,4,2
1gp088h_AMD,AMD,Why is QCOM still stuck at ~$165? It's a high-growth chip stock at a fwd P/E of 15!,2024-11-11,19,36
1kf0p1b_QCOM,QCOM,Is Qcom still Considered a Good Hold??,2025-05-05,9,28
1cilnaq_QCOM,QCOM,QCOM is the future,2024-05-02,8,27
1fmx1eo_QCOM,QCOM,Shoutout that $QCOM/$INTC news on Friday. Always take your gains.,2024-09-22,152,33
1aippe6_QCOM,QCOM,QCOM Thesis,2024-02-04,27,51
1dy2gpj_QCOM,QCOM,$QCOM latest Chip to have Silicon Battery. Only one co in the world can do this $ENVX,2024-07-08,47,27
1arcdvv_QCOM,QCOM,Why its time for $QCOM,2024-02-15,59,28
1fmmzsv_QCOM,QCOM,"I have sell ETF shares after hold 9 months, for buy QCOM 😎",2024-09-22,8,11
1cyt07q_QCOM,QCOM,QCOM and Small LLMs,2024-05-23,16,24
ku9cvm_QCOM,QCOM,Missed the NIO train? Get on the QCOM rocket asap 🚀🚀🚀🚀,2021-01-10,75,87
jojun5_QCOM,QCOM,$QCOM Earnings YOLO play 132$ 11/6,2020-11-05,291,36
1de1fom_QCOM,QCOM,QCOM disARMEd?: Heise reports: ARM torpedoes Windows on ARM: Demands destruction of all PCs with Snapdragon X,2024-06-12,8,12
1ehnnae_QCOM,QCOM,Qualcomm (QCOM) Q2 2024 earnings: A strong showing driven by 5G and AI trends,2024-08-01,8,4
17zphrl_QCOM,QCOM,All in Long Term on Globalstar (NYSE: GSAT) - Partnerships with Apple (NASDAQ: AAPL) and Qualcomm (NASDAQ: QCOM),2023-11-20,22,20
9zhykj_QCOM,QCOM,"Was down to $296 at the start of the month from a $5k starting balance and some terrible bandwagon trading. Drinks are on ZG,QCOM, and NVDA",2018-11-22,313,28
beenic_QCOM,QCOM,Held last night sold this morning for extra 4K. Was only 4 $60 $QCOM 4/18 Calls. These were my first options plays.,2019-04-17,163,39
qvhq2s_QCOM,QCOM,Not a bad day thanks $IONq $QCOM,2021-11-16,74,29
4tt4be_QCOM,QCOM,$QCOM Destroys earnings. GFY. I am your new false god.,2016-07-20,36,70
bdxubd_QCOM,QCOM,Thanks appl and qcom for settling the dispute,2019-04-16,198,30
4ttn2h_QCOM,QCOM,"Good job on $PGNX and $QCOM, WSB. What's next?",2016-07-20,36,70
8x3asx_QCOM,QCOM,"New York jury convicts two men for trading on hacked press releases ($AMD, $QCOM, $CAT, $HD)",2018-07-08,96,45
brms87_QCOM,QCOM,QCOM hit with antitrust,2019-05-22,91,39
10rwmhx_QCOM,QCOM,"Option Probability Updates on SBUX, QCOM, HIG, GILD, F, CLX, AAPL, AMZN, GOOGL",2023-02-02,13,14
qtf19x_QCOM,QCOM,QCOM$$$ 😍,2021-11-14,140,10
16nrvdd_QCOM,QCOM,Qualcomm (QCOM) Down on China Woes: Should Investors Worry?,2023-09-20,3,3
r5jxpd_QCOM,QCOM,Why you should buy $QCOM,2021-11-30,33,21
5pp3rl_QCOM,QCOM,$QCOM FIRE SALE BUY THE DIP,2017-01-23,20,55
s22k34_QCOM,QCOM,Buy QCOM now! Samsung cancelled Exynos. All Galaxy S22 rumoured to be using Qualcomm chips.,2022-01-12,19,21
hggcml_QCOM,QCOM,"Anybody know what was up with the sell off of AMD, INTC & QCOM right before close?",2020-06-26,7,31
ji77p9_QCOM,QCOM,QUALCOMM DD - QCOM shouldn't be overlooked especially with iPhone 13 rumors for improved 5G Modem,2020-10-26,25,24
tmc0sj_QCOM,QCOM,"Ladies and Gentlemen, #Chip Gang is back in business. 88k QCOM YOLO",2022-03-24,22,13
jwsd1u_QCOM,QCOM,Send QCOM to the Moon!!,2020-11-19,17,24
4tln29_QCOM,QCOM,Qualcomm Earnings ($QCOM),2016-07-19,55,37
gah5rz_QCOM,QCOM,"$FB, $MSFT, $QCOM, $TSLA* earnings after hours, and Fed will continue zero interest rates and money printing. All in on calls for all 4 of them, plus calls on $SPY as well. Money Pump Bump!",2020-04-29,37,21
qvqs1r_QCOM,QCOM,$QCOM : Sleeping giant awakens,2021-11-17,41,10
6sq6ac_QCOM,QCOM,I'm all in on QCOM ($101.5k) - AMA,2017-08-10,11,38
vuhfsi_QCOM,QCOM,CASe for QcOm ST0Nk,2022-07-08,2,8
u93itt_QCOM,QCOM,Why does QCOM stock continuously send me to the dumpster?,2022-04-22,7,9
6ck6za_QCOM,QCOM,Let's talk about $QCOM.,2017-05-22,71,26
iog3fq_QCOM,QCOM,QCOM QUEEFS,2020-09-07,25,17
4twzqz_QCOM,QCOM,Thanks for QCOM guys,2016-07-21,67,28
a4x52t_QCOM,QCOM,"IPhones banned in China , QCOM lawsuit",2018-12-10,54,20
6o8t47_QCOM,QCOM,QCOM earnings today big mover,2017-07-19,9,31
n9unle_QCOM,QCOM,The legitimate case for $QCOM.,2021-05-11,15,13
begm48_QCOM,QCOM,Thank you QCOM,2019-04-18,89,14
4u5560_QCOM,QCOM,QCOM option first time,2016-07-22,16,31
ckdr8b_QCOM,QCOM,QCOM Earnings?,2019-07-31,15,19
66aujy_QCOM,QCOM,Anyone playing QCOM Earnings today??,2017-04-19,10,28
lcpvjc_QCOM,QCOM,Good day to buy some $QCOM options?,2021-02-04,19,9
s8yi2v_QCOM,QCOM,I heard QCOM is cool again,2022-01-21,15,3
9f2w4x_QCOM,QCOM,Buy QCOM Leaps 2020 (DD inside).,2018-09-12,17,19
evosp5_QCOM,QCOM,Buy QCOM,2020-01-29,16,13
ckc2y4_QCOM,QCOM,qcom gonna pull an AMD,2019-07-31,18,14
jom1wc_QCOM,QCOM,What are your guys thoughts on QCOM?,2020-11-05,1,8
9ap6wf_QCOM,QCOM,$QCOM 8/31 $90C - $1.1Million option play went down this morning? Wtf?,2018-08-27,17,16
be10jb_QCOM,QCOM,"QCOM up on agreedment with Apple. Good news, but is it is it THAT good?",2019-04-16,9,14
i8j6m3_QCOM,QCOM,QCOM,2020-08-12,18,7
1kf0omv_QCOM,QCOM,Is Qcom still Considered a Good Hold??,2025-05-05,7,4
p2v8y4_QCOM,QCOM,"Thirteen stocks possibly worth attention, a consensus strategy: FAF, FB, FSS, GLPI, HWKN, ICLR, IEX, JNJ, LRCX, MDLZ, OTEX, QCOM, QRVO",2021-08-12,194,82
1hjlx7f_QCOM,QCOM,Qcom and ARM stock future,2024-12-21,10,4
owl3to_QCOM,QCOM,"Investing in VR, $QCOM or $FB",2021-08-02,15,69
bdyvir_QCOM,QCOM,Qualcomm and Apple agree to drop all litigation. QCOM up 23%,2019-04-16,73,36
i085yu_QCOM,QCOM,QCOM gives strong forecast and stock price jumps 12% aftermarket,2020-07-29,68,22
5pp3xb_QCOM,QCOM,Lets talk about QCOM and INTC?,2017-01-23,19,34
i5chwc_QCOM,QCOM,"The growing anti-US sentiment in China could potentially hurt US companies with high revenue exposure to China (e.g. WYNN, QCOM, MU, QRVO) much more than companies who produce there (e.g. AAPL, NKE) and companies who make most of their money outside China (e.g. SBUX, GM, CAT, BA)",2020-08-07,17,15
7al3yi_QCOM,QCOM,Broadcom (AVGO) exploring the possibility of Qualcomm (QCOM) takeover,2017-11-03,39,22
3wxt72_QCOM,QCOM,Thoughts on Qualcomm (QCOM) ?,2015-12-15,9,27
6ox5de_QCOM,QCOM,Is QCOM a Sell or Hold?,2017-07-22,20,17
bro70u_QCOM,QCOM,How bad is the judge's ruling siding the with ftc against qcom?,2019-05-22,6,12
hzfsh0_QCOM,QCOM,QCOM Earnings,2020-07-28,1,4
82jrb0_QCOM,QCOM,Broadcom’s proposed acquisition of $QCOM could pose a national security risk says US gov,2018-03-06,13,7
79q0yp_QCOM,QCOM,QCOM/NXPI Buyout,2017-10-30,22,7
9056o0_QCOM,QCOM,$QCOM purchase of NXP still waiting for China’s approval. Plans $20B stock buyback if not approved.,2018-07-19,3,7
8qjyfk_QCOM,QCOM,Qcom shareholder alert,2018-06-12,1,6
2l760d_QCOM,QCOM,QCOM as a long-term dividend growth investment?,2014-11-03,9,12
2bmfax_QCOM,QCOM,Is QCOM a buy during this dip?,2014-07-24,5,13
a1ea0q_QCOM,QCOM,Buy QCOM?,2018-11-29,3,4
anliwf_QCOM,QCOM,QCOM or AMAT or UTX and why,2019-02-06,5,3
3rny5n_QCOM,QCOM,Anyone buying the QCOM dip?,2015-11-05,5,10
pjpqa_QCOM,QCOM,"Tech Stocks to Buy Not Called Facebook or Apple - QCOM, RAX, Z - Foolish Blogging Network",2012-02-10,10,12
5lcaf1_QCOM,QCOM,Is there a cutoff date to buy NXPI shares before QCOM buyout completes?,2016-12-31,14,4
2twzfw_QCOM,QCOM,"driverless cars,good investment? qcom,nvda",2015-01-28,0,7
7albh6_QCOM,QCOM,NXPI falling on AVGO QCOM deal,2017-11-03,2,1
1a9jox_QCOM,QCOM,Thoughts on QCOM,2013-03-14,14,7
5qc5vb_QCOM,QCOM,NYSE:TGT or NASDAQ:QCOM,2017-01-26,2,2
5hxxpb_QCOM,QCOM,QCOM aquiring NXPI $110 per share seems low,2016-12-12,3,2
ybg9e_QCOM,QCOM,Suggestions for buying QCOM,2012-08-16,2,6
1d374o_QCOM,QCOM,QCOM for 1yr+ investment,2013-04-25,2,5
2oeaf9_QCOM,QCOM,Trying to understand QCOM,2014-12-05,1,2
2mpqjf_QCOM,QCOM,What do you guys think about QCOM?,2014-11-18,1,2
rtcn0_QCOM,QCOM,QCOM: Small Buy Or No?,2012-04-04,2,1
1kf0ovj_QCOM,QCOM,Is Qcom still Considered a Good Hold??,2025-05-05,0,19
pcf16a_QCOM,QCOM,"Is the semiconductor/processor industry (NVDA, AMD, TSM, QCOM) a no-brainer investment for a 10+ yr time frame?",2021-08-27,477,277
1ewbblz_QCOM,QCOM,Why is QCOM so cheap?,2024-08-19,47,82
be0glg_QCOM,QCOM,"QCOM Vs. AAPL settlement. How I lost the opportunity to make $50,000 on a very stupid decision",2019-04-16,375,169
15d5z6w_QCOM,QCOM,"Intel $INTC earnings beat expectations which is good news for Apple $AAPL, Qualcomm $QCOM, and AMD $AMD",2023-07-29,113,73
122tqkk_QCOM,QCOM,Qualcomm #QCOM is a good bargain at this price.,2023-03-26,60,38
m3j30i_QCOM,QCOM,$QCOM currently a buy for long term?,2021-03-12,79,71
1ekmu4o_QCOM,QCOM,QCOM ( Qualcomm) under valued ,2024-08-05,7,7
13u4tnm_QCOM,QCOM,looking for qcom advise,2023-05-28,17,20
bdxun3_QCOM,QCOM,Qcom vs Apple is finally over,2019-04-16,125,37
tsgkrx_QCOM,QCOM,Why did the $QCOM drop so hard today?,2022-03-30,0,29
gagphq_QCOM,QCOM,"QCOM, MSFT and FB all SURGING AH after good earnings",2020-04-29,11,46
qmgddb_QCOM,QCOM,"Qualcomm (QCOM) EPS beats by 0.29$, beats on revenue, guides Q1 above estimates",2021-11-04,41,19
lco711_QCOM,QCOM,Would $QCOM be a good buy right now?,2021-02-04,20,23
lij4qm_QCOM,QCOM,"Google, msft and qcom protesting Arm's acquisition by nvda!",2021-02-12,16,17
leawdx_QCOM,QCOM,Which do you like more after earnings stock price slides: U or QCOM?,2021-02-07,13,11
k6ps9s_QCOM,QCOM,QCOM?!?,2020-12-04,13,10
9iulwl_QCOM,QCOM,Opinions on $QCOM?,2018-09-25,12,20
iino69_QCOM,QCOM,Anyone got some insight on Qualcomm (QCOM)?,2020-08-29,0,12
l9obwp_QCOM,QCOM,Wash rule sale question. Sell INTC loss then buy QCOM.,2021-01-31,7,7
bktnhk_QCOM,QCOM,Is it the right time to buy into QCOM?,2019-05-05,10,15
ga1x3c_QCOM,QCOM,Considering two stocks : RTX and QCOM,2020-04-29,2,11
hp5vze_QCOM,QCOM,QCOM or INTC?,2020-07-11,1,10
d3trpu_QCOM,QCOM,Need advice; Bought QCOM at $78.57 per. Did I make a mistake?,2019-09-13,1,12
a08rj4_QCOM,QCOM,Your opinion on Qualcomm (QCOM),2018-11-25,21,12
jhismz_QCOM,QCOM,QCOM,2020-10-24,1,6
lg622z_QCOM,QCOM,The case for QCOM buy-the-dip and hold,2021-02-09,11,3
i4gq85_QCOM,QCOM,QCOM comes to deal with Huawei over patent infringement,2020-08-05,8,5
k0vjwt_QCOM,QCOM,QCOM?,2020-11-25,5,2
7al7kz_QCOM,QCOM,QCOM is spiking right now!,2017-11-03,11,11
9fobvb_QCOM,QCOM,QCOM - stock buy backs. What are your thoughts?,2018-09-14,13,7
61o95w_QCOM,QCOM,QCOM or HIMX?,2017-03-26,2,12
dzbhua_QCOM,QCOM,Thoughts on whether or not $QCOM can keep rallying?,2019-11-21,7,2
5vim0j_QCOM,QCOM,QCOM,2017-02-22,7,9
67xwtg_QCOM,QCOM,What are your thoughts on QCOM,2017-04-27,4,9
e5y5cl_QCOM,QCOM,Thoughts on QCOM,2019-12-04,0,1
69yb8p_QCOM,QCOM,"QCOM(Qualcomm) is there any chance, that stock will rise?",2017-05-08,2,8
5rzznh_QCOM,QCOM,Thoughts on QCOM?,2017-02-04,4,8
82typ1_QCOM,QCOM,Question regarding QCOM,2018-03-08,3,5
73uot7_QCOM,QCOM,Thoughts on swapping my QCOM stock for WDC?,2017-10-02,2,5
84i0jq_QCOM,QCOM,Should I start hoarding QCOM?,2018-03-14,1,4
alalmo_QCOM,QCOM,Whats your guys take on QCOM these days,2019-01-30,3,1
6q5imd_QCOM,QCOM,Is $QCOM oversold?,2017-07-28,6,3
7adf2m_QCOM,QCOM,QCOM Earnings: Where's the positive?,2017-11-02,1,3
6picru_QCOM,QCOM,$QCOM Sell or Hold?,2017-07-25,3,3
84r1ps_QCOM,QCOM,Ex-chairman Jacobs seeks to buy QCOM with SoftBank,2018-03-15,2,1
827x7x_QCOM,QCOM,US gives QCOM 30 day cooling period -CNBC,2018-03-05,11,0
5ueg41_QCOM,QCOM,$QCOM is coming back up,2017-02-16,1,3
5sxf9q_QCOM,QCOM,(QCOM) What are your thoughts on this company?!,2017-02-09,1,3
4ts7un_QCOM,QCOM,QCOM fine,2016-07-20,1,4
4x4iam_QCOM,QCOM,$QCOM aftermarket tank,2016-08-10,2,3
5jkw6a_QCOM,QCOM,QCOM acquisition of NXP: how official is it? Add position in NXP or just start buying QCOM?,2016-12-21,4,2
6puosc_QCOM,QCOM,"Thoughts on $TJX, $GE, $QCOM",2017-07-27,2,1
3egmej_QCOM,QCOM,INTC and QCOM,2015-07-24,1,2
4rinwc_QCOM,QCOM,$QCOM sales forecast just turned negative :(,2016-07-06,2,0
1tqnjt_QCOM,QCOM,Any news on the rumor that the next Nexus 7 will have an INTC z3000 and not a QCOM chip in 2014?,2013-12-26,5,3
3869kd_QCOM,QCOM,Should Qualcomm(QCOM) participate in the semi-conductor m&a frenzy?,2015-06-02,2,1
3nt5e6_QCOM,QCOM,QCOM questions,2015-10-07,1,0
3fyte4_QCOM,QCOM,Thinking of buying QCOM.,2015-08-06,2,0
sse3p_QCOM,QCOM,"Apple-Fever Spreads To Its Component Makers (AAPL, AMD, BRCM, MRVL, MU, LSI, QCOM, SNDK, SWKS, TQNT)",2012-04-25,9,2
15h7pn0_QCOM,QCOM,"What happened to QCOM, any predictions?",2023-08-03,24,32
13ei4f9_QCOM,QCOM,Possible bearish signals with QUALCOMM ($QCOM) insiders disposing stock,2023-05-11,2,6
w5rla7_QCOM,QCOM,"I see a bunch of $NVDA, $INTC, $QCOM trades by politicians",2022-07-23,3,9
137ccs8_QCOM,QCOM,Qualcomm ($QCOM) disappointing guidance on the slow China recovery will force our hand on the stock.,2023-05-04,4,0
m7rlxr_QCOM,QCOM,Qcom Vs Tesla,2021-03-18,2,7
oiqxev_QCOM,QCOM,[DD] QUalcomm (QCOM),2021-07-12,6,2
ct1t01_QCOM,QCOM,QCOM Technical Analysis Report - Now May Be a Good Time to Buy,2019-08-20,11,4
55o2yi_QCOM,QCOM,Expectations for QCOM?,2016-10-03,5,1
67dgvr_QCOM,QCOM,"Uniform Accounting Highlights QCOM will see declining EPS’ going forward, meaning it’s not a value name, but potentially a value trap",2017-04-25,3,0
2qgd18_QCOM,QCOM,"Early movers: SNE, QCOM, MHFI, TSLA, GPRO & more",2014-12-26,2,4
3e1t2s_QCOM,QCOM,"Reuters/WSJ: Qualcomm considering a breakup, selling chip biz $QCOM",2015-07-21,6,2
3rmkfu_QCOM,QCOM,"11/5/15 Thursday Movers: TIME, SEAS, TAP, NDLS, FB, QCOM, WFM, FEYE, HOME, BOJA, AZN, GM, LUV, GDDY, MET, PRU & more",2015-11-05,2,1
2u08xg_QCOM,QCOM,QCOM -5% after the bell,2015-01-28,2,2
3lf8ho_QCOM,QCOM,"9/18/15 Friday Movers: ADBE, LQ, AET, IGT, AAPL, BAC, CVC, FB, EFX, BA, BWLD, QCOM, AKS, & TXN",2015-09-18,8,0
1tvmwj_QCOM,QCOM,"CNBC Fast Money desk long ideas - SBUX, XOM, QCOM, BAC, HA, FDX, EWW",2013-12-28,0,1
387n5n_QCOM,QCOM,Trapeze Asset Management Letter 1Q15: Featuring Qualcomm ($QCOM),2015-06-02,6,0
1hiui9l_QCOM,QCOM,ARM/QCOM post-close trial news,2024-12-20,1,0
10rwg84_QCOM,QCOM,"Option Probability Updates on SBUX, QCOM, HIG, GILD, F, CLX, AAPL, AMZN, GOOGL",2023-02-02,62,37
10s0dgo_QCOM,QCOM,"[UPDATE] Option Probabilities on SBUX, QCOM, HIG, GILD, F, CLX, AAPL, AMZN, GOOG",2023-02-02,3,5
mrnxcg_QCOM,QCOM,"Your take on Chips (AMD, NVDA, QCOM, INTC)",2021-04-15,8,22
lr6da4_QCOM,QCOM,Trade of the Year: QCOM 01/21/22 Call $135 Strike DD,2021-02-24,34,13
leazn6_QCOM,QCOM,Which do you like more after earnings stock price slides: U or QCOM?,2021-02-07,3,6
mukocn_QCOM,QCOM,QCOM 137 CALL (4/23),2021-04-20,2,4
bpdfbo_QCOM,QCOM,7/19 $QCOM $90 Call Strike best pay for averaging down?,2019-05-16,5,10
81m151_QCOM,QCOM,Critique QCOM Straddle ahead of board vote,2018-03-03,1,14
joljpn_QCOM,QCOM,QCOM 1200% plays,2020-11-05,0,0
97ez8d_QCOM,QCOM,"Monitor my plays for the week - In TSLA, AMZN, UNP, UNH, QCOM, AMD, AAPL",2018-08-15,0,2
5pu6e4_QCOM,QCOM,Black swans do exist! Why giving up a few dimes to spread will save your butt! (Qcom),2017-01-24,7,3
648k1t_QCOM,QCOM,How I manage my losing QCOM trade,2017-04-08,0,0
leehd4_QCOM,QCOM,QCOM Calls,2021-02-07,11,25
sjqk60_QCOM,QCOM,$QCOM Trade - 2022-02-03 (+.6R Profit),2022-02-03,2,0
jwaz9m_QCOM,QCOM,Stock Watch List - Nov 18 2020 ($BABA $QDEL $NFLX $FSLY $ZM $DKNG $KSS $TWLO $QCOM $RUN $PTON $EXPE),2020-11-18,4,7
q7dqwh_QCOM,QCOM,QCOM made 30% in a min on calls!,2021-10-13,2,1
qmp6ko_QCOM,QCOM,"$QCOM, option spread, and price action",2021-11-04,4,0
jvof7m_QCOM,QCOM,Stock Watch List - Nov 17 2020 ($NFLX $QDEL $SNAP $PLUG $ETSY $ZM $QCOM $AMD $RKT $AAPL $PINS $GM $TSLA),2020-11-17,4,2
jolxpe_QCOM,QCOM,Trade Review 11/3: $QCOM long and $RCL short +$606.31,2020-11-05,3,0
1gxd4hz_QCOM,QCOM,What do you think about QCOM?,2024-11-22,2,10
11lxjwo_QCOM,QCOM,QCOM dividend increase,2023-03-08,137,12
1d30jbl_QCOM,QCOM,QCOM thoughts and opinions,2024-05-29,3,3
13d6zvc_QCOM,QCOM,AVGO vs QCOM vs INTC Which is a Better Investment?,2023-05-09,5,17
119kei5_QCOM,QCOM,AVGO v. TXN v. QCOM,2023-02-23,11,15
11iiugv_QCOM,QCOM,"Does anyone own QCOM ? If so, aren’t the prospects great for this div stock?",2023-03-05,5,9
xa902f_QCOM,QCOM,"Growth/dividend i would say , looking at qcom and tsm right now , any tips ?",2022-09-09,4,13
zsr1qr_QCOM,QCOM,I love QCOM here is why,2022-12-22,8,8
tzvn1m_QCOM,QCOM,QCOM worth buying,2022-04-09,4,16
qz9vvh_QCOM,QCOM,QCOM or NVDA,2021-11-22,2,8
3ctxjw_QCOM,QCOM,Qualcomm: Dividend Stock Analysis - Qualcomm Inc. (NASDAQ:QCOM),2015-07-10,4,0
1gp088h_QCOM,QCOM,Why is QCOM still stuck at ~$165? It's a high-growth chip stock at a fwd P/E of 15!,2024-11-11,16,36
10usdzj_QCOM,QCOM,QCOM Value Play,2023-02-06,44,27
15h3wns_QCOM,QCOM,Qualcomm (QCOM),2023-08-03,33,13
119zxak_QCOM,QCOM,Analysis of Qualcomm (QCOM) stock,2023-02-23,36,18
lotvp4_QCOM,QCOM,Equity research (QCOM).pdf,2021-02-21,55,24
p6k18m_QCOM,QCOM,Thoughts on QCOM right now ?,2021-08-18,4,22
5zzsll_QCOM,QCOM,"Dabbled for a week made a whopping 3.50, still have QCOM and TACT that i'm holding, looking for some day trade suggestions or anything really, 520 in buying power. I'm leaving robinhood in like a week for another trading platform. Hoping to leave with a grand.",2017-03-17,2,9
6tv8qs_QCOM,QCOM,$QCOM,2017-08-15,4,2
