Post_ID,Ticker,Title,Post_Date,Upvotes,Num_Comments
i7wpmk_GLD,GLD,$slv and $gld gangs,2020-08-11,1045,246
is7hb1_GLD,GLD,Is now the time to become Rich AF from GLD and SLV and stack a Mil?,2020-09-13,79,79
l68ou8_GLD,GLD,SLV and GLD - the next GME?,2021-01-27,354,22
1c2avz2_GLD,GLD,"I'm bullish here, as debt is too big and growing, all metals are happy, and SLV still has a long way to go to catch up with GLD",2024-04-12,13,10
ix2r78_GLD,GLD,Where are my GLD & SLV gangs?,2020-09-21,56,60
ladv10_GLD,GLD,"FYI: If you make a sh**ton of money on SLV, GLD, PPLT or other precious metals ETF you pay a sh**ton of taxes because precious metals have a special tax rate",2021-02-01,121,35
k6bv16_GLD,GLD,Time go buy GLD/SLV calls you bastards,2020-12-04,91,43
gbrn6o_GLD,GLD,Gold silver ratio just set 100 year highs. SLV 15C 6/19 GLD 1500P 6/19,2020-05-01,34,54
i503w4_GLD,GLD,SLV & GLD relating to stimulus and NFP,2020-08-06,14,55
flcjl0_GLD,GLD,GLD and SLV calls increasing regardless of stock movement,2020-03-19,24,50
ibbbgz_GLD,GLD,Genuine thoughts on SLV GLD,2020-08-17,23,39
i4g3fc_GLD,GLD,Olympics canceled means $GLD and $SLV go parabolic,2020-08-05,86,21
imlb5i_GLD,GLD,"With all this market rug pull fuckery, SLV and GLD become safe havens",2020-09-04,20,27
1fkqckl_GLD,GLD,GLD vs SLV in this changing market ,2024-09-19,1,10
i67c1w_GLD,GLD,Are ETFs such as GLD and SLV tracking gold and silver spot price in danger?,2020-08-08,37,35
i7kl65_GLD,GLD,SLV/GLD Market Value Premium,2020-08-11,1,9
238qf9_GLD,GLD,Holding physical gold and silver while shorting GLD and SLV,2014-04-17,0,8
2s2n44_GLD,GLD,GLD and SLV ETF holdings,2015-01-11,3,5
3mt3w9_GLD,GLD,"Thoughts on SLV US and GLD US, time to buy commodities?",2015-09-29,2,3
2qrlnv_GLD,GLD,"Question on stocks like ""GLD"" and ""SLV"" which aren't backed by enough assets (like actual gold and silver) to cover them.",2014-12-30,0,1
1am5tl_GLD,GLD,What if there was a bitcoin ETF analogous to GLD and SLV for gold and silver?,2013-03-19,0,1
fuy3t_GLD,GLD,Daily Charting Silver and Gold SLV GLD at New Highs ,2011-03-01,0,0
kg2q61_GLD,GLD,Stimulus effect on commodities such as $SLV and $GLD,2020-12-19,4,5
arebbi_GLD,GLD,Cant invest in GLD or SLV. what are the alternatives?,2019-02-16,4,13
hzuvzk_GLD,GLD,What would be the outcome of potentially negative interest rates on GLD and SLV?,2020-07-29,1,5
4tc5k5_GLD,GLD,$SLV or $GLD,2016-07-17,0,7
4pnfiu_GLD,GLD,Why do GLD and SLV behave almost completely opposite to the average market?,2016-06-24,3,3
5bijxb_GLD,GLD,Future of GLD/SLV,2016-11-06,0,2
2gwizd_GLD,GLD,Possibly time to start investing in $PPLT $GLD and $SLV,2014-09-19,6,4
mxs3it_GLD,GLD,$SLV Intermediate-Term Bull Thesis in a Nutshell: we entered long Friday morning because: 1) 15-min = bullish Gartley harmonic in play 2) Hourly = bearish Gartley harmonic likely violated 3) Daily = bullish Gartley harmonic in play 4) Recent positive volume flow //Tags: Silver Gold $SIL $GLD //,2021-04-24,0,4
m0jrkr_GLD,GLD,$GLD struggling to regain entry into falling wedge after breaking bottom rail support. Meanwhile Gold CFDs price is approaching the bottom rail of its falling wedge. This is a most critical period for Gold. Discuss. ________________________________________________ $GLD $GDX $SLV $SIL $SPX $SPY,2021-03-08,6,0
1kfnft_GLD,GLD,JJC GLD SLV Precious Metals Uptrend Intact,2013-08-15,1,0
ceelzu_GLD,GLD,"SLV (iSilver Shares) of Real Silver, [It's pretty much your guys' last chance to get in on this] Going straight up like a rocket.",2019-07-17,0,22
7m58og_GLD,GLD,slv/gld/tlt,2017-12-26,5,17
dlog1w_GLD,GLD,CMC markets options trading on GLD.US and SLV.US?,2019-10-22,3,1
i1yk4m_GLD,GLD,SLV / GLD: My Guidelines and Opinions #2 The Coming FOMO!!,2020-08-01,0,23
ic3th8_GLD,GLD,"If there was a flash crash, what do you think would happen to SLV, GLD, cryptocurrencies, and gold itself, and *why*, please? Thanks!",2020-08-18,3,4
ceeujo_GLD,GLD,"SLV (iSilver Shares) of Real Silver, [It's pretty much your guys' last chance to get in on this] Going straight up like a rocket.",2019-07-17,0,4
la4mog_SLV,SLV,STOP BUYING SLV YOU SMOOTH BRAINED RETARDS ITS TECHNICALLY INVERSING GME. *I LOST MY CRAYONS SO I HAD TO USE REAL CHARTS*,2021-02-01,75361,2692
la1xhf_SLV,SLV,Guess who owns tonnes of $SLV options? Fuck Citadel. This shit is co-ordinated,2021-02-01,77553,2146
mbx510_SLV,SLV,"SLV is a complete scam, its a scalp trade set up by banks to screw over investors. Avoid it at all costs. The silver market is and has been rigged for years",2021-03-24,24640,2477
l6novm_SLV,SLV,"The real DD on SLV, the worlds biggest short squeeze is possible and we can make history",2021-01-28,15127,5395
l71rdv_SLV,SLV,SILVER BIGGEST SHORT SQUEEZE IN THE WORLD $SLV 25$ to 1000$,2021-01-28,5908,3214
l9jj7z_SLV,SLV,Why an SLV squeeze will 100% not work.,2021-01-31,5173,665
ljmwyt_SLV,SLV,$SLV Broke?,2021-02-14,2404,1160
l6fgbn_SLV,SLV,"The other post about SLV is absolutely correct. Silver is by far the most manipulated market in the world. JPM just paid $1 billion fine for their manipulation and they brushed it off and kept doing it. The other post didn’t say how to cause the squeeze, here’s how to play it",2021-01-27,3479,441
l8uu76_SLV,SLV,The $GME squeeze will bring down Melvin. The Silver squeeze will bring down the biggest banks in the world. That's why Robinhood barred trading of $SLV the day after they took a billion dollars in loans from JPM and Goldman Sachs. ARE YOU FUCKING KIDDING ME.,2021-01-30,2000,597
n1xbms_SLV,SLV,Silver YOLO - $1mm in PSLV shares and SLV calls,2021-04-30,1290,728
l92ma1_SLV,SLV,JPM & CITADEL AND HOW SLV IS CONNECTED. MAJOR SCHEME THAT WAS PLANNED AND HERE IS HOW YOU ARE GETTING PLAYED,2021-01-31,1432,565
la1m8w_SLV,SLV,WHATCH OUT APES - TELEGRAM WSB GROUP SIS PUSHING FOR SLV TO DISTRACT FROM GME,2021-02-01,4313,105
l8ogfn_SLV,SLV,Could not have been more proud of all you retards and apes $SLV $GME $NOK $BB $AMC,2021-01-30,1338,284
i7wpmk_SLV,SLV,$slv and $gld gangs,2020-08-11,1050,246
l9hvfu_SLV,SLV,Is $SLV a trap?,2021-01-31,770,289
ic11ti_SLV,SLV,"""Look at that retard I heard he didn't buy the SLV dip""",2020-08-18,1220,133
i84klt_SLV,SLV,SLV gang watching it go down all day to -14%,2020-08-12,1070,143
lc8vgo_SLV,SLV,$SLV is not going to get squeezed...$SLV is the Trojan Horse for the squeeze THAT'S ALREADY HAPPENING,2021-02-04,757,181
l7lx6t_SLV,SLV,The $SLV DD you were waiting for. Why this could be the next big thing. Don't expect it to Rocket like meme Stonks but SLV has a potential to go up by atleast 20% in next month or two.,2021-01-29,828,147
l6u9wu_SLV,SLV,"Once you're done with GME - $AG and $SLV, the gentleman's short squeeze, driven by macro fundamentals",2021-01-28,915,132
i7rkie_SLV,SLV,Where is my SLV gang..,2020-08-11,326,393
i5373o_SLV,SLV,600k+ gain on SLV in 3 days,2020-08-06,468,249
l9ssxq_SLV,SLV,Now CNN Spreading Lies About Us and SLV,2021-02-01,421,192
qtqhp0_SLV,SLV,"Armed to the Teeth with SPY Puts 🐻 SLV melting up, US economy melting down",2021-11-14,256,240
l8xaik_SLV,SLV,Think twice before investing in $SLV,2021-01-30,226,309
la6c8u_SLV,SLV,"They’re trying to divide us with this silver nonsense. Stay strong, stay together and stay the fuck away from SLV",2021-02-01,1194,61
laeon2_SLV,SLV,Congrats on giving Citadel 10 million today in SLV. And in giving Melvin Capital 15 billion on GME.,2021-02-01,673,101
l973g8_SLV,SLV,$SLV is dumb,2021-01-31,237,255
ihlg2w_SLV,SLV,SLV gang don't tweak.,2020-08-27,316,195
l7sx82_SLV,SLV,YOLO # 2 of 3. $150k in SLV.,2021-01-29,542,93
l85rgr_SLV,SLV,SLV YOLO,2021-01-29,350,134
l78kzn_SLV,SLV,"I heard SLV was a solid value investment. Don't worry, I didn't close my GME for this.",2021-01-28,601,80
i7wgrm_SLV,SLV,A lesson learned the hard way by SLV gang,2020-08-11,409,123
l6zla2_SLV,SLV,Why I think we See SLV hit an All-Time High In February,2021-01-28,578,75
l9tzkv_SLV,SLV,The DD on SLV - Updated 1/31 - clarity on what to buy,2021-02-01,94,216
i7x8x2_SLV,SLV,You fucking tissue hand pussies hold the SLV!,2020-08-11,251,138
i6q5hm_SLV,SLV,Only way to save WSBers is with double resuscitation after last week’s losses. SLV KODK PRPL,2020-08-09,305,118
ign3qp_SLV,SLV,fed conference thursday morning / buy SLV,2020-08-25,165,148
l7u6ag_SLV,SLV,SLV GAINS! I am going to the 🚀 who wants to come with me?,2021-01-29,373,77
i5m4ri_SLV,SLV,Real Talk: SLV,2020-08-07,86,189
i8cny1_SLV,SLV,Holler if you're a Diamond Hands SLV surfer?,2020-08-12,174,116
hy8wv9_SLV,SLV,Silver. $SLV call options. New York Comex.,2020-07-26,149,123
ib309w_SLV,SLV,"Ray Dalio’s hedge fund invests $400M in gold (and probably silver, too). SLV SURFERS RISE",2020-08-16,192,104
ictfdo_SLV,SLV,SLV Gang please comfort my dying calls🥺,2020-08-19,84,132
i06tbi_SLV,SLV,Well that was fucking dreadful (SLV),2020-07-29,92,119
l9opep_SLV,SLV,ATTN MODS: SLV pomp and dumpers and bullshit being spammed in inboxes,2021-01-31,159,87
l74l35_SLV,SLV,LET'S GO! $SLV NEXT STOP $100!,2021-01-28,460,37
l9w5ok_SLV,SLV,It's not about the short squeeze in $SLV,2021-02-01,0,135
1dg4zm7_SLV,SLV,Bullish on SLV $30 Calls for July 5th - Here's Why I'm All In! 🚀💰,2024-06-14,14,22
led04d_SLV,SLV,$SLV This is the Way (🦍 allowed),2021-02-07,0,123
la5g5f_SLV,SLV,BANG is BS. SLV is BS. There is only one squeeze. Game 🚀 Stop.,2021-02-01,183,63
ib68g3_SLV,SLV,"SLV share price and Google Search Traffic, a battle royale.",2020-08-17,138,78
1didv1l_SLV,SLV,"SLV $30 Calls - Added More Contracts, Staying Bullish on Silver 🚀",2024-06-18,18,12
1eu1pkc_SLV,SLV,SLV,2024-08-16,21,5
1hs8ku9_SLV,SLV,Why did AG and SLV uncouple from each other?,2025-01-03,6,1
1fkqckl_SLV,SLV,GLD vs SLV in this changing market ,2024-09-19,0,10
i67c1w_SLV,SLV,Are ETFs such as GLD and SLV tracking gold and silver spot price in danger?,2020-08-08,43,35
hv89sf_SLV,SLV,Recent Surge in SLV?,2020-07-21,19,35
flwtep_SLV,SLV,Physical Silver vs. Paper Silver (i.e. SLV) in this Crisis,2020-03-20,6,15
fun5uc_SLV,SLV,Any thoughts on USLV 3x SLV,2020-04-04,1,13
h7enn_SLV,SLV,What do you guys think of buying some SLV after last week's big drop?,2011-05-09,6,34
kpwsms_SLV,SLV,"Sold SLV at a loss last week, will buying SLVP tomorrow be considered a wash sale? (Substantially identical?)",2021-01-04,4,7
i7kl65_SLV,SLV,SLV/GLD Market Value Premium,2020-08-11,0,9
l9dkj3_SLV,SLV,Hi for those involved in buying SLV ETF . I am a veteran of the Silver Liberation Army (2010-2011),2021-01-31,1,2
fg2n73_SLV,SLV,What's the deal with SLV?,2020-03-09,0,4
gwxoq9_SLV,SLV,Slv silver rally?,2020-06-05,0,2
1rl6yj_SLV,SLV,What is your take on SLV?,2013-11-27,7,13
238qf9_SLV,SLV,Holding physical gold and silver while shorting GLD and SLV,2014-04-17,0,8
2s2n44_SLV,SLV,GLD and SLV ETF holdings,2015-01-11,2,5
3mt3w9_SLV,SLV,"Thoughts on SLV US and GLD US, time to buy commodities?",2015-09-29,2,3
2i4k9x_SLV,SLV,Eli5: Difference between ETF and ETN (slv vs slvo),2014-10-02,1,4
hf3om_SLV,SLV,I bet SLV trades in a sandpaper pattern for a few months (trading in a narrow band). A good time to make some money off options?,2011-05-19,3,5
2qrlnv_SLV,SLV,"Question on stocks like ""GLD"" and ""SLV"" which aren't backed by enough assets (like actual gold and silver) to cover them.",2014-12-30,0,1
h4uuc_SLV,SLV,"Silver getting slammed, no the dollar is getting a rally. SLV support levels chart within.",2011-05-05,1,4
1l7lpl_SLV,SLV,"The Daily Stock Forecast: Syria On Watch, Trade Only The Best levels! $SPY, $TSLA,$SLV, $JPM",2013-08-27,0,1
1am5tl_SLV,SLV,What if there was a bitcoin ETF analogous to GLD and SLV for gold and silver?,2013-03-19,0,1
giwuz_SLV,SLV,"Digging Deeper Into Silver (SLV, SLW, SIL) - Silver prices have once again set a record. The metal rose to $38.50/ounce, it’s highest level in 38 years.

",2011-04-05,5,1
jaeyp_SLV,SLV,Time to get back into PSLV or SLV?,2011-08-06,0,1
f2p2m_SLV,SLV,Silver SLV ETF Impact ,2011-01-15,5,0
fuy3t_SLV,SLV,Daily Charting Silver and Gold SLV GLD at New Highs ,2011-03-01,0,0
l1dqsq_SLV,SLV,SLV as a hedge against inflation due to new giant stimulus,2021-01-20,54,42
igfobs_SLV,SLV,"SLV- Fed Announcement Thursday, What's the protocol?",2020-08-25,16,18
lbat3j_SLV,SLV,"The Big Short Squeeze: Why Reddit Isn’t to Blame for the Silver ($SLV) Short Squeeze That Never Was, and Why Stable Silver Is Here to Stay",2021-02-03,8,9
hw5xtl_SLV,SLV,"SLV, and other metal EFT's may not be a safe investment: Claims they dont have the silver they claim to have/price manipulation of metals.",2020-07-23,10,8
kg2q61_SLV,SLV,Stimulus effect on commodities such as $SLV and $GLD,2020-12-19,3,5
arebbi_SLV,SLV,Cant invest in GLD or SLV. what are the alternatives?,2019-02-16,3,13
hzuvzk_SLV,SLV,What would be the outcome of potentially negative interest rates on GLD and SLV?,2020-07-29,1,5
fnrlpv_SLV,SLV,SLV Poised for 8% Gain?,2020-03-23,2,6
3ehc7i_SLV,SLV,I OWN SLV (silver etf)-- WHY SILVER IS THE BEST TIME TO BUY!,2015-07-24,0,20
j7sw1b_SLV,SLV,SLV silver price increase,2020-10-09,12,0
hytw3b_SLV,SLV,There are three ETFs that hold SLV. Help me decide which one to choose,2020-07-27,1,2
frlwww_SLV,SLV,SLV,2020-03-30,0,3
d3d2on_SLV,SLV,Which is the most profitable and aggressive Silver investment? Can't decide... AG / SLV / AGQ / USLV?,2019-09-12,1,5
fpdvqf_SLV,SLV,"SLV, will it match the physical price of silver?",2020-03-26,3,1
fkc6wa_SLV,SLV,"SLV question, and help",2020-03-17,1,1
cspuvi_SLV,SLV,How does USLV work compare to simply just SLV?,2019-08-20,2,2
4q218g_SLV,SLV,$SLV this week,2016-06-27,6,7
4ik0qa_SLV,SLV,Any news on why SLV is suddenly down today?,2016-05-09,7,7
4tc5k5_SLV,SLV,$SLV or $GLD,2016-07-17,2,7
919glz_SLV,SLV,SLV from the past and present,2018-07-23,1,1
57ej6m_SLV,SLV,SLV?,2016-10-14,6,4
4pnfiu_SLV,SLV,Why do GLD and SLV behave almost completely opposite to the average market?,2016-06-24,3,3
4k320k_SLV,SLV,Is it right time to buy $SLV @ 15.51?,2016-05-19,2,4
5bijxb_SLV,SLV,Future of GLD/SLV,2016-11-06,0,2
2gwizd_SLV,SLV,Possibly time to start investing in $PPLT $GLD and $SLV,2014-09-19,6,4
ky8pn_SLV,SLV,"Silver Forecast (SLV) plus PAAS and SSRI - Sept 30, 2011. - YouTube",2011-10-02,2,1
i7gbx_SLV,SLV,Silver Markets Decline Daily Technical Analysis (SLV) (AGQ) 6/23/2011,2011-06-23,2,0
l9vp58_SLV,SLV,DO NOT BUY SLV CITADEL IS THE 5TH LARGEST OWNER ITS A TRAP GME AND AMC ONLY,2021-02-01,462,46
liducu_SLV,SLV,SLV for Silver trades..... What I see and how it can and will go up... If you are looking to make a move... This is an idea for you. The REAL SQUEEZE!,2021-02-12,0,33
lacqb4_SLV,SLV,Stop Listening to SLV - Stop Buying SLV - It's All Bullshit,2021-02-01,96,9
ceelzu_SLV,SLV,"SLV (iSilver Shares) of Real Silver, [It's pretty much your guys' last chance to get in on this] Going straight up like a rocket.",2019-07-17,0,22
l9vn0k_SLV,SLV,Don’t buy $SLV it’s a trap.,2021-02-01,47,3
mxs3it_SLV,SLV,$SLV Intermediate-Term Bull Thesis in a Nutshell: we entered long Friday morning because: 1) 15-min = bullish Gartley harmonic in play 2) Hourly = bearish Gartley harmonic likely violated 3) Daily = bullish Gartley harmonic in play 4) Recent positive volume flow //Tags: Silver Gold $SIL $GLD //,2021-04-24,0,4
l9zljc_SLV,SLV,SLV - THEY ARE TRYING TO PLAY WITH 10K SHARES FOR US TO SELL. Keep buying and selling,2021-02-01,0,5
l6v1c3_SLV,SLV,THE BIGGEST SHORT SQUEEZE IN THE WORLD $SLV Silver 25$ to 1000$.,2021-01-28,26,1
l6uxr3_SLV,SLV,Could the GME effect happen in SLV? Would it completely change the financial system and countries?,2021-01-28,13,2
l8t5f7_SLV,SLV,"Whats next AMC, SLV, NOK, or BB",2021-01-30,2,3
lcrx6i_SLV,SLV,All About SLV Shorts.. any one know how true this is ?,2021-02-04,0,3
d3buqg_SLV,SLV,Which is the most profitable and aggressive Silver investment? Can't decide... AG / SLV / AGQ / USLV?,2019-09-12,9,8
lahxs9_SLV,SLV,"REMEMBER OUR BROTHERS IN ARMS ARE EN ROUTE FROM ROBINHOOD AND HAVE FUNDS TIED UP! HOLD THE LINE $GME, THIS IS THE WAY. LONG THE SHORTS, ALSO F SLV TRASH DISTRACTION. 💎🙌💎 SSR also active. Vbiv",2021-02-01,13,0
m0jrkr_SLV,SLV,$GLD struggling to regain entry into falling wedge after breaking bottom rail support. Meanwhile Gold CFDs price is approaching the bottom rail of its falling wedge. This is a most critical period for Gold. Discuss. ________________________________________________ $GLD $GDX $SLV $SIL $SPX $SPY,2021-03-08,5,0
b3g56d_SLV,SLV,SLV i shares trust SLV,2019-03-20,1,3
4trcfa_SLV,SLV,"Silver ($SLV) Collapsing, This Is How To Profit From It. Note The Chart...",2016-07-20,9,3
1xegmh_SLV,SLV,Why does Google Finance not show options table for SLV? It does for QQQ and others...,2014-02-09,6,3
1kfnft_SLV,SLV,JJC GLD SLV Precious Metals Uptrend Intact,2013-08-15,1,0
1f1auom_SLV,SLV,Using $SLV to Sell CCs,2024-08-26,27,46
fk8sw0_SLV,SLV,Silver from a dealer SLV trust,2020-03-17,75,50
16aw2dc_SLV,SLV,$SLV Trade,2023-09-05,1,8
ldwn0z_SLV,SLV,Help me salvage this $SLV position please,2021-02-06,6,32
i4slil_SLV,SLV,Anyone holding $SLV? Currently have $25 c 8/28,2020-08-06,13,30
hyf7sn_SLV,SLV,Bullish on Silver ($SLV),2020-07-26,17,28
hvxgkc_SLV,SLV,Will $SLV be the next monster trade?,2020-07-22,2,28
fx02iq_SLV,SLV,Is SLV the perfect asset for weekly wheels?,2020-04-08,4,28
i90iht_SLV,SLV,SLV Spread - Can someone help me quantify the risk/reward of this play?,2020-08-13,6,24
l71jva_SLV,SLV,My OTM SLV calls suddenly becomes profitable overnight for no reason,2021-01-28,48,15
l9r7n6_SLV,SLV,SLV going to explode now,2021-02-01,2,21
i5imzg_SLV,SLV,SLV play,2020-08-07,6,19
qv7kme_SLV,SLV,SLV & SH options Jan. 2023,2021-11-16,2,10
lpwn9b_SLV,SLV,Alternatives to SLV,2021-02-22,1,14
igqi6l_SLV,SLV,SLV 1/15/21 $30 Call -- should I just abandon it now? Every time SLV drops 0.03% it's like it sucks $0.10 off the price of the contract.,2020-08-26,1,17
htiw4h_SLV,SLV,$SLV Call Question,2020-07-18,1,16
l9mk5u_SLV,SLV,Anyone buying slv options?,2021-01-31,0,11
h99uli_SLV,SLV,SLV Options A Vehicle To Economic Prosperity And Insanity,2020-06-15,3,12
d065jp_SLV,SLV,The first time silver goes down in a month is the day before my 18 50 option expires.....wtf slv,2019-09-05,13,14
hqwwrb_SLV,SLV,Going Long on SLV,2020-07-14,1,9
la7f5k_SLV,SLV,Shorting $SLV,2021-02-01,0,6
7m58og_SLV,SLV,slv/gld/tlt,2017-12-26,4,17
i6i5za_SLV,SLV,Suggestion on slv 27/30 debit spread for Jan 15,2020-08-09,1,7
hyrlcb_SLV,SLV,TRADE OF THE DAY: Silver ETF ($SLV) $18 Cash-Secured Put 18SEP Series [07/27/20],2020-07-27,4,4
3a3o59_SLV,SLV,Going all out in SLV,2015-06-16,3,18
fnyjxh_SLV,SLV,SLV option question,2020-03-24,1,4
i86kzv_SLV,SLV,Risk Assessed Delta Play for $SLV,2020-08-12,3,2
fkqdlf_SLV,SLV,Going long on USO and SLV in the coming months/years,2020-03-18,3,3
if9yhc_SLV,SLV,"Have 2 SLV leaps, planning to make it a PMCC, need help with calculations.",2020-08-23,3,1
fppm97_SLV,SLV,$SLV puts,2020-03-27,0,2
dlog1w_SLV,SLV,CMC markets options trading on GLD.US and SLV.US?,2019-10-22,3,1
7sc7r2_SLV,SLV,best way to play SLV calls?,2018-01-23,1,5
289cpz_SLV,SLV,SLV options,2014-06-16,1,4
i1yk4m_SLV,SLV,SLV / GLD: My Guidelines and Opinions #2 The Coming FOMO!!,2020-08-01,0,23
hzjedc_SLV,SLV,[Video] SLV Silver etf - Guidelines for the coming FOMO Parabolic movement!,2020-07-28,1,7
ic3th8_SLV,SLV,"If there was a flash crash, what do you think would happen to SLV, GLD, cryptocurrencies, and gold itself, and *why*, please? Thanks!",2020-08-18,3,4
1bv73dl_SLV,SLV,$SLV - #DDAmanda Chart,2024-04-03,0,10
gfhv2o_SLV,SLV,Anyone here look at automated trading of SLV?,2020-05-07,2,0
i7zkp9_SLV,SLV,How are SLV options settled?,2020-08-11,3,5
hzjphi_SLV,SLV,Help! It won’t let me close my SLV option even though I own it already,2020-07-28,1,0
ceeujo_SLV,SLV,"SLV (iSilver Shares) of Real Silver, [It's pretty much your guys' last chance to get in on this] Going straight up like a rocket.",2019-07-17,0,4
