Post_ID,Ticker,Title,Body,Post_Date,Upvotes,Num_Comments
25f3a805-947c-4fea-93fb-f5adcc7c6711,SNOW,This is the future kids want,"Yes, kids still dream of going to space.
This story originally appeared in Kids Today, Vox’s newsletter about kids, for everyone. Sign up here for future editions.
Earlier this year, I went to Career Day at my older kid’s school. The experience was sometimes humbling — at an elementary school…",2025-05-29,,
5e76edf7-162f-49cf-8928-d2d84442f608,SNOW,'Lilo & Stitch' is a smash hit. Here are the movies Disney could remake next,"Maia Kealoha and Sydney Agudong play Lilo and Nani in the live-action remake of ""Lilo & Stitch.""
Matt Kennedy / Disney
Disney's live-action version of ""Lilo & Stitch"" was a big hit in a memorable Memorial Day weekend.
Nostalgia helped the film soar after ""Snow White"" struggled, analysts say.
Here…",2025-05-29,,
363c883f-861f-43b3-8f6c-cf1ca94cacc2,SNOW,Shares Soar On Strategic Nuclear Reactor Venture,"Snow Lake Resources Ltd (NASDAQ:LITM) shares surged on Wednesday, closing up 18.18% to $4.29 after the company announced a strategic partnership with Exodys Energy to launch a new nuclear reactor development firm.
What To Know: The collaboration supports Snow Lake's expansion into the nuclear…",2025-05-28,,
8f5f6429-fca1-40b4-a2fc-34d6f40e4ca2,SNOW,"Is “At The Cusp Of A Breakout,” Says Jim Cramer","In This Article:
We recently published a list of Jim Cramer Says Trump’s One Big, Beautiful Bill Is Pro Growth & Discusses These 12 Stocks. In this article, we are going to take a look at where Snowflake Inc. (NYSE:SNOW) stands against other stocks that Jim Cramer discusses.
Snowflake Inc.…",2025-05-28,,
b0371a35-965b-43be-a34a-070fbb9541b9,SNOW,All 19 Disney live-action remakes ranked from tolerable to downright unwatchable,"""Lilo & Stitch.""
Disney
In 2010, Disney began releasing live-action remakes of some of its classic animated films in earnest.
While most were successful at the box office, their artistic value has been questioned.
In almost every case, the original animated film is superior to its live-action…",2025-05-28,,
570d2be9-8e11-4fcd-ba13-c0f9ca0bc9c0,SNOW,How I survived 2 weeks filming the Army's grueling mountain warfare school hiking in subzero temperatures and waist-high snow,"Jake Gabbard is standing in front of Smuggler's Notch in Vermont.
Business Insider
This as-told-to essay is based on a conversation with Jake Gabbard, a video producer at Business Insider. The conversation has been edited for length and clarity.
It was like one of those moments in the movies where…",2025-05-28,,
e2413745-417a-4507-970d-7e4df21c8c0e,SNOW,Famous Investor Identifies Snowflake (SNOW) as One of the Market’s Top Stocks,,2025-05-28,,
953f9aef-e4c2-4d86-b6ba-6ccaea01bae6,SNOW,The Syrian entrepreneur gunning to be Ukraine’s drone king,"The Scoop
Drone warfare has become central to Ukraine’s defense against Russia, where cheap, nimble aircraft are being deployed to counter superior firepower. What began as modified hobbyist drones have evolved into a large industry which experts say could position Ukraine as a leading supplier of…",2025-05-28,,
49841ef7-5c43-43fe-99f8-331a2202a412,SNOW,"This Former Warren Buffett AI Stock Was a Market Darling in 2020, but Is Down 50% Today. Should Investors Buy the Dip?","In This Article:
Key Points
-
An excessive valuation and poor business execution hit Snowflake stock hard.
-
Snowflake still has plenty of growth opportunities, but some bad warts remain.
-
Buffett gave up and sold Berkshire's holdings in Snowflake last year. Was he right to do…",2025-05-28,,
70aa5e7e-8a53-4c2f-8b29-1ec8e58c1fee,SNOW,Vail Resorts Replaces CEO Lynch With Former Boss Rob Katz,"Kirsten Lynch was ousted as CEO of Vail Resorts and has been replaced by former CEO Rob Katz, the resort announced Tuesday after the stock market closed. Katz was CEO for 16 years before Lynch was appointed in 2021 and built Vail into a ski resort giant that now includes 42 mountains.
Lynch’s…",2025-05-27,,
669c1a2e-8fd8-431a-b1fd-19e9aa540f35,SNOW,The 'Lilo & Stitch' box office numbers show Disney learned a major lesson after the 'Snow White' debacle,"""Lilo & Stitch.""
Disney
Disney's ""Lilo & Stitch"" broke Memorial Day box office records with $341.7 million worldwide.
It's a major win for Disney, whose most recent live-action remake, ""Snow White,"" was a commercial flop.
""Lilo & Stitch"" shows that the studio will fare better if they avoid…",2025-05-27,,
8d555fac-0a88-444f-a8a4-43fbe9b40b9d,SNOW,15 bizarre creatures from the bottom of the ocean that look like aliens,"A tiro of blobfish on display in 2022.
: HUM Images/Universal Images Group via Getty Images
Sea creatures have adapted to help them thrive in extreme environments.
Unusual features allow them to live thousands of feet below the surface.
Underwater robots give researchers a glimpse at some of these…",2025-05-27,,
8b28ddea-b6fa-4e3b-ae81-91e3006473da,SNOW,"Amazon is selling 'durable' $70 outdoor string lights for $35, and they are an 'excellent addition' to any backyard","TheStreet aims to feature only the best products and services. If you buy something via one of our links, we may earn a commission.
If you've ever hosted a hopping backyard barbecue, you know the party doesn't stop just because the sun goes down. The only problem is that many outdoor areas are…",2025-05-27,,
840a164c-22cc-4339-b380-f82612541f72,SNOW,Snowflake's AI-Driven Insights To Power LA28 Olympic And Paralympic Games,"Snowflake Inc. (NYSE:SNOW) on Monday announced a three-year partnership as the Official Data Collaboration Provider for the LA28 Olympic and Paralympic Games and Team USA.
This partnership underscores the growing importance of data in sports, from optimizing athlete performance to enhancing fan…",2025-05-27,,
34ac27a5-96b8-47ad-afe3-daa0539a1e81,SNOW,‘Money in the pockets of administrators’: California charter school network steers millions in taxpayer money to opaque firm tied to execs,"For five years, Eric Shirley taught home-school students for a small California charter school network called Elite Academic Academy. He left in 2023, he said, because of several things he found fishy about Elite’s administration.
Among them: Elite’s CEO Meghan Freeman lives in a mountain resort…",2025-05-27,,
dc481ee9-6a5c-46cf-896d-d1758f09cf10,SNOW,"Epic Expansion: Sölden Joins Vail Resorts, Inc. (MTN)’ Global Ski Portfolio","In This Article:
Vail Resorts, Inc. (NYSE:MTN) has announced adding Austria’s Sölden to its growing European network just ahead of the May 26 deadline for securing the 2025/26 Epic Pass at the year’s lowest price.
An aerial view of a mountain resort, its snow-capped peaks and lush ski slopes…",2025-05-27,,
840b78a2-4003-46cc-89f0-f8ba982463c5,SNOW,"‘Lilo & Stitch,’ Tom Cruise and final ‘Mission Impossible’ score box-office bonanzas","By Andrew Dalton | Associated Press
“Lilo & Stitch” teamed with Tom Cruise for a monster Memorial Day box office weekend.
Disney’s live action version of “Lilo & Stitch” earned a staggering $145.5 million in North American theaters, according to studio estimates Sunday, the second biggest domestic…",2025-05-26,,
6ec8b4bc-38ec-4324-8f21-2d275d6bd19b,SNOW,New Progress Report From World's Biggest Construction Project,"Voice is AI-generated. Inconsistencies may occur.
Further progress has been announced at Saudi Arabia's vast Neom project with the completion of an underground tunnel to connect a ski resort in the desert at the world's largest construction site.
Newsweek has reached out to the company for…",2025-05-26,,
0894eb15-bcc9-4718-b61a-3b9dfc08e1e3,SNOW,Garage meets and sleepless flights: How Nippon Steel's negotiator stuck at U.S. merger,"Snow lay thick in the Pittsburgh suburbs as Takahiro Mori, a bespectacled, 67-year-old executive from Japan's Nippon Steel, huddled in a cluttered garage with community leaders to reassure them he was not giving up on a bid to buy the town's steel mill.
Just days before the early January meeting,…",2025-05-26,,
ab5d47ed-bd48-4280-ba9f-00e786bb71e9,SNOW,‘Lilo & Stich’ earns $145.5 million at the box office to become biggest domestic Memorial Day weekend movie ever,"“Lilo & Stich” teamed with Tom Cruise for a monster Memorial Day box office weekend.
Disney’s live action version of “Lilo & Stich” earned a staggering $145.5 million in North American theaters, according to studio estimates Sunday, the second biggest domestic opening of the year after “A…",2025-05-26,,
e9c8da8c-526b-4997-af32-f2266c9e90a2,SNOW,Steve Jobs Wasn't Happy Unless Things Were 'Insanely Great' And That's Why This Tech CEO Is Passionate About Moving 'Mental Boundaries' That Withhold Perfection,"Snowflake Inc. (NYSE:SNOW) chief executive Frank Slootman says he runs his companies on the mantra the late Steve Jobs loved: a product is either ""insanely great"" or it's “total sh*t.”
What Happened: By erasing the gray zone, Slootman argues, leaders bulldoze mediocrity and force teams to stretch…",2025-05-26,,
898711d5-5654-4aa5-8da4-f9a802aaad79,SNOW,Battle Lines: Gardening in war,"In this special episode of Battle Lines, we're joined by Lally Snow — a seasoned war reporter and photographer who has spent ...",2025-05-26,,
5ebae544-8598-4582-a260-365610e6c990,SNOW,Movie theaters are having their best Memorial Day weekend ever,"Stitch in the live-action remake of ""Lilo & Stitch.""
Disney
Movie theaters saw record sales this Memorial Day weekend.
""Lilo & Stitch"" and ""Mission: Impossible - The Final Reckoning"" led the way.
Disney's 'Lilo & Stitch' is expected to make over $180 million, a Memorial Day weekend record.
This…",2025-05-25,,
3ebf3f25-f3b1-4c35-b770-905dce961919,SNOW,18 Items That Are Now So Expensive People Have Given Up Buying Them,"Ask just about any friend or family member, and they'll probably agree on one thing: the cost of everyday stuff just keeps climbing, and it doesn't look like it's going to stop. Eventually, it starts to take a real toll on your wallet — and suddenly, ordering delivery or that night out doesn’t…",2025-05-25,,
5ae5d935-e5da-42c1-8bb1-984bfbbbda2c,SNOW,"Adios, Green New Deal. Welcome, Free-Market Energy Independence","Buried within the 1,100-page bill recently passed by the House of Representatives—the ""One Big, Beautiful Bill"" that reflects President Trump's priorities—are several provisions that, if enacted into law, could return the U.S. energy sector to a more capitalistic model.
President Joe Biden, with…",2025-05-25,,
1a90814a-fab8-4d87-aa08-a9a9ec9bc342,SNOW,"Oppenheimer Maintains Outperform Rating on Snowflake (SNOW), Lifts PT","In This Article:
On Thursday, Oppenheimer raised its price target on Snowflake Inc. (NYSE:SNOW) to $225 from $210, while maintaining an Outperform rating on the shares.
The firm noted that Snowflake delivered strong FQ1 2026 results due to broad-based demand and consistent consumption trends.
A…",2025-05-25,,
92524813-7b1e-4b91-8cf3-47d93a5a9243,SNOW,My family of 5 took an RV trip in New Zealand for a week. We saved money on groceries and free campsites and splurged on sightseeing,"The author and her family spent over a week in New Zealand traveling in an RV.
Courtesy of Melissa Noble
For my 40th birthday, my family and I traveled New Zealand's South Island in an RV.
We went for eight nights and had an absolute blast.
Though the RV itself was expensive, we found other ways…",2025-05-25,,
b78fe501-5b71-46e1-91bc-c3ba2363d079,SNOW,"Ours Is A System Of Fraud, Swindles, And Corruption","Ours Is A System Of Fraud, Swindles, And Corruption
 
Authored by Charles Hugh Smith via OfTwoMinds blog,
But all bubbles pop, and there are no tricks left to fund both the greed of the few and the needs of the many.
Every society / economy is a distribution mechanism that distributes:
1. Gains
2.…",2025-05-25,,
4d4716b5-843c-489f-a0f9-b441b836ec24,SNOW,‘Stitchpossible’ kicks off summer with record box office for Memorial Day weekend,"After a slow start to 2025, the Hollywood box office has pulled off a “Stitchpossible” comeback buoyed by a huge holiday weekend.
Disney’s “Lilo & Stitch” and the eighth installment of “Mission: Impossible” helped spark a record $325 million estimated box office haul for Memorial Day…",2025-05-25,,
ede6cd01-6ffb-4f76-93a1-e5d6f83fe15c,SNOW,"Amazon is selling a $200 trail camera for only $40, and shoppers say 'the footage is crystal clear'","TheStreet aims to feature only the best products and services. If you buy something via one of our links, we may earn a commission.
If you live out in the country or in an area with some interesting wildlife, a good trail cam can be a fun, fulfilling way to observe your surroundings. There's a…",2025-05-24,,
87277afd-3bc5-4d2f-b7e3-2a72fc544d65,SNOW,"Walmart is selling a $1,000 solar hardtop gazebo for $548, and shoppers call it 'very solid' and 'high quality'","TheStreet aims to feature only the best products and services. If you buy something via one of our links, we may earn a commission.
Some of us love the outdoors, but the sun doesn't always agree with us. Maybe you sweat a lot; maybe you once suffered a particularly gnarly sunburn. Fortunately, a…",2025-05-23,,
97daeddc-bf0b-4df8-b641-7009ed310dd1,SNOW,’s AI Tools Drive Momentum—Analyst Boosts Price Target,"In This Article:
We recently published a list of 10 AI Stocks on Latest News and Ratings. In this article, we are going to take a look at where Snowflake Inc. (NYSE:SNOW) stands against other best AI stocks on latest news and ratings.
Snowflake Inc. (NYSE:SNOW) is a cloud-based data storage…",2025-05-23,,
8330aeb3-96dc-4245-b0e2-053f6e3dd793,SNOW,The Stache returns,"The Scene
Eight years ago, Randy Bryce challenged the Speaker of the House, raised more than almost any other candidate for Congress, and lost. The union ironworker, a longtime Democratic activist, gained national attention for an unscripted, uncautious campaign that endorsed Medicare for All and…",2025-05-23,,
13f46379-2ca1-4409-9458-ea6081a05999,SNOW,"Stock Market Falls As Treasury Yields Spike, Trump Targets Apple, EU; Tesla, Snowflake, Urban Outfitters In Focus: Weekly Review","The stock market rally retreated this week with Treasury yields spiking mid-week and later President Donald Trump threatening huge tariffs on Apple and the European Union. Revived concerns about AI export bans also were a factor. Snowflake (SNOW), Intuit (INTU), Urban Outfitters (URBN) and Amer…",2025-05-23,,
5f28ba6e-3444-487d-8abc-5eb4185f2870,SNOW,Why Intuit Shares Are Trading Higher By Over 8%; Here Are 20 Stocks Moving Premarket,"Shares of Intuit Inc. INTU rose sharply in today's pre-market after the company reported stronger-than-expected third-quarter financial results and raised its full-year guidance.
Intuit reported third-quarter revenue of $7.75 billion, beating analyst estimates of $7.56 billion, according to…",2025-05-23,,
c7b572c7-d70d-4a16-bd58-7b07f6e3816c,SNOW,Snowflake's Massive Losses Are Getting Worse,"In This Article:
Key Points
-
Snowflake's revenue grew 26% year over year to $1 billion, but net losses widened to $430 million.
-
The company's net loss grew both in absolute terms and as a percentage of sales.
-
Snowflake's rich valuation leaves little margin for error.
An investment in growth…",2025-05-23,,
1b014cf5-8d3f-4d0c-b546-c22e128b092d,SNOW,Uncommon May nor’easter brings rain and snow to New England states just before Memorial Day weekend,,2025-05-23,,
b205e755-2dbd-4190-8db2-575801e49513,SNOW,Cory Michael Smith Embraces Chaos in Jesse Armstrong's 'Mountainhead',"Voice is AI-generated. Inconsistencies may occur.
""I'm really grateful that I feel like I didn't f*** it up.""
Four tech CEOs, drunk on power, reunite at a mountaintop home amid a global economic crisis they might be partially responsible for. ""There is a power that is purchased by money, where…",2025-05-23,,
48399aa2-104e-48e9-8ba6-ccdf200df3c8,SNOW,Snowflake (NYSE: SNOW) Price Prediction and Forecast 2025-2030 (May 2025),"Shares of cloud-based storage solutions provider Snowflake Inc. (NYSE: SNOW) surged nearly 37% over the past month and are now up 54.51% since hitting their year-to-date low on April 4. When the company reported Q1 earnings on May 21 after the close, it announced a beat on EPS with revenue meeting…",2025-05-23,,
