Post_ID,Ticker,Title,Post_Date,Upvotes,Num_Comments
1ku1fjg_target,TGT,Blackberry acquisition target,2025-05-24,23,22
1kri8ep_TGT,TGT,TGT earnings tomorrow morning,2025-05-20,22,18
1kj9b6l_target,TGT,"Standard Chartered analyst apologizes for $120,000 bitcoin price call, says target 'may be too low'",2025-05-10,0,3
1k915l9_target,TGT,Volatility targeting on a portfolio level,2025-04-27,10,16
1jczarp_target,TGT,JP Morgan lowers Tesla’s share price target to $120.,2025-03-16,13103,876
1gglh3j_target,TGT,"US inflation falls to 2.1%, almost hitting Federal Reserve target",2024-10-31,95,8
1f5mroo_target,TGT,$2400 per month dividend income target - almost there,2024-08-31,459,133
1ddur2g_target,TGT,What value investments under 100M market cap are you targeting,2024-06-12,303,171
1cwh3c3_target,TGT,"Wall Street's biggest bear flips, raises S&P 500 price target by 20%",2024-05-20,1166,129
1cmw54n_target,TGT,Probability of a stock reaching a target ?,2024-05-08,106,52
