Ticker,Title,Post_Date,Upvotes,Num_Comments
TSLA,To cook or be cooked? $TSLA,2025-05-27,4,17
TSLA,"$TSLA ,$37K real money out of the gate, 92% return, 342.5c tactical replay (technical analysis)",2025-05-27,1,6
TSLA,TSLA: Why I'm still bullish despite the EPS nosedive,2025-05-27,121,38
TSLA,30k TSLA Puts,2025-05-26,442,308
TSLA,TSLA vs. BYDDY – Which EV Stock Is the Better Bet Right Now?,2025-05-25,61,128
TSLA,Realistically what is going to happen with TSLA robotaxi launch,2025-05-24,407,757
TSLA,"(TSLA) Honestly, how much money can it really make from autonomous driving to justify a $2 trillion valuation? In my opinion, very little.",2025-05-23,172,265
TSLA,"Senate Votes to End California Gas-Car Ban, Sends Bill to Trump - TSLA: Another bunch of calls?",2025-05-22,186,110
TSLA,"TSLA +$14k, up in a falling market",2025-05-20,130,24
TSLA,"TSLA calls finally hit – not rich, but no longer poor 🚀💎🙌",2025-05-13,419,63
TSLA,"LFG!!!!! TSLA this morning GOT ME INTO 6 FIGURES, INSANE MONTH OF TRADING!!!!! 2K start on April 8th",2025-05-09,3238,862
TSLA,Tesla (TSLA) accounting raises red flags as report shows $1.4 billion missing,2025-03-20,14667,668
TSLA,Is TSLA permanently toast?,2025-03-11,13314,2814
TSLA,TSLA being investigated by Transport Canada for cooking their books in Canada to snag EV rebates without selling cars.,2025-03-09,18881,493
TSLA,"$80,000 to $1.12M in 7 days. Thank you Elon Musk! $TSLA",2024-11-11,19466,1512
TSLA,TSLA 1DTE Puts go boom,2024-10-11,193,40
TSLA,Big Call Buying in $TSLA $PLTR $MSFT and more is telling me the market is going MUCH higher,2024-07-10,130,99
TSLA,TSLA 04/16 700 Puts. Destroyed.,2021-04-14,1154,637
TSLA,Shorting TSLA!,2021-02-19,1638,1100
TSLA,Breaking news... tesla introduces the cyber bus to go along with the 4 to 1 stock split.,2020-08-20,2348,61
