Post_ID,Ticker,Title,Body,Post_Date,Upvotes,Num_Comments
76583cbf-d055-422d-aa7d-c104d816259d,TXN,Here's How Much You Would Have Made Owning Texas Instruments Stock In The Last 20 Years,"Texas Instruments (NASDAQ:TXN) has outperformed the market over the past 20 years by 1.74% on an annualized basis producing an average annual return of 9.99%. Currently, Texas Instruments has a market capitalization of $166.31 billion. 
Buying $100 In TXN: If ...
Full story available on Benzinga.com",2025-05-29,,
c2a7a5d1-1f97-4cff-903c-ef425fe11e87,TXN,Wall Street's Most Accurate Analysts Spotlight On 3 Tech Stocks With Over 3% Dividend Yields,"During times of turbulence and uncertainty in the markets, many investors turn to dividend-yielding stocks. These are often companies that have high free cash flows and reward shareholders with a high dividend payout.
Benzinga readers can review the latest analyst takes on their favorite stocks by…",2025-05-27,,
750f23d4-fc69-402b-a8eb-edb2980dcff7,TXN,This Chip Stock Is Soaring on an Nvidia Partnership,"The Nvidia fairy dust worked its magic on another obscure tech stock on Thursday.
Shares of Navitas Semiconductor (NVTS) more than doubled in value after the company announced it would partner with Nvidia (NVDA) to develop “high-efficiency, scalable power delivery for next-generation AI…",2025-05-22,,
56ab69a3-3ac7-4a90-a00e-2f3672f61883,TXN,Here's How Much $1000 Invested In Texas Instruments 15 Years Ago Would Be Worth Today,"Texas Instruments (NASDAQ:TXN) has outperformed the market over the past 15 years by 2.63% on an annualized basis producing an average annual return of 14.34%. Currently, Texas Instruments has a market capitalization of $168.45 billion. 
Buying $1000 In TXN: If ...
Full story available on…",2025-05-21,,
b12cc5ba-4497-4b83-a1eb-fad786a00820,TXN,3 Dividend-Paying Growth Stocks Set to Crush the Market This Year,"Key Points
 
 
 
 
These growth stocks have expanding underlying businesses, and they are profitable enough to pay dividends.
 
 
 
The dividends paid are above 2% for all the stocks in this article, so it’s far more than the small, symbolic dividends most growth stocks pay.
 
 
 
On top of that,…",2025-05-21,,
