Post_ID,Ticker,Title,Post_Date,Upvotes,Num_Comments
10juhvh_NFLX,NFLX,"WBD has $50.4bn in debt, DIS has $45bn, PARA has $15.6bn, and NFLX has $14bn. Netflix is the only one making money on streaming.",2023-01-24,53,49
wn8tq3_NFLX,NFLX,Streaming wars continue - which stock do you prefer? $NFLX $DIS $WBD $PARA,2022-08-13,19,62
wkz8yy_NFLX,NFLX,"Subscriber growth for $NFLX, $DIS, $AMZN, $AAPL, and $WBD streaming services.",2022-08-10,28,11
xay546_NFLX,NFLX,Warner Bros Discovery (WBD) Undervalued ?,2022-09-10,58,43
urpv3f_NFLX,NFLX,Is Warner Bros Discovery Stock a BUY?! Full WBD Stock Analysis 🚀,2022-05-17,23,1
10juhvh_DIS,DIS,"WBD has $50.4bn in debt, DIS has $45bn, PARA has $15.6bn, and NFLX has $14bn. Netflix is the only one making money on streaming.",2023-01-24,56,49
wn8tq3_DIS,DIS,Streaming wars continue - which stock do you prefer? $NFLX $DIS $WBD $PARA,2022-08-13,17,62
1b7ivh8_DIS,DIS,Streaming Services a BUY right now? (WBD & DIS),2024-03-05,1,16
1cymf38_DIS,DIS,"5/22 Daily Update: $NVDA, $WBD Partners with $DIS, $AMZN Alexa",2024-05-23,14,0
wkz8yy_DIS,DIS,"Subscriber growth for $NFLX, $DIS, $AMZN, $AAPL, and $WBD streaming services.",2022-08-10,29,11
xay546_DIS,DIS,Warner Bros Discovery (WBD) Undervalued ?,2022-09-10,55,43
urpv3f_DIS,DIS,Is Warner Bros Discovery Stock a BUY?! Full WBD Stock Analysis 🚀,2022-05-17,21,1
1h7hwbd_WBD,WBD,WBD YOLO,2024-12-05,438,195
1hkxc7g_WBD,WBD,$5k Hail Mary on $WBD,2024-12-23,79,59
1k59n6j_WBD,WBD,YOLO my life savings $WBD calls,2025-04-22,16,11
1dd6fy1_WBD,WBD,The Regard case for WBD. Hear me out.,2024-06-11,44,36
119ywnp_WBD,WBD,$WBD - Harry Potter is going to make $billions this year...and you can too!,2023-02-23,316,264
1b27k6g_WBD,WBD,Why Warner Bros Discovery ($WBD) is a DEEP VALUE PLAY,2024-02-28,42,63
1axgi8l_WBD,WBD,3 Letters WBD. Look at the Harry Potter Wand Pattern on this Chart. Then Read My Analysis. It is Pure Magic🧙🪄 📈,2024-02-22,11,46
1ci6ord_WBD,WBD,"We all think we are different, but we are not Nancy Pelosi. (11k loss WBD)",2024-05-02,32,23
1bnju7k_WBD,WBD,WBD - What's going on?,2024-03-25,14,24
18cggqg_WBD,WBD,"People bought TTWO cuz trailers, Warner discovery stock anyone? WBD in time for Dragon and gold eggs?",2023-12-06,4,25
12cvm2c_WBD,WBD,Warner Bros. [WBD] Looks to Close Deal for ‘Harry Potter’ HBO Max Series,2023-04-05,19,31
18o1ooy_WBD,WBD,"WBD and Paramount merger talks, why are the stocks down, surely this is bullish for the synergies?",2023-12-22,2,13
1ay5wxi_WBD,WBD,"$3500 to $12K, 1DTE calls CVNA & SQ, with a side of WBD puts ",2024-02-23,17,5
1bovk8q_WBD,WBD,"$WBD, $DIS as an AI play",2024-03-27,9,3
xaxwqi_WBD,WBD,Warner Bros Discovery (WBD) a monster in the making,2022-09-10,22,28
15avbvf_WBD,WBD,Anyone still holding WBD after T split?,2023-07-27,11,15
wu6frp_WBD,WBD,WBD Bullish or dead stock?,2022-08-21,14,29
1b9nx9w_WBD,WBD,$WBD Lisan al Galib,2024-03-08,6,3
u2evux_WBD,WBD,WBD currently has 27% of shares being shorted.,2022-04-13,1,30
u181uo_WBD,WBD,Robin Hood Marks WBD as a Russian Company.,2022-04-11,7,20
u8uqo0_WBD,WBD,Potential for $WBD in the coming weeks following Netflix plunge,2022-04-21,10,19
xb3bvr_WBD,WBD,Warner Bros Discovery (WBD) a monster in the making (Re-post because OG got banned for several hours before being unlocked),2022-09-10,25,12
wlyfk8_WBD,WBD,WBD is ready.. everything is baked in and set to dominate the quarter..,2022-08-11,11,14
wj7v44_WBD,WBD,$WBD Value play with BIG potential upside,2022-08-08,4,13
wsuy0n_WBD,WBD,"Cramer said about WBD that: ""I throw my rotten tomatoes in a certain corner of my garden. I'm going to call that corner the Warner Brothers Corner."" So naturally I'm YOLOing my account with 2000 shares long and making money! Hey, Cramer, I'll take yer taters!",2022-08-20,20,9
wsf1sw_WBD,WBD,"Down on BBBY? WBD Game of Thrones rally coming - Multiversus, Black Adam, HBO Max, The Sandman",2022-08-19,10,9
x1nkem_WBD,WBD,Is it worth shorting $WBD?,2022-08-30,1,8
wxq4da_WBD,WBD,WBD,2022-08-25,1,6
wq08d2_WBD,WBD,"WBD Short Squeezing off Multiversus, GOT: HOD, The CW sale, Black Adam - Over Sold",2022-08-16,2,1
u1fv8f_WBD,WBD,AT&T-WBD Stock Spinoff Question,2022-04-11,35,32
u2rckf_WBD,WBD,Question about AT&T spin-off and WBD,2022-04-13,49,32
xmc1hr_WBD,WBD,WBD Insiders claim David Zaslav may be looking to 'flip' WBD to Universal Comcast,2022-09-23,7,10
u1d9ue_WBD,WBD,ATT options post spinoff include WBD stock?,2022-04-11,0,7
1izfe6e_WBD,WBD,"WBD adds 6.4 million Max subscribers, forecasts 150 million subs by end of 2026",2025-02-27,37,4
10zy3xp_WBD,WBD,WBD the sleeping giant waking up,2023-02-11,275,131
1ebcqra_WBD,WBD,"NBA says Amazon will be its new media partner, rebuffing WBD attempt to match deal ",2024-07-24,100,35
vmneko_WBD,WBD,Does Wall Street know something about WBD that we don’t?,2022-06-28,43,96
wo474r_WBD,WBD,Let's Talk About Warner Bros. Discovery (WBD),2022-08-14,68,70
10juhvh_WBD,WBD,"WBD has $50.4bn in debt, DIS has $45bn, PARA has $15.6bn, and NFLX has $14bn. Netflix is the only one making money on streaming.",2023-01-24,57,49
tw8u4i_WBD,WBD,"AT&T April 5th Split $T, $DISCA, $DISCK, $WBD, and $WBDWV",2022-04-04,41,72
wn8tq3_WBD,WBD,Streaming wars continue - which stock do you prefer? $NFLX $DIS $WBD $PARA,2022-08-13,18,62
viw0b8_WBD,WBD,Are there any good reasons not to load up on WBD?,2022-06-23,52,48
vwrl06_WBD,WBD,Warner Bros (WBD) is Reportedly in Talks with Amazon For A New HBO Max Deal,2022-07-11,99,38
12jzym4_WBD,WBD,HBO max changing to MAX… and it’ll be a hard fall for WBD,2023-04-12,0,38
1cthb5y_WBD,WBD,"Disney, Fox and WBD Unveil Name of Sports-Streaming Venture: Venu Sports",2024-05-16,15,9
vfyzmd_WBD,WBD,WBD is an over leveraged nightmare. How do they get out of it?,2022-06-19,10,44
1cr1uy2_WBD,WBD,"Warner Bros Discovery ($WBD) Q1 2024 Earnings Analysis: Content Acquisition, Streaming Growth, and Advertising Shifts",2024-05-13,21,4
15i5cq3_WBD,WBD,WBD popping today 7.5%+,2023-08-04,5,11
15h8s5y_WBD,WBD,"WBD narrows streaming loss thanks to 3x higher content licensing revenue ($410M). More ""co-exclusive"" deals coming.",2023-08-03,11,8
vnpt8k_WBD,WBD,What’s better WBD vs PARA?,2022-06-29,10,23
ya382b_WBD,WBD,What caused WBD to rally today?,2022-10-21,19,14
u11dgi_WBD,WBD,WBD and T spinoff/merger cost basis,2022-04-11,8,20
wrs00m_WBD,WBD,Will this affect WBD earnings negatively?,2022-08-18,4,11
11kio5j_WBD,WBD,"""The Making of Harry Potter,"" a Warner Brothers Studio Tour set to open in Tokyo in the summer of 2023. $WBD",2023-03-06,1,1
rlciiy_WBD,WBD,Discovery - WBD - which share class?,2021-12-21,8,10
u8ub0o_WBD,WBD,T and WBD Cost Basis,2022-04-21,8,6
u061wj_WBD,WBD,Who's excited for WBD's debut on Monday?,2022-04-10,36,50
1b7ivh8_WBD,WBD,Streaming Services a BUY right now? (WBD & DIS),2024-03-05,4,16
1cymf38_WBD,WBD,"5/22 Daily Update: $NVDA, $WBD Partners with $DIS, $AMZN Alexa",2024-05-23,13,0
12cvk4j_WBD,WBD,Warner Bros. [WBD] Looks to Close Deal for ‘Harry Potter’ HBO Max Series,2023-04-05,15,9
vhpyuu_WBD,WBD,META and WBD are the greatest value plays of the decade,2022-06-21,0,19
wkz8yy_WBD,WBD,"Subscriber growth for $NFLX, $DIS, $AMZN, $AAPL, and $WBD streaming services.",2022-08-10,28,11
10o7iw9_WBD,WBD,Technical Analysis & Trades: SPY QQQ IWM // LVS UNG PFG AXP WBD K KHC,2023-01-29,5,2
1ar5y21_WBD,WBD,The ESPN-Fox-WBD sports venture is a counterstrike against Big Tech and rights fees inflation. Here's how.,2024-02-15,4,0
1df33o7_WBD,WBD,I would call WBD expires in Jan 2026,2024-06-13,3,7
z2h3nc_WBD,WBD,"WBD - Long term Bullish, short term bearish/neutral - IVR 6 - strategies to buy shares using options",2022-11-23,5,4
u18z4b_WBD,WBD,"DISCA, DISCB, DISCK merged into WBD. My Disca options converted to WBD but my Disck options still say Disck.",2022-04-11,7,4
16ao7xp_WBD,WBD,Day Trade Levels I'm watching in NXGN TSLA WBD WBA,2023-09-05,2,4
u1b0om_WBD,WBD,"If you are holding T, what's your plan with WBD?",2022-04-11,35,90
twcfen_WBD,WBD,T vs WBD post split thoughts.,2022-04-04,10,14
1jyhtt0_WBD,WBD,WBD Sell or HODL,2025-04-13,3,23
1dj4nve_WBD,WBD,Convince me not to continue to plow money into WBD,2024-06-18,185,182
1emmxng_WBD,WBD,WBD falls sharply after taking $9.1B impairment charge,2024-08-07,113,92
1iv2l0u_WBD,WBD,Deep dive into WBD - The $40 billion Bet,2025-02-21,87,40
1egi48t_WBD,WBD,Warner brothers (WBD) large debt will inflate away - good inflation hedge ?,2024-07-31,45,44
1i3796x_WBD,WBD,Thoughts On WBD,2025-01-17,18,16
1glrf4m_WBD,WBD,"WBD earnings report: Revenue at $9.62 billion, a 3% drop compared to the $9.98 billion seen in Q3 2023. Adjusted earnings per share of $0.05 versus a loss of $0.17 in the year-earlier period.",2024-11-07,24,14
17qr958_WBD,WBD,WBD worse than expected results,2023-11-08,46,45
1ch20sb_WBD,WBD,Thoughts on WBD,2024-04-30,19,29
1dq9x9u_WBD,WBD,Thoughts on WBD?,2024-06-28,7,26
1df7sya_WBD,WBD,WBD at an inflection point?,2024-06-13,20,24
1dkakj0_WBD,WBD,"WBD , why they'll fail.",2024-06-20,0,25
17raqyf_WBD,WBD,WBD Debt Payments,2023-11-09,32,33
1bdeom0_WBD,WBD,WBD stock suggestion ,2024-03-13,6,32
18n9g9x_WBD,WBD,Advice regarding $WBD,2023-12-21,23,31
16cdnxh_WBD,WBD,WBD has just issued 1.5 billion in fresh debt at 6.4% interest.,2023-09-07,23,36
xay546_WBD,WBD,Warner Bros Discovery (WBD) Undervalued ?,2022-09-10,57,43
v3kn8q_WBD,WBD,I feel like Warner Brothers Discovery ($WBD) Is Undervalued,2022-06-02,60,45
1ej3jan_WBD,WBD,Help Finding Intrinsic Value of WBD,2024-08-03,4,1
udouxw_WBD,WBD,Anyone else looking at $WBD and being like wtf?,2022-04-28,34,34
16bim4s_WBD,WBD,IS WBD PROFITABLE?,2023-09-06,6,9
1ar5y6u_WBD,WBD,The ESPN-Fox-WBD sports venture is a counterstrike against Big Tech and rights fees inflation. Here's how.,2024-02-15,3,1
xbz82y_WBD,WBD,"5 Companies I am Looking Into For September | DJCO, MU, WBD, CRSR, & CSV",2022-09-12,36,19
13ixfhi_WBD,WBD,Opinions on WBD?,2023-05-16,16,10
100utt3_WBD,WBD,Warner Bros. Discovery ($WBD) - Special Situation Investment Thesis,2023-01-01,9,13
viy9p2_WBD,WBD,Why is the Book Value per Share so high for WBD? Am I calculating it incorrectly? More info in description.,2022-06-23,9,13
vnpwxb_WBD,WBD,"What’s a better value, WBD vs PARA?",2022-06-29,9,5
ur0ic7_WBD,WBD,Full DD on Warner Bros Discovery Stock | WBD Stock Pitch,2022-05-16,16,2
urpv3f_WBD,WBD,Is Warner Bros Discovery Stock a BUY?! Full WBD Stock Analysis 🚀,2022-05-17,22,1
tzhp81_WBD,WBD,Projected WBD and T eps?,2022-04-09,5,3
