Post_ID,Ticker,Title,Body,Post_Date,Upvotes,Num_Comments
1axgi8l_WBD,WBD,3 Letters WBD. Look at the Harry Potter Wand Pattern on this Chart. Then Read My Analysis. It is Pure Magic🧙🪄 📈,"
So I have been waiting for WBD price to get back down to the 9.65 range because I knew if it ever did, it would set up a life changing trade. Here is the reason why. 

The WBD chart looks eerily similar to what the BTC chart looked like Jan 2023. 

The first chart pic is WBD currently (2.21.24). The second chart is BTC from its high, until it bottomed in Nov 2022. The last chart is BTC current day from the Nov 2022 low. BTC price has more than trippled. WBD will be at more than 3x simply by retracing to the .382 fib (roughly $35).

BTC had at least one retracement of .382 during its decline, WBD has NOT. If you know your TA and you see this chart, you would be salivating. The WSB community isn’t dumb!
 
Ladies and gentlemen:

I HAVE BEEN WAITING FOR PRICE TO GET HERE FOR A YEAR 

PRICE HAS TO REVISIT THE HIGH.

PRICE WILL REVISIT THE HIGH.

The question isn’t when, the question is how fast.

As much consolidation as I am seeing here at the absolute range lows without any breaking of the below support ($8.82) in over 1 year, means price will go higher quickly. 

There is a tiny gap at 16.27 that has to be closed. So that’s why I say once this goes up it will go 🚀🚀🚀quickly.

For reference sake, I saw the same thing I see now on WBD in Jan of 2023. Those options did 5 x in one week. Not to mention… We have been range trading for over a year and a half. That’s bananas. 

This chart gives us parabolic potential on returns. This WILL go above $78 sooner than we think. The thing is if it gets there fast (WSB supports this) or we get there immediately. Either way. The charts don’t lie and I will be profiting all the way up on this one.

Footnote: Their Earnings Call is tomorrow at 8am. 

As explosive as this breakout will be to the upside, buying the cheapest options will be explosive with the profits. 

I anticipate it will hit 16.27 within the first 2 months (that’s 2x even though I really think the first 3 weeks for a 20x return, but I will be conservative). 

I purchased the following long calls:

-June 21 $30 @$.01 
      -If price jumps short term to 16.27, these options will be the first to cash out.

-Jan 2025 $30 @.06 
       -If we move a bit slower, my target is $30 for these options 

 -Jan 2026 $25 @$.39
        - I am buying these in case the WSB community sees what I see here and we shoot to push this to a new high.

I’m certain everyone has an options calculator so please DYOR. I am happy to answer any questions. 

I don’t have a cat meme, but this is definitely a Harry Potty meme. His wand was made of Holly Wood and made magic at the movies. So let’s make our own hit and get rich from the movies WITHOUT being a celebrity!

Feel free to see my X @earlyadapter to check my record on short term calls.",2024-02-22,10,46
1ar5y21_WBD,WBD,The ESPN-Fox-WBD sports venture is a counterstrike against Big Tech and rights fees inflation. Here's how.,,2024-02-15,6,0
1ar5y6u_WBD,WBD,The ESPN-Fox-WBD sports venture is a counterstrike against Big Tech and rights fees inflation. Here's how.,,2024-02-15,3,1
18o1ooy_WBD,WBD,"WBD and Paramount merger talks, why are the stocks down, surely this is bullish for the synergies?",,2023-12-22,0,13
18n9g9x_WBD,WBD,Advice regarding $WBD,,2023-12-21,23,31
18iaq2e_WBD,WBD,Warner Bros Discovery currently has a 58% Probability of Bankruptcy - Macroaxis,"Source: [https://www.macroaxis.com/invest/ratio/WBD/Probability-Of-Bankruptcy](https://www.macroaxis.com/invest/ratio/WBD/Probability-Of-Bankruptcy)

>Our calculation of Warner Bros probability of bankruptcy is based on Altman Z-Score and Piotroski F-Score, but not limited to these measures. To be applied to a broader range of industries and markets, we use several other techniques to enhance the accuracy of predicting Warner Bros odds of financial distress. These include financial statement analysis, different types of price predictions, earning estimates, analysis consensus, and basic intrinsic valuation. Please use the options below to get a better understanding of different measures that drive the calculation of Warner Bros Discovery financial health.

I do not hold a position in WBD. ",2023-12-14,25,43
18cggqg_WBD,WBD,"People bought TTWO cuz trailers, Warner discovery stock anyone? WBD in time for Dragon and gold eggs?",,2023-12-06,4,25
17raqyf_WBD,WBD,WBD Debt Payments,"I have updated my WBD google sheet with the new debt payments, comparing to Q2 2023 to see what this ""2.4billion in debt payments"" actually looks like.

**On 'charts' on** [my sheet](https://docs.google.com/spreadsheets/d/1Dx-99aQ5xt8f1snN43ABznjEqYZ1oc_-NmcpYiFn7ig/edit?usp=sharing) **you can see the difference in 5 year debt, 10 year debt and lifetime debt.**

All values in the sheet are nominal. So $100 borrowed at 10% is $110.

**Overall nominal debt is actually up despite debt payments, however some of the additions in debt are drastically in the future. Hence the need for moddelling.**

TOTAL NOMINAL DEBT IN USD Q2 2023: 47.6B

TOTAL NOMINAL DEBT IN USD Q3 2023: 48B

**We currently have more cash and cash equivilants than we do in overall debt due in 2024.**

Cash and cash equivilants Q3 2023: $2.4B.

Debt due in 2023+2024: $1.8B

**18 months change in debt due. ($2.5b is due in Q1 2025 but expect this to change)**

Q2 2023 until Q4 2024 = 4B

Q3 2023 until Q1 2025 = $4.4B. (2.5b is due in Q1 2025).

**Only 3% of debt is now variable rate.**

The true strength of WBD is tested in Q4. It is their most important quarter. Last year Q3 was a weak quarter, and Q4 was phenominal.

**See below strong cash increase in Q4:**

*Q3 2022 = $2,422,000,000*

*Q4 2022	= $3,713,000,000 (+$1.3Billion in debt paid off)*

~~Q1 2023	= $2,594,000,000~~

~~Q2 2023 = $3,027,000,000~~

*Q3 2023 = $2,383,000,000*

Full disclosure, I'm a WBD shareholder, so I am biased. This post is just to share my research, it's not to say buy or sell. If you want more info I plan to do a livestream today at 3pm [here.](https://youtube.com/live/FWDvfDoLZ5E)",2023-11-09,32,33
17qr958_WBD,WBD,WBD worse than expected results,"What is your opinion about the stock after Q3 results? (-16% today)

I have seen many of you talking about WBD in this sub as many see it as undervalued. I am long in WBD and I am considering adding more but today's drop confused me and made me think twice. I know advertising and network business is going down (maybe faster than expected) but I think the drop is too strong. Am I missing something?",2023-11-08,46,45
16cdnxh_WBD,WBD,WBD has just issued 1.5 billion in fresh debt at 6.4% interest.,"PAGE 47 of WBD most recent Sec filling

""During the six months ended June 30, 2023, we issued $1.5 billion of 6.412% fixed rate senior notes due March 2026. After March 2024, the senior notes are redeemable at par plus accrued and unpaid interest.""

Am I reading the above right? WBD will have to pay $1.5 billion in debt in 2026 at 6% interest?

I think this is begining to fall into catagory 3 for me, yes, no and too hard.",2023-09-07,22,36
16bim4s_WBD,WBD,IS WBD PROFITABLE?,"I'm stuck on WBD dd.

They say they are unprofitable but have positive FCF. I think that's only after a high Depreciation and amortisation (D&A) for tax purposes I'm guessing. After Discovery bought warner media they claimed it assets as depriciating assets which I think works to their advantage. So they can report no profit while making profits and pay less tax. But I want to check this here.

The following is from their [MRQ.](https://s201.q4cdn.com/336605034/files/doc_financials/2023/q2/WBD-2023-06-30-10Q-Filed.pdf)

They have 1.9billion in D&A. So, revenue = 10billion. Cost & Expenses = 11Billion. 

This means profit = loss of -1billion.

But if you do Costs and Expenses - D&A = 9Billion.

This means profit = profit of +1billion in the MRQ.

Have I got this right? On Yahoo Finance and their 10-Q their FCF is positive and net cash flow is negative. Thats whats throwing me through loops. 

Also their cash is down 700m. I need to create some solid benchmarks to establish if I should hold or close and wander where to put them.

&#x200B;

&#x200B;

&#x200B;

&#x200B;",2023-09-06,6,9
16ao7xp_WBD,WBD,Day Trade Levels I'm watching in NXGN TSLA WBD WBA,,2023-09-05,2,4
15i5cq3_WBD,WBD,WBD popping today 7.5%+,Some sort of market mover/whale must have come into possession of a lot of WBD shares or something?  Can someone help explain the huge jump today?  My 4-month investment is *finally*  profitable.  I can't seem to find any news directly tying any action to the jump.,2023-08-04,5,11
15h8s5y_WBD,WBD,"WBD narrows streaming loss thanks to 3x higher content licensing revenue ($410M). More ""co-exclusive"" deals coming.","The company’s DTC division reported $410 million in licensing revenue, more than triple last year’s sales, after offering shows like “Westworld” to rivals

Revenue from licensing HBO content buoyed Warner Bros. Discovery’s streaming business in the second quarter, the company revealed in its earnings report Thursday. The sales helped significantly narrow its loss and appeared to be playing a big part in the company’s promise for its U.S. direct-t0-consumer business to turn a profit in 2023.

The media giant reported $2.73 billion in revenue in its DTC segment, which launched its Max service during the quarter. That was a 37% leap from last year’s second quarter, and represented about 26% of the company’s total revenue for the period. The segment swung to a $3 million EBITDA loss for the second quarter after reporting $50 million in positive EBITDA in the first quarter.

Content licensing revenue at $410 million revenue rose notably, more than tripling the $132 million reported in the same quarter last year, suggesting that the company would have had a far more significant loss without those fees.

The growth in licensing reflects a surprising move in recent months toward offering HBO shows like “Westworld” to free, ad-supported streaming TV services like Amazon’s Freevee and the Roku Channel. Warner Bros. Discovery also licensed HBO shows including “Insecure” to Netflix.

CEO David Zaslav said on a call with analysts Thursday that it would seek to do deals on a “co-exclusive” basis, meaning the licensed shows would also be available to Max subscribers.

Distribution revenue of $2.19 billion made up the bulk of the division’s total, including traditional HBO subscriptions, Max and HBO Max subscriptions, and Amazon Prime Video Channels revenue. Advertising revenue jumped 26% to $121 million, also mainly driven by subscriber growth. Total DTC subscribers fell by 1.8 million in the quarter to 95.8 million.

Zaslav told analysts the company’s deep content library “offers a wealth of opportunity in terms of feeding our own platforms, as well as others.”

“It’s a mainstay of our business to create great content and window width, through creating value in each window,” he said. “And as you would expect a lot of analysis and strategic discussion goes into these decisions. In some cases, we’ll want to keep premium content exclusively on our platform for a very long time. In other cases, we may sell it to third parties, and we don’t lose anything by growing the pie.”

“The fact is licensing some library content to others VOD platforms like Netflix or Amazon as part of a co-exclusive agreement is just smart business,” Zaslav said. “We’re expanding our audience, while maximizing the value of the asset and providing more revenue streams. And that is our job, to optimize the windowing to get the best possible return on investment.”

Warner Bros Discovery also inked deals with Roku and Tubi to license 2,000 hours of content and launch a series of channels in January. It also plans to introduce its own FAST service this year.

Later in the call, the CEO noted that if the Hollywood strikes continue, “there may be more demand” for WBD content.",2023-08-03,11,8
15avbvf_WBD,WBD,Anyone still holding WBD after T split?,,2023-07-27,11,15
14qpbk2_WBD,WBD,Warner Bros Discovery - licencing to Netflix,"Can fellow investors tell me if this news is bullish or bearish please? 

It's being touted as a move to improve the financials of WBD - I assume it's a cash flow from Netflix as commission for hosting WBD's shows, so bullish short term, but also implies that cash flow might be an issue as WBD have their own streaming platforms so why licence shows to Netflix and not just keep them yourself? So long term bear?

Looks like cash took a significant downturn in Q1 23, mainly due to debt repayments and poorly managed working capital (receivables/ payables) - it would have been even worse had they not taken out $1.5bln in debt (of which they will pay more interest on, but was used to pay off some near term debt, so assume small net increase). WBD have also been in a net current liability position for 2023 & 2022.

Good to get some more opinions please! All seems quite bearish on cash now that I think about it :/

 [HBO Shows Start Arriving on Netflix Under Warner Bros. Discovery's New Licensing Deal - IGN](https://www.ign.com/articles/hbo-show-netflix-due-to-warner-bros-discovery-licensing-deal) 

https://preview.redd.it/k47aazfq30ab1.png?width=803&format=png&auto=webp&s=a7c3a2fc9231ed85eedd2eea37a752b392ea133d

&#x200B;",2023-07-04,5,25
13ixfhi_WBD,WBD,Opinions on WBD?,,2023-05-16,16,10
12jzym4_WBD,WBD,HBO max changing to MAX… and it’ll be a hard fall for WBD,"I’m sure other got the email: 

“Introducing Max,

We’ve been dying to tell you the good news! You’re getting everything you love to watch on HBO Max, plus the best in true crime, reality, food, and home — all for the same price you pay today. Pretty great, right?

Mark your calendar. You’ll have access to Max as soon as it arrives on May 23.”


My take :


One of Zeslavs (and bob iger) complain is how expensive content has become. And that there’s too much good stuff in these service.


I follow this a lot and worked in one of these big companies.

Imo at the end of the day these platforms will end up being and doing the “TV thing” of having a few prime time shows so people tune in… in streaming well, you can see it taking form: Disney has mandalorian, hbomax has succession and paramount dives into Star Trek and other famous franchises to cut through the noise.


The issue now is how to get people to not expect hbo max to not have every single amazing title on the service and therefore be able to sell these licenses to other networks and streaming companies. Create scarcity to push up licensing prices but without pushing users to bittorrent.

Which is basically like taking away peoples beer at a bar during last call. 

The plan I’m seeing is putting some of the cheaper content from discovery (reality tv / docuseries etc) so there is more “filler”. 
And the good shows will be once again sold and resold to several other companies
Which makes good money. 

Anyways, WBD will probably hit a very sharp downturn and later rise as the plan pays off. 
And maybe they can pay some of that debt.

The other thing I’m predicting is wb selling off some big channel or IP to help w the debt. Maybe the cnn+ fiasco is a precursor. (There’s office/building moments as well). If that happens the that’ll be a good catalyst.

Well, just a random post that’s not a news article",2023-04-12,0,38
12cvm2c_WBD,WBD,Warner Bros. [WBD] Looks to Close Deal for ‘Harry Potter’ HBO Max Series,"Bloomberg reported that talks are underway for a new project based directly on J.K. Rowling’s popular book series, instead of a spinoff within the same universe like the “Fantastic Beasts” movies. The plan is for each season to be based on one of the books, indicating a long-running franchise for the studio.

This news of the developing agreement arrives ahead of a presentation by Warner Bros. Discovery on April 12 for investors and the public. The event will showcase the integration of HBO Max and Discovery+ as well as the studio's upcoming streaming content lineup.

[https://variety.com/2023/tv/news/harry-potter-hbo-max-series-warner-bros-closing-deal-1235572610/](https://variety.com/2023/tv/news/harry-potter-hbo-max-series-warner-bros-closing-deal-1235572610/)",2023-04-05,19,31
12cvk4j_WBD,WBD,Warner Bros. [WBD] Looks to Close Deal for ‘Harry Potter’ HBO Max Series,,2023-04-05,15,9
11kio5j_WBD,WBD,"""The Making of Harry Potter,"" a Warner Brothers Studio Tour set to open in Tokyo in the summer of 2023. $WBD",,2023-03-06,1,1
11a913n_WBD,WBD,Warner Bros Discovery revenue misses as media giant posts big loss,"https://www.cnbc.com/2023/02/23/warner-bros-discovery-wbd-4q22.html

Warner Bros. Discovery said it recorded about $11.1 billion in fourth quarter revenue, missing analysts’ estimates, as the media industry contends with a soft advertising market. 

The company’s TV networks segment – which includes cable-TV channels like TNT, TBS and Discovery – decreased 6% to roughly $5.5 billion, as advertising revenue took a drop in particular.

Here’s what the company reported:

Revenue: $11.01 billion vs. $11.36 billion expected, according to estimates from Refinitiv

Loss per share: 86 cents per share

The company reported a quarter loss of $2.1 billion for the period, or 86 cents per share. It was not immediately clear whether that figure was comparable to analyst estimates from Refinitiv.

Warner Bros. Discovery executives began warning of a worsening advertising market last summer, and other media companies, including Paramount Global, have seen it weigh on their earnings.

The company, which owns streaming services HBO Max and Discovery+, said its global direct-to-consumer streaming subscriber base increased by 1.1 million to 96.1 million by the end of the quarter. 

Revenue for the streaming segment was up 6%, the company said Thursday, driven by an uptick in subscriber growth for its ad-supported tiers.

However, losses for its streaming segment improved, with a loss of $217 million, “a $511 million year-over-year improvement in losses,” the company said. 

Warner Bros. Discovery reported continued softness in the advertising market, which has been weighing on its revenue since last summer, when executives first warned of a slowdown in ad spending. Last week, Paramount Global reported a decrease in quarterly revenue due to lower ad spending.

The company’s network TV segment was particularly affected as major sporting events including college football and the men’s World Cup took place on other networks during the fourth quarter.",2023-02-23,161,53
119ywnp_WBD,WBD,$WBD - Harry Potter is going to make $billions this year...and you can too!,"# [Hogwarts Legacy](https://www.hogwartslegacy.com/en-us) is the latest blockbuster videogame released by WBD and is breaking numerous videogame sales records within the first few weeks of release.

[You nerds are going to make WBD execs a lot of money](https://preview.redd.it/zp8ylxk25yja1.png?width=2560&format=png&auto=webp&s=4e837247c787ef9910aee485845ff7130067b287)

# Overview

Hogwarts Legacy's physical sales have already outpaced Elden Ring by 80% while digital sales are outpacing by 56% as of this morning ([source 1](https://gamerant.com/hogwarts-legacy-stats-successful-launch/), [source 2](https://gamerant.com/hogwarts-legacy-sales-numbers-so-far-figures-record/)). Assuming a blended 65% increase over Elden Ring's sales at an assumed $65/unit sold (many special editions have been purchased), **the game has generated a rough estimate of approximately $1.3B in the first two weeks of release**.

There are no known major issues with the game (some bugs present on Steam but no more than typical) and once it is clear the game is a hit among fans and the development is solid, the sales momentum should continue. Additionally, this momentum will likely see some benefit from the release of Hogwarts Legacy on PS4, Xbox One, and Nintendo Switch at later dates:

https://preview.redd.it/iwyr7teg4yja1.png?width=589&format=png&auto=webp&s=5cbf59d1cef19fd78ead78ca6df95b2a9c26c745

Overall, Hogwarts Legacy will probably generate at least $2B in revenue for WBD within the first year of its release. The massive success of this game will open the door for more opportunities to expand on the Harry Potter franchise potentially including DLC for the game and possibly, a [new movie](https://screenrant.com/harry-potter-cursed-child-movie-release-date-cast-story-will-it-happen/).

# FY23 Estimates

[source: https:\/\/app.tikr.com\/ \(you need to sign up but it's free\)](https://preview.redd.it/mqza0wsp5yja1.png?width=512&format=png&auto=webp&s=6dc139bd067d284ed497d2da4679e1b8f8bd1cf0)

**WBD is currently trading at a discounted 0.75x P/BV** with a forward FCF Yield of 5.7%. Estimated sales for WBD is $44.2B for 2023 (2% growth YoY, median of analyst estimates from Bloomberg, sourced from [https://app.tikr.com/](https://app.tikr.com/)) which surely includes Hogwarts Legacy sales but this estimate is probably a bit conservative based on very strong sales figures so far.

If WBD guides for an extra $500MM to $1B in sales for the year based on initial sales, this would imply a 3-4% increase in total sales (vs 2% estimate) which for a stagnant company like WBD, is a fairly big deal. Profit margins for new big name VGs can approach 50% or higher so with at least $2B in sales, at least a $1B increase in FCF seems realistic and would bring WBD's FCF Yield up to a favorable 7%.

# TL;DR - Focus on FY23 guidance, not past results!

* Hogwarts Legacy will generate at least $2B in sales in its first year
* WBD will likely increase revenue and earnings guidance for the year based on Hogwarts Legacy's strong sales so far
* Mgmt will want to further leverage the Harry Potter franchise given the massive success of the videogame with potential for DLC, another movie, or even a tv series (a la Disney)
* Markets are not yet pricing in the sizable revenue and FCF increase Hogwarts Legacy will contribute with WBD trading at a discounted 0.75x P/BV

My Position:

https://preview.redd.it/uz33a8v96yja1.png?width=687&format=png&auto=webp&s=15db75238debfa615a5598c0eb6343948f9d1654

WBD has earnings AH today and I'm in the 17C expiring tomorrow, June, selling 14P exp March, and am holding shares. In case you don't know what to do, here's a chart giving you terrible instructions:

|*Investor Type*|*Trade*|
|:-|:-|
|Boomer|Buy shares or 20C LEAPs, wait at least a few quarters for increased sales to be baked into stock price|
|Thetagang|Sell OTM or ATM Mar puts based on risk tolerance, get assigned at a lower price or make 50-80% annualized return|
|Degenerate|Weeklies baby, might I suggest the delectable 17C or 20C. Could also be less degen and buy June|

&#x200B;",2023-02-23,314,264
