Post_ID,Ticker,Title,Body,Post_Date,Upvotes,Num_Comments
1khpl2n_WBD,WBD,Warner Bros Discovery misses revenue estimates on box office weakness,"https://stocks.apple.com/AV2Irp1ZHQ2eG8M_0a9BnNg

Summary
Quarterly studios revenue declines 18% after 'Mickey 17' underperforms
Streaming subscriber gains of 5.3 million far exceed estimates
Cable TV unit revenue falls 7% as cord-cutting continues
Warner Bros Discovery (WBD.O) missed first-quarter revenue estimates on Thursday, weighed down by a lack of big box office hits from its studios and weakness in its traditional TV business as consumers continued to abandon cable for streaming.
Like others in the media business, Warner Bros Discovery is losing thousands of cable TV subscribers each year, putting pressure on the company to consistently produce hit content and boost profitability in its streaming business.
The threat of U.S. tariffs on foreign-made films has also added to the headaches of an industry whose biggest-budget films are often produced across several continents.
WBD struggled in the January-March quarter to replicate the success of last year's ""Dune: Part Two,"" which grossed more than $700 million. The company's marquee release for the period, Bong Joon Ho's sci-fi dark comedy ""Mickey 17,"" earned only slightly more than its reported budget at the box office.
That meant studios revenue fell 18% to $2.31 billion, missing estimates of $2.73 billion, according to Visible Alpha.
The company has, however, made a strong start to the second quarter with Ryan Coogler's horror film ""Sinners"" and the blockbuster ""A Minecraft Movie,"" which has raked in around $900 million globally, making it the biggest release of 2025 so far. Its summer lineup also looks strong with ""Superman,"" directed by Marvel's long-time hitmaker James Gunn, set to release in July.
Revenue at the TV networks segment, which includes CNN, Discovery Channel and Animal Planet, fell 7%, with advertising revenue in the business declining 12% as marketers avoided cable TV amid cord-cutting by subscribers.
Overall, revenue fell 10% in the first three months of 2025 to $8.98 billion, missing analysts' average estimate of $9.60 billion, according to data compiled by LSEG. Loss of 18 cents per share was also larger than expectations for a 13-cent loss, even as costs declined 11.8%.
The company's shares were down 1.9% in premarket trading.
Still, its streaming business was a bright spot.
WBD added 5.3 million streaming subscribers in the quarter, compared with 3.1 million estimated by analysts, according to Visible Alpha, taking its total to 122.3 million. The quarter featured some strong content slate including the third season of HBO's ""The White Lotus"" and the medical drama series ""The Pitt"".
The company also launched its Max streaming service in Australia earlier this year, following rollouts in more than 70 countries across Europe and Asia last year. Analysts say it has also benefited and reduced churn thanks to a streaming bundle combining Disney+, Hulu and Max that was introduced last year.
Reporting by Aditya Soni in Bengaluru; Editing by Shounak Dasgupta",2025-05-08,22,14
1k59n6j_WBD,WBD,YOLO my life savings $WBD calls,"What can I say, I just like the MAX original series. What do you regards know about webistics? ",2025-04-22,15,11
1jyhtt0_WBD,WBD,WBD Sell or HODL,,2025-04-13,3,23
1izfe6e_PATH,PATH,"WBD adds 6.4 million Max subscribers, forecasts 150 million subs by end of 2026","Warner Bros. Discovery said Thursday it added 6.4 million global streaming subscribers in the fourth quarter for a total of 116.9 million subscribers.

Fourth-quarter revenue for the streaming segment, which is anchored by flagship service Max, totaled $2.65 billion, up 5% from $2.53 billion in the same quarter last year. Adjusted earnings before interest, taxes, depreciation and amortization for the unit came in at $409 million, compared to an adjusted EBITDA loss of $55 million in the fourth quarter of 2023.

In a shareholder letter, the company forecast adjusted EBITDA of $1.3 billion for its streaming business for the year — roughly double the $677 million adjusted EBITDA it reported for 2024 — and said it has a “clear path” to hit 150 million global subscribers by the end of 2026. Max is set to launch on television service Sky in the United Kingdom and Ireland by the second quarter of 2026, and will debut in Germany and Italy in the first quarter of that year.

The media and entertainment company announced Wednesday that Max would keep its B/R Sports and CNN content available at no additional cost to subscribers in its standard and premium tiers. Initially WBD planned to charge an additional cost for sports.

However, it will pull both verticals from its basic, ad-supported tier beginning March 30.

WBD’s overall fourth-quarter revenue fell 2% to $10.03 billion from $10.28 billion during the same quarter in 2023. Full-year 2024 revenue came in at $39.32 billion, down 5% from $41.32 billion in 2023.

Warner Bros. Discovery reported a net loss of $494 million for the fourth quarter of 2024, or a loss of 20 cents per share, compared with a net loss of $400 million, or a loss of 16 cents per share, during the fourth quarter of 2023.

TV networks revenue came in at $4.77 billion, compared to $5.04 billion in the year-earlier period. The company previously wrote down $9.1 billion for its networks business in its 2024 second-quarter earnings report. In its shareholder letter, Warner Bros. Discovery noted that it expects further declines in cable subscribers and that the advertising market for U.S. linear television is shrinking faster than expected.

For the studios business, fourth-quarter revenue totaled $3.66 billion, an increase of 15% from $3.17 billion in the fourth quarter of 2023.

Source: [https://www.cnbc.com/2025/02/27/warner-bros-discovery-wbd-q4-2024-earnings.html](https://www.cnbc.com/2025/02/27/warner-bros-discovery-wbd-q4-2024-earnings.html)",2025-02-27,40,4
1izfe6e_WBD,WBD,"WBD adds 6.4 million Max subscribers, forecasts 150 million subs by end of 2026","Warner Bros. Discovery said Thursday it added 6.4 million global streaming subscribers in the fourth quarter for a total of 116.9 million subscribers.

Fourth-quarter revenue for the streaming segment, which is anchored by flagship service Max, totaled $2.65 billion, up 5% from $2.53 billion in the same quarter last year. Adjusted earnings before interest, taxes, depreciation and amortization for the unit came in at $409 million, compared to an adjusted EBITDA loss of $55 million in the fourth quarter of 2023.

In a shareholder letter, the company forecast adjusted EBITDA of $1.3 billion for its streaming business for the year — roughly double the $677 million adjusted EBITDA it reported for 2024 — and said it has a “clear path” to hit 150 million global subscribers by the end of 2026. Max is set to launch on television service Sky in the United Kingdom and Ireland by the second quarter of 2026, and will debut in Germany and Italy in the first quarter of that year.

The media and entertainment company announced Wednesday that Max would keep its B/R Sports and CNN content available at no additional cost to subscribers in its standard and premium tiers. Initially WBD planned to charge an additional cost for sports.

However, it will pull both verticals from its basic, ad-supported tier beginning March 30.

WBD’s overall fourth-quarter revenue fell 2% to $10.03 billion from $10.28 billion during the same quarter in 2023. Full-year 2024 revenue came in at $39.32 billion, down 5% from $41.32 billion in 2023.

Warner Bros. Discovery reported a net loss of $494 million for the fourth quarter of 2024, or a loss of 20 cents per share, compared with a net loss of $400 million, or a loss of 16 cents per share, during the fourth quarter of 2023.

TV networks revenue came in at $4.77 billion, compared to $5.04 billion in the year-earlier period. The company previously wrote down $9.1 billion for its networks business in its 2024 second-quarter earnings report. In its shareholder letter, Warner Bros. Discovery noted that it expects further declines in cable subscribers and that the advertising market for U.S. linear television is shrinking faster than expected.

For the studios business, fourth-quarter revenue totaled $3.66 billion, an increase of 15% from $3.17 billion in the fourth quarter of 2023.

Source: [https://www.cnbc.com/2025/02/27/warner-bros-discovery-wbd-q4-2024-earnings.html](https://www.cnbc.com/2025/02/27/warner-bros-discovery-wbd-q4-2024-earnings.html)",2025-02-27,38,4
1iv2l0u_WBD,WBD,Deep dive into WBD - The $40 billion Bet,,2025-02-21,87,40
1i3796x_WBD,WBD,Thoughts On WBD,,2025-01-17,18,16
1hkxc7g_WBD,WBD,$5k Hail Mary on $WBD,,2024-12-23,79,59
1h7hwbd_WBD,WBD,WBD YOLO,"WBD YOLO

You will hate to hear this but WBD is a solid candidate for a long term turn around play. I started buying in July and was ridiculed, maybe some of you are ready to consider now. Book value is $14.32 and they’ve been unfairly priced for bankruptcy. You guys didn’t like hearing about my other play after it was already +900% (sorry but mods have market cap rules) Here’s a a play that has not had a significant run up yet. Buy some ATM leaps and relax. 😎 ",2024-12-05,447,195
1glrf4m_WBD,WBD,"WBD earnings report: Revenue at $9.62 billion, a 3% drop compared to the $9.98 billion seen in Q3 2023. Adjusted earnings per share of $0.05 versus a loss of $0.17 in the year-earlier period.",,2024-11-07,24,14
1emmxng_WBD,WBD,WBD falls sharply after taking $9.1B impairment charge,,2024-08-07,113,92
1ej3jan_WBD,WBD,Help Finding Intrinsic Value of WBD,,2024-08-03,4,1
1egi48t_WBD,WBD,Warner brothers (WBD) large debt will inflate away - good inflation hedge ?,"Guys a large portion of the 40$ billion debt is fixed rate and matures in 2040 and beyond. example: 7 billion in 2050  !! and 4,8 billion in 2040 !!, (and 5.1 Billion in 2032).

At that time inflation will have eaten the debt.",2024-07-31,44,44
1ebcqra_WBD,WBD,"NBA says Amazon will be its new media partner, rebuffing WBD attempt to match deal ","The National Basketball Association has told Warner Bros. Discovery it doesn’t intend to honor its matching rights and instead plans to move ahead with Amazon as a media partner.

 “Warner Bros. Discovery’s most recent proposal did not match the terms of Amazon Prime Video’s offer and, therefore, we have entered into a long-term arrangement with Amazon,” the NBA said in a statement Wednesday.

 “Throughout these negotiations, our primary objective has been to maximize the reach and accessibility of our games for our fans. Our new arrangement with Amazon supports this goal by complementing the broadcast, cable and streaming packages that are already part of our new Disney and NBCUniversal arrangements,” the league added. “All three partners have also committed substantial resources to promote the league and enhance the fan experience. We are grateful to Turner Sports for its award-winning coverage of the NBA and look forward to another season of the NBA on TNT.”

Warner Bros. Discovery said Monday it matched one of the NBA’s three media rights packages, which people familiar with the matter identified as the $1.93 billion per-year deal earmarked for Amazon Prime Video. Disney and Comcast’s NBCUniversal signed deals for the other two packages, part of the league’s $77 billion media rights renewal over 11 years.

“In an effort to continue our long-standing partnership, during both exclusive and non-exclusive negotiation periods, we acted in good faith to present strong bids that were fair to both parties. Regrettably, the league notified us of its intention to accept other offers for the games in our current rights package, leaving us to proceed under the matching rights provision, which is an integral part of our current agreement and the rights we have paid for under it,” Warner Bros. Discovery said in a statement on Monday.  “This will allow fans to keep enjoying our unparalleled coverage, including the best live game productions in the industry and our iconic studio shows and talent, while building on our proven 40-year commitment for many more years.”

Warner Bros. Discovery’s Turner Sports has carried live NBA games for nearly 40 years. The cable network TNT is home to “Inside the NBA,” the popular studio show starring Ernie Johnson, Charles Barkley, Kenny Smith and Shaquille O’Neal. The future of the show is in doubt if the NBA doesn’t strike a deal with Warner Bros. Discovery.

Warner Bros. Discovery acquired matching rights as part of its current media rights deal with the league, which expires at the end of next season. That provision allows the company to match payment for any of the games that air on TNT.

The NBA doesn’t believe Warner Bros. Discovery’s rights extend to an all-streaming package, as has been carved out for Amazon. Warner Bros. Discovery also owns a streaming service, Max, which it could use to air games.

Amazon Prime Video has more than twice as many global customers — more than 200 million to Max’s roughly 100 million — which may make the service a more appealing platform for the league. The streaming rights are global, even though Warner Bros. Discovery is only bidding on U.S. rights, according to people familiar with the language in the contract.

Source: https://www.cnbc.com/2024/07/24/nba-picks-amazon-for-media-rights-over-warner-bros-discovery.html",2024-07-24,101,35
1dq9x9u_WBD,WBD,Thoughts on WBD?,,2024-06-28,7,26
1dkakj0_WBD,WBD,"WBD , why they'll fail.","They do not care about the consumer. I just recently purchased multiple movies of theirs that were labeled as having a digital code. Which when I recieved then didn't have the little flyer in them that should contain the code. (Dune, Mad Max Fury Road, and Edge of Tomorrow btw) they won't give me a code because they said these products are Inelgible once they've expired even though there was no paper even with them and they are being advertised as having it!

It turns out after some more digging they are also the only company that LETS these codes expire in the movies they sell. 

If they can't provide the same level of service as competitors, why would anyone want to use their product? 

Needless to say I've cancelled my Max subscription that'd I've had for years. As they keep raising prices and are locking 4k behind an additional pay wall when it used to be the same tier (unlike Disney).",2024-06-20,0,25
1dj4nve_WBD,WBD,Convince me not to continue to plow money into WBD,"Yes it has lots of debt I know this. However, their free cash flows suggest they can get rid of this in a few years. 

Netflix = market cap 295 billion and annual revenue 33 billion 

WBD = market cap 17 billion and annual revenue 41 billion 

Once they are out of debt land, can’t WBD simply trim the shitty aspects of their portfolio to increase margins and make potentially more money than Netflix? Their IP is insane. HBO is a powerhouse and I probably watch more shows on their platform than Netflix. 

Am I taking crazy pills?! Why isn’t this thing worth way more right now? ",2024-06-18,185,182
1df33o7_WBD,WBD,I would call WBD expires in Jan 2026,,2024-06-13,3,7
1df7sya_WBD,WBD,WBD at an inflection point?,,2024-06-13,20,24
1dd6fy1_WBD,WBD,The Regard case for WBD. Hear me out.,"I’m a full regard so I love garbage. WBD is such garbage stock. But there’s real treasure in the trash sometimes. Like some old lady buying a Picasso print at the thrift store for five bucks. Why is WBD treasure in the trash?

Okay so the entertainment business has been trash for a while now. Covid killed theaters, streaming is a trash business and is consolidating, the tech bros are going to ruin the movie business just like they ruin everything else. So the WBD stock is way down. A trash stock in a trash industry.

But what I like is the IP. It’s fucking WARNER BROS! It’s fucking HBO! It’s Harry Potter, Lord of the Rings, Batman, ~~TMNT~~, Dune, The Matrix, Game of Thrones, The Sopranos, Barbie! These are iconic and beloved titles that will have huge value for the foreseeable future. Every time there’s a new streaming service, new video format, new theme park, new video game, new fucking slot machines, new anything, this IP will get monetized the fuck out it.  They own Police Academy which I know you love because you are in this sub like me.

And yes Zazlav is an asshole. It’s just what this dumb industry needs. An asshole BUSINESSMAN. Unemotional, cunning, cutthroat. Will break your heart by killing some superhero nerd fest for the sweet tax breaks. And he’s paying down debt like a beast. People in Hollywood hate him with a passion and that’s how you know he’s good.

So what’s the upshot? Well the intrinsic FCF value is $27. Current share price around 8?  For a ratio of .3. Historically, that is at the absolute low end. It’s been as high at 1.5 in the last ten years. 

Do I really understand any of that? Clearly not. Maybe all of this is bullshit. What am I a quant? I’m betting on the company being in a cyclical slump because of covid and strikes, with huge potential because of the IP and the leader not afraid to be a huge prick. Also the the historic median Price-to-Intrinsic-Value-Projected-FCF is .69 - which is good enough for me.

This motherfucker is beaten down and once it pays off the merger debt and the streaming consolidation settles, this dog will hunt. We’re talking at least $18 in the next twelve months. And the bear case is around $7. Huge upside, minimal downside. 

I know this is a gambling sub, but even in a casino you wanna find the roulette wheel with just one green and not those sucker ones with three. 

TL;DR - Huge IP value, ruthless asshole CEO, entertainment biz is shit right now but WB is iconic and will bounce back bigly. 

This is clearly not financial advise. I’m a dumbass creative and not some Wall Street douche. Tell me why I am wrong.",2024-06-11,40,36
1cymf38_WDAY,WDAY,"5/22 Daily Update: $NVDA, $WBD Partners with $DIS, $AMZN Alexa","GM folks, here’s what's cooking today

All eyes on **$NVDA.**

**$NVDA** announced a 10-for-one stock split and is upping its quarterly cash dividend by a casual 150%.

$NVDA is now flaunting a market cap above $2.5 TRILLION for the first time ever. Nvidia is now bigger than the entire German stock market. It’s also larger than the combined market cap of the Italian and Australian stock markets. 

Warner Bros. Discovery **$WBD** and Disney **$DIS** have decided to buddy up for College Football Playoff games. They’ve signed a 5-year deal where WBD’s TNT will air two first-round games starting this year, and by 2026, they’ll add a couple of quarterfinal games to the mix.

Amazon planning to roll out an upgraded version of its decade-old voice assistant, Alexa. The cool thing is that they'll be charging a monthly fee for it. Because who doesn’t love paying more for something they’ve been using for free

Earnings reports worth mentioning today: Intuit ($INTU), Workday ($WDAY), and TD Bank ($TD).

GL HF",2024-05-23,13,0
1cymf38_WBD,WBD,"5/22 Daily Update: $NVDA, $WBD Partners with $DIS, $AMZN Alexa",,2024-05-23,13,0
1cymf38_AMZN,AMZN,"5/22 Daily Update: $NVDA, $WBD Partners with $DIS, $AMZN Alexa","GM folks, here’s what's cooking today

All eyes on **$NVDA.**

**$NVDA** announced a 10-for-one stock split and is upping its quarterly cash dividend by a casual 150%.

$NVDA is now flaunting a market cap above $2.5 TRILLION for the first time ever. Nvidia is now bigger than the entire German stock market. It’s also larger than the combined market cap of the Italian and Australian stock markets. 

Warner Bros. Discovery **$WBD** and Disney **$DIS** have decided to buddy up for College Football Playoff games. They’ve signed a 5-year deal where WBD’s TNT will air two first-round games starting this year, and by 2026, they’ll add a couple of quarterfinal games to the mix.

Amazon planning to roll out an upgraded version of its decade-old voice assistant, Alexa. The cool thing is that they'll be charging a monthly fee for it. Because who doesn’t love paying more for something they’ve been using for free

Earnings reports worth mentioning today: Intuit ($INTU), Workday ($WDAY), and TD Bank ($TD).

GL HF",2024-05-23,13,0
1cymf38_DIS,DIS,"5/22 Daily Update: $NVDA, $WBD Partners with $DIS, $AMZN Alexa",,2024-05-23,14,0
1cthb5y_WBD,WBD,"Disney, Fox and WBD Unveil Name of Sports-Streaming Venture: Venu Sports",,2024-05-16,15,9
1cr1uy2_WBD,WBD,"Warner Bros Discovery ($WBD) Q1 2024 Earnings Analysis: Content Acquisition, Streaming Growth, and Advertising Shifts",,2024-05-13,21,4
1ci6ord_WBD,WBD,"We all think we are different, but we are not Nancy Pelosi. (11k loss WBD)",,2024-05-02,34,23
1ch20sb_WBD,WBD,Thoughts on WBD,,2024-04-30,19,29
1bovk8q_WBD,WBD,"$WBD, $DIS as an AI play",,2024-03-27,9,3
1bnju7k_WBD,WBD,WBD - What's going on?,"WBD's stock has been on a constant decline, despite reporting its first year of profit on Max, and having the #1 and #7 highest-grossing movies of 2023. Acknowledging its declining profits and underwhelming revenue, does WBD *really* deserve to be a single-digit stock? LMK your thoughts. ",2024-03-25,14,24
1bdeom0_WBD,WBD,WBD stock suggestion ,What you guy think about WBD? ,2024-03-13,6,32
1b9nx9w_WBD,WBD,$WBD Lisan al Galib,"Trying to Dune some gains! Don’t want to bore you all with some deep analysis. This is pure value, if anything IP alone is worth $20
a share for let’s say a Prime, Netflix, or Apple buyout. Let’s ride this Sandworm to gain town. ",2024-03-08,5,3
1b7ivh8_WBD,WBD,Streaming Services a BUY right now? (WBD & DIS),,2024-03-05,4,16
1b7ivh8_DIS,DIS,Streaming Services a BUY right now? (WBD & DIS),"Disney+/Hulu, and now HBO(owned by Warner Bros Discovery) have all announced they’re going to be following the same strategy  of cracking down on password sharing to increase subscriber revenue. After Netflix fully implemented their changes in Q4 of 2023 they had a record number of new subscribers  (around 13 million +). NFLX YTD has risen 28% since their Q4 earnings report.HBO and Disney+/HULU plan on fully implementing the same strategy in 2025. 

Im not an experienced investor by any means but this makes me think that streaming services may be a smart buy now before they follow suite with Netflix on their subscriber crack down (obviously as long as subscribers don’t revolt and just cancel their service). I’m also aware that just because it worked for NFLX doesn’t mean it will work for WBD or DIS, but the concept worked once, it could work again. 

Just curious to hear other people’s opinions on this! Thanks! ",2024-03-05,1,16
1b27k6g_WBD,WBD,Why Warner Bros Discovery ($WBD) is a DEEP VALUE PLAY,,2024-02-28,42,63
1ay5wxi_SQ,SQ,"$3500 to $12K, 1DTE calls CVNA & SQ, with a side of WBD puts ","Credit to u/Green-Corgi3945 for their DD the other day. 3 for 3 on their predictions! 

Note that the $3500 represented only 7% of my portfolio total at the time. ",2024-02-23,17,5
1ay5wxi_WBD,WBD,"$3500 to $12K, 1DTE calls CVNA & SQ, with a side of WBD puts ","Credit to u/Green-Corgi3945 for their DD the other day. 3 for 3 on their predictions! 

Note that the $3500 represented only 7% of my portfolio total at the time. ",2024-02-23,18,5
